canonical_keyword,suggested_title,category,variant_count,signal_strength,cluster_size,all_variants,merged_from
How to fill a shape with an image in canva,How to fill a shape with an image in canva,howto,4,medium,1,how to fill a shape with an image in canva | how to fill a shape in canva with an image | how to fill shape with image canva | how to fill a shape on canva with an image,
How to outline a shape in canva,How to outline a shape in canva,howto,4,medium,1,how to outline a shape in canva | how to outline shapes in canva | how to outline shape in canva | how to outline a shape on canva,
How to fill text with an image in canva,How to fill text with an image in canva,howto,4,medium,1,how to fill text with an image in canva | how to fill text with image in canva | how to fill text with image canva | how to fill a text with an image in canva,
How to add a footnote in canva,How to add a footnote in canva,howto,4,medium,1,how to add footnotes in canva | how to add a footnote in canva | how to add footnote in canva | how to add footnotes on canva,
How to flip a picture in canva,How to flip a picture in canva,howto,4,medium,1,how to flip a picture in canva | how to flip a picture on canva | how to flip picture in canva | how to flip picture on canva,
How to trim a video in canva,How to trim a video in canva,howto,4,medium,1,how to trim video in canva | how to trim a video in canva | how to trim videos in canva | how to trim a video on canva,
How to draw a line in canva,How to draw a line in canva,howto,4,medium,1,how to draw a line in canva | how to draw lines in canva | how to draw a line on canva | how to draw lines on canva,
How to rotate a text box in canva,How to rotate a text box in canva,howto,4,medium,1,how to rotate a text box in canva | how to rotate text box in canva | how to rotate a text box on canva | how to rotate text box on canva,
How to transfer canva ownership,How to transfer canva ownership,howto,4,medium,1,how to transfer ownership on canva | how to transfer ownership in canva | how to transfer canva ownership | how to transfer ownership canva,
How to record a voiceover on canva,How to record a voiceover on canva,howto,4,medium,1,how to record voiceover on canva | how to record a voiceover on canva | how to record voiceover in canva | how to record a voiceover in canva,
How to fade a photo in canva,How to fade a photo in canva,howto,4,medium,1,how to fade a photo in canva | how to fade a photo on canva | how to fade photo in canva | how to fade photos in canva,
How to empty canva trash,How to empty canva trash,howto,4,medium,1,how to empty trash in canva | how to empty canva trash | how to empty trash on canva | how to empty trash canva,
How to upscale an image in canva,How to upscale an image in canva,howto,4,medium,1,how to upscale an image in canva | how to upscale image in canva | how to upscale an image on canva | how to upscale images in canva,
How to resize a picture in canva,How to resize a picture in canva,howto,4,medium,1,how to resize a picture in canva | how to resize a picture on canva | how to resize picture in canva | how to resize pictures in canva,
How to stretch a font in canva,How to stretch a font in canva,howto,4,medium,1,how to stretch font in canva | how to stretch font on canva | how to stretch a font in canva | how to stretch fonts in canva,
How to add a slide on canva,How to add a slide on canva,howto,4,medium,1,how to add a slide on canva | how to add a slide in canva | how to add slides on canva | how to add slide on canva,
How to make a transition in canva,How to make a transition in canva,howto,4,medium,1,how to make transitions in canva | how to make transitions on canva | how to make a transition in canva | how to make a transition on canva,
How to resize a canva template,How to resize a canva template,howto,4,medium,1,how to resize a canva template | how to resize a template in canva | how to resize template in canva | how to resize canva template,
How to record a presentation on canva,How to record a presentation on canva,howto,4,medium,1,how to record presentation on canva | how to record a presentation on canva | how to record on canva presentation | how to record canva presentation,
How to turn a canva presentation into a video,How to turn a canva presentation into a video,howto,4,medium,1,how to turn a canva presentation into a video | how to turn canva presentation into video | how to turn a presentation into a video on canva | how to turn my canva presentation into a video,
How to resize a canva design,How to resize a canva design,howto,4,medium,1,how to resize a design in canva | how to resize design in canva | how to resize a canva design | how to resize canva design,
How to rotate an element in canva,How to rotate an element in canva,howto,4,medium,1,how to rotate elements in canva | how to rotate an element in canva | how to rotate element in canva | how to rotate an element on canva,
How to unlock a layer in canva,How to unlock a layer in canva,howto,4,medium,1,how to unlock layers in canva | how to unlock layer in canva | how to unlock a layer in canva | how to unlock canva layers,
How to publish a canva website,How to publish a canva website,howto,4,medium,1,how to publish a website on canva | how to publish a canva website | how to publish canva website | how to publish website on canva,
How to reverse an image in canva,How to reverse an image in canva,howto,4,medium,1,how to reverse an image in canva | how to reverse an image on canva | how to reverse image on canva | how to reverse image in canva,
How to upload a picture to canva,How to upload a picture to canva,howto,4,medium,1,how to upload a picture to canva | how to upload pictures to canva | how to upload pictures on canva | how to upload a picture on canva,
How to make a canva poster landscape,How to make a canva poster landscape,howto,4,medium,1,how to make a poster landscape in canva | how to make canva poster landscape | how to make poster landscape in canva | how to make a canva poster landscape,
How to remove a watermark from a photo in canva,How to remove a watermark from a photo in canva,howto,4,medium,1,how to remove watermark from photo on canva | how to remove watermark from photo in canva | how to remove watermark from photo canva | how to remove a watermark from a photo in canva,
How to print a brochure on canva,How to print a brochure on canva,howto,4,medium,1,how to print a brochure on canva | how to print a brochure from canva | how to print brochure from canva | how to print canva brochure,
How to crop a canva page,How to crop a canva page,howto,4,medium,1,how to crop a page in canva | how to crop a canva page | how to crop page in canva | how to crop a page on canva,
How to save a canva design,How to save a canva design,howto,4,medium,1,how to save a canva design | how to save your canva design | how to save a design in canva | how to save canva design,
How to unlock a project on canva,How to unlock a project on canva,howto,4,medium,1,how to unlock canva project | how to unlock a project on canva | how to unlock project in canva | how to unlock a project in canva,
How to resize a canva project,How to resize a canva project,howto,4,medium,1,how to resize a project in canva | how to resize project in canva | how to resize a canva project | how to resize a project on canva,
How to upload a video to canva,How to upload a video to canva,howto,4,medium,1,how to upload a video to canva | how to upload video on canva | how to upload a video on canva | how to upload video to canva,
How to recover a deleted canva project,How to recover a deleted canva project,howto,4,medium,1,how to recover deleted canva projects | how to recover a deleted canva project | how to recover deleted projects in canva | how to recover deleted projects on canva,
How to size an image in canva,How to size an image in canva,howto,4,medium,1,how to size an image in canva | how to size an image on canva | how to size image in canva | how to size images in canva,
How to change color scheme in canva,How to change color scheme in canva,howto,4,medium,1,how to change color scheme in canva | how to change color scheme on canva | how to change the color scheme on canva | how to change the color scheme in canva,
How to rotate a picture in canva,How to rotate a picture in canva,howto,4,medium,1,how to rotate a picture in canva | how to rotate a picture on canva | how to rotate pictures on canva | how to rotate picture on canva,
How to stretch a picture in canva,How to stretch a picture in canva,howto,4,medium,1,how to stretch a picture in canva | how to stretch picture in canva | how to stretch pictures in canva | how to stretch a picture on canva,
How to outline a font in canva,How to outline a font in canva,howto,4,medium,1,how to outline font in canva | how to outline fonts in canva | how to outline a font in canva | how to outline font on canva,
How to make a cutout on canva,How to make a cutout on canva,howto,4,medium,1,how to make cutouts on canva | how to make a cutout on canva | how to make a cutout in canva | how to make cutout on canva,
How to blur a picture on canva,How to blur a picture on canva,howto,4,medium,1,how to blur a picture on canva | how to blur a picture in canva | how to blur picture in canva | how to blur pictures on canva,
How to change the size of a canva project,How to change the size of a canva project,howto,4,medium,1,how to change size of canva project | how to change the size of a project in canva | how to change size of project in canva | how to change the size of a canva project,
How to split a page in half on canva,How to split a page in half on canva,howto,4,medium,1,how to split canva page in half | how to split a page in half on canva | how to split a page in half in canva | how to split page in half on canva,
How to upload a gif to canva,How to upload a gif to canva,howto,4,medium,1,how to upload a gif to canva | how to upload gif to canva | how to upload gifs to canva | how to upload gifs on canva,
How to make a line in canva,How to make a line in canva,howto,4,medium,1,how to make a line in canva | how to make lines on canva | how to make a line on canva | how to make lines in canva,
How to use a canva template,How to use a canva template,howto,4,medium,1,how to use templates in canva | how to use a canva template | how to use a template in canva | how to use templates on canva,
How to turn a page on canva,How to turn a page on canva,howto,4,medium,1,how to turn a page on canva | how to turn page on canva | how to turn page in canva | how to turn a page in canva,
How to save a canva design as a template,How to save a canva design as a template,howto,4,medium,1,how to save a design in canva as a template | how to save a design as a template in canva | how to save a canva design as a template | how to save design as canva template,
How to make a canva video loop,How to make a canva video loop,howto,4,medium,1,how to make a video loop on canva | how to make a video loop in canva | how to make a canva video loop | how to make canva video loop,
How to change color of a picture in canva,How to change color of a picture in canva,howto,4,medium,1,how to change the color of a picture in canva | how to change color of picture in canva | how to change color of a picture in canva | how to change the color of a picture on canva,
How to change ratio on canva,How to change ratio on canva,howto,4,medium,1,how to change ratio on canva | how to change ratio in canva | how to change the ratio on canva | how to change the ratio in canva,
How to resize a video in canva,How to resize a video in canva,howto,4,medium,1,how to resize a video in canva | how to resize video in canva | how to resize video on canva | how to resize a video on canva,
canva hubspot integration,How to Integrate canva with Hubspot,integration,4,medium,1,canva hubspot integration | hubspot canva integration | canva and hubspot integration | hubspot and canva integration,
canva shopify integration,How to Integrate canva with Shopify,integration,4,medium,1,canva shopify integration | canva connect shopify app | canva shopify integration features | shopify canva integration,
How to delete a canva account,How to delete a canva account,howto,4,medium,2,how to delete canva account | how to delete a canva account | how to delete my canva account | how to remove team members from canva,How to delete a canva account | How to remove team members from canva
How to group items canva,How to group items canva,howto,4,medium,2,how to group items in canva | how to group items on canva | how to group items canva | how to group two items in canva,How to group items canva | How to group two items in canva
How to animate canva,How to animate canva,howto,4,medium,2,how to animate on canva | how to animate in canva | how to animate canva | how to animate in canva one by one,How to animate canva | How to animate in canva one by one
How to indent canva,How to indent canva,howto,4,medium,2,how to indent on canva | how to indent in canva | how to indent canva | how to do indent in canva,How to indent canva | How to do indent in canva
How to resize canva,How to resize canva,howto,4,medium,2,how to resize in canva | how to resize on canva | how to resize canva | how to resize canvas in canva,How to resize canva | How to resize canvas in canva
How to flip canva,How to flip canva,howto,4,medium,2,how to flip in canva | how to flip on canva | how to flip canva | how to flip canvas in canva,How to flip canva | How to flip canvas in canva
How to create a booklet in canva,How to create a booklet in canva,howto,4,medium,2,how to create a booklet in canva | how to create booklet in canva | how to create a booklet on canva | how to design a booklet in canva,How to create a booklet in canva | How to design a booklet in canva
How to stretch letter in canva,How to stretch letter in canva,howto,4,medium,2,how to stretch letters in canva | how to stretch letters on canva | how to stretch letter in canva | how to stretch out letters in canva,How to stretch letter in canva | How to stretch out letters in canva
How to print front and back canva,How to print front and back canva,howto,4,medium,2,how to print front and back on canva | how to print front and back from canva | how to print front and back canva | how to print something front and back on canva,How to print front and back canva | How to print something front and back on canva
How to add gridlines in canva,How to add gridlines in canva,howto,4,medium,2,how to add gridlines in canva | how to add gridlines to canva | how to add gridlines on canva | how to put gridlines on canva,How to add gridlines in canva | How to put gridlines on canva
How to make text transparent canva,How to make text transparent canva,howto,4,medium,2,how to make text transparent in canva | how to make text transparent on canva | how to make text transparent canva | how to make transparent text in canva,How to make text transparent canva | How to make transparent text in canva
How to edit a pdf in canva,How to edit a pdf in canva,howto,4,medium,2,how to edit pdf in canva | how to edit a pdf in canva | how to edit a pdf on canva | how to change canva to pdf,How to edit a pdf in canva | How to change canva to pdf
How to soften edges of a photo in canva,How to soften edges of a photo in canva,howto,4,medium,2,how to soften the edges of a photo in canva | how to soften edges of photo in canva | how to soften edges of a photo in canva | how to soften photo edges in canva,How to soften edges of a photo in canva | How to soften photo edges in canva
How to save a canva design as a pdf,How to save a canva design as a pdf,howto,4,medium,2,how to save canva design as pdf | how to save a canva design as a pdf | how to save your design as a pdf canva | how to save a canva design as an editable pdf,How to save a canva design as a pdf | How to save a canva design as an editable pdf
How to make an image circular in canva,How to make an image circular in canva,howto,4,medium,2,how to make an image circular in canva | how to make an image circular on canva | how to make image circular in canva | how to make a circular image in canva,How to make an image circular in canva | How to make a circular image in canva
How to add a stroke to text in canva,How to add a stroke to text in canva,howto,4,medium,2,how to add stroke to text in canva | how to add a stroke to text in canva | how to add stroke to text on canva | how to add text stroke in canva,How to add a stroke to text in canva | How to add text stroke in canva
How to round corners of an image in canva,How to round corners of an image in canva,howto,4,medium,2,how to round the corners of an image in canva | how to round corners of an image in canva | how to round corners of image in canva | how to round image corners in canva,How to round corners of an image in canva | How to round image corners in canva
How to change a color palette in canva,How to change a color palette in canva,howto,4,medium,2,how to change color palette in canva | how to change the color palette in canva | how to change a color palette in canva | how to change color palette in canva template,How to change a color palette in canva | How to change color palette in canva template
How to create a canva website,How to create a canva website,howto,4,medium,2,how to create a website on canva | how to create a canva website | how to create a website in canva | how to build a website on canva,How to create a canva website | How to build a website on canva
How to get paid in canva,How to get paid in canva,howto,4,medium,2,how to get paid in canva | how to get paid on canva | how to get paid from canva | how to get paid by canva,How to get paid in canva | How to get paid by canva
How to make a good canva presentation,How to make a good canva presentation,howto,4,medium,2,how to make a good canva presentation | how to make a good presentation on canva | how to make a good presentation in canva | how to make a canva presentation look good,How to make a good canva presentation | How to make a canva presentation look good
How to add sound effects on canva,How to add sound effects on canva,howto,4,medium,2,how to add sound effects on canva | how to add sound effects to canva | how to add sound effects in canva | how to add sound effects to canva presentation,How to add sound effects on canva | How to add sound effects to canva presentation
How to match a font in canva,How to match a font in canva,howto,4,medium,2,how to match a font in canva | how to match fonts in canva | how to match font in canva | how to font match in canva,How to match a font in canva | How to font match in canva
How to extract audio canva,How to extract audio canva,howto,4,medium,2,how to extract audio in canva | how to extract audio on canva | how to extract audio canva | how to download audio from canva,How to extract audio canva | How to download audio from canva
How to make a table chart in canva,How to make a table chart in canva,howto,4,medium,2,how to make a table chart in canva | how to make a table chart on canva | how to make table chart in canva | how to create a table chart in canva,How to make a table chart in canva | How to create a table chart in canva
How to add a subscript in canva,How to add a subscript in canva,howto,4,medium,2,how to add subscript in canva | how to add a subscript in canva | how to add subscripts in canva | how to put a subscript in canva,How to add a subscript in canva | How to put a subscript in canva
How to upload audio to canva,How to upload audio to canva,howto,4,medium,2,how to upload audio to canva | how to upload audio on canva | how to upload audio in canva | how to import audio into canva,How to upload audio to canva | How to import audio into canva
How to fill a shape in canva,How to fill a shape in canva,howto,4,medium,2,how to fill a shape in canva | how to fill a shape on canva | how to fill shape in canva | how to fill in a shape on canva,How to fill a shape in canva | How to fill in a shape on canva
How to do canva ai,How to do canva ai,howto,4,medium,2,how to do ai on canva | how to do ai in canva | how to do canva ai | how to ai on canva,How to do canva ai | How to ai on canva
How to download a photo from canva,How to download a photo from canva,howto,4,medium,2,how to download a photo from canva | how to download photos from canva | how to download photo from canva | how to download canva to photos,How to download a photo from canva | How to download canva to photos
How to make a checklist in canva,How to make a checklist in canva,howto,4,medium,2,how to make a checklist in canva | how to make a checklist on canva | how to make checklist in canva | how to create a checklist in canva,How to make a checklist in canva | How to create a checklist in canva
How to save a photo in canva,How to save a photo in canva,howto,4,medium,2,how to save a photo from canva | how to save photo from canva | how to save a photo in canva | how to save canva to photos,How to save a photo in canva | How to save canva to photos
How to get a qr code on canva,How to get a qr code on canva,howto,4,medium,2,how to get a qr code on canva | how to get a qr code in canva | how to get qr code on canva | how to get venmo qr code on canva,How to get a qr code on canva | How to get venmo qr code on canva
How to make an image smaller in canva,How to make an image smaller in canva,howto,4,medium,2,how to make an image smaller in canva | how to make an image smaller on canva | how to make image smaller in canva | how to make canva file smaller,How to make an image smaller in canva | How to make canva file smaller
How to share a canva file,How to share a canva file,howto,4,medium,2,how to share canva files | how to share a canva file | how to share canva file | how to share a canva document,How to share a canva file | How to share a canva document
How to make a video play automatically in canva,How to make a video play automatically in canva,howto,4,medium,2,how to make a video play automatically in canva | how to make video play automatically in canva | how to make canva video play automatically | how to make a video automatically play in canva,How to make a video play automatically in canva | How to make a video automatically play in canva
How to add audio in canva from youtube,How to add audio in canva from youtube,howto,4,medium,2,how to add audio in canva from youtube | how to add audio to canva from youtube | how to add audio from youtube to canva | how to add youtube audio to canva,How to add audio in canva from youtube | How to add youtube audio to canva
How to make a bullet point on canva,How to make a bullet point on canva,howto,4,medium,2,how to make bullet points in canva | how to make a bullet point on canva | how to make a bullet point in canva | how to create bullet points in canva,How to make a bullet point on canva | How to create bullet points in canva
How to make a business card on canva,How to make a business card on canva,howto,4,medium,2,how to make business cards in canva | how to make business cards on canva | how to make a business card on canva | how to make a digital business card in canva,How to make a business card on canva | How to make a digital business card in canva
How to fill an image in canva,How to fill an image in canva,howto,4,medium,2,how to fill an image in canva | how to fill an image on canva | how to fill image in canva | how to fill in an image on canva,How to fill an image in canva | How to fill in an image on canva
How to do a cutout on canva,How to do a cutout on canva,howto,4,medium,2,how to do a cutout on canva | how to do cutouts in canva | how to do cutouts on canva | how to cutout on canva,How to do a cutout on canva | How to cutout on canva
How to make a pie chart on canva,How to make a pie chart on canva,howto,4,medium,2,how to make a pie chart on canva | how to make a pie chart in canva | how to make pie chart in canva | how to create a pie chart in canva,How to make a pie chart on canva | How to create a pie chart in canva
How to change the color of a logo in canva,How to change the color of a logo in canva,howto,4,medium,2,how to change color of logo in canva | how to change the color of a logo in canva | how to change color of logo on canva | how to change logo color in canva,How to change the color of a logo in canva | How to change logo color in canva
How to save a canva presentation as a powerpoint,How to save a canva presentation as a powerpoint,howto,4,medium,2,how to save canva presentation as powerpoint | how to save a canva presentation as a powerpoint | how to save your canva presentation as a powerpoint | how to save canva as powerpoint,How to save a canva presentation as a powerpoint | How to save canva as powerpoint
How to add a link in canva flyer,How to add a link in canva flyer,howto,4,medium,2,how to add link to canva flyer | how to add a link in canva flyer | how to add a link to canva flyer | how to add a link to a canva flyer,How to add a link in canva flyer | How to add a link to a canva flyer
How to create a ugc portfolio on canva,How to create a ugc portfolio on canva,howto,4,medium,2,how to create a ugc portfolio on canva | how to create a ugc portfolio in canva | how to create ugc portfolio canva | how to make a ugc portfolio on canva,How to create a ugc portfolio on canva | How to make a ugc portfolio on canva
How to make a straight line in canva,How to make a straight line in canva,howto,4,medium,2,how to make a straight line in canva | how to make a straight line on canva | how to make straight lines in canva | how to make a line straight in canva,How to make a straight line in canva | How to make a line straight in canva
