canonical_keyword,suggested_title,category,variant_count,signal_strength,cluster_size,all_variants,merged_from
How to number pages in canva,How to number pages in canva,howto,2,low,1,how to number pages in canva | how to number pages on canva,
How to curve text in canva mobile,How to curve text in canva mobile,howto,2,low,1,how to curve text in canva mobile | how to curve text on canva mobile,
How to change font color in canva,How to change font color in canva,howto,2,low,1,how to change font color in canva | how to change font color on canva,
How to add guides in canva,How to add guides in canva,howto,2,low,1,how to add guides in canva | how to add guides on canva,
How to flip words on canva,How to flip words on canva,howto,2,low,1,how to flip words on canva | how to flip words in canva,
How to bend words in canva,How to bend words in canva,howto,2,low,1,how to bend words in canva | how to bend words on canva,
How to make text taller in canva,How to make text taller in canva,howto,2,low,1,how to make text taller in canva | how to make text taller on canva,
How to open a canva template link,How to open a canva template link,howto,2,low,1,how to open canva template link | how to open a canva template link,
How to flip things in canva,How to flip things in canva,howto,2,low,1,how to flip things in canva | how to flip things on canva,
How to check spelling in canva,How to check spelling in canva,howto,2,low,1,how to check spelling in canva | how to check spelling on canva,
How to create a media kit in canva,How to create a media kit in canva,howto,2,low,1,how to create a media kit in canva | how to create a media kit on canva,
How to flip a text box in canva,How to flip a text box in canva,howto,2,low,1,how to flip a text box in canva | how to flip text box in canva,
How to squish an image in canva,How to squish an image in canva,howto,2,low,1,how to squish an image in canva | how to squish images in canva,
How to overlay images in canva,How to overlay images in canva,howto,2,low,1,how to overlay images in canva | how to overlay images on canva,
How to cancel canva plan,How to cancel canva plan,howto,2,low,1,how to cancel canva plan | how to cancel plan on canva,
How to curve writing in canva,How to curve writing in canva,howto,2,low,1,how to curve writing in canva | how to curve writing on canva,
How to photoshop on canva,How to photoshop on canva,howto,2,low,1,how to photoshop on canva | how to photoshop in canva,
How to make something transparent in canva,How to make something transparent in canva,howto,2,low,1,how to make something transparent in canva | how to make something transparent on canva,
How to round edges in canva,How to round edges in canva,howto,2,low,1,how to round edges in canva | how to round edges on canva,
How to recolor an image in canva,How to recolor an image in canva,howto,2,low,1,how to recolor an image in canva | how to recolor image in canva,
How to highlight something in canva,How to highlight something in canva,howto,2,low,1,how to highlight something in canva | how to highlight something on canva,
How to do a table in canva,How to do a table in canva,howto,2,low,1,how to do table in canva | how to do a table in canva,
How to change resolution on canva,How to change resolution on canva,howto,2,low,1,how to change resolution on canva | how to change resolution in canva,
How to print stickers on canva,How to print stickers on canva,howto,2,low,1,how to print stickers from canva | how to print stickers on canva,
How to mirror something in canva,How to mirror something in canva,howto,2,low,1,how to mirror something in canva | how to mirror something on canva,
How to underline in canva,How to underline in canva,howto,2,low,1,how to underline in canva | how to underline on canva,
How to select multiple objects in canva,How to select multiple objects in canva,howto,2,low,1,how to select multiple objects in canva | how to select multiple objects on canva,
How to embed in canva,How to embed in canva,howto,2,low,1,how to embed in canva | how to embed on canva,
How to unlock something on canva,How to unlock something on canva,howto,2,low,1,how to unlock something on canva | how to unlock something in canva,
How to crop something into a circle on canva,How to crop something into a circle on canva,howto,2,low,1,how to crop something into a circle on canva | how to crop something into a circle in canva,
How to create a silhouette in canva,How to create a silhouette in canva,howto,2,low,1,how to create a silhouette in canva | how to create silhouette in canva,
How to make th small in canva,How to make th small in canva,howto,2,low,1,how to make th small in canva | how to make the th small in canva,
How to blur something in canva,How to blur something in canva,howto,2,low,1,how to blur something in canva | how to blur something on canva,
How to make a picture circular in canva,How to make a picture circular in canva,howto,2,low,1,how to make a picture circular in canva | how to make a picture circular on canva,
How to make text bend in canva,How to make text bend in canva,howto,2,low,1,how to make text bend in canva | how to make text bend on canva,
How to flip a group in canva,How to flip a group in canva,howto,2,low,1,how to flip a group in canva | how to flip group in canva,
How to make a magazine on canva,How to make a magazine on canva,howto,2,low,1,how to make a magazine on canva | how to make magazine on canva,
How to arch words in canva,How to arch words in canva,howto,2,low,1,how to arch words in canva | how to arch words on canva,
How to get rid of ruler on canva,How to get rid of ruler on canva,howto,2,low,1,how to get rid of ruler on canva | how to get rid of the ruler on canva,
How to make text arch in canva,How to make text arch in canva,howto,2,low,1,how to make text arch in canva | how to make your text arch in canva,
How to comment on canva,How to comment on canva,howto,2,low,1,how to comment on canva | how to comment in canva,
How to make money on canva app,How to make money on canva app,howto,2,low,1,how to make money with canva app | how to make money on canva app,
How to add text to speech in canva,How to add text to speech in canva,howto,2,low,1,how to add text to speech in canva | how to add text to speech on canva,
How to create a tri-fold brochure in canva,How to create a tri-fold brochure in canva,howto,2,low,1,how to create a tri-fold brochure in canva | how to create tri-fold brochure in canva,
How to make money with canva and amazon,How to make money with canva and amazon,howto,2,low,1,how to make money with canva and amazon | how to make money using canva and amazon,
How to double space in canva,How to double space in canva,howto,2,low,1,how to double space in canva | how to double space on canva,
How to layer photos in canva,How to layer photos in canva,howto,2,low,1,how to layer photos in canva | how to layer photos on canva,
How to edit in canva,How to edit in canva,howto,2,low,1,how to edit in canva | how to edit on canva,
How to get a vector file from canva,How to get a vector file from canva,howto,2,low,1,how to get a vector file from canva | how to get vector file from canva,
How to link text in canva,How to link text in canva,howto,2,low,1,how to link text in canva | how to link text on canva,
How to send a canva invite via text,How to send a canva invite via text,howto,2,low,1,how to send canva invite via text | how to send a canva invite via text,
How to add voiceover to canva presentation,How to add voiceover to canva presentation,howto,2,low,1,how to add voiceover to canva presentation | how to add voiceover in canva presentation,
How to imbed a youtube video in canva,How to imbed a youtube video in canva,howto,2,low,1,how to imbed a youtube video in canva | how to imbed youtube video in canva,
How to share canva,How to share canva,howto,2,low,1,how to share on canva | how to share canva,
How to group together in canva,How to group together in canva,howto,2,low,1,how to group together in canva | how to group together on canva,
How to reverse text in canva,How to reverse text in canva,howto,2,low,1,how to reverse text in canva | how to reverse text on canva,
How to download a picture from canva,How to download a picture from canva,howto,2,low,1,how to download a picture from canva | how to download pictures from canva,
How to do a border on canva,How to do a border on canva,howto,2,low,1,how to do a border on canva | how to do borders in canva,
How to copy and paste on canva,How to copy and paste on canva,howto,2,low,1,how to copy and paste on canva | how to copy and paste in canva,
How to turn off snap in canva,How to turn off snap in canva,howto,2,low,1,how to turn off snap in canva | how to turn off snap on canva,
How to create a linkedin carousel in canva,How to create a linkedin carousel in canva,howto,2,low,1,how to create linkedin carousel in canva | how to create a linkedin carousel in canva,
How to flip a speech bubble in canva,How to flip a speech bubble in canva,howto,2,low,1,how to flip a speech bubble in canva | how to flip speech bubble in canva,
How to get 300 dpi in canva,How to get 300 dpi in canva,howto,2,low,1,how to get 300 dpi in canva | how to get 300 dpi on canva,
How to add text boxes in canva,How to add text boxes in canva,howto,2,low,1,how to add text boxes in canva | how to add text boxes on canva,
How to duplicate page in canva mobile,How to duplicate page in canva mobile,howto,2,low,1,how to duplicate page in canva mobile | how to duplicate page on canva mobile,
How to mirror an element in canva,How to mirror an element in canva,howto,2,low,1,how to mirror an element in canva | how to mirror elements in canva,
How to increase resolution in canva,How to increase resolution in canva,howto,2,low,1,how to increase resolution in canva | how to increase resolution on canva,
How to indent in canva text box,How to indent in canva text box,howto,2,low,1,how to indent in canva text box | how to indent on canva text box,
How to merge on canva,How to merge on canva,howto,2,low,1,how to merge on canva | how to merge in canva,
How to lower opacity in canva,How to lower opacity in canva,howto,2,low,1,how to lower opacity in canva | how to lower opacity on canva,
How to layer pictures on canva,How to layer pictures on canva,howto,2,low,1,how to layer pictures on canva | how to layer pictures in canva,
How to make something black and white in canva,How to make something black and white in canva,howto,2,low,1,how to make something black and white in canva | how to make something black and white on canva,
How to stretch an image in canva without cropping,How to stretch an image in canva without cropping,howto,2,low,1,how to stretch image in canva without cropping | how to stretch an image in canva without cropping,
How to stretch words in canva,How to stretch words in canva,howto,2,low,1,how to stretch words in canva | how to stretch words on canva,
How to wrap text around a photo in canva,How to wrap text around a photo in canva,howto,2,low,1,how to wrap text around a photo in canva | how to wrap text around photo in canva,
How to overlay on canva,How to overlay on canva,howto,2,low,1,how to overlay on canva | how to overlay in canva,
How to animate a picture in canva,How to animate a picture in canva,howto,2,low,1,how to animate a picture in canva | how to animate a picture on canva,
How to adjust dpi in canva,How to adjust dpi in canva,howto,2,low,1,how to adjust dpi in canva | how to adjust dpi on canva,
How to make a background on canva,How to make a background on canva,howto,2,low,1,how to make a background on canva | how to make a background in canva,
How to make a wallpaper on canva,How to make a wallpaper on canva,howto,2,low,1,how to make a wallpaper on canva | how to make a wallpaper in canva,
How to group items together in canva,How to group items together in canva,howto,2,low,1,how to group items together in canva | how to group items together on canva,
How to use background remover in canva,How to use background remover in canva,howto,2,low,1,how to use background remover in canva | how to use background remover on canva,
How to flip canva to landscape,How to flip canva to landscape,howto,2,low,1,how to flip to landscape in canva | how to flip canva to landscape,
How to resize an element in canva,How to resize an element in canva,howto,2,low,1,how to resize an element in canva | how to resize elements in canva,
How to share a canva design for editing,How to share a canva design for editing,howto,2,low,1,how to share canva design for editing | how to share a canva design for editing,
How to edit a graphic in canva,How to edit a graphic in canva,howto,2,low,1,how to edit a graphic in canva | how to edit graphics in canva,
How to paste a link in canva,How to paste a link in canva,howto,2,low,1,how to paste a link in canva | how to paste a link on canva,
How to change canva to portrait,How to change canva to portrait,howto,2,low,1,how to change to portrait in canva | how to change canva to portrait,
How to save a vector file in canva,How to save a vector file in canva,howto,2,low,1,how to save a vector file in canva | how to save vector file in canva,
How to turn off canva auto align,How to turn off canva auto align,howto,2,low,1,how to turn off auto align in canva | how to turn off canva auto align,
How to resize something in canva,How to resize something in canva,howto,2,low,1,how to resize something in canva | how to resize something on canva,
How to make a sticker sheet on canva,How to make a sticker sheet on canva,howto,2,low,1,how to make a sticker sheet on canva | how to make sticker sheets on canva,
How to blend in canva,How to blend in canva,howto,2,low,1,how to blend in canva | how to blend on canva,
How to save canva ai generated images,How to save canva ai generated images,howto,2,low,1,how to save ai generated images on canva | how to save canva ai generated images,
How to make a font taller in canva,How to make a font taller in canva,howto,2,low,1,how to make font taller in canva | how to make a font taller in canva,
How to resize a graphic in canva,How to resize a graphic in canva,howto,2,low,1,how to resize a graphic in canva | how to resize graphics in canva,
How to add a glow effect in canva,How to add a glow effect in canva,howto,2,low,1,how to add glow effect in canva | how to add a glow effect in canva,
How to outline an element in canva,How to outline an element in canva,howto,2,low,1,how to outline an element in canva | how to outline elements in canva,
How to add brand colors to canva,How to add brand colors to canva,howto,2,low,1,how to add brand colors to canva | how to add brand colors in canva,
How to create a trifold brochure in canva,How to create a trifold brochure in canva,howto,2,low,1,how to create a trifold brochure in canva | how to create trifold brochure in canva,
How to color background in canva,How to color background in canva,howto,2,low,1,how to color background in canva | how to color the background in canva,
How to autoplay a youtube video in canva,How to autoplay a youtube video in canva,howto,2,low,1,how to autoplay a youtube video in canva | how to autoplay youtube video in canva,
How to make a table smaller in canva,How to make a table smaller in canva,howto,2,low,1,how to make a table smaller in canva | how to make table smaller in canva,
How to turn a page horizontal in canva,How to turn a page horizontal in canva,howto,2,low,1,how to turn page horizontal in canva | how to turn a page horizontal in canva,
How to print a postcard from canva,How to print a postcard from canva,howto,2,low,1,how to print postcards from canva | how to print a postcard from canva,
How to border text in canva,How to border text in canva,howto,2,low,1,how to border text in canva | how to border text on canva,
How to fill a shape in canva with a picture,How to fill a shape in canva with a picture,howto,2,low,1,how to fill a shape in canva with a picture | how to fill a shape with a picture in canva,
How to upload a song to canva,How to upload a song to canva,howto,2,low,1,how to upload a song to canva | how to upload songs to canva,
How to add a youtube link to canva,How to add a youtube link to canva,howto,2,low,1,how to add a youtube link to canva | how to add youtube link to canva,
How to align in canva,How to align in canva,howto,2,low,1,how to align in canva | how to align on canva,
How to use chatgpt in canva,How to use chatgpt in canva,howto,2,low,1,how to use chatgpt with canva | how to use chatgpt in canva,
How to crop a shape in canva,How to crop a shape in canva,howto,2,low,1,how to crop a shape in canva | how to crop shapes in canva,
How to make a movie poster in canva,How to make a movie poster in canva,howto,2,low,1,how to make a movie poster in canva | how to make a movie poster on canva,
How to erase something on canva,How to erase something on canva,howto,2,low,1,how to erase something on canva | how to erase something in canva,
How to find free images in canva,How to find free images in canva,howto,2,low,1,how to find free images in canva | how to find free images on canva,
How to stretch an element in canva,How to stretch an element in canva,howto,2,low,1,how to stretch elements in canva | how to stretch an element in canva,
How to stretch a graphic in canva,How to stretch a graphic in canva,howto,2,low,1,how to stretch a graphic in canva | how to stretch graphics in canva,
How to invert a picture on canva,How to invert a picture on canva,howto,2,low,1,how to invert a picture on canva | how to invert picture on canva,
How to paint in canva,How to paint in canva,howto,2,low,1,how to paint in canva | how to paint on canva,
How to download canva video,How to download canva video,howto,2,low,1,how to download video from canva | how to download canva video,
How to add a box in canva,How to add a box in canva,howto,2,low,1,how to add a box in canva | how to add a box on canva,
How to get a hanging indent on canva,How to get a hanging indent on canva,howto,2,low,1,how to get hanging indent on canva | how to get a hanging indent on canva,
How to resize a logo in canva,How to resize a logo in canva,howto,2,low,1,how to resize a logo in canva | how to resize logo in canva,
How to make font curve in canva,How to make font curve in canva,howto,2,low,1,how to make font curve in canva | how to make font curve on canva,
How to blur part of an image in canva,How to blur part of an image in canva,howto,2,low,1,how to blur part of an image in canva | how to blur part of an image on canva,
How to save a template in canva,How to save a template in canva,howto,2,low,1,how to save a template in canva | how to save a template on canva,
How to rotate a template in canva,How to rotate a template in canva,howto,2,low,1,how to rotate a template in canva | how to rotate template in canva,
How to flip a design in canva,How to flip a design in canva,howto,2,low,1,how to flip a design in canva | how to flip design in canva,
How to turn a picture into a silhouette on canva,How to turn a picture into a silhouette on canva,howto,2,low,1,how to turn a picture into a silhouette on canva | how to turn picture into silhouette canva,
How to fix spacing in canva,How to fix spacing in canva,howto,2,low,1,how to fix spacing in canva | how to fix spacing on canva,
How to link slides in canva,How to link slides in canva,howto,2,low,1,how to link slides in canva | how to link slides on canva,
How to add a color overlay in canva,How to add a color overlay in canva,howto,2,low,1,how to add a color overlay in canva | how to add color overlay in canva,
How to group photos in canva,How to group photos in canva,howto,2,low,1,how to group photos in canva | how to group photos on canva,
How to make something a link on canva,How to make something a link on canva,howto,2,low,1,how to make something a link on canva | how to make something a link in canva,
How to unhide a page in canva,How to unhide a page in canva,howto,2,low,1,how to unhide a page in canva | how to unhide page in canva,
How to embed a canva newsletter in gmail,How to embed a canva newsletter in gmail,howto,2,low,1,how to embed a canva newsletter in gmail | how to embed canva newsletter in gmail,
How to underline text in canva,How to underline text in canva,howto,2,low,1,how to underline text in canva | how to underline text on canva,
How to invert a photo on canva,How to invert a photo on canva,howto,2,low,1,how to invert a photo on canva | how to invert photo on canva,
How to download canva with links,How to download canva with links,howto,2,low,1,how to download canva with links | how to download from canva with links,
How to enhance image quality in canva,How to enhance image quality in canva,howto,2,low,1,how to enhance image quality in canva | how to enhance image quality on canva,
How to edit an svg in canva,How to edit an svg in canva,howto,2,low,1,how to edit svg in canva | how to edit an svg in canva,
How to group pictures in canva,How to group pictures in canva,howto,2,low,1,how to group pictures in canva | how to group pictures on canva,
How to make canva animation longer,How to make canva animation longer,howto,2,low,1,how to make canva animation longer | how to make animation longer in canva,
How to flip an entire page in canva,How to flip an entire page in canva,howto,2,low,1,how to flip an entire page in canva | how to flip entire page in canva,
How to shrink an image in canva,How to shrink an image in canva,howto,2,low,1,how to shrink an image in canva | how to shrink an image on canva,
How to close a canva account,How to close a canva account,howto,2,low,1,how to close canva account | how to close a canva account,
How to hyper link in canva,How to hyper link in canva,howto,2,low,1,how to hyper link in canva | how to hyper link on canva,
How to make a copy of a canva project,How to make a copy of a canva project,howto,2,low,1,how to make a copy of a project in canva | how to make a copy of a canva project,
How to get curved text in canva,How to get curved text in canva,howto,2,low,1,how to get curved text in canva | how to get curved text on canva,
How to make a zine on canva,How to make a zine on canva,howto,2,low,1,how to make a zine on canva | how to make a zine in canva,
How to make an ad on canva,How to make an ad on canva,howto,2,low,1,how to make an ad on canva | how to make an ad in canva,
How to make an exponent in canva,How to make an exponent in canva,howto,2,low,1,how to make an exponent in canva | how to make exponent in canva,
How to layer things in canva,How to layer things in canva,howto,2,low,1,how to layer things in canva | how to layer things on canva,
How to save a canva project as a pdf,How to save a canva project as a pdf,howto,2,low,1,how to save canva project as pdf | how to save a canva project as a pdf,
How to change image in canva template,How to change image in canva template,howto,2,low,1,how to change image in canva template | how to change image on canva template,
How to unsubscribe canva subscription,How to unsubscribe canva subscription,howto,2,low,1,how to unsubscribe from canva subscription | how to unsubscribe canva subscription,
How to crop a video in canva,How to crop a video in canva,howto,2,low,1,how to crop a video in canva | how to crop video on canva,
How to add a footer in canva,How to add a footer in canva,howto,2,low,1,how to add footer in canva | how to add a footer in canva,
How to add an outline to a photo in canva,How to add an outline to a photo in canva,howto,2,low,1,how to add outline to photo in canva | how to add an outline to a photo in canva,
How to stretch in canva,How to stretch in canva,howto,2,low,1,how to stretch in canva | how to stretch on canva,
How to fill in canva,How to fill in canva,howto,2,low,1,how to fill in canva | how to fill on canva,
How to do a voice recording on canva,How to do a voice recording on canva,howto,2,low,1,how to do a voice recording on canva | how to do voice recording on canva,
How to upload canva to cricut,How to upload canva to cricut,howto,2,low,1,how to upload canva to cricut | how to upload from canva to cricut,
How to make images transparent in canva,How to make images transparent in canva,howto,2,low,1,how to make images transparent in canva | how to make images transparent on canva,
How to download an element from canva,How to download an element from canva,howto,2,low,1,how to download an element from canva | how to download elements from canva,
How to get text to curve on canva,How to get text to curve on canva,howto,2,low,1,how to get text to curve on canva | how to get text to curve in canva,
How to type on canva,How to type on canva,howto,2,low,1,how to type on canva | how to type in canva,
How to link things on canva,How to link things on canva,howto,2,low,1,how to link things on canva | how to link things in canva,
How to crop background in canva,How to crop background in canva,howto,2,low,1,how to crop background in canva | how to crop the background in canva,
How to loop a canva presentation,How to loop a canva presentation,howto,2,low,1,how to loop canva presentation | how to loop a canva presentation,
How to give text an outline in canva,How to give text an outline in canva,howto,2,low,1,how to give text an outline in canva | how to give text outline in canva,
How to fix resolution on canva,How to fix resolution on canva,howto,2,low,1,how to fix resolution on canva | how to fix resolution in canva,
How to print on canva without paying,How to print on canva without paying,howto,2,low,1,how to print on canva without paying | how to print from canva without paying,
How to turn an image into a circle on canva,How to turn an image into a circle on canva,howto,2,low,1,how to turn an image into a circle on canva | how to turn an image into a circle in canva,
