canonical_keyword,suggested_title,category,variant_count,signal_strength,cluster_size,all_variants,merged_from
How to add shadow to an image in canva,How to add shadow to an image in canva,howto,10,high,4,how to add shadow to image in canva | how to add a shadow to an image in canva | how to add shadow to an image in canva | how to add shadow to image canva | how to add a shadow to an image on canva | how to add shadow to images in canva | how to add drop shadow to image in canva | how to add a drop shadow to an image in canva | how to add shadow behind image in canva | how to put a shadow on an image in canva,How to add shadow to an image in canva | How to add a drop shadow to an image in canva | How to add shadow behind image in canva | How to put a shadow on an image in canva
How to make a table in canva,How to make a table in canva,howto,10,high,2,how to make a table in canva | how to make a table on canva | how to make table in canva | how to make tables in canva | how to make table on canva | how to create a table in canva | how to create a table on canva | how to create table in canva | how to create tables in canva | how to create table on canva,How to make a table in canva | How to create a table in canva
How to turn off canva danger zone,How to turn off canva danger zone,howto,10,high,4,how to turn off danger zone in canva | how to turn off the danger zone in canva | how to turn off danger zone on canva | how to turn off canva danger zone | how to turn off danger zone canva | how to hide danger zone in canva | how to hide the danger zone in canva | how to disable danger zone in canva | how to disable canva danger zone | how to turn off danger zone warning in canva,How to turn off canva danger zone | How to hide danger zone in canva | How to disable canva danger zone | How to turn off danger zone warning in canva
How to make a canva carousel,How to make a canva carousel,howto,10,high,3,how to make a carousel on canva | how to make a carousel in canva | how to make carousel on canva | how to make carousel in canva | how to make a canva carousel | how to create a carousel in canva | how to create carousel in canva | how to create a carousel on canva | how to create carousel on canva | how to design a carousel in canva,How to make a canva carousel | How to create a carousel in canva | How to design a carousel in canva
How to make a canva frame,How to make a canva frame,howto,10,high,3,how to make a frame in canva | how to make a frame on canva | how to make frames in canva | how to make canva frames | how to make a canva frame | how to create a frame in canva | how to create frames in canva | how to create canva frames | how to create frame in canva | how to make your own frame in canva,How to make a canva frame | How to create a frame in canva | How to make your own frame in canva
How to see canva edit history,How to see canva edit history,howto,10,high,5,how to see edit history on canva | how to see edit history in canva | how to see canva edit history | how to see edit history canva | how to check edit history on canva | how to check canva edit history | how to view edit history in canva | how to view edit history on canva | how to look at edit history on canva | how to find edit history on canva,How to see canva edit history | How to check canva edit history | How to view edit history in canva | How to look at edit history on canva | How to find edit history on canva
How to make a brand kit in canva,How to make a brand kit in canva,howto,10,high,5,how to make a brand kit in canva | how to make a brand kit on canva | how to make brand kit on canva | how to make brand kit in canva | how to create a new brand kit in canva | how to create new brand kit in canva | how to set up a brand kit in canva | how to set up brand kit in canva | how to make a new brand kit on canva | how to build a brand kit in canva,How to make a brand kit in canva | How to create a new brand kit in canva | How to set up a brand kit in canva | How to make a new brand kit on canva | How to build a brand kit in canva
How to add a link to canva presentation,How to add a link to canva presentation,howto,10,high,6,how to add a link to canva presentation | how to add a link in canva presentation | how to add link in canva presentation | how to add link to canva presentation | how to insert link in canva presentation | how to insert a link in canva presentation | how to add a link to a canva presentation | how to put a link in canva presentation | how to put a link in a canva presentation | how to insert a link into canva presentation,How to add a link to canva presentation | How to insert a link in canva presentation | How to add a link to a canva presentation | How to put a link in canva presentation | How to put a link in a canva presentation | How to insert a link into canva presentation
How to crop a circle in canva,How to crop a circle in canva,howto,10,high,5,how to crop a circle in canva | how to crop circle in canva | how to crop a circle on canva | how to crop in a circle on canva | how to crop in circle in canva | how to crop into a circle on canva | how to crop into circle in canva | how to crop to a circle in canva | how to crop to circle in canva | how to do a circle crop in canva,How to crop a circle in canva | How to crop in a circle on canva | How to crop into a circle on canva | How to crop to a circle in canva | How to do a circle crop in canva
How to add an outline to image in canva,How to add an outline to image in canva,howto,10,high,7,how to add an outline to an image in canva | how to add outline to image in canva | how to add an outline to image in canva | how to add white outline to image in canva | how to add a white outline to an image in canva | how to put an outline around an image in canva | how to add an outline around an image in canva | how to put an outline on an image in canva | how to add outline to canva image | how to add outline on image in canva,How to add an outline to image in canva | How to add a white outline to an image in canva | How to put an outline around an image in canva | How to add an outline around an image in canva | How to put an outline on an image in canva | How to add outline to canva image | How to add outline on image in canva
How to filter canva for free templates,How to filter canva for free templates,howto,10,high,7,how to filter for free templates on canva | how to filter canva for free templates | how to filter on canva for free templates | how to filter free templates on canva | how to filter free canva templates | how to filter only free templates in canva | how to search free templates in canva | how to filter canva templates to free | how to search only free templates on canva | how to search canva for free templates,How to filter canva for free templates | How to filter free canva templates | How to filter only free templates in canva | How to search free templates in canva | How to filter canva templates to free | How to search only free templates on canva | How to search canva for free templates
How to create a shareable editable canva link,How to create a shareable editable canva link,howto,10,high,5,how to create shareable editable canva link | how to create a shareable editable canva link | how to create a shareable editable link in canva | how to create editable canva link | how to create an editable canva link | how to create a shareable canva link for a design | how to create a shareable link for a canva design | how to generate shareable canva link | how to generate canva shareable link | how to generate shareable editable canva link,How to create a shareable editable canva link | How to create an editable canva link | How to create a shareable canva link for a design | How to generate shareable canva link | How to generate shareable editable canva link
How to create canva templates to sell,How to create canva templates to sell,howto,10,high,8,how to create canva templates to sell | how to create templates on canva to sell | how to create and sell canva templates | how to create and sell templates on canva | how to make canva templates to sell | how to create a canva template to sell | how to make and sell canva templates | how to make a canva template to sell | how to create canva templates to sell online | how to sell design templates on canva,How to create canva templates to sell | How to create and sell canva templates | How to make canva templates to sell | How to create a canva template to sell | How to make and sell canva templates | How to make a canva template to sell | How to create canva templates to sell online | How to sell design templates on canva
How to make a copy of canva design,How to make a copy of canva design,howto,10,high,6,how to make a copy of a canva design | how to make a copy of canva design | how to make a copy on canva | how to make a copy in canva | how to duplicate a design in canva | how to duplicate design in canva | how to copy a design in canva | how to copy a canva design | how to make a copy of canva | how to mirror design in canva,How to make a copy of canva design | How to make a copy on canva | How to duplicate a design in canva | How to copy a canva design | How to make a copy of canva | How to mirror design in canva
How to put a picture in a shape on canva,How to put a picture in a shape on canva,howto,10,high,8,how to put a picture in a shape on canva | how to put picture in shape canva | how to put a picture into a shape on canva | how to put a picture into a shape in canva | how to add a picture to a shape in canva | how to insert a picture into a shape in canva | how to add a picture into a shape on canva | how to insert a picture in a shape in canva | how to put a picture inside a shape in canva | how to add a picture in a shape on canva,How to put a picture in a shape on canva | How to put a picture into a shape on canva | How to add a picture to a shape in canva | How to insert a picture into a shape in canva | How to add a picture into a shape on canva | How to insert a picture in a shape in canva | How to put a picture inside a shape in canva | How to add a picture in a shape on canva
How to cancel a canva subscription,How to cancel a canva subscription,howto,9,high,1,how to cancel canva subscription | how to cancel my canva subscription | how to cancel a canva subscription | how to cancel your canva subscription | how to cancel my subscription for canva | how to cancel my subscription on canva | how to cancel the subscription in canva | how to cancel a subscription on canva | how to cancel canva subscriptions,
How to flip a shape canva,How to flip a shape canva,howto,9,high,1,how to flip a shape in canva | how to flip shapes in canva | how to flip shape in canva | how to flip a shape on canva | how to flip shapes on canva | how to flip shape on canva | how to flip a shape canva | how to flip shape canva | how to flip an shape in canva,
How to crop image into a circle on canva,How to crop image into a circle on canva,howto,9,high,2,how to crop an image into a circle on canva | how to crop image into circle canva | how to crop an image into a circle in canva | how to crop an image in canva into a circle | how to crop image into circle in canva | how to crop image into a circle on canva | how to crop image into circle on canva | how to crop an image to a circle in canva | how to crop image to circle in canva,How to crop image into a circle on canva | How to crop an image to a circle in canva
How to print a canva page,How to print a canva page,howto,9,high,3,how to print a canva page | how to print a page from canva | how to print canva pages | how to print a page in canva | how to print a page on canva | how to print pages on canva | how to print pages from canva | how to print form canva | how to download one page on canva,How to print a canva page | How to print form canva | How to download one page on canva
How to remove danger zone canva,How to remove danger zone canva,howto,9,high,2,how to remove danger zone on canva | how to remove the danger zone in canva | how to remove danger zone in canva | how to remove danger zone from canva | how to remove danger zone canva | how to remove canva danger zone | how to remove danger zone warning on canva | how to remove danger zone warning in canva | how to remove the danger zone warning on canva,How to remove danger zone canva | How to remove danger zone warning on canva
How to make a poster on canva,How to make a poster on canva,howto,9,high,4,how to make a poster on canva | how to make a poster in canva | how to make poster on canva | how to make posters on canva | how to make posters in canva | how to create a poster in canva | how to create a poster on canva | how to create a poster in canva step by step | how to design a poster on canva,How to make a poster on canva | How to create a poster in canva | How to create a poster in canva step by step | How to design a poster on canva
How to add a chart in canva,How to add a chart in canva,howto,9,high,3,how to add a chart in canva | how to add a chart to canva | how to add a chart on canva | how to add chart in canva | how to add charts in canva | how to insert a chart in canva | how to insert a chart on canva | how to insert chart in canva | how to insert a chart into canva,How to add a chart in canva | How to insert a chart in canva | How to insert a chart into canva
How to edit a photo in canva,How to edit a photo in canva,howto,9,high,2,how to edit photos in canva | how to edit a photo in canva | how to edit photos on canva | how to edit photo in canva | how to edit a photo on canva | how to change a photo in canva | how to change photo in canva | how to change a photo on canva | how to change photo on canva,How to edit a photo in canva | How to change a photo in canva
How to change a portrait to landscape in canva,How to change a portrait to landscape in canva,howto,9,high,4,how to change portrait to landscape in canva | how to change portrait to landscape on canva | how to change a portrait to landscape in canva | how to change canva portrait to landscape | how to change from portrait to landscape in canva | how to change canva from portrait to landscape | how to change from landscape to portrait in canva | how to change canva from landscape to portrait | how to change landscape to portrait in canva,How to change a portrait to landscape in canva | How to change canva from portrait to landscape | How to change canva from landscape to portrait | How to change landscape to portrait in canva
How to add a border to image in canva,How to add a border to image in canva,howto,9,high,5,how to add a border to an image in canva | how to add border to image in canva | how to add a border to an image on canva | how to add a border to image in canva | how to add a border around an image in canva | how to add border around image in canva | how to add border in canva image | how to put a border around an image in canva | how to add white border to image in canva,How to add a border to image in canva | How to add a border around an image in canva | How to add border in canva image | How to put a border around an image in canva | How to add white border to image in canva
How to show a grid on canva,How to show a grid on canva,howto,9,high,3,how to show grid on canva | how to show grid in canva | how to show a grid on canva | how to show grids on canva | how to get a grid on canva | how to get grid on canva | how to get grids on canva | how to see grid on canva | how to see grid in canva,How to show a grid on canva | How to get a grid on canva | How to see grid on canva
How to select multiple canva,How to select multiple canva,howto,9,high,4,how to select multiple on canva | how to select multiple in canva | how to select multiple canva | how to select all in canva | how to select all on canva | how to select in canva | how to select on canva | how to multiple select in canva | how to multiple select on canva,How to select multiple canva | How to select all in canva | How to select in canva | How to multiple select in canva
How to create and share a canva template,How to create and share a canva template,howto,9,high,6,how to create and share canva templates | how to create and share a canva template | how to create and share canva template | how to create instagram post templates in canva | how to create instagram post template in canva | how to create a canva template and share it | how to create and share canva video template | how to create a canva template for instagram post | how to create and share canva templates tutorial,How to create and share a canva template | How to create instagram post template in canva | How to create a canva template and share it | How to create and share canva video template | How to create a canva template for instagram post | How to create and share canva templates tutorial
How to make a continuous instagram post canva,How to make a continuous instagram post canva,howto,9,high,3,how to make a continuous instagram post canva | how to make a continuous instagram post on canva | how to make continuous instagram post canva | how to create instagram post in canva | how to create an instagram post in canva | how to create instagram posts in canva | how to make an instagram post on canva | how to make instagram posts on canva | how to make instagram post on canva,How to make a continuous instagram post canva | How to create an instagram post in canva | How to make an instagram post on canva
How to convert a canva presentation to google slides,How to convert a canva presentation to google slides,howto,9,high,7,how to convert a canva presentation to google slides | how to convert canva presentation to google slides | how to convert google slides to canva | how to convert a google slide to canva | how to convert canva slides to google slides | how to convert canva into google slides | how to convert a canva slide to google slides | how to convert canva slides into google slides | how to convert google slides into canva,How to convert a canva presentation to google slides | How to convert a google slide to canva | How to convert canva slides to google slides | How to convert canva into google slides | How to convert a canva slide to google slides | How to convert canva slides into google slides | How to convert google slides into canva
How to flip an element canva,How to flip an element canva,howto,8,high,1,how to flip an element in canva | how to flip elements in canva | how to flip element in canva | how to flip an element on canva | how to flip elements on canva | how to flip element on canva | how to flip a element in canva | how to flip an element canva,
How to blur a image in canva,How to blur a image in canva,howto,8,high,1,how to blur an image in canva | how to blur image in canva | how to blur an image on canva | how to blur image on canva | how to blur images in canva | how to blur images on canva | how to blur image canva | how to blur a image in canva,
How to print a canva project,How to print a canva project,howto,8,high,2,how to print canva projects | how to print a canva project | how to print a project from canva | how to print a project on canva | how to print canva project | how to print a project in canva | how to print my canva project | how to print out a canva project,How to print a canva project | How to print out a canva project
How to move a text box in canva,How to move a text box in canva,howto,8,high,2,how to move a text box in canva | how to move text box in canva | how to move a text box on canva | how to move text box on canva | how to move the text box in canva | how to move text box canva | how to drag a text box in canva | how to drag text box in canva,How to move a text box in canva | How to drag a text box in canva
How to share an editable canva template,How to share an editable canva template,howto,8,high,2,how to share editable canva template | how to share editable canva templates | how to share canva editable template | how to share editable template in canva | how to share editable template canva | how to share an editable canva template | how to create and share editable canva templates | how to create and share editable canva template,How to share an editable canva template | How to create and share editable canva template
How to download a font to canva,How to download a font to canva,howto,8,high,3,how to download fonts to canva | how to download a font to canva | how to download fonts on canva | how to download fonts in canva | how to download font to canva | how to download fonts for canva | how to download fonts into canva | how to download font into canva,How to download a font to canva | How to download fonts into canva | How to download font into canva
How to delete a comment on canva,How to delete a comment on canva,howto,8,high,2,how to delete a comment on canva | how to delete a comment in canva | how to delete comments on canva | how to delete comments in canva | how to delete canva comments | how to delete comment on canva | how to remove comments in canva | how to remove a comment in canva,How to delete a comment on canva | How to remove a comment in canva
How to change canva dimensions,How to change canva dimensions,howto,8,high,3,how to change dimensions on canva | how to change the dimensions on canva | how to change canva dimensions | how to change dimensions in canva | how to change the dimensions in canva | how to edit dimensions on canva | how to edit dimensions in canva | how to adjust dimensions in canva,How to change canva dimensions | How to edit dimensions on canva | How to adjust dimensions in canva
How to add a drop shadow in canva,How to add a drop shadow in canva,howto,8,high,3,how to add drop shadow in canva | how to add a drop shadow in canva | how to add drop shadow canva | how to add drop shadow on canva | how to add a drop shadow on canva | how to add drop shadow to shape in canva | how to add a drop shadow to a shape in canva | how to add drop shadow to text in canva,How to add a drop shadow in canva | How to add a drop shadow to a shape in canva | How to add drop shadow to text in canva
How to add a voice over on canva,How to add a voice over on canva,howto,8,high,2,how to add a voice over on canva | how to add voice over in canva | how to add voice over on canva | how to add a voice over in canva | how to add voice over to canva | how to add voice to canva | how to add your voice on canva | how to add voice in canva,How to add a voice over on canva | How to add voice to canva
How to duplicate a page in canva,How to duplicate a page in canva,howto,8,high,3,how to duplicate a page in canva | how to duplicate page in canva | how to duplicate a page on canva | how to duplicate page on canva | how to duplicate pages in canva | how to copy a page in canva | how to copy a page on canva | how to mirror a page on canva,How to duplicate a page in canva | How to copy a page in canva | How to mirror a page on canva
How to make a canva page horizontal,How to make a canva page horizontal,howto,8,high,3,how to make a page horizontal in canva | how to make page horizontal in canva | how to make canva page horizontal | how to make a canva page horizontal | how to make the page horizontal in canva | how to make a horizontal page in canva | how to make horizontal page in canva | how to make a vertical page horizontal in canva,How to make a canva page horizontal | How to make a horizontal page in canva | How to make a vertical page horizontal in canva
How to add a song to canva video,How to add a song to canva video,howto,8,high,3,how to add a song to canva video | how to add song to canva video | how to add a song on canva video | how to add a song in canva video | how to add song on canva video | how to add a song to a canva video | how to add a song to a video in canva | how to add songs to canva video,How to add a song to canva video | How to add a song to a canva video | How to add songs to canva video
How to add a shape in canva,How to add a shape in canva,howto,8,high,2,how to add shapes in canva | how to add a shape in canva | how to add shapes on canva | how to add shapes to canva | how to add shape in canva | how to insert shapes in canva | how to insert a shape in canva | how to insert shape in canva,How to add a shape in canva | How to insert a shape in canva
How to print a canva poster,How to print a canva poster,howto,8,high,2,how to print a poster from canva | how to print canva poster | how to print a poster on canva | how to print a canva poster | how to print poster from canva | how to download a poster from canva | how to download a poster on canva | how to download poster from canva,How to print a canva poster | How to download a poster on canva
How to download a canva presentation,How to download a canva presentation,howto,8,high,2,how to download a canva presentation | how to download canva presentation | how to download a presentation from canva | how to download presentation from canva | how to print a canva presentation | how to print canva presentation | how to print a presentation in canva | how to print a presentation on canva,How to download a canva presentation | How to print a canva presentation
How to download a pdf from canva,How to download a pdf from canva,howto,8,high,4,how to download pdf from canva | how to download pdf in canva | how to download a pdf from canva | how to download pdf on canva | how to export canva to pdf | how to export from canva to pdf | how to export pdf from canva | how to print pdf from canva,How to download a pdf from canva | How to export canva to pdf | How to export pdf from canva | How to print pdf from canva
