canonical_keyword,suggested_title,category,variant_count,signal_strength,cluster_size,all_variants,merged_from
How to add a youtube video to canva,How to add a youtube video to canva,howto,75,high,31,how to add a youtube video to canva | how to add youtube video to canva | how to add youtube videos to canva | how to add a youtube video on canva | how to add a youtube video in canva | how to add youtube video on canva | how to add youtube video in canva | how to add youtube videos on canva | how to add youtube videos in canva | how to put a youtube video in canva | how to put youtube video in canva | how to put a youtube video on canva | how to put youtube videos in canva | how to put youtube video on canva | how to put youtube videos on canva,How to add a youtube video to canva | How to put a youtube video in canva | How to add a video to canva from youtube | How to insert a youtube video in canva | How to put a video on canva from youtube | How to insert a video in canva from youtube | How to add a youtube video to canva presentation | How to put a youtube video in canva presentation | How to embed a video in canva from youtube | How to insert a youtube video into canva | How to insert a video into canva from youtube | How to embed a youtube video into canva | How to put a youtube video into canva | How to add a youtube video into canva | How to add a youtube video to canva slides | How to insert a video from youtube into canva | How to add videos to canva from youtube | How to put a youtube video in canva slides | How to embed youtube video in canva presentation | How to put a youtube video in a canva presentation | How to add music to canva video from youtube | How to insert youtube videos into canva | How to insert youtube video in canva presentation | How to put youtube video into canva presentations | How to put a youtube video on a canva slide | How to include a youtube video in canva | How to put a video into canva from youtube | How to embed youtube video in canva website | How to add music from youtube to canva video | How to put youtube videos into canva | How to insert a youtube video into canva slides
canva api integration,How to Integrate canva with Api,integration,57,high,1,canva connect api create design from template | canva connect api export design | canva connect api export design endpoint | canva connect api update design content | canva connect api update design elements | canva connect api create design endpoint | canva connect api exports endpoint | canva connect api templates endpoint | canva connect api create design | canva connect api templates,
canva share template link how to create,canva share template link how to create,other,50,high,50,canva share template link how to create | canva share template link how to | canva share design link how to create | canva create template share link how to | canva share link how to create | canva share design link how to | canva template share link how to create | canva share link how to create template | canva template link share how to create | canva template share link how to | canva template link how to create | canva create editable template share link how to | canva share link how to create and share a design | canva share template link how to create and share | canva template link how to create and share,canva share template link how to create | canva share template link how to | canva share design link how to create | canva create template share link how to | canva share link how to create | canva share design link how to | canva template share link how to create | canva share link how to create template | canva template link share how to create | canva template share link how to | canva template link how to create | canva create editable template share link how to | canva share link how to create and share a design | canva share template link how to create and share | canva template link how to create and share | canva share editable template link how to create | canva share template link how to create and send | canva template link how to share | canva share template link how to generate | canva share template how to create | canva create template link how to | canva create editable template link how to share | canva share template link how to share template | canva template link how to share template link | canva share link template how to create | canva video template create share link how to | create canva template share link how to | canva create custom template share link how to | canva share design via link how to | canva share template how to create link | canva template share link how to create and share | canva share template link how to use | canva share link how to generate | canva share template link how to create template | canva share design link how to create and send | canva share a template link how to | canva template link share how to | canva template how to share link | canva share design as template link how to | canva share template link how to share | canva create template link share how to | canva share link how to create and send | canva share link how to share template | canva template link how to share template | canva share as template link how to create | canva create public template link how to share | canva share template link how to create and edit | canva share link how to create editable template | canva share design link how to generate | canva share link how to share design link
How to put canva slides into google slides,How to put canva slides into google slides,howto,42,high,32,how to put canva slides into google slides | how to put slides from canva into google slides | how to add canva slides to google slides | how to add slides from canva to google slides | how to put a canva slide into google slides | how to put canva slide into google slides | how to put canva slides on google slides | how to put your canva slides on google slides | how to insert canva into google slides | how to insert a canva into google slides | how to put a canva presentation in google slides | how to put canva presentation in google slides | how to put a canva template into google slides | how to put canva template into google slides | how to add canva template to google slides,How to put canva slides into google slides | How to add canva slides to google slides | How to put a canva slide into google slides | How to put canva slides on google slides | How to insert a canva into google slides | How to put a canva presentation in google slides | How to put a canva template into google slides | How to add a canva template to google slides | How to add a canva slide to google slides | How to add a canva presentation to google slides | How to put canva into google slides | How to put canva on google slides | How to put canva slides in google slides | How to add canva to google slides | How to put canva template on google slides | How to put a canva template in google slides | How to insert canva slides into google slides | How to put canva presentation into google slides | How to put a canva slide on google slides | How to put canva in google slides | How to add google slides to canva | How to put google slides into canva | How to insert google slides into canva | How to put my canva presentation on google slides | How to put an image from canva into google slides | How to put canva to google slides | How to put a google slide into canva | How to insert canva template into google slides | How to put a canva slideshow into google slides | How to put canva slides to google slides | How to add canva slides to google classroom | How to put canva slides onto google slides
How to make a qr code canva,How to make a qr code canva,howto,39,high,17,how to make a qr code in canva | how to make a qr code on canva | how to make qr code on canva | how to make qr code in canva | how to make a qr code with canva | how to make qr code canva | how to make a qr code canva | how to make qr codes in canva | how to make a qr code for canva | how to make qr codes on canva | how to generate a qr code in canva | how to generate a qr code on canva | how to generate qr code in canva | how to generate qr code on canva | how to generate a qr code with canva,How to make a qr code canva | How to generate a qr code canva | How to make a qr code for a link canva | How to create a qr code for a link in canva | How to create a qr code in canva for free | How to add qr code to canva design | How to make a link a qr code in canva | How to make a qr code clickable in canva | How to make a free qr code on canva | How to create a free qr code on canva | How to make a qr code for a canva presentation | How to create a qr code for a pdf in canva | How to design a qr code in canva | How to create a qr code through canva | How to create a qr code for a canva presentation | How to make a custom qr code in canva | How to make your own qr code on canva
How to share a canva template link,How to share a canva template link,howto,38,high,21,how to share canva template link | how to share template link canva | how to share template link in canva | how to share a template link in canva | how to share canva template links | how to share a canva template link | how to create a canva template and share link | how to create canva template and share link | how to create template in canva and share link | how to create a template in canva and share link | how to create a canva template and share a link | how to create and share a canva template link | how to create and share canva template link | how to create and share a template link in canva | how to create canva template share link,How to share a canva template link | How to create a canva template and share link | How to create and share a canva template link | How to create a canva template share link | How to create canva share link template | How to share a canva template link for editing | How to share a canva video template link | How to share canva link template | How to share canva template link instructions | How to share canva template link free | How to share canva template link tutorial | How to share canva templates via link | How to share canva template via link | How to share canva templates link | How to share canva template link properly | How to share canva template link not working | How to share canva template public link | How to share canva template link correctly | How to share canva presentation template link | How to share canva template link publicly | How to send canva template link
How to make a canva background transparent,How to make a canva background transparent,howto,37,high,12,how to make background transparent in canva | how to make a background transparent in canva | how to make canva background transparent | how to make the background transparent in canva | how to make background transparent on canva | how to make a canva background transparent | how to make background transparent canva | how to make the background transparent on canva | how to make background on canva transparent | how to make a background transparent on canva | how to make a transparent background in canva | how to make transparent background in canva | how to make a transparent background on canva | how to make transparent background on canva | how to make canva transparent background,How to make a canva background transparent | How to make a transparent background canva | How to make a logo background transparent in canva | How to create a transparent background in canva | How to make an image background transparent in canva | How to make transparent background in canva for free | How to make a transparent gif background in canva | How to make a logo with transparent background on canva | How to save canva design with transparent background | How to make white background transparent in canva | How to make the background of canva transparent | How to make a photo background transparent on canva
How to add text to an image in canva,How to add text to an image in canva,howto,35,high,19,how to add text to image in canva | how to add text to an image in canva | how to add text to image using canva | how to add text to an image using canva | how to add text to an image on canva | how to add text to image on canva | how to put image in text canva | how to put an image in text in canva | how to put image in text on canva | how to put an image in text canva | how to put image in text in canva | how to add text to canva image | how to add text on canva image | how to add an image to text in canva | how to add image to text in canva,How to add text to an image in canva | How to put an image in text canva | How to add text to canva image | How to add an image to text in canva | How to put an image behind text in canva | How to put text behind an image in canva | How to put text over an image in canva | How to insert a text box in canva document | How to add text over an image in canva | How to put image inside text in canva | How to put an image inside of text in canva | How to put text around an image in canva | How to put image on text in canva | How to put image next to text canva | How to add text on image in canva | How to add text behind an image in canva | How to add text on top of an image in canva | How to add text box in canva document | How to add image inside text in canva
How to create a shareable canva template link,How to create a shareable canva template link,howto,32,high,11,how to create shareable canva template link | how to create a shareable canva template link | how to create shareable template link in canva | how to create canva shareable template link | how to create shareable template link canva | how to create a shareable template link in canva | how to create a canva template link | how to create canva template link | how to create a template link in canva | how to create template link in canva | how to create template link canva | how to create canva template links | how to create shareable canva template | how to create shareable template in canva | how to create a shareable canva template,How to create a shareable canva template link | How to create a canva template link | How to create a shareable canva template | How to create a shareable canva link | How to generate shareable canva template link | How to generate a canva template link | How to create canva template shareable link | How to create canva template link shareable | How to make shareable canva template | How to create shareable canva templates link | How to create shareable link for canva template
How to add a video to canva,How to add a video to canva,howto,30,high,9,how to add a video to canva | how to add video to canva | how to add a video on canva | how to add videos to canva | how to add a video in canva | how to add video in canva | how to add videos on canva | how to add video on canva | how to add videos in canva | how to embed a video in canva | how to embed video in canva | how to embed a video on canva | how to embed videos in canva | how to embed video on canva | how to embed video canva,How to add a video to canva | How to embed a video in canva | How to put a video in canva | How to insert a video in canva | How to insert a video into canva | How to embed a video into canva | How to add a video into canva | How to put a video into canva | How to insert videos into canva
How to move a canva to google slides,How to move a canva to google slides,howto,29,high,18,how to move canva to google slides | how to move from canva to google slides | how to move a canva to google slides | how to move canva slides to google slides | how to move slides from canva to google slides | how to move your canva slides to google slides | how to transfer canva to google slides | how to transfer from canva to google slides | how to transfer canva slides to google slides | how to transfer slides from canva to google slides | how to move a canva presentation to google slides | how to move canva presentation to google slides | how to transfer google slides to canva | how to transfer a google slide to canva | how to transfer a canva presentation to google slides,How to move a canva to google slides | How to move canva slides to google slides | How to transfer canva to google slides | How to transfer canva slides to google slides | How to move a canva presentation to google slides | How to transfer a google slide to canva | How to transfer a canva presentation to google slides | How to transfer a canva template to google slides | How to move a canva template to google slides | How to move something from canva to google slides | How to move a canva slide to google slides | How to transfer a canva slide to google slides | How to move google slides to canva | How to transfer canva slides into google slides | How to transfer canva into google slides | How to move an image from canva to google slides | How to move a canva project to google slides | How to move canva into google slides
How to insert a link in canva,How to insert a link in canva,howto,28,high,10,how to insert a link in canva | how to insert link in canva | how to insert a link on canva | how to insert link on canva | how to insert links in canva | how to insert link canva | how to insert links on canva | how to insert a link to canva | how to put a link in canva | how to put a link on canva | how to put links in canva | how to put links on canva | how to put link in canva | how to put link on canva | how to embed a link in canva,How to insert a link in canva | How to put a link in canva | How to embed a link in canva | How to insert a link into canva | How to add a link into canva | How to put a link into canva | How to add links into canva | How to put links into canva | How to embed a link into canva | How to insert links into canva
How to add a picture on canva,How to add a picture on canva,howto,26,high,8,how to add a picture on canva | how to add pictures to canva | how to add pictures on canva | how to add pictures in canva | how to add a picture to canva | how to add a picture in canva | how to add picture in canva | how to add picture to canva | how to add picture on canva | how to insert picture in canva | how to insert a picture in canva | how to insert a picture on canva | how to insert pictures on canva | how to insert picture on canva | how to insert pictures in canva,How to add a picture on canva | How to insert a picture in canva | How to put a picture in canva | How to insert a picture into canva | How to insert pictures into canva | How to put pictures into canva | How to add your own pictures to canva | How to add a picture into canva
How to add a image on canva,How to add a image on canva,howto,25,high,5,how to add images to canva | how to add image to canva | how to add an image in canva | how to add an image on canva | how to add an image to canva | how to add images in canva | how to add image in canva | how to add image on canva | how to add images on canva | how to add a image on canva | how to insert image in canva | how to insert image on canva | how to insert images in canva | how to insert an image on canva | how to insert images on canva,How to add a image on canva | How to insert a image in canva | How to put an image in canva | How to insert an image into canva | How to add your own image in canva
How to find starred canva templates,How to find starred canva templates,howto,24,high,13,how to find starred templates on canva | how to find your starred templates on canva | how to find my starred templates on canva | how to find starred templates in canva | how to find the starred templates on canva | how to find starred canva templates | how to see starred templates on canva | how to see your starred templates on canva | how to see starred templates in canva | how to see my starred templates in canva | how to view starred templates on canva | how to view starred templates in canva | how to view your starred templates in canva | how to get to starred templates on canva | how to get to your starred templates on canva,How to find starred canva templates | How to see starred templates on canva | How to view starred templates on canva | How to get to starred templates on canva | How to find starred templates on canva mobile | How to access starred templates on canva | How to look at starred templates on canva | How to find starred templates on canva app | How to find templates you starred on canva | How to find templates i starred on canva | How to go to starred templates in canva | How to find starred templates on canva computer | How to check starred templates in canva
How to change the size of an image in canva,How to change the size of an image in canva,howto,23,high,13,how to change the size of an image in canva | how to change size of image in canva | how to change size of image on canva | how to change the size of an image on canva | how to change document size in canva | how to change document size on canva | how to change canva document size | how to change the size of a document in canva | how to change size of document in canva | how to change size of canva document | how to change image size in canva | how to change image size on canva | how to adjust image size in canva | how to adjust image size on canva | how to edit size of image in canva,How to change the size of an image in canva | How to change canva document size | How to change the size of a document in canva | How to change image size in canva | How to adjust image size in canva | How to edit the size of an image in canva | How to change doc size in canva | How to change file size in canva | How to adjust the size of an image in canva | How to edit image size in canva | How to change size of doc in canva | How to manually change size of image in canva | How to edit document size in canva
How to add a gif to canva,How to add a gif to canva,howto,22,high,7,how to add gifs to canva | how to add gif to canva | how to add a gif to canva | how to add gifs on canva | how to add gifs in canva | how to add gif in canva | how to add gif on canva | how to add a gif on canva | how to add a gif in canva | how to put gifs in canva | how to put a gif in canva | how to put gifs on canva | how to put gif in canva | how to put a gif on canva | how to insert gif into canva,How to add a gif to canva | How to put a gif in canva | How to insert a gif into canva | How to insert a gif in canva | How to add a gif into canva | How to insert gifs into canva | How to put a gif into canva
How to add a photo to canva,How to add a photo to canva,howto,21,high,6,how to add a photo to canva | how to add photos on canva | how to add photos to canva | how to add photo to canva | how to add a photo on canva | how to add photos in canva | how to add a photo in canva | how to add photo in canva | how to add photo on canva | how to insert a photo in canva | how to insert photo on canva | how to insert photos in canva | how to insert photos on canva | how to insert photo in canva | how to insert a photo on canva,How to add a photo to canva | How to insert a photo in canva | How to insert a photo into canva | How to put a photo in canva | How to insert photos into canva | How to add photos into canva
How to change color of an image in canva,How to change color of an image in canva,howto,21,high,10,how to change the color of an image in canva | how to change color of image in canva | how to change the color of an image on canva | how to change color of an image in canva | how to change color of image on canva | how to change a color of an image in canva | how to change color of an image on canva | how to change the color of image in canva | how to change image color in canva | how to change an image color in canva | how to change image color on canva | how to change background color on canva document | how to change background color in canva document | how to change the background color on canva doc | how to change background color on canva doc,How to change color of an image in canva | How to change an image color in canva | How to change background color on canva document | How to change background color on canva doc | How to change background color of canva doc | How to change document color in canva | How to change background color of image in canva | How to change colors of an image in canva | How to change document background color in canva | How to edit the color of an image in canva
How to create a canva template,How to create a canva template,howto,21,high,8,how to create a template in canva | how to create a canva template | how to create canva templates | how to create canva template | how to create templates in canva | how to create a template on canva | how to create templates on canva | how to create template in canva | how to make a canva template | how to make canva templates | how to make a template in canva | how to make a template on canva | how to make templates on canva | how to make templates in canva | how to make canva template,How to create a canva template | How to make a canva template | How to create canva templates tutorial | How to create a canva template tutorial | How to create a canva template from a design | How to create your own template in canva | How to make a design a template in canva | How to make your own template in canva
