canonical_keyword,suggested_title,category,variant_count,signal_strength,already_covered,all_variants
How to create a template in Notion database,How to create a template in Notion database,howto,1,low,False,how to create a template in notion database
How to create a table in Notion mobile app,How to create a table in Notion mobile app,howto,1,low,False,how to create a table in notion mobile app
How to describe Notion,How to describe Notion,howto,1,low,False,how to describe notion
How to download Notion calendar on windows,How to download Notion calendar on windows,howto,1,low,False,how to download notion calendar on windows
How to round in Notion,How to round in Notion,howto,1,low,False,how to round in notion
How to export Notion to google sheets,How to export Notion to google sheets,howto,1,low,False,how to export notion to google sheets
How to move icon in Notion,How to move icon in Notion,howto,1,low,False,how to move icon in notion
How to set password for Notion,How to set password for Notion,howto,1,low,False,how to set password for notion
How to manage projects in Notion,How to manage projects in Notion,howto,1,low,False,how to manage projects in notion
How to create a travel itinerary in Notion,How to create a travel itinerary in Notion,howto,1,low,False,how to create a travel itinerary in notion
How to type code in Notion,How to type code in Notion,howto,1,low,False,how to type code in notion
How to turn off Notion email notifications,How to turn off Notion email notifications,howto,1,low,False,how to turn off notion email notifications
How to find Notion token,How to find Notion token,howto,1,low,False,how to find notion token
How to import markdown to Notion,How to import markdown to Notion,howto,1,low,False,how to import markdown to notion
How to link an image to a page in Notion,How to link an image to a page in Notion,howto,1,low,False,how to link an image to a page in notion
How to rename Notion,How to rename Notion,howto,1,low,False,how to rename notion
How to import Notion template mobile,How to import Notion template mobile,howto,1,low,False,how to import notion template mobile
How to undo things in Notion,How to undo things in Notion,howto,1,low,False,how to undo things in notion
How to create Notion profile picture,How to create Notion profile picture,howto,1,low,False,how to create notion profile picture
How to make archive in Notion,How to make archive in Notion,howto,1,low,False,how to make archive in notion
How to add custom icons to Notion,How to add custom icons to Notion,howto,1,low,False,how to add custom icons to notion
How to move blocks in Notion,How to move blocks in Notion,howto,1,low,False,how to move blocks in notion
How to make Notion darkmode,How to make Notion darkmode,howto,1,low,False,how to make notion darkmode
How to add pictures to Notion gallery view,How to add pictures to Notion gallery view,howto,1,low,False,how to add pictures to notion gallery view
How to replace words in Notion,How to replace words in Notion,howto,1,low,False,how to replace words in notion
How to turn off Notion open on start,How to turn off Notion open on start,howto,1,low,False,how to turn off notion open on start
How to change status name in Notion,How to change status name in Notion,howto,1,low,False,how to change status name in notion
How to uninstall Notion windows,How to uninstall Notion windows,howto,1,low,False,how to uninstall notion windows
How to cross out in Notion,How to cross out in Notion,howto,1,low,False,how to cross out in notion
How to merge google calendar with Notion,How to merge google calendar with Notion,howto,1,low,False,how to merge google calendar with notion
How to create a task board in Notion,How to create a task board in Notion,howto,1,low,False,how to create a task board in notion
How to embed mermaid in Notion,How to embed mermaid in Notion,howto,1,low,False,how to embed mermaid in notion
How to link relation property Notion database,How to link relation property Notion database,howto,1,low,False,how to link relation property notion database
How to extract database id from Notion url,How to extract database id from Notion url,howto,1,low,False,how to extract database id from notion url
How to delete a row in Notion table,How to delete a row in Notion table,howto,1,low,False,how to delete a row in notion table
How to add things side by side in Notion,How to add things side by side in Notion,howto,1,low,False,how to add things side by side in notion
How to share Notion template duplicate public,How to share Notion template duplicate public,howto,1,low,False,how to share notion template duplicate public
How to start Notion on startup,How to start Notion on startup,howto,1,low,False,how to start notion on startup
How to embed website in Notion,How to embed website in Notion,howto,1,low,False,how to embed website in notion
How to setup Notion for students,How to setup Notion for students,howto,1,low,False,how to setup notion for students
How to embed Notion calendar into Notion page,How to embed Notion calendar into Notion page,howto,1,low,False,how to embed notion calendar into notion page
How to delete Notion account on mobile,How to delete Notion account on mobile,howto,1,low,False,how to delete notion account on mobile
How to set full width as default in Notion,How to set full width as default in Notion,howto,1,low,False,how to set full width as default in notion
How to put Notion on desktop,How to put Notion on desktop,howto,1,low,False,how to put notion on desktop
How to turn Notion into a website,How to turn Notion into a website,howto,1,low,False,how to turn notion into a website
How to change image in gallery view Notion,How to change image in gallery view Notion,howto,1,low,False,how to change image in gallery view notion
How to create a new section in Notion,How to create a new section in Notion,howto,1,low,False,how to create a new section in notion
How to translate Notion page,How to translate Notion page,howto,1,low,False,how to translate notion page
How to embed spotify playlist into Notion,How to embed spotify playlist into Notion,howto,1,low,False,how to embed spotify playlist into notion
How to set up Notion for personal use,How to set up Notion for personal use,howto,1,low,False,how to set up notion for personal use
How to create a website using Notion and super.so,How to create a website using Notion and super.so,howto,1,low,False,how to create a website using notion and super.so
How to create public Notion template link share,How to create public Notion template link share,howto,1,low,False,how to create public notion template link share
How to copy a property in Notion,How to copy a property in Notion,howto,1,low,False,how to copy a property in notion
How to embed excel into Notion,How to embed excel into Notion,howto,1,low,False,how to embed excel into notion
How to edit font on Notion,How to edit font on Notion,howto,1,low,False,how to edit font on notion
How to create a line in Notion,How to create a line in Notion,howto,1,low,False,how to create a line in notion
How to create boxes in Notion,How to create boxes in Notion,howto,1,low,False,how to create boxes in notion
How to password protect Notion pages or workspace,How to password protect Notion pages or workspace,howto,1,low,False,how to password protect notion pages or workspace
How to get free Notion plus as a student,How to get free Notion plus as a student,howto,1,low,False,how to get free notion plus as a student
How to save work on Notion,How to save work on Notion,howto,1,low,False,how to save work on notion
How to import a Notion page,How to import a Notion page,howto,1,low,False,how to import a notion page
How to link one database to another in Notion,How to link one database to another in Notion,howto,1,low,False,how to link one database to another in notion
How to organize projects in Notion,How to organize projects in Notion,howto,1,low,False,how to organize projects in notion
How to type equations in Notion,How to type equations in Notion,howto,1,low,False,how to type equations in notion
How to create a clickable link in Notion,How to create a clickable link in Notion,howto,1,low,False,how to create a clickable link in notion
How to merge two cells in Notion table,How to merge two cells in Notion table,howto,1,low,False,how to merge two cells in notion table
How to edit a link in Notion,How to edit a link in Notion,howto,1,low,False,how to edit a link in notion
How to unpublish Notion page,How to unpublish Notion page,howto,1,low,False,how to unpublish notion page
How to move Notion pages between accounts,How to move Notion pages between accounts,howto,1,low,False,how to move notion pages between accounts
How to add multiple tags in Notion,How to add multiple tags in Notion,howto,1,low,False,how to add multiple tags in notion
How to edit formula in Notion,How to edit formula in Notion,howto,1,low,False,how to edit formula in notion
How to Notion template,How to Notion template,howto,1,low,False,how to notion template
How to imbed spotify in Notion,How to imbed spotify in Notion,howto,1,low,False,how to imbed spotify in notion
How to download Notion ai,How to download Notion ai,howto,1,low,False,how to download notion ai
How to make aesthetic Notion pages,How to make aesthetic Notion pages,howto,1,low,False,how to make aesthetic notion pages
How to add Notion template on ipad,How to add Notion template on ipad,howto,1,low,False,how to add notion template on ipad
How to make a table template in Notion,How to make a table template in Notion,howto,1,low,False,how to make a table template in notion
How to add google calendar to Notion database,How to add google calendar to Notion database,howto,1,low,False,how to add google calendar to notion database
How to make colored blocks in Notion,How to make colored blocks in Notion,howto,1,low,False,how to make colored blocks in notion
How to make a database template in Notion,How to make a database template in Notion,howto,1,low,False,how to make a database template in notion
How to add syllabus to Notion,How to add syllabus to Notion,howto,1,low,False,how to add syllabus to notion
How to delete callout in Notion mobile app,How to delete callout in Notion mobile app,howto,1,low,False,how to delete callout in notion mobile app
How to rename teamspace in Notion,How to rename teamspace in Notion,howto,1,low,False,how to rename teamspace in notion
How to change colour of text in Notion,How to change colour of text in Notion,howto,1,low,False,how to change colour of text in notion
How to make cute Notion templates,How to make cute Notion templates,howto,1,low,False,how to make cute notion templates
How to adjust column width in Notion,How to adjust column width in Notion,howto,1,low,False,how to adjust column width in notion
How to add spotify to Notion without preview,How to add spotify to Notion without preview,howto,1,low,False,how to add spotify to notion without preview
How to find trash in Notion,How to find trash in Notion,howto,1,low,False,how to find trash in notion
How to divide sections in Notion,How to divide sections in Notion,howto,1,low,False,how to divide sections in notion
How to move text in Notion,How to move text in Notion,howto,1,low,False,how to move text in notion
How to save twitter threads to Notion,How to save twitter threads to Notion,howto,1,low,False,how to save twitter threads to notion
How to share Notion as template,How to share Notion as template,howto,1,low,False,how to share notion as template
How to get out of a workspace in Notion,How to get out of a workspace in Notion,howto,1,low,False,how to get out of a workspace in notion
How to export Notion to word,How to export Notion to word,howto,1,low,False,how to export notion to word
How to get Notion business for free,How to get Notion business for free,howto,1,low,False,how to get notion business for free
How to install Notion on windows,How to install Notion on windows,howto,1,low,False,how to install notion on windows
How to write greek letters in Notion,How to write greek letters in Notion,howto,1,low,False,how to write greek letters in notion
How to create share link Notion template,How to create share link Notion template,howto,1,low,False,how to create share link notion template
How to share Notion template link instructions,How to share Notion template link instructions,howto,1,low,False,how to share notion template link instructions
How to make a line graph in Notion,How to make a line graph in Notion,howto,1,low,False,how to make a line graph in notion
How to upgrade Notion account,How to upgrade Notion account,howto,1,low,False,how to upgrade notion account
How to change Notion calendar to light mode,How to change Notion calendar to light mode,howto,1,low,False,how to change notion calendar to light mode
How to autofill dates in Notion,How to autofill dates in Notion,howto,1,low,False,how to autofill dates in notion
How to make a mini calendar in Notion,How to make a mini calendar in Notion,howto,1,low,False,how to make a mini calendar in notion
How to add icon in Notion text,How to add icon in Notion text,howto,1,low,False,how to add icon in notion text
How to give access to Notion,How to give access to Notion,howto,1,low,False,how to give access to notion
How to add a recurring event in Notion,How to add a recurring event in Notion,howto,1,low,False,how to add a recurring event in notion
How to create a Notion template for goal tracking,How to create a Notion template for goal tracking,howto,1,low,False,how to create a notion template for goal tracking
How to show cover in gallery view Notion,How to show cover in gallery view Notion,howto,1,low,False,how to show cover in gallery view notion
How to add a new database in Notion,How to add a new database in Notion,howto,1,low,False,how to add a new database in notion
How to use grammarly with Notion,How to use grammarly with Notion,howto,1,low,False,how to use grammarly with notion
How to write sigma in Notion,How to write sigma in Notion,howto,1,low,False,how to write sigma in notion
How to delete comment section in Notion,How to delete comment section in Notion,howto,1,low,False,how to delete comment section in notion
How to change color of events on Notion calendar,How to change color of events on Notion calendar,howto,1,low,False,how to change color of events on notion calendar
How to see google calendar in Notion,How to see google calendar in Notion,howto,1,low,False,how to see google calendar in notion
How to write a book in Notion,How to write a book in Notion,howto,1,low,False,how to write a book in notion
How to create private temspace on Notion,How to create private temspace on Notion,howto,1,low,False,how to create private temspace on notion
How to make Notion calendar light mode,How to make Notion calendar light mode,howto,1,low,False,how to make notion calendar light mode
How to add Notion calendar to Notion dashboard,How to add Notion calendar to Notion dashboard,howto,1,low,False,how to add notion calendar to notion dashboard
How to create a Notion board for study plan,How to create a Notion board for study plan,howto,1,low,False,how to create a notion board for study plan
How to use save to Notion twitter,How to use save to Notion twitter,howto,1,low,False,how to use save to notion twitter
How to price Notion templates,How to price Notion templates,howto,1,low,False,how to price notion templates
How to add grammarly to Notion,How to add grammarly to Notion,howto,1,low,False,how to add grammarly to notion
How to make a revision timetable on Notion,How to make a revision timetable on Notion,howto,1,low,False,how to make a revision timetable on notion
How to resize photos on Notion,How to resize photos on Notion,howto,1,low,False,how to resize photos on notion
How to get vertical divider in Notion,How to get vertical divider in Notion,howto,1,low,False,how to get vertical divider in notion
How to create a Notion board and share link,How to create a Notion board and share link,howto,1,low,False,how to create a notion board and share link
How to export Notion page to markdown,How to export Notion page to markdown,howto,1,low,False,how to export notion page to markdown
How to do subscript and superscript in Notion,How to do subscript and superscript in Notion,howto,1,low,False,how to do subscript and superscript in notion
How to add template to Notion page,How to add template to Notion page,howto,1,low,False,how to add template to notion page
How to create a table template in Notion,How to create a table template in Notion,howto,1,low,False,how to create a table template in notion
How to make pictures smaller on Notion,How to make pictures smaller on Notion,howto,1,low,False,how to make pictures smaller on notion
How to become a Notion expert,How to become a Notion expert,howto,1,low,False,how to become a notion expert
How to create Notion templates tutorial,How to create Notion templates tutorial,howto,1,low,False,how to create notion templates tutorial
How to delete Notion cache,How to delete Notion cache,howto,1,low,False,how to delete notion cache
How to delete a column in Notion database,How to delete a column in Notion database,howto,1,low,False,how to delete a column in notion database
How to organize tasks in Notion,How to organize tasks in Notion,howto,1,low,False,how to organize tasks in notion
How to add tags in Notion table,How to add tags in Notion table,howto,1,low,False,how to add tags in notion table
How to get Notion api key 2026,How to get Notion api key 2026,howto,1,low,False,how to get notion api key 2026
How to create a sharable Notion page link,How to create a sharable Notion page link,howto,1,low,False,how to create a sharable notion page link
How to create a Notion board without any cards,How to create a Notion board without any cards,howto,1,low,False,how to create a notion board without any cards
How to share Notion database template,How to share Notion database template,howto,1,low,False,how to share notion database template
How to organize Notion for college,How to organize Notion for college,howto,1,low,False,how to organize notion for college
How to password protect Notion pages or folders,How to password protect Notion pages or folders,howto,1,low,False,how to password protect notion pages or folders
How to import Notion template json,How to import Notion template json,howto,1,low,False,how to import notion template json
How to save to Notion from twitter,How to save to Notion from twitter,howto,1,low,False,how to save to notion from twitter
How to add star rating in Notion,How to add star rating in Notion,howto,1,low,False,how to add star rating in notion
How to find templates on Notion on ipad,How to find templates on Notion on ipad,howto,1,low,False,how to find templates on notion on ipad
How to open Notion calendar in app,How to open Notion calendar in app,howto,1,low,False,how to open notion calendar in app
How to get Notion in dark mode,How to get Notion in dark mode,howto,1,low,False,how to get notion in dark mode
How to update Notion on mac,How to update Notion on mac,howto,1,low,False,how to update notion on mac
How to move title in Notion,How to move title in Notion,howto,1,low,False,how to move title in notion
How to make colored dividers in Notion,How to make colored dividers in Notion,howto,1,low,False,how to make colored dividers in notion
How to drag in Notion,How to drag in Notion,howto,1,low,False,how to drag in notion
How to use template button in Notion,How to use template button in Notion,howto,1,low,False,how to use template button in notion
How to expand Notion page,How to expand Notion page,howto,1,low,False,how to expand notion page
How to change Notion into light mode,How to change Notion into light mode,howto,1,low,False,how to change notion into light mode
How to use subscript in Notion,How to use subscript in Notion,howto,1,low,False,how to use subscript in notion
How to get subscript in Notion,How to get subscript in Notion,howto,1,low,False,how to get subscript in notion
How to delete properties in Notion,How to delete properties in Notion,howto,1,low,False,how to delete properties in notion
How to open Notion links in app,How to open Notion links in app,howto,1,low,False,how to open notion links in app
How to insert a clock in Notion,How to insert a clock in Notion,howto,1,low,False,how to insert a clock in notion
How to create a grade calculator in Notion,How to create a grade calculator in Notion,howto,1,low,False,how to create a grade calculator in notion
How to create a digital habit tracker in Notion,How to create a digital habit tracker in Notion,howto,1,low,False,how to create a digital habit tracker in notion
How to download Notion desktop app,How to download Notion desktop app,howto,1,low,False,how to download notion desktop app
How to calculate in Notion table,How to calculate in Notion table,howto,1,low,False,how to calculate in notion table
How to share a Notion page via link,How to share a Notion page via link,howto,1,low,False,how to share a notion page via link
How to create a daily to do list in Notion,How to create a daily to do list in Notion,howto,1,low,False,how to create a daily to do list in notion
How to duplicate Notion template mobile app,How to duplicate Notion template mobile app,howto,1,low,False,how to duplicate notion template mobile app
How to share a Notion board link,How to share a Notion board link,howto,1,low,False,how to share a notion board link
How to open embed pdf in Notion using pdf viewer,How to open embed pdf in Notion using pdf viewer,howto,1,low,False,how to open embed pdf in notion using pdf viewer
How to copy a table in Notion to another page,How to copy a table in Notion to another page,howto,1,low,False,how to copy a table in notion to another page
doodle notion integration,How to Integrate Notion with Doodle,integration,1,low,False,doodle notion integration
schedule notion integration,How to Integrate Notion with Schedule,integration,1,low,False,schedule notion integration
netlify notion integration,How to Integrate Notion with Netlify,integration,1,low,False,netlify notion integration
dash notion integration,How to Integrate Notion with Sh,integration,1,low,False,dash notion integration
xmind notion integration sync workflow,How to Integrate Notion with Xm Kflow,integration,1,low,False,xmind notion integration sync workflow
anythingllm notion integration,How to Integrate Notion with Yth Gllm,integration,1,low,False,anythingllm notion integration
jotform notion integration,How to Integrate Notion with Jot,integration,1,low,False,jotform notion integration
help.ticktick.com notion integration,How to Integrate Notion with Help.Ticktick.Com,integration,1,low,False,help.ticktick.com notion integration
notion ai sales knowledge platform integration,How to Integrate Notion with Les Knowledge Pl,integration,1,low,False,notion ai sales knowledge platform integration
gravity forms notion integration,How to Integrate Notion with Gr Ms,integration,1,low,False,gravity forms notion integration
ai meeting notetaker integration with notion,How to Integrate Notion with Meet Notet Ker,integration,1,low,False,ai meeting notetaker integration with notion
tl;dv notion integration,How to Integrate Notion with Tl;Dv,integration,1,low,False,tl;dv notion integration
notta notion integration,How to Integrate Notion with Nott,integration,1,low,False,notta notion integration
notion time tracking integration,How to Integrate Notion with Time Tr Ck,integration,1,low,False,notion time tracking integration
notion shopify integration no code,How to Integrate Notion with Shopify No Code,integration,1,low,False,notion shopify integration no code
chatbase notion integration,How to Integrate Notion with Ch Tb Se,integration,1,low,False,chatbase notion integration
notion shopify integration two-way sync,How to Integrate Notion with Shopify Two-W,integration,1,low,False,notion shopify integration two-way sync
avoma notion integration,How to Integrate Notion with Vom,integration,1,low,False,avoma notion integration
supernormal notion integration,How to Integrate Notion with Supern,integration,1,low,False,supernormal notion integration
notion internal integration token how to get,How to Integrate Notion with Tern Ken Get,integration,1,low,False,notion internal integration token how to get
transcript generator notion integration,How to Integrate Notion with Tr Script Gener,integration,1,low,False,transcript generator notion integration
notion template ticktick integration,How to Integrate Notion with Templ Te Ticktick,integration,1,low,False,notion template ticktick integration
retool notion integration,How to Integrate Notion with Retool,integration,1,low,False,retool notion integration
langchain notion integration,How to Integrate Notion with Gch,integration,1,low,False,langchain notion integration
framer notion integration,How to Integrate Notion with Fr Mer,integration,1,low,True,framer notion integration
plaud note notion integration,How to Integrate Notion with Pl Ud Note,integration,1,low,False,plaud note notion integration
notion blog auto-publish integration,How to Integrate Notion with Blog -Publish,integration,1,low,False,notion blog auto-publish integration
zerowork notion integration,How to Integrate Notion with Zerow,integration,1,low,False,zerowork notion integration
superhuman notion integration,How to Integrate Notion with Superhum,integration,1,low,False,superhuman notion integration
omnivore notion integration,How to Integrate Notion with Omniv,integration,1,low,False,omnivore notion integration
notion synced block how to use,How to Integrate Notion with Block Use,integration,1,low,False,notion synced block how to use
