canonical_keyword,suggested_title,category,variant_count,signal_strength,already_covered,all_variants
How to create and sell Notion templates tutorial,How to create and sell Notion templates tutorial,howto,1,low,False,how to create and sell notion templates tutorial
How to make a good Notion template,How to make a good Notion template,howto,1,low,False,how to make a good notion template
How to make a workout plan on Notion,How to make a workout plan on Notion,howto,1,low,False,how to make a workout plan on notion
How to make a hyperlink in Notion,How to make a hyperlink in Notion,howto,1,low,False,how to make a hyperlink in notion
How to create an archive in Notion,How to create an archive in Notion,howto,1,low,False,how to create an archive in notion
How to link Notion to canvas,How to link Notion to canvas,howto,1,low,False,how to link notion to canvas
How to download Notion table as csv,How to download Notion table as csv,howto,1,low,False,how to download notion table as csv
How to put Notion on light mode,How to put Notion on light mode,howto,1,low,False,how to put notion on light mode
How to backup Notion to google drive,How to backup Notion to google drive,howto,1,low,False,how to backup notion to google drive
How to open a Notion link in app,How to open a Notion link in app,howto,1,low,False,how to open a notion link in app
How to do a calendar in Notion,How to do a calendar in Notion,howto,1,low,False,how to do a calendar in notion
How to create a duplicatable Notion template link,How to create a duplicatable Notion template link,howto,1,low,False,how to create a duplicatable notion template link
How to full screen Notion,How to full screen Notion,howto,1,low,False,how to full screen notion
How to add page icon in Notion,How to add page icon in Notion,howto,1,low,False,how to add page icon in notion
How to create a daily task list in Notion,How to create a daily task list in Notion,howto,1,low,False,how to create a daily task list in notion
How to export Notion as pdf,How to export Notion as pdf,howto,1,low,False,how to export notion as pdf
How to have 2 columns in Notion,How to have 2 columns in Notion,howto,1,low,False,how to have 2 columns in notion
How to make a to do list table in Notion,How to make a to do list table in Notion,howto,1,low,False,how to make a to do list table in notion
How to change email in Notion account,How to change email in Notion account,howto,1,low,False,how to change email in notion account
How to import md file in Notion,How to import md file in Notion,howto,1,low,False,how to import md file in notion
How to get the best out of Notion,How to get the best out of Notion,howto,1,low,False,how to get the best out of notion
How to add total in Notion table,How to add total in Notion table,howto,1,low,False,how to add total in notion table
How to embed multiple google calendars in Notion,How to embed multiple google calendars in Notion,howto,1,low,False,how to embed multiple google calendars in notion
How to share Notion board template link,How to share Notion board template link,howto,1,low,False,how to share notion board template link
How to share a Notion page with someone else,How to share a Notion page with someone else,howto,1,low,False,how to share a notion page with someone else
How to copy someone else's Notion page,How to copy someone else's Notion page,howto,1,low,False,how to copy someone else's notion page
How to import json to Notion,How to import json to Notion,howto,1,low,False,how to import json to notion
How to generate qr code for Notion page,How to generate qr code for Notion page,howto,1,low,False,how to generate qr code for notion page
How to add formula in Notion database,How to add formula in Notion database,howto,1,low,False,how to add formula in notion database
How to create a workflow in Notion,How to create a workflow in Notion,howto,1,low,False,how to create a workflow in notion
How to automate tasks in Notion,How to automate tasks in Notion,howto,1,low,False,how to automate tasks in notion
How to save tweets to Notion,How to save tweets to Notion,howto,1,low,False,how to save tweets to notion
How to private Notion page,How to private Notion page,howto,1,low,False,how to private notion page
How to format Notion page,How to format Notion page,howto,1,low,False,how to format notion page
How to add widgets to Notion page,How to add widgets to Notion page,howto,1,low,False,how to add widgets to notion page
How to use if in Notion,How to use if in Notion,howto,1,low,False,how to use if in notion
How to make a homepage in Notion,How to make a homepage in Notion,howto,1,low,False,how to make a homepage in notion
How to import md to Notion,How to import md to Notion,howto,1,low,False,how to import md to notion
How to turn off spellcheck in Notion,How to turn off spellcheck in Notion,howto,1,low,False,how to turn off spellcheck in notion
How to make a spotify widget on Notion,How to make a spotify widget on Notion,howto,1,low,False,how to make a spotify widget on notion
How to remove page icon in Notion,How to remove page icon in Notion,howto,1,low,False,how to remove page icon in notion
How to hide database title in Notion,How to hide database title in Notion,howto,1,low,False,how to hide database title in notion
How to add a link to a page in Notion,How to add a link to a page in Notion,howto,1,low,False,how to add a link to a page in notion
How to embed a google sheet into Notion,How to embed a google sheet into Notion,howto,1,low,False,how to embed a google sheet into notion
How to create sections in Notion sidebar,How to create sections in Notion sidebar,howto,1,low,False,how to create sections in notion sidebar
How to add drop down in Notion table,How to add drop down in Notion table,howto,1,low,False,how to add drop down in notion table
How to create a Notion template and export to pdf,How to create a Notion template and export to pdf,howto,1,low,False,how to create a notion template and export to pdf
How to add icloud calendar to Notion calendar,How to add icloud calendar to Notion calendar,howto,1,low,False,how to add icloud calendar to notion calendar
How to outdent in Notion,How to outdent in Notion,howto,1,low,False,how to outdent in notion
How to follow someone on Notion,How to follow someone on Notion,howto,1,low,False,how to follow someone on notion
How to see how many blocks i have in Notion,How to see how many blocks i have in Notion,howto,1,low,False,how to see how many blocks i have in notion
How to create a todo list in Notion,How to create a todo list in Notion,howto,1,low,False,how to create a todo list in notion
How to duplicate a Notion page template,How to duplicate a Notion page template,howto,1,low,False,how to duplicate a notion page template
How to create shareable public link in Notion,How to create shareable public link in Notion,howto,1,low,False,how to create shareable public link in notion
How to add birthdays to Notion calendar,How to add birthdays to Notion calendar,howto,1,low,False,how to add birthdays to notion calendar
How to link google drive to Notion,How to link google drive to Notion,howto,1,low,False,how to link google drive to notion
How to add Notion as a widget on mac,How to add Notion as a widget on mac,howto,1,low,False,how to add notion as a widget on mac
How to add more groups in board view Notion,How to add more groups in board view Notion,howto,1,low,False,how to add more groups in board view notion
How to generate Notion template share link,How to generate Notion template share link,howto,1,low,False,how to generate notion template share link
How to link to do list to calendar in Notion,How to link to do list to calendar in Notion,howto,1,low,False,how to link to do list to calendar in notion
How to get Notion back online,How to get Notion back online,howto,1,low,False,how to get notion back online
How to share Notion template with public link,How to share Notion template with public link,howto,1,low,False,how to share notion template with public link
How to add Notion page to home screen,How to add Notion page to home screen,howto,1,low,False,how to add notion page to home screen
How to remove pages on side Notion,How to remove pages on side Notion,howto,1,low,False,how to remove pages on side notion
How to underline in Notion,How to underline in Notion,howto,1,low,False,how to underline in notion
How to install Notion app on mac,How to install Notion app on mac,howto,1,low,False,how to install notion app on mac
How to put Notion calendar on desktop,How to put Notion calendar on desktop,howto,1,low,False,how to put notion calendar on desktop
How to customize Notion templates,How to customize Notion templates,howto,1,low,False,how to customize notion templates
How to make Notion banner bigger,How to make Notion banner bigger,howto,1,low,False,how to make notion banner bigger
How to add Notion to slack,How to add Notion to slack,howto,1,low,False,how to add notion to slack
How to edit status in Notion,How to edit status in Notion,howto,1,low,False,how to edit status in notion
How to get notifications from Notion calendar,How to get notifications from Notion calendar,howto,1,low,False,how to get notifications from notion calendar
How to create eisenhower matrix in Notion,How to create eisenhower matrix in Notion,howto,1,low,False,how to create eisenhower matrix in notion
How to log out of Notion app,How to log out of Notion app,howto,1,low,False,how to log out of notion app
How to create a shareable link in Notion template,How to create a shareable link in Notion template,howto,1,low,False,how to create a shareable link in notion template
How to reduce font size in Notion,How to reduce font size in Notion,howto,1,low,False,how to reduce font size in notion
How to create a personal dashboard in Notion,How to create a personal dashboard in Notion,howto,1,low,False,how to create a personal dashboard in notion
How to share custom Notion template link,How to share custom Notion template link,howto,1,low,False,how to share custom notion template link
How to share Notion page via email,How to share Notion page via email,howto,1,low,False,how to share notion page via email
How to center things in Notion,How to center things in Notion,howto,1,low,False,how to center things in notion
How to split Notion into columns,How to split Notion into columns,howto,1,low,False,how to split notion into columns
How to add code block in Notion,How to add code block in Notion,howto,1,low,False,how to add code block in notion
How to count rows in Notion database,How to count rows in Notion database,howto,1,low,False,how to count rows in notion database
How to share Notion template duplicate link guide,How to share Notion template duplicate link guide,howto,1,low,False,how to share notion template duplicate link guide
How to embed google sheets chart in Notion,How to embed google sheets chart in Notion,howto,1,low,False,how to embed google sheets chart in notion
How to add more rows to table in Notion,How to add more rows to table in Notion,howto,1,low,False,how to add more rows to table in notion
How to make Notion calendar only show one month,How to make Notion calendar only show one month,howto,1,low,False,how to make notion calendar only show one month
How to insert symbols in Notion,How to insert symbols in Notion,howto,1,low,False,how to insert symbols in notion
How to build a Notion page,How to build a Notion page,howto,1,low,False,how to build a notion page
How to properly use Notion,How to properly use Notion,howto,1,low,False,how to properly use notion
How to create a Notion portfolio for freelancers,How to create a Notion portfolio for freelancers,howto,1,low,False,how to create a notion portfolio for freelancers
How to create reminders in Notion,How to create reminders in Notion,howto,1,low,False,how to create reminders in notion
How to create charts in Notion database 2025,How to create charts in Notion database 2025,howto,1,low,False,how to create charts in notion database 2025
How to change the size of an image in Notion,How to change the size of an image in Notion,howto,1,low,False,how to change the size of an image in notion
How to delete Notion cash account,How to delete Notion cash account,howto,1,low,False,how to delete notion cash account
How to utilize Notion,How to utilize Notion,howto,1,low,False,how to utilize notion
How to add apple music playlist to Notion,How to add apple music playlist to Notion,howto,1,low,False,how to add apple music playlist to notion
How to embed file from google drive into Notion,How to embed file from google drive into Notion,howto,1,low,False,how to embed file from google drive into notion
How to export Notion page as html,How to export Notion page as html,howto,1,low,False,how to export notion page as html
How to access Notion,How to access Notion,howto,1,low,False,how to access notion
How to organize information in Notion,How to organize information in Notion,howto,1,low,False,how to organize information in notion
How to create checkbox in Notion,How to create checkbox in Notion,howto,1,low,False,how to create checkbox in notion
How to add fractions in Notion,How to add fractions in Notion,howto,1,low,False,how to add fractions in notion
How to put a picture in Notion,How to put a picture in Notion,howto,1,low,False,how to put a picture in notion
How to add stars in Notion,How to add stars in Notion,howto,1,low,False,how to add stars in notion
How to remove people from Notion workspace,How to remove people from Notion workspace,howto,1,low,False,how to remove people from notion workspace
How to log into Notion,How to log into Notion,howto,1,low,False,how to log into notion
How to create class schedule in Notion,How to create class schedule in Notion,howto,1,low,False,how to create class schedule in notion
How to get free Notion templates,How to get free Notion templates,howto,1,low,False,how to get free notion templates
How to edit groups in Notion board,How to edit groups in Notion board,howto,1,low,False,how to edit groups in notion board
How to remove comments from Notion page,How to remove comments from Notion page,howto,1,low,False,how to remove comments from notion page
How to make columns in Notion ipad,How to make columns in Notion ipad,howto,1,low,False,how to make columns in notion ipad
How to embed a website into Notion,How to embed a website into Notion,howto,1,low,False,how to embed a website into notion
How to embed figma in Notion,How to embed figma in Notion,howto,1,low,False,how to embed figma in notion
How to add emojis in Notion text,How to add emojis in Notion text,howto,1,low,False,how to add emojis in notion text
How to back up or export data from Notion,How to back up or export data from Notion,howto,1,low,False,how to back up or export data from notion
How to create a list in Notion,How to create a list in Notion,howto,1,low,False,how to create a list in notion
How to make a picture smaller on Notion,How to make a picture smaller on Notion,howto,1,low,False,how to make a picture smaller on notion
How to import html into Notion,How to import html into Notion,howto,1,low,False,how to import html into notion
How to write power in Notion,How to write power in Notion,howto,1,low,False,how to write power in notion
How to write square root in Notion,How to write square root in Notion,howto,1,low,False,how to write square root in notion
How to share Notion template import link,How to share Notion template import link,howto,1,low,False,how to share notion template import link
How to put two things side by side in Notion,How to put two things side by side in Notion,howto,1,low,False,how to put two things side by side in notion
How to password protect Notion page or workspace,How to password protect Notion page or workspace,howto,1,low,False,how to password protect notion page or workspace
How to ask Notion ai questions,How to ask Notion ai questions,howto,1,low,False,how to ask notion ai questions
How to earn from Notion,How to earn from Notion,howto,1,low,False,how to earn from notion
How to make aesthetic Notion templates,How to make aesthetic Notion templates,howto,1,low,False,how to make aesthetic notion templates
How to install Notion ai,How to install Notion ai,howto,1,low,False,how to install notion ai
How to repeat dates in Notion,How to repeat dates in Notion,howto,1,low,False,how to repeat dates in notion
How to get pomodoro timer on Notion,How to get pomodoro timer on Notion,howto,1,low,False,how to get pomodoro timer on notion
How to remove Notion from mac,How to remove Notion from mac,howto,1,low,False,how to remove notion from mac
How to gamify Notion,How to gamify Notion,howto,1,low,False,how to gamify notion
How to delete Notion account on phone,How to delete Notion account on phone,howto,1,low,False,how to delete notion account on phone
How to use dependencies in Notion,How to use dependencies in Notion,howto,1,low,False,how to use dependencies in notion
How to write with pen on Notion,How to write with pen on Notion,howto,1,low,False,how to write with pen on notion
How to embed asana in Notion,How to embed asana in Notion,howto,1,low,False,how to embed asana in notion
How to create a content planner in Notion,How to create a content planner in Notion,howto,1,low,False,how to create a content planner in notion
How to add math symbols in Notion,How to add math symbols in Notion,howto,1,low,False,how to add math symbols in notion
How to create a blog on Notion,How to create a blog on Notion,howto,1,low,False,how to create a blog on notion
How to change Notion to white background,How to change Notion to white background,howto,1,low,False,how to change notion to white background
How to delete data source in Notion,How to delete data source in Notion,howto,1,low,False,how to delete data source in notion
How to set up Notion mail,How to set up Notion mail,howto,1,low,False,how to set up notion mail
How to add description to Notion page,How to add description to Notion page,howto,1,low,False,how to add description to notion page
How to duplicate someone else's Notion page,How to duplicate someone else's Notion page,howto,1,low,False,how to duplicate someone else's notion page
How to make Notion template share link,How to make Notion template share link,howto,1,low,False,how to make notion template share link
How to link canvas assignments to Notion,How to link canvas assignments to Notion,howto,1,low,False,how to link canvas assignments to notion
How to import csv into Notion on iphone,How to import csv into Notion on iphone,howto,1,low,False,how to import csv into notion on iphone
How to make Notion dark,How to make Notion dark,howto,1,low,False,how to make notion dark
How to attach google calendar to Notion,How to attach google calendar to Notion,howto,1,low,False,how to attach google calendar to notion
How to merge 2 databases in Notion,How to merge 2 databases in Notion,howto,1,low,False,how to merge 2 databases in notion
How to uninstall Notion calendar on mac,How to uninstall Notion calendar on mac,howto,1,low,False,how to uninstall notion calendar on mac
How to create custom Notion template guide,How to create custom Notion template guide,howto,1,low,False,how to create custom notion template guide
How to share Notion template link duplication,How to share Notion template link duplication,howto,1,low,False,how to share notion template link duplication
How to private Notion,How to private Notion,howto,1,low,False,how to private notion
How to create a moodboard on Notion,How to create a moodboard on Notion,howto,1,low,False,how to create a moodboard on notion
How to hide hidden groups in Notion,How to hide hidden groups in Notion,howto,1,low,False,how to hide hidden groups in notion
How to multiply in Notion formula,How to multiply in Notion formula,howto,1,low,False,how to multiply in notion formula
How to add things to Notion calendar,How to add things to Notion calendar,howto,1,low,False,how to add things to notion calendar
How to create recurring events in Notion,How to create recurring events in Notion,howto,1,low,False,how to create recurring events in notion
How to insert checkbox in Notion,How to insert checkbox in Notion,howto,1,low,False,how to insert checkbox in notion
How to make a photo gallery in Notion,How to make a photo gallery in Notion,howto,1,low,False,how to make a photo gallery in notion
How to get word count in Notion,How to get word count in Notion,howto,1,low,False,how to get word count in notion
How to download pdf from Notion,How to download pdf from Notion,howto,1,low,False,how to download pdf from notion
How to edit widgets on Notion,How to edit widgets on Notion,howto,1,low,False,how to edit widgets on notion
How to get free Notion ai,How to get free Notion ai,howto,1,low,False,how to get free notion ai
How to get Notion calendar to show up in Notion,How to get Notion calendar to show up in Notion,howto,1,low,False,how to get notion calendar to show up in notion
How to group blocks in Notion,How to group blocks in Notion,howto,1,low,False,how to group blocks in notion
How to uninstall Notion from mac,How to uninstall Notion from mac,howto,1,low,False,how to uninstall notion from mac
How to get rid of red underline in Notion,How to get rid of red underline in Notion,howto,1,low,False,how to get rid of red underline in notion
How to change Notion to white mode,How to change Notion to white mode,howto,1,low,False,how to change notion to white mode
How to do square root in Notion,How to do square root in Notion,howto,1,low,False,how to do square root in notion
How to send a Notion page to someone,How to send a Notion page to someone,howto,1,low,False,how to send a notion page to someone
How to create a Notion template for workout plan,How to create a Notion template for workout plan,howto,1,low,False,how to create a notion template for workout plan
How to widen Notion page,How to widen Notion page,howto,1,low,False,how to widen notion page
How to link Notion database to google calendar,How to link Notion database to google calendar,howto,1,low,False,how to link notion database to google calendar
How to free up blocks on Notion,How to free up blocks on Notion,howto,1,low,False,how to free up blocks on notion
How to make three columns in Notion,How to make three columns in Notion,howto,1,low,False,how to make three columns in notion
How to use mermaid in Notion code block,How to use mermaid in Notion code block,howto,1,low,False,how to use mermaid in notion code block
How to add Notion widget to desktop windows,How to add Notion widget to desktop windows,howto,1,low,False,how to add notion widget to desktop windows
How to add a page in a table Notion,How to add a page in a table Notion,howto,1,low,False,how to add a page in a table notion
How to get a Notion avatar,How to get a Notion avatar,howto,1,low,False,how to get a notion avatar
How to speed up Notion,How to speed up Notion,howto,1,low,False,how to speed up notion
How to add a column to a table in Notion,How to add a column to a table in Notion,howto,1,low,False,how to add a column to a table in notion
How to change Notion to british english,How to change Notion to british english,howto,1,low,False,how to change notion to british english
How to password protect Notion pages or databases,How to password protect Notion pages or databases,howto,1,low,False,how to password protect notion pages or databases
How to download Notion in laptop,How to download Notion in laptop,howto,1,low,False,how to download notion in laptop
How to change Notion from dark to light mode,How to change Notion from dark to light mode,howto,1,low,False,how to change notion from dark to light mode
How to embed google drive in Notion,How to embed google drive in Notion,howto,1,low,False,how to embed google drive in notion
How to add Notion mcp to cursor,How to add Notion mcp to cursor,howto,1,low,False,how to add notion mcp to cursor
How to hide filters in Notion,How to hide filters in Notion,howto,1,low,False,how to hide filters in notion
How to share Notion template copy link,How to share Notion template copy link,howto,1,low,False,how to share notion template copy link
How to share Notion template link duplicate page,How to share Notion template link duplicate page,howto,1,low,False,how to share notion template link duplicate page
How to use gallery in Notion,How to use gallery in Notion,howto,1,low,False,how to use gallery in notion
How to take notes with Notion ai,How to take notes with Notion ai,howto,1,low,False,how to take notes with notion ai
How to add trello to Notion,How to add trello to Notion,howto,1,low,False,how to add trello to notion
How to create a knowledge base in Notion,How to create a knowledge base in Notion,howto,1,low,False,how to create a knowledge base in notion
How to play Notion by tash sultana,How to play Notion by tash sultana,howto,1,low,False,how to play notion by tash sultana
How to change group name in Notion,How to change group name in Notion,howto,1,low,False,how to change group name in notion
How to convert callout to text block in Notion,How to convert callout to text block in Notion,howto,1,low,False,how to convert callout to text block in notion
How to create Notion duplicate template link,How to create Notion duplicate template link,howto,1,low,False,how to create notion duplicate template link
How to back up Notion data,How to back up Notion data,howto,1,low,False,how to back up notion data
How to access Notion template gallery,How to access Notion template gallery,howto,1,low,False,how to access notion template gallery
How to set Notion to light mode,How to set Notion to light mode,howto,1,low,False,how to set notion to light mode
