canonical_keyword,suggested_title,category,variant_count,signal_strength,already_covered,all_variants
How to insert image in Notion,How to insert image in Notion,howto,2,low,False,how to insert images in notion | how to insert image in notion
How to duplicate a Notion workspace,How to duplicate a Notion workspace,howto,2,low,False,how to duplicate a notion workspace | how to duplicate notion workspace
How to add a group in Notion,How to add a group in Notion,howto,2,low,False,how to add a group in notion | how to add group in notion
How to embed a video in Notion,How to embed a video in Notion,howto,2,low,False,how to embed video in notion | how to embed a video in notion
How to make a repeating event in Notion,How to make a repeating event in Notion,howto,2,low,False,how to make repeating events in notion | how to make a repeating event in notion
How to add code in Notion,How to add code in Notion,howto,2,low,False,how to add code in notion | how to add code to notion
How to duplicate a Notion template step by step,How to duplicate a Notion template step by step,howto,2,low,False,how to duplicate a notion template step by step | how to duplicate notion template step by step
How to add a dropdown in Notion,How to add a dropdown in Notion,howto,2,low,False,how to add dropdown in notion | how to add a dropdown in notion
How to use database in Notion,How to use database in Notion,howto,2,low,False,how to use databases in notion | how to use database in notion
How to create a crm in Notion,How to create a crm in Notion,howto,2,low,False,how to create a crm in notion | how to create crm in notion
How to calculate in Notion,How to calculate in Notion,howto,2,low,False,how to calculate in notion | how to calculate on notion
How to create a duplicable Notion template link,How to create a duplicable Notion template link,howto,2,low,False,how to create a duplicable notion template link | how to create duplicable notion template link
How to share a Notion template with another user,How to share a Notion template with another user,howto,2,low,False,how to share notion template with another user | how to share a notion template with another user
How to duplicate a table in Notion,How to duplicate a table in Notion,howto,2,low,False,how to duplicate a table in notion | how to duplicate table in notion
How to export Notion to excel,How to export Notion to excel,howto,2,low,False,how to export notion to excel | how to export from notion to excel
How to add recurring events to Notion calendar,How to add recurring events to Notion calendar,howto,2,low,False,how to add recurring events to notion calendar | how to add recurring events on notion calendar
How to add a pinterest board to Notion,How to add a pinterest board to Notion,howto,2,low,False,how to add pinterest board to notion | how to add a pinterest board to notion
How to make a gantt chart in Notion,How to make a gantt chart in Notion,howto,2,low,False,how to make a gantt chart in notion | how to make gantt chart in notion
How to embed google map in Notion,How to embed google map in Notion,howto,2,low,False,how to embed google maps in notion | how to embed google map in notion
How to add a cover to gallery view in Notion,How to add a cover to gallery view in Notion,howto,2,low,False,how to add cover to gallery view notion | how to add a cover to gallery view in notion
How to duplicate a Notion template from a link,How to duplicate a Notion template from a link,howto,2,low,False,how to duplicate notion template from link | how to duplicate a notion template from a link
How to build a crm in Notion,How to build a crm in Notion,howto,2,low,False,how to build a crm in notion | how to build crm in notion
How to make a grade calculator in Notion,How to make a grade calculator in Notion,howto,2,low,False,how to make a grade calculator in notion | how to make grade calculator in notion
How to make sections in Notion,How to make sections in Notion,howto,2,low,False,how to make sections in notion | how to make sections on notion
How to embed a playlist in Notion,How to embed a playlist in Notion,howto,2,low,False,how to embed playlist in notion | how to embed a playlist in notion
How to share a Notion workspace link,How to share a Notion workspace link,howto,2,low,False,how to share notion workspace link | how to share a notion workspace link
How to make Notion white,How to make Notion white,howto,2,low,False,how to make notion white | how to make my notion white
How to add a table of contents in Notion,How to add a table of contents in Notion,howto,2,low,False,how to add table of contents in notion | how to add a table of contents in notion
How to save Notion,How to save Notion,howto,2,low,False,how to save in notion | how to save notion
How to remove a teamspace member in Notion,How to remove a teamspace member in Notion,howto,2,low,False,how to remove teamspace member from notion | how to remove a teamspace member in notion
How to start Notion ai meeting notes,How to start Notion ai meeting notes,howto,2,low,False,how to start notion ai meeting notes | how to start ai meeting notes in notion
How to add a group in Notion board view,How to add a group in Notion board view,howto,2,low,False,how to add group in notion board view | how to add a group in notion board view
How to turn a page into a database Notion,How to turn a page into a database Notion,howto,2,low,False,how to turn a page into a database notion | how to turn a notion page into a database
How to setup Notion,How to setup Notion,howto,2,low,False,how to setup notion | how to setup your notion
How to record on Notion,How to record on Notion,howto,2,low,False,how to record on notion | how to record in notion
How to automate Notion,How to automate Notion,howto,2,low,False,how to automate notion | how to automate in notion
How to create a Notion checklist template,How to create a Notion checklist template,howto,2,low,False,how to create a notion checklist template | how to create a checklist template in notion
How to insert a calendar in Notion,How to insert a calendar in Notion,howto,2,low,False,how to insert calendar in notion | how to insert a calendar in notion
How to export Notion data,How to export Notion data,howto,2,low,False,how to export data from notion | how to export notion data
How to change Notion page background color,How to change Notion page background color,howto,2,low,False,how to change notion page background color | how to change page background color in notion
How to share a Notion template with others,How to share a Notion template with others,howto,2,low,False,how to share notion template with others | how to share a notion template with others
How to change colors on Notion calendar,How to change colors on Notion calendar,howto,2,low,False,how to change colors on notion calendar | how to change colors in notion calendar
How to turn on light mode on Notion,How to turn on light mode on Notion,howto,2,low,False,how to turn on light mode on notion | how to turn on light mode in notion
How to draw in Notion ipad,How to draw in Notion ipad,howto,2,low,False,how to draw in notion ipad | how to draw on notion ipad
How to copy a Notion page to another workspace,How to copy a Notion page to another workspace,howto,2,low,False,how to copy notion page to another workspace | how to copy a notion page to another workspace
How to create a daily planner template in Notion,How to create a daily planner template in Notion,howto,2,low,False,how to create a daily planner template in notion | how to create notion daily planner template
How to turn a Notion page into a pdf,How to turn a Notion page into a pdf,howto,2,low,False,how to turn notion page into pdf | how to turn a notion page into a pdf
How to import excel to Notion,How to import excel to Notion,howto,2,low,False,how to import excel to notion | how to import excel in notion
How to add a checkbox in Notion table,How to add a checkbox in Notion table,howto,2,low,False,how to add checkbox in notion table | how to add a checkbox in notion table
How to make money with Notion templates,How to make money with Notion templates,howto,2,low,False,how to make money with notion templates | how to make money from notion templates
How to add a new group in Notion,How to add a new group in Notion,howto,2,low,False,how to add a new group in notion | how to add new group in notion
How to create a template button in Notion,How to create a template button in Notion,howto,2,low,False,how to create a template button in notion | how to create template button in notion
How to make images smaller on Notion,How to make images smaller on Notion,howto,2,low,False,how to make images smaller on notion | how to make images smaller in notion
How to find Notion database id url,How to find Notion database id url,howto,2,low,False,how to find notion database id url | how to find database id in notion url
How to share Notion calendar with others,How to share Notion calendar with others,howto,2,low,False,how to share notion calendar with others | how to share my notion calendar with others
How to delete a callout block in Notion 2026,How to delete a callout block in Notion 2026,howto,2,low,False,how to delete callout block in notion 2026 | how to delete a callout block in notion 2026
How to make a budget in Notion,How to make a budget in Notion,howto,2,low,False,how to make a budget in notion | how to make a budget on notion
How to link to a page in Notion,How to link to a page in Notion,howto,2,low,False,how to link to a page in notion | how to link to page in notion
How to copy Notion table to excel,How to copy Notion table to excel,howto,2,low,False,how to copy notion table to excel | how to copy table from notion to excel
How to create a timeline in Notion,How to create a timeline in Notion,howto,2,low,False,how to create a timeline in notion | how to create a timeline on notion
How to lock a Notion page with password,How to lock a Notion page with password,howto,2,low,False,how to lock notion page with password | how to lock a notion page with password
How to add a document to Notion,How to add a document to Notion,howto,2,low,False,how to add documents to notion | how to add a document to notion
How to add a weekly calendar in Notion,How to add a weekly calendar in Notion,howto,2,low,False,how to add a weekly calendar in notion | how to add weekly calendar in notion
How to add properties to a Notion page,How to add properties to a Notion page,howto,2,low,False,how to add properties to a page in notion | how to add properties to a notion page
How to make a reading list in Notion,How to make a reading list in Notion,howto,2,low,False,how to make a reading list in notion | how to make a reading list on notion
How to add clock widget to Notion,How to add clock widget to Notion,howto,2,low,False,how to add clock widget to notion | how to add clock widget in notion
How to copy text in Notion,How to copy text in Notion,howto,2,low,False,how to copy text in notion | how to copy text on notion
How to make a recurring event in Notion,How to make a recurring event in Notion,howto,2,low,False,how to make a recurring event in notion | how to make recurring events in notion
How to embed a clock in Notion,How to embed a clock in Notion,howto,2,low,False,how to embed clock in notion | how to embed a clock in notion
How to put dark mode in Notion,How to put dark mode in Notion,howto,2,low,False,how to put dark mode in notion | how to put dark mode on notion
How to turn on autocorrect in Notion,How to turn on autocorrect in Notion,howto,2,low,False,how to turn on autocorrect in notion | how to turn on autocorrect on notion
How to design a Notion page,How to design a Notion page,howto,2,low,False,how to design notion page | how to design a notion page
How to make a school schedule on Notion,How to make a school schedule on Notion,howto,2,low,False,how to make school schedule in notion | how to make a school schedule on notion
How to share a Notion dashboard link,How to share a Notion dashboard link,howto,2,low,False,how to share a notion dashboard link | how to share notion dashboard link
How to link a table to a calendar in Notion,How to link a table to a calendar in Notion,howto,2,low,False,how to link a table to a calendar in notion | how to link table to calendar in notion
How to enable spell check in Notion,How to enable spell check in Notion,howto,2,low,False,how to enable spell check in notion | how to enable spell check on notion
How to share only one Notion page,How to share only one Notion page,howto,2,low,False,how to share only one page in notion | how to share only one notion page
How to put a link in Notion,How to put a link in Notion,howto,2,low,False,how to put a link in notion | how to put links in notion
How to share Notion notes,How to share Notion notes,howto,2,low,False,how to share notes on notion | how to share notion notes
How to save a Notion page,How to save a Notion page,howto,2,low,False,how to save a notion page | how to save notion page
How to make a daily schedule in Notion,How to make a daily schedule in Notion,howto,2,low,False,how to make daily schedule in notion | how to make a daily schedule in notion
How to make a sub bullet point in Notion,How to make a sub bullet point in Notion,howto,2,low,False,how to make sub bullet points in notion | how to make a sub bullet point in notion
How to share a single Notion page,How to share a single Notion page,howto,2,low,False,how to share a single page in notion | how to share a single notion page
How to create a box in Notion,How to create a box in Notion,howto,2,low,False,how to create box in notion | how to create a box in notion
How to add a block to the right in Notion,How to add a block to the right in Notion,howto,2,low,False,how to add block to the right notion | how to add a block to the right in notion
How to delete a Notion workspace on ipad,How to delete a Notion workspace on ipad,howto,2,low,False,how to delete a notion workspace on ipad | how to delete workspace in notion on ipad
How to use emoji in Notion,How to use emoji in Notion,howto,2,low,False,how to use emojis in notion | how to use emoji in notion
How to get Notion out of dark mode,How to get Notion out of dark mode,howto,2,low,False,how to get notion out of dark mode | how to get out of dark mode on notion
How to activate Notion ai,How to activate Notion ai,howto,2,low,False,how to activate ai in notion | how to activate notion ai
How to make a divider in Notion,How to make a divider in Notion,howto,2,low,False,how to make a divider in notion | how to make dividers in notion
How to make a formula in Notion,How to make a formula in Notion,howto,2,low,False,how to make a formula in notion | how to make formulas in notion
How to create Notion shared template link,How to create Notion shared template link,howto,2,low,False,how to create notion shared template link | how to create shared notion template link
How to create a vertical divider in Notion,How to create a vertical divider in Notion,howto,2,low,False,how to create vertical divider in notion | how to create a vertical divider in notion
How to create a graph in Notion,How to create a graph in Notion,howto,2,low,False,how to create a graph in notion | how to create graphs in notion
How to add to Notion,How to add to Notion,howto,2,low,False,how to add to notion | how to add in notion
How to remove a member from Notion workspace,How to remove a member from Notion workspace,howto,2,low,False,how to remove member from notion workspace | how to remove a member from notion workspace
How to use google calendar in Notion,How to use google calendar in Notion,howto,2,low,False,how to use google calendar with notion | how to use google calendar in notion
How to create a Notion portfolio template,How to create a Notion portfolio template,howto,2,low,False,how to create notion portfolio template | how to create a notion portfolio template
How to change timezone in Notion calendar,How to change timezone in Notion calendar,howto,2,low,False,how to change timezone in notion calendar | how to change timezone on notion calendar
How to delete a default teamspace in Notion,How to delete a default teamspace in Notion,howto,2,low,False,how to delete default teamspace in notion | how to delete a default teamspace in notion
How to set up a habit tracker in Notion,How to set up a habit tracker in Notion,howto,2,low,False,how to set up habit tracker in notion | how to set up a habit tracker in notion
How to add class schedule in Notion,How to add class schedule in Notion,howto,2,low,False,how to add class schedule in notion | how to add class schedule to notion
How to make a weekly agenda in Notion,How to make a weekly agenda in Notion,howto,2,low,False,how to make a weekly agenda in notion | how to make weekly agenda on notion
How to crop on Notion,How to crop on Notion,howto,2,low,False,how to crop on notion | how to crop in notion
How to share a Notion template for duplication,How to share a Notion template for duplication,howto,2,low,False,how to share a notion template for duplication | how to share notion template for duplication
How to take class notes on Notion,How to take class notes on Notion,howto,2,low,False,how to take class notes on notion | how to take class notes in notion
How to put a pdf in Notion,How to put a pdf in Notion,howto,2,low,False,how to put pdf in notion | how to put a pdf in notion
How to delete add a comment on Notion,How to delete add a comment on Notion,howto,2,low,False,how to delete add a comment on notion | how to delete add comment in notion
How to refresh a Notion page,How to refresh a Notion page,howto,2,low,False,how to refresh a notion page | how to refresh notion page
How to delete a workspace in Notion mobile,How to delete a workspace in Notion mobile,howto,2,low,False,how to delete a workspace in notion mobile | how to delete workspace in notion mobile
How to link a spotify playlist to Notion,How to link a spotify playlist to Notion,howto,2,low,False,how to link spotify playlist to notion | how to link a spotify playlist to notion
How to change page colour in Notion,How to change page colour in Notion,howto,2,low,False,how to change page colour in notion | how to change page colour on notion
How to change Notion link,How to change Notion link,howto,2,low,False,how to change notion link | how to change link in notion
How to write in Notion,How to write in Notion,howto,2,low,False,how to write in notion | how to write on notion
How to do undo on Notion,How to do undo on Notion,howto,2,low,False,how to do undo on notion | how to do undo in notion
How to earn money from Notion,How to earn money from Notion,howto,2,low,False,how to earn money from notion | how to earn money with notion
How to delete a Notion plan,How to delete a Notion plan,howto,2,low,False,how to delete notion plan | how to delete a notion plan
How to search for a word in Notion,How to search for a word in Notion,howto,2,low,False,how to search for a word in notion | how to search for words in notion
How to open a Notion template,How to open a Notion template,howto,2,low,False,how to open a template in notion | how to open a notion template
How to create a drop down list in Notion,How to create a drop down list in Notion,howto,2,low,False,how to create drop down list in notion | how to create a drop down list in notion
How to unhide Notion,How to unhide Notion,howto,2,low,False,how to unhide in notion | how to unhide notion
How to embed gif in Notion,How to embed gif in Notion,howto,2,low,False,how to embed gif in notion | how to embed gifs in notion
How to lock Notion notes,How to lock Notion notes,howto,2,low,False,how to lock notion notes | how to lock notes in notion
How to share a Notion page with a public link,How to share a Notion page with a public link,howto,2,low,False,how to share a notion page with a public link | how to share notion page with public link
How to get rid of add a comment on Notion,How to get rid of add a comment on Notion,howto,2,low,False,how to get rid of add comment on notion | how to get rid of add a comment on notion
How to create a Notion journal template,How to create a Notion journal template,howto,2,low,False,how to create a notion journal template | how to create a journal template in notion
How to create an index in Notion,How to create an index in Notion,howto,2,low,False,how to create an index in notion | how to create index in notion
How to put a password on Notion,How to put a password on Notion,howto,2,low,False,how to put password on notion | how to put a password on notion
How to download a table from Notion,How to download a table from Notion,howto,2,low,False,how to download a table from notion | how to download notion table
How to freeze a column in Notion,How to freeze a column in Notion,howto,2,low,False,how to freeze column in notion | how to freeze a column in notion
How to delete a backlink in Notion,How to delete a backlink in Notion,howto,2,low,False,how to delete a backlink in notion | how to delete backlinks in notion
How to remove add a property in Notion,How to remove add a property in Notion,howto,2,low,False,how to remove add property in notion | how to remove add a property in notion
How to clear a Notion template,How to clear a Notion template,howto,2,low,False,how to clear notion templates | how to clear a notion template
How to unsubscribe Notion,How to unsubscribe Notion,howto,2,low,False,how to unsubscribe notion | how to unsubscribe from notion
How to put image in Notion,How to put image in Notion,howto,2,low,False,how to put image in notion | how to put images in notion
How to colour code Notion calendar,How to colour code Notion calendar,howto,2,low,False,how to colour code notion calendar | how to colour code calendar in notion
How to add a checklist in Notion,How to add a checklist in Notion,howto,2,low,False,how to add checklist in notion | how to add a checklist in notion
How to sell a Notion template on etsy,How to sell a Notion template on etsy,howto,2,low,False,how to sell a notion template on etsy | how to sell notion template on etsy
How to resize on Notion,How to resize on Notion,howto,2,low,False,how to resize on notion | how to resize in notion
How to embed a pdf into Notion,How to embed a pdf into Notion,howto,2,low,False,how to embed a pdf into notion | how to embed pdf into notion
How to change the background color of Notion,How to change the background color of Notion,howto,2,low,False,how to change the background color of notion | how to change the background color of your notion
How to allow duplicate as template Notion,How to allow duplicate as template Notion,howto,2,low,False,how to allow duplicate as template in notion | how to allow duplicate as template notion
How to do a habit tracker in Notion,How to do a habit tracker in Notion,howto,2,low,False,how to do a habit tracker in notion | how to do habit tracker in notion
How to create a planner on Notion,How to create a planner on Notion,howto,2,low,False,how to create a planner on notion | how to create a planner in notion
How to add a map to Notion,How to add a map to Notion,howto,2,low,False,how to add map to notion | how to add a map to notion
How to put Notion calendar into Notion,How to put Notion calendar into Notion,howto,2,low,False,how to put my notion calendar into notion | how to put notion calendar into notion
How to add a new group in Notion board,How to add a new group in Notion board,howto,2,low,False,how to add a new group in notion board | how to add new group in notion board
How to show tags in Notion calendar,How to show tags in Notion calendar,howto,2,low,False,how to show tags in notion calendar | how to show tags on notion calendar
How to make a repeating task in Notion,How to make a repeating task in Notion,howto,2,low,False,how to make a repeating task in notion | how to make repeating tasks in notion
How to create a view in Notion,How to create a view in Notion,howto,2,low,False,how to create a view in notion | how to create views in notion
How to change colour in Notion,How to change colour in Notion,howto,2,low,False,how to change colour in notion | how to change colour on notion
How to turn a database into a page in Notion,How to turn a database into a page in Notion,howto,2,low,False,how to turn a database into a page in notion | how to turn database into page notion
How to centre text on Notion,How to centre text on Notion,howto,2,low,False,how to centre text on notion | how to centre text in notion
How to change Notion username,How to change Notion username,howto,2,low,False,how to change username on notion | how to change notion username
How to rename a view in Notion,How to rename a view in Notion,howto,2,low,False,how to rename a view in notion | how to rename views in notion
How to add members in Notion,How to add members in Notion,howto,2,low,False,how to add members in notion | how to add members to notion
How to add photos to gallery view Notion,How to add photos to gallery view Notion,howto,2,low,False,how to add photos to gallery view notion | how to add photos to gallery view in notion
How to add a row in Notion,How to add a row in Notion,howto,2,low,False,how to add a row in notion | how to add rows in notion
How to open another Notion window,How to open another Notion window,howto,2,low,False,how to open another notion windows | how to open another notion window
How to make Notion font bigger,How to make Notion font bigger,howto,2,low,False,how to make font bigger on notion | how to make notion font bigger
How to move a database in Notion,How to move a database in Notion,howto,2,low,False,how to move a database in notion | how to move database in notion
