canonical_keyword,suggested_title,category,variant_count,signal_strength,already_covered,all_variants
how to connect chatgpt to notion,How to Integrate Notion with Chatgpt,integration,178,high,False,chatgpt notion integration | notion chatgpt integration | notion ai chatgpt integration | chatgpt integration with notion | connect notion to chatgpt | notion integration with chatgpt | connect chatgpt to notion | how do i connect notion to chatgpt? | how to integrate chatgpt with notion | how to connect chatgpt to notion
how to sync google calendar to notion,How to Integrate Notion with Google Calendar,integration,148,high,True,notion google calendar integration | how to connect google calendar to notion | connect google calendar to notion | how to sync notion calendar with google calendar | google calendar notion integration | how to connect notion to google calendar | how to sync google calendar with notion | connect notion to google calendar | notion calendar google calendar integration | how do i connect google calendar to notion?
how to connect claude to notion,How to Integrate Notion with Claude,integration,126,high,False,claude notion integration | notion claude integration | claude ai notion integration | connect claude to notion | claude ai integration with notion | notion mcp claude integration | claude mcp notion integration | notion ai claude integration | claude code notion integration | anthropic claude notion integration
how to connect outlook to notion,How to Integrate Notion with Outlook,integration,105,high,True,notion outlook integration | microsoft outlook notion integration | notion outlook calendar integration | notion calendar outlook integration | how do i connect microsoft outlook to notion? | how do i connect notion to microsoft outlook? | notion calendar outlook integration 2025 | outlook notion integration | connect microsoft outlook to notion | notion integration with outlook
how to get notion api integration token,How to Integrate Notion with Api,integration,104,high,False,notion api rate limits per integration | notion api integration | notion api integration guide | anytype api integration notion | ai writing apps api hooks notion integration | notion api integration token | notion api authentication integration token | notion api python integration | notion integration api | notion api rate limits per integration 2025
how to sync notion,How to Integrate Notion with _General_,integration,83,high,False,notion integration | notion ai integration | notion notion integration | how to connect canvas to notion | notion form integration | notion canvas integration | notion integration news | integration notion | canva notion integration | notion mind map integration
how to connect notion to zapier,How to Integrate Notion with Zapier,integration,82,high,True,zapier notion integration | zapier notion integration create database item | notion zapier integration | zapier notion integration documentation | zapier notion integration ideas? | zapier notion integration guide | zapier rss to notion integration | zapier notion integration tutorial | zapier motion notion integration | otter.ai notion integration zapier
how to connect notion to slack,How to Integrate Notion with Slack,integration,81,high,True,notion slack integration | slack notion integration | notion and slack integration | slack and notion integration | how do i connect notion to slack? | notion slack integration notifications | slack to notion integration | slack integration with notion | notion integration with slack | connect notion to slack
how to make a synced block in notion,How to Integrate Notion with Make,integration,66,high,False,make.com notion integration | make notion integration | make.com notion integration tutorial | make (integromat) notion integration | make.com notion integration create database item | make notion integration documentation | notion make integration | make.com notion integration module | make.com notion integration documentation | make.com notion integration modules
how to connect notion to n8n,How to Integrate Notion with N8N,integration,49,high,False,n8n notion integration | n8n notion integration tutorial | n8n notion integration node | n8n notion node integration | notion n8n integration | n8n notion integration create page | n8n integration with notion | n8n notion api integration | n8n notion integration docs | n8n notion integration documentation
how to sync calendar to notion,How to Integrate Notion with Lend,integration,47,high,False,notion calendar integration | how to connect notion calendar to notion | notion calendar integration features | notion calendar integration 2025 | notion calendar icloud integration | notion calendar integration news | notion ai calendar integration | notion icloud calendar integration | how to connect canvas calendar to notion | connect notion calendar to notion
how to connect google drive to notion,How to Integrate Notion with Google Drive,integration,42,high,True,google drive notion integration | notion google drive integration | connect google drive to notion | notion google drive integration embed | notion google drive integration features | notion google drive integration 2025 | notion google drive integration export | how to integrate notion with google drive | how to connect google drive to notion | notion ai google drive integration
how to sync notion to google sheets,How to Integrate Notion with Google Sheets,integration,39,high,True,google sheets notion integration | notion google sheets integration | how do i connect google sheets to notion? | connect google sheets to notion | how to connect google sheets to notion | notion and google sheets integration | sync2sheets notion google sheets integration | connect google sheets notion | how to integrate notion with google sheets | how to sync notion to google sheets
how to connect notion with mcp,How to Integrate Notion with Mcp,integration,38,high,False,notion mcp integration | mcp server notion integration | mcp notion integration | notion mcp server integration | notion mcp ai integration | model context protocol mcp notion integration | alternatives to notion mcp for ai integration | notion mcp ai integration alternatives | mcp model context protocol notion integration | notion model context protocol mcp integration
how to connect perplexity to notion,How to Integrate Notion with Perplex,integration,37,high,True,perplexity ai notion integration | perplexity notion integration | perplexity ai integration with notion | perplexity integration with notion | connect perplexity ai to notion | notion perplexity integration | connect perplexity to notion | how to connect perplexity to notion | notion integration with perplexity | connect notion to perplexity
how to connect notion to github,How to Integrate Notion with Github,integration,36,high,True,github notion integration | notion github integration | notion github integration official | notion integration with github | connect notion to github | how to sync notion tasks with github issues? | how to integrate notion with github | notion github integration features | notion github integration bi-directional issues | notion github integration 2025
how to sync notion with todoist,How to Integrate Notion with Todoist,integration,33,high,False,todoist notion integration | notion todoist integration | todoist and notion integration | notion and todoist integration | integrate todoist with notion | make (integromat) notion todoist integration | todoist integration with notion | notion integration with todoist | todoist notion integration official | how to integrate todoist with notion
anytype notion integration,How to Integrate Notion with Ytype,integration,31,high,False,anytype notion integration | notion anytype integration | anytype integration notion | anytype notion integration 2025 | connect notion to anytype | anytype notion integration sync | connect notion and anytype | anytype connect notion | anytype integration notion 2025 | notion anytype integration 2025
how to connect gmail to notion,How to Integrate Notion with Gmail,integration,31,high,True,gmail notion integration | notion gmail integration | how do i connect gmail to notion? | notion mail gmail integration | gmail to notion integration | how to integrate notion with gmail | notion gmail integration tutorial | connect gmail to notion | notion and gmail integration | notion gmail integration official
how to connect hubspot to notion,How to Integrate Notion with Hubspot,integration,31,high,True,hubspot notion integration | notion hubspot integration | how do i connect hubspot to notion? | how do i connect hubspot with notion? | connect hubspot to notion | notion and hubspot integration | connect hubspot with notion | hubspot to notion integration | hubspot and notion integration | connect hubspot notion
how to connect jira to notion,How to Integrate Notion with Jir,integration,26,high,False,notion jira integration | jira software cloud notion integration | jira notion integration | jira and notion integration | notion and jira integration | connect notion to jira | notion integration with jira | connect jira to notion | integrate jira with notion | notion integration jira
how to connect linear to notion,How to Integrate Notion with Linear,integration,26,high,True,linear notion integration | notion linear integration | how do i connect linear to notion? | notion and linear integration | linear and notion integration | connect linear to notion | linear to notion integration | notion + linear integration | how to integrate notion with linear | notion integration with linear
how to connect discord to notion,How to Integrate Notion with Discord,integration,26,high,True,notion discord integration | discord notion integration | how do i connect discord to notion? | connect discord to notion | notion ai notetaker discord integration | connect discord notion | how to integrate notion with discord | how to connect discord to notion | how to connect discord to notion integration | notion discord integration official
motion notion integration,How to Integrate Notion with Moti,integration,25,high,False,how do i connect notion to motion? | motion app notion integration | motion notion integration | motion ai notion integration | notion motion integration | notion to motion integration | motion ai integration with notion | motion app integration with notion | notion and motion integration | notion motion integration guide
how to connect gemini to notion,How to Integrate Notion with Gemini,integration,25,high,False,gemini notion integration | notion gemini integration | google gemini notion integration | gemini integration with notion | gemini ai notion integration | connect notion to gemini | connect gemini to notion | google gemini integration with notion | can gemini connect to notion | notion integration with google gemini
how to sync apple calendar to notion,How to Integrate Notion with Le Lend,integration,24,high,False,notion apple calendar integration | how to connect apple calendar to notion | how to connect notion to apple calendar | connect notion to apple calendar | connect apple calendar to notion | can notion connect to apple calendar | how to sync notion with apple calendar | how to sync apple calendar to notion | can i connect notion to apple calendar | how to sync apple calendar with notion
how to integrate notion with ticktick,How to Integrate Notion with Ticktick,integration,21,high,True,notion ticktick integration | ticktick notion integration | ticktick notion integration 2025 | notion integration ticktick | how to integrate notion with ticktick | ticktick notion integration official | connect notion ticktick | ticktick integration notion | ticktick integration with notion | how to integrate ticktick with notion
how to sync google tasks with notion,How to Integrate Notion with Google Sks,integration,19,high,True,google tasks notion integration | notion google tasks integration | how do i connect google tasks to notion? | connect google tasks to notion | how to integrate notion with google tasks | how to connect google tasks to notion integration | how to connect google tasks to notion | integrate google tasks with notion | how to sync google tasks with notion | connect notion with google tasks
how to connect notion to openclaw,How to Integrate Notion with Opencl,integration,18,high,False,openclaw notion integration | openclaw notion integration setup | notion openclaw integration | how to connect notion to openclaw | openclaw notion integration guide | openclaw notion integration connector | openclaw ai notion integration | openclaw notion integration setup 2026 | connect openclaw to notion | openclaw notion integration plugin
how to connect microsoft teams to notion,How to Integrate Notion with Microsoft Teams,integration,17,high,True,notion microsoft teams integration | microsoft teams notion integration | how do i connect microsoft teams to notion? | connect microsoft teams to notion | connect microsoft teams notion | notion integration with microsoft teams | notion calendar microsoft teams integration | notion microsoft teams integration official | notion microsoft teams integration app | notion microsoft teams integration 2025
how to connect google forms to notion,How to Integrate Notion with Google Forms,integration,16,high,True,how do i connect google forms to notion? | connect google forms to notion | google forms notion integration | how to integrate notion with google forms | google forms to notion integration | how to connect google forms to notion | google forms notion integration tutorial | connect google forms to notion integration 2026 | google forms to notion integration 2026 | connect google forms to notion 2025 or 2026
How to make a Notion template,How to make a Notion template,howto,15,high,True,how to make a notion template | how to make notion templates | how to make a template in notion | how to make notion template | how to make a template on notion | how to make template in notion | how to make templates in notion | how to make a template notion | how to make template notion | how to make template on notion
how to integrate notion with asana,How to Integrate Notion with Asana,integration,15,high,True,notion asana integration | asana notion integration | notion and asana integration | asana and notion integration | connect asana notion | how to integrate notion with asana | asana integration with notion | estuary data integration notion asana | notion asana integration 2025 | asana notion integration official
how to sync readwise to notion,How to Integrate Notion with Re Dwise,integration,15,high,False,readwise notion integration | readwise notion integration official | readwise notion integration setup | notion readwise integration | readwise notion integration documentation | how to connect readwise to notion | connect readwise to notion | readwise to notion integration | readwise notion integration how it works | readwise to notion integration official
How to add a calendar in Notion,How to add a calendar in Notion,howto,14,high,True,how to add notion calendar to notion | how to add calendar to notion | how to add calendar in notion | how to add a calendar in notion | how to add a calendar to notion | how to add calendar on notion | how to add a calendar on notion | how to add my notion calendar to notion | how to add calendars to notion | how to add calendar notion
How to add a Notion widget,How to add a Notion widget,howto,14,high,False,how to add widgets to notion | how to add widget to notion | how to add widgets in notion | how to add widgets on notion | how to add a widget to notion | how to add widget on notion | how to add a widget in notion | how to add widget in notion | how to add notion widget | how to add a widget on notion
how to connect trello to notion,How to Integrate Notion with Trello,integration,14,high,True,trello notion integration | notion trello integration | trello and notion integration | integrate trello with notion | notion and trello integration | notion integration with trello | connect trello to notion | how to integrate notion with trello | notion trello integration tutorial | how to integrate trello with notion
notebooklm notion integration,How to Integrate Notion with Notebooklm,integration,14,high,False,notebooklm notion integration | notion notebooklm integration | notebooklm integration with notion | integrate notebooklm with notion | notion integration with notebooklm | connect notion to notebooklm | connect notebooklm to notion | notebooklm notion integration 2025 | notebooklm integration notion | notebooklm and notion integration
How to create a Notion template,How to create a Notion template,howto,13,high,False,how to create a notion template | how to create a template in notion | how to create notion template | how to create notion templates | how to create templates in notion | how to create template in notion | how to create a template on notion | how to create a template in notion? | how to create template notion | how to create a template notion
How to delete a Notion workspace,How to delete a Notion workspace,howto,13,high,True,how to delete a workspace in notion | how to delete notion workspace | how to delete a notion workspace | how to delete workspace in notion | how to delete a workspace on notion | how to delete notion workspaces | how to delete workspaces in notion | how to delete workspace notion | how to delete workspace on notion | how to delete a workspace notion
How to add a Notion template,How to add a Notion template,howto,13,high,False,how to add template to notion | how to add a template to notion | how to add templates to notion | how to add notion templates | how to add a template in notion | how to add a notion template | how to add notion template | how to add template in notion | how to add template on notion | how to add template notion
how to connect notion to onenote,How to Integrate Notion with Enote,integration,13,high,False,how do i connect notion to onenote? | notion onenote integration | connect notion to onenote | connect notion onenote | how to connect notion to onenote | onenote notion integration | integrate notion with onenote 2025 or 2026 | connect notion to onenote 2025 or 2026 | notion and onenote integration | onenote and notion integration
cursor notion integration,How to Integrate Notion with Cursor,integration,13,high,False,cursor mcp notion integration | cursor notion integration | cursor ide notion integration | cursor notion mcp integration | connect notion to cursor | connect cursor to notion | notion cursor integration | notion mcp cursor integration | cursor ai notion integration | notion mcp server cursor integration
How to share a Notion template,How to share a Notion template,howto,12,high,True,how to share a notion template | how to share notion template | how to share notion templates | how to share a template on notion | how to share a template in notion | how to share your notion template | how to share templates in notion | how to share my notion template | how to share template in notion | how to share template notion
how to integrate notion with airtable,How to Integrate Notion with Airtable,integration,12,high,True,airtable notion integration | notion airtable integration | how do i connect notion to airtable? | connect notion to airtable | notion and airtable integration | airtable and notion integration | how to integrate notion with airtable | notion airtable ai database integration tools | airtable to notion integration | integrate airtable with notion
how to connect excel to notion,How to Integrate Notion with Excel,integration,12,high,True,how do i connect excel to notion? | notion excel integration | how to integrate notion with excel | excel notion integration | connect excel to notion | how to connect excel to notion | notion excel integration official | how to connect excel to notion integration | connect excel to notion 2025 or 2026 | notion and excel integration
grok notion integration,How to Integrate Notion with Grok,integration,12,high,False,grok xai notion integration | grok ai notion integration | grok xai notion integration 2026 | grok xai integration with notion | grok xai notion integration connected apps | integrate grok xai with notion | grok xai connected apps notion integration | integrate grok ai with notion | grok ai notion integration 2026 | grok ai integration with notion
How to add an icon in Notion,How to add an icon in Notion,howto,11,high,True,how to add an icon in notion | how to add icon in notion | how to add icons in notion | how to add icon on notion | how to add icons to notion | how to add an icon on notion | how to add icons on notion | how to add icon to notion | how to add an icon to notion | how to add icon notion
how to integrate notion with salesforce crm?,How to Integrate Notion with Salesforce,integration,11,high,False,notion salesforce integration | salesforce notion integration | notion to salesforce integration | how to integrate notion with salesforce crm? | notion and salesforce integration | connect notion to salesforce | notion salesforce integration reviews g2 capterra | notion integration salesforce | notion integration with salesforce | zapier notion salesforce integration
how to sync notion calendar to apple calendar,How to Integrate Notion with Lend Le Lend,integration,11,high,False,how to connect notion calendar to apple calendar | how to sync notion calendar with apple calendar | notion calendar apple calendar integration | connect notion calendar to apple calendar | can i connect notion calendar to apple calendar | how to sync notion calendar to apple calendar | integrate notion calendar with apple calendar | notion calendar integration apple calendar | notion calendar integration with apple calendar | notion calendar connect to apple calendar
How to change Notion font,How to change Notion font,howto,10,high,True,how to change font in notion | how to change font on notion | how to change notion font | how to change the font in notion | how to change font notion | how to change fonts in notion | how to change fonts on notion | how to change the font on notion | how to change fonts notion | how to change notion fonts
How to add an emoji in Notion,How to add an emoji in Notion,howto,10,high,True,how to add emojis in notion | how to add emoji in notion | how to add an emoji in notion | how to add emoji to notion | how to add emoji on notion | how to add emoji notion | how to add emojis on notion | how to add emojis to notion | how to add emojis notion | how to add an emoji on notion
How to make a Notion page template,How to make a Notion page template,howto,10,high,False,how to make a page a template in notion | how to make a notion page a template | how to make a page template in notion | how to make your notion page a template | how to make page template in notion | how to make a page a template notion | how to make a notion page template | how to make a page in notion a template | how to make page a template notion | how to make notion page a template
How to remove a comment on Notion,How to remove a comment on Notion,howto,10,high,False,how to remove comments in notion | how to remove comment in notion | how to remove comment from notion | how to remove comments on notion | how to remove a comment on notion | how to remove comment on notion | how to remove comments from notion | how to remove comments notion | how to remove a comment in notion | how to remove comment notion
notion email integration,How to Integrate Notion with Em Il,integration,10,high,False,notion email integration | email notion integration | notion email integration features | notion email integration 2025 | notion ai email integration | email to notion integration | connect email to notion | integrate email with notion | notion email integration setup | notion email integration tools
how to integrate notion with miro,How to Integrate Notion with Miro,integration,10,high,True,miro notion integration | notion miro integration | notion miro integration guide | how to integrate notion with miro | miro integration notion | connect notion to miro | miro notion integration features | miro and notion integration | miro notion integration embed | integrate miro with notion
clickup notion integration,How to Integrate Notion with Clickup,integration,10,high,False,clickup notion integration | notion clickup integration | notion and clickup integration | clickup and notion integration | notion integration clickup | notion integration with clickup | integrate clickup with notion | clickup integration notion | clickup integration with notion | connect clickup to notion
tally notion integration,How to Integrate Notion with Lly,integration,10,high,False,tally notion integration | tally form notion integration | tally integration notion | tally notion integration free | tally notion integration guide | tally notion integration official | tally to notion integration | notion tally integration | tally notion integration 2025 | tally notion integration how to
notion obsidian integration,How to Integrate Notion with Obsidi,integration,10,high,False,notion obsidian integration | obsidian notion integration | obsidian notion integration plugin | obsidian and notion integration | notion and obsidian integration | obsidian integration with notion | notion to obsidian integration | integrate obsidian with notion | connect notion to obsidian | obsidian to notion integration
