keyword,reason
how to windsurf,filtered
how to use windsurf,filtered
how to use windsurf ai,filtered
how to use windsurf in vscode,filtered
how to use windsurf ide,filtered
how to use windsurf in intellij,filtered
how to use windsurf effectively,filtered
windsurf how to,filtered
windsurf how to use,filtered
how to use windsurf in visual studio,filtered
windsurf how to use mcp,filtered
how to learn to windsurf,filtered
how to use windsurf for free,filtered
how to use windsurf in vs code,filtered
how to use windsurf ai in vscode,filtered
windsurf how to open chat,filtered
how to use windsurf editor,filtered
how to use windsurf ai for free,filtered
how to use windsurf cascade,filtered
windsurf how to open cascade,filtered
how to use windsurf browser,filtered
how to use windsurf rules,filtered
