canonical_keyword,suggested_title,category,variant_count,signal_strength,already_covered,all_variants
How to Integrate Intercom with Delighted,How to Integrate Notion with Intercom,integration,6,high,False,"Integrate Intercom with ActiveCampaign | </div></div><p id="""""""">‍</p><p id="""""""">It is very easy to integrate Intercom with ActiveCampaign via Zapier. Here’s a quick tutorial on how to do it:</p><p>‍</p><ol id=""""""""><li>Head over to the left-side panel and click 'Create'.</li><li>Select 'Zaps' from the list of options.</li><li>After that | How to Integrate Intercom with Delighted | </div></div><p>‍</p><p>‍</p><p>It is very easy to integrate Intercom with Delighted. Here’s a quick tutorial on how to do it:</p><p>‍</p><ol id=""""""""><li>Go to the top menu bar | How to Integrate Customer.io with Intercom | </div></div><p>‍</p><p>‍</p><p>Integrating Intercom as a destination allows you to sync your Customer.io data (like user attributes and events) directly into Intercom so your support team has the latest context.</p><p>‍</p><ol><li>On your <strong>Customer.io main dashboard</strong>"
How to Integrate Microsoft To Do With Copilot,How to Integrate Notion with Copilot,integration,6,high,False,How to Integrate Microsoft Copilot with Planner | </div></div><p>‍</p><p>‍</p><p>You can integrate Microsoft Copilot with Microsoft Planner | How to Integrate Microsoft To Do With Copilot | How to Integrate GitHub Copilot with Model Context Protocol | How to Integrate GitHub Copilot with Custom Model | </div></div><p>‍</p><p>‍</p><p>Here’s how to integrate GitHub Copilot with Custom Model:&nbsp;</p><p>‍</p><ol><li>In your IDE
How to Integrate Customer.io with Zapier,How to Integrate Notion with Zapier,integration,5,high,False,"</div></div><p>‍</p><p>‍</p><p>Using Zapier to connect Microsoft To Do and Excel is a reliable way to automate your task logs or create tasks from spreadsheet rows.</p><p>‍</p><ol><li>Go to <strong>zapier.com</strong> and <strong>sign in</strong> (or <strong>sign up</strong> for free).</li><li>Click <strong>Create</strong> &gt; <strong>Zaps</strong> in the left panel to start a new <strong>Zap</strong>.</li><li>Click <strong>Trigger</strong> to define what kicks off this workflow.</li><li>Search for and select <strong>Microsoft To Do</strong> as your trigger application.</li><li>Click <strong>Sign in</strong> to connect your Microsoft To Do account.</li><li>Under <strong>Trigger event</strong> | How to Integrate Microsoft To Do With Zapier | </div></div><p>‍</p><p>‍</p><p>Zapier is the gold standard for connecting Microsoft To Do to thousands of other apps. This integration allows you to either """"Trigger"""" an action when something happens in To Do or create a """"Task"""" based on activity in another app.</p><p>‍</p><ol><li>Go to <strong>zapier.com</strong> and <strong>sign in</strong> (or <strong>sign up</strong> for free).</li><li>Click <strong>Create</strong> &gt; <strong>Zaps</strong> in the left panel to start a new <strong>Zap</strong>.</li><li>Click <strong>Trigger</strong> to define what kicks off this workflow.</li><li>Search for and select <strong>Microsoft To Do</strong> as your trigger application.</li><li>Click <strong>Sign in</strong> to connect your Microsoft To Do account.</li><li>Choose your <strong>Trigger Event</strong> from the dropdown menu | How to Integrate Customer.io with Zapier | </div></div><p>‍</p><p>‍</p><p>Integrating with Zapier allows you to connect Customer.io to over 6"
How to Integrate Gusto with Xero,How to Integrate Notion with Gusto,integration,5,high,False,"How to Integrate Gusto with Xero | How to Integrate Gusto with 7shifts | </div></div><p>‍</p><p>‍</p><p>Connecting Gusto with 7shifts allows employee work hours and overtime from 7shifts to automatically sync with Gusto payroll | How to Integrate Gusto with Deputy | </div></div><p>‍</p><p>‍</p><p>Integrating Gusto with Deputy allows approved timesheets and employee data to sync between the two platforms for easier payroll processing.</p><p>‍</p><ol><li>Sign in to your <strong>Deputy admin account</strong>.</li><li>Click your <strong>name initials</strong> at the top right corner of the dashboard.</li><li>Select <strong>""""Integrations""""</strong> from the dropdown menu.</li><li>Scroll down and locate <strong>""""Gusto""""</strong> under the Payroll integrations section.</li><li>Click <strong>""""Connect add-on""""</strong> next to Gusto to begin the setup.</li><li>Click <strong>""""Login to Gusto""""</strong>"
How to Connect Figma to Cursor,How to Integrate Notion with Cursor,integration,5,high,False,"</div></div><p>‍</p><p>‍</p><p>Model Context Protocol (MCP) servers allow Cursor to connect to external tools like Google Search | How to Connect OpenRouter to Cursor | </div></div><p>‍</p><p>‍</p><p>Cursor has fully integrated the GPT-5 series | How to Connect Figma to Cursor | </div></div><p>‍</p><p>‍</p><p>The official way to connect Figma to Cursor is via the Figma MCP Server. This allows the AI to """"read"""" your design frames"
How to Integrate Intercom with Amplitude,How to Integrate Notion with Amplitude,integration,4,medium,False,"How to Integrate Intercom with Amplitude | </div></div><p>‍</p><p>‍</p><p id="""""""">It is very easy to integrate Intercom with Amplitude. Here’s a quick tutorial on how to do it:</p><p>‍</p><ol id=""""""""><li>On Amplitude's main dashboard | How to Integrate Customer.io with Amplitude | </div></div><p>‍</p><p>‍</p><p>You can integrate these platforms in two ways: sending Customer.io metrics to Amplitude for analysis"
How to Integrate Apollo io With Airtable,How to Integrate Notion with Airtable,integration,3,medium,False,"</div></div><p>‍</p><p id="""""""">Here’s a step-by-step tutorial to merge records with attachments in Airtable:&nbsp;</p><ol id=""""""""><li>Go to MiniExtensions &gt;<a id="""""""" href=""""https://miniextensions.com/merge-multiple-airtable-attachment-fields/""""> Merge Multiple Airtable Attachment Fields.</a></li><li>Create an account and <strong id="""""""">Sign in.</strong></li><li>Connect your Airtable Base.</li><li>Click on <strong id="""""""">Create an extension.</strong></li><li>Search for """"merge"""" in the search bar.</li><li>Find the extension <strong id="""""""">Merge Airtable Attachment Fields.</strong></li><li>Click on the <strong id="""""""">Add</strong> button to select fields that have attachments.</li><li>Example: You have <strong id="""""""">Attachments 1 </strong>and <strong id="""""""">Attachment 2</strong> fields. You want both in a 3rd <strong id="""""""">""""Merged""""</strong> column.</li><li>Mention the <strong id="""""""">Attachment Fields </strong>.(Eg. Attachment 1 and Attachment 2)</li><li>Finally | How to Integrate Apollo io With Airtable | </div></div><p>‍</p><p>‍</p><p>To integrate Apollo.io with Airtable"
How to Integrate Microsoft To Do With Outlook,How to Integrate Notion with Outlook,integration,3,medium,False,"</div></div><p>‍</p><p>‍</p><p>Here's how to do it:</p><p>‍</p><ol><li>Open Outlook and click """"Add Account"""" in the left pane.</li><li>Open your Zoho Mail in a browser.</li><li>Open """"Mail accounts"""" dashboard on the left side panel.</li><li>Select """"IMAP.""""</li><li>Enable IMAP to sync your emails across desktop | How to Integrate Microsoft To Do With Outlook | </div></div><p>‍</p><p>‍</p><p>Using Zapier to connect Microsoft To Do and Outlook is ideal if you want to create custom workflows"
"</div></div><p id="""""""">‍</p><p id="""""""">‍</p><p id="""""""">Here’s a step-by-step guide to integrating HubSpot with PandaDoc:</p><p id="""""""">‍</p><ol id="""""""" start=""""1""""><li id="""""""">Log in to your PandaDoc account and go to 'Settings'.</li><li id="""""""">Select 'Integrations'.</li><li id="""""""">Find 'HubSpot' in the list of available integrations and click on it.</li><li id="""""""">Click 'Connect'.</li><li id="""""""">Choose an account you want to continue. Grant the necessary permissions to allow PandaDoc to access your HubSpot data.</li><li id="""""""">Once logged in",How to Integrate Notion with Pandadoc,integration,2,low,False,"Integrate HubSpot with PandaDoc | </div></div><p id="""""""">‍</p><p id="""""""">‍</p><p id="""""""">Here’s a step-by-step guide to integrating HubSpot with PandaDoc:</p><p id="""""""">‍</p><ol id="""""""" start=""""1""""><li id="""""""">Log in to your PandaDoc account and go to 'Settings'.</li><li id="""""""">Select 'Integrations'.</li><li id="""""""">Find 'HubSpot' in the list of available integrations and click on it.</li><li id="""""""">Click 'Connect'.</li><li id="""""""">Choose an account you want to continue. Grant the necessary permissions to allow PandaDoc to access your HubSpot data.</li><li id="""""""">Once logged in"
How to Connect Microsoft Planner to Excel,How to Integrate Notion with Excel,integration,2,low,False,"How to Connect Microsoft Planner to Excel | </div></div><p>‍</p><p>‍</p><p>Here’s a step by step guide to integrate Microsoft Planner with Excel:</p><p>‍</p><ol start=""""1""""><li>Open your Planner plan and click on """"My Plans"""".</li><li>Select a plan you want to connect to excel.</li><li>Click on the arrow beside the title to see more options.</li><li>Select """"Export plan to Excel"""".</li><li>That's it! You can now connect the file and open it in Excel.</li></ol>"""
How to Integrate Microsoft To Do with Planner,How to Integrate Notion with Microsoft Do Pl Ner,integration,2,low,False,How to Integrate Microsoft To Do with Planner | Integrate Microsoft To Do With Planner
How to Integrate Microsoft To Do With ClickUp via Zapier,How to Integrate Notion with Clickup,integration,2,low,False,How to Integrate Microsoft To Do With ClickUp via Zapier | </div></div><p>‍</p><p>‍</p><p>Connecting ClickUp to Microsoft To Do via Zapier ensures that your team project tasks automatically show up in your personal task list.</p><p>‍</p><ol><li>Go to <strong>zapier.com</strong> and <strong>sign in</strong> (or <strong>sign up</strong> for free).</li><li>Click <strong>Create</strong> &gt; <strong>Zaps</strong> in the left panel to start a new <strong>Zap</strong>.</li><li>Click <strong>Trigger</strong> to define what kicks off this workflow.</li><li>Search for and select <strong>Microsoft To Do</strong> as your trigger application.</li><li>Click <strong>Sign in</strong> to connect your Microsoft To Do account.</li><li>Under <strong>Trigger event</strong>
How to Integrate Microsoft To Do With Slack,How to Integrate Notion with Slack,integration,2,low,False,How to Integrate Microsoft To Do With Slack | </div></div><p>‍</p><p>‍</p><p>Setting up Slack messages allows you to send internal alerts to your team or direct messages to your customers. You must first connect your Slack workspace to Customer.io to enable this feature.</p><p>‍</p><ol><li>On your <strong>Customer.io main dashboard</strong>
How to Integrate Microsoft To Do With Todoist,How to Integrate Notion with Todoist,integration,2,low,False,How to Integrate Microsoft To Do With Todoist | </div></div><p>‍</p><p>‍</p><p>Integrating Microsoft To Do with Todoist via Zapier is a great way to keep your tasks synced across both platforms automatically.</p><p>‍</p><ol><li>Go to <strong>zapier.com</strong> and <strong>sign in</strong> (or <strong>sign up</strong> for free).</li><li>Click <strong>Create</strong> &gt; <strong>Zaps</strong> in the left panel to start a new <strong>Zap</strong>.</li><li>Click <strong>Trigger</strong> to define what kicks off this workflow.</li><li>Search for and select <strong>Microsoft To Do</strong> as your trigger application.</li><li>Click <strong>Sign in</strong> to connect your Microsoft To Do account.</li><li>Under <strong>Trigger event</strong>
How to Integrate Customer.io with Zendesk,How to Integrate Notion with Zendesk,integration,2,low,False,How to Integrate Customer.io with Zendesk | </div></div><p>‍</p><p>‍</p><p>Connecting Zendesk with Customer.io allows you to sync customer support data
How to Integrate Customer.io with Typeform,How to Integrate Notion with Typeform,integration,2,low,False,How to Integrate Customer.io with Typeform | </div></div><p>‍</p><p>‍</p><p>The direct Typeform integration allows you to capture form submissions as events in Customer.io
How to Integrate Gusto with QuickBooks Online,How to Integrate Notion with Quickbooks,integration,2,low,False,How to Integrate Gusto with QuickBooks Online | </div></div><p>‍</p><p>‍</p><p>Connecting Gusto with QuickBooks Online allows payroll data to sync with your accounting records automatically.</p><p>‍</p><ol><li><strong>Sign in</strong> to your Gusto admin account.</li><li>On your main dashboard
How to Connect Supabase to Cursor,How to Integrate Notion with Supabase,integration,2,low,False,"How to Connect Supabase to Cursor | </div></div><p>‍</p><p>‍</p><p>The most powerful way to connect Supabase to Cursor is through the Model Context Protocol (MCP). This allows the Cursor AI to directly """"see"""" your database schema"
How to Create a Jira Scrum Project,How to Create a Jira Scrum Project,howto,1,low,False,How to Create a Jira Scrum Project
How to Create a Spike in Jira,How to Create a Spike in Jira,howto,1,low,False,How to Create a Spike in Jira
How to Create Velocity Chart in Jira,How to Create Velocity Chart in Jira,howto,1,low,False,How to Create Velocity Chart in Jira
How to Create Conditional Formatting in Coda,How to Create Conditional Formatting in Coda,howto,1,low,False,How to Create Conditional Formatting in Coda
How to Create Custom Formulas in Coda,How to Create Custom Formulas in Coda,howto,1,low,False,How to Create Custom Formulas in Coda
How to Mass Message on Linked Sales Navigator,How to Mass Message on Linked Sales Navigator,howto,1,low,False,How to Mass Message on Linked Sales Navigator
How to Move a File from Google Drive to Dropbox,How to Move a File from Google Drive to Dropbox,howto,1,low,False,How to Move a File from Google Drive to Dropbox
How to Optimize Images For WordPress,How to Optimize Images For WordPress,howto,1,low,False,How to Optimize Images For WordPress
How to Record and Transcribe Meetings With Tactiq,How to Record and Transcribe Meetings With Tactiq,howto,1,low,False,How to Record and Transcribe Meetings With Tactiq
How to Remove Default Header ActiveCampaign,How to Remove Default Header ActiveCampaign,howto,1,low,False,How to Remove Default Header ActiveCampaign
How to Transfer the Ownership of Figma Files to Another Account,How to Transfer the Ownership of Figma Files to Another Account,howto,1,low,False,How to Transfer the Ownership of Figma Files to Another Account
How to Use Dashboard Templates in Amplitude,How to Use Dashboard Templates in Amplitude,howto,1,low,False,How to Use Dashboard Templates in Amplitude
How to Get Microsoft Copilot for Free,How to Get Microsoft Copilot for Free,howto,1,low,False,How to Get Microsoft Copilot for Free
How to Set up Microsoft Copilot,How to Set up Microsoft Copilot,howto,1,low,False,How to Set up Microsoft Copilot
How to Modify the Lovable Design,How to Modify the Lovable Design,howto,1,low,False,How to Modify the Lovable Design
How to Use Microsoft Copilot,How to Use Microsoft Copilot,howto,1,low,False,How to Use Microsoft Copilot
How to Fix Bugs in Lovable,How to Fix Bugs in Lovable,howto,1,low,False,How to Fix Bugs in Lovable
How to Debug a Lovable App,How to Debug a Lovable App,howto,1,low,False,How to Debug a Lovable App
How to Add New Features to the Lovable App,How to Add New Features to the Lovable App,howto,1,low,False,How to Add New Features to the Lovable App
How to Add Email Authentication to Lovable Projects,How to Add Email Authentication to Lovable Projects,howto,1,low,False,How to Add Email Authentication to Lovable Projects
How to Add a Database to Lovable Projects,How to Add a Database to Lovable Projects,howto,1,low,False,How to Add a Database to Lovable Projects
How to Set Up a Backend in Lovable,How to Set Up a Backend in Lovable,howto,1,low,False,How to Set Up a Backend in Lovable
How to Enable Microsoft Copilot in Word,How to Enable Microsoft Copilot in Word,howto,1,low,False,How to Enable Microsoft Copilot in Word
How to Enable Microsoft Copilot in Excel,How to Enable Microsoft Copilot in Excel,howto,1,low,False,How to Enable Microsoft Copilot in Excel
How to Build a Blog with Softr Using a Prompt,How to Build a Blog with Softr Using a Prompt,howto,1,low,False,How to Build a Blog with Softr Using a Prompt
How to Create a Client Portal with Softr using a prompt,How to Create a Client Portal with Softr using a prompt,howto,1,low,False,How to Create a Client Portal with Softr using a prompt
How to Open 2 Microsoft Project Windows,How to Open 2 Microsoft Project Windows,howto,1,low,False,How to Open 2 Microsoft Project Windows
How to Adjust Bullets in Adobe InDesign,How to Adjust Bullets in Adobe InDesign,howto,1,low,False,How to Adjust Bullets in Adobe InDesign
How to Change Color Settings in Adobe InDesign,How to Change Color Settings in Adobe InDesign,howto,1,low,False,How to Change Color Settings in Adobe InDesign
How to Use Master Page in Adobe InDesign,How to Use Master Page in Adobe InDesign,howto,1,low,False,How to Use Master Page in Adobe InDesign
How to Disable Gemini in Google Docs,How to Disable Gemini in Google Docs,howto,1,low,False,How to Disable Gemini in Google Docs
How to Measure in Adobe InDesign,How to Measure in Adobe InDesign,howto,1,low,False,How to Measure in Adobe InDesign
How to Move an Image Without Cropping in Adobe InDesign,How to Move an Image Without Cropping in Adobe InDesign,howto,1,low,False,How to Move an Image Without Cropping in Adobe InDesign
How to Multiply in Adobe InDesign,How to Multiply in Adobe InDesign,howto,1,low,False,How to Multiply in Adobe InDesign
How to Number Pages in Adobe InDesign,How to Number Pages in Adobe InDesign,howto,1,low,False,How to Number Pages in Adobe InDesign
How to Open an AI File in Adobe InDesign,How to Open an AI File in Adobe InDesign,howto,1,low,False,How to Open an AI File in Adobe InDesign
How to Open IDML File in Adobe InDesign,How to Open IDML File in Adobe InDesign,howto,1,low,False,How to Open IDML File in Adobe InDesign
How to Open Illustrator File in Adobe InDesign,How to Open Illustrator File in Adobe InDesign,howto,1,low,False,How to Open Illustrator File in Adobe InDesign
How to Open Photoshop File in Adobe InDesign,How to Open Photoshop File in Adobe InDesign,howto,1,low,False,How to Open Photoshop File in Adobe InDesign
How to Override Master Page in Adobe InDesign,How to Override Master Page in Adobe InDesign,howto,1,low,False,How to Override Master Page in Adobe InDesign
How to Package File in Adobe InDesign,How to Package File in Adobe InDesign,howto,1,low,False,How to Package File in Adobe InDesign
How to Package File for Print in Adobe InDesign,How to Package File for Print in Adobe InDesign,howto,1,low,False,How to Package File for Print in Adobe InDesign
How to Package File with Fonts in Adobe InDesign,How to Package File with Fonts in Adobe InDesign,howto,1,low,False,How to Package File with Fonts in Adobe InDesign
How to Package File with Links in Adobe InDesign,How to Package File with Links in Adobe InDesign,howto,1,low,False,How to Package File with Links in Adobe InDesign
How to Preflight in Adobe InDesign,How to Preflight in Adobe InDesign,howto,1,low,False,How to Preflight in Adobe InDesign
How to Prepare File for Print in Adobe InDesign,How to Prepare File for Print in Adobe InDesign,howto,1,low,False,How to Prepare File for Print in Adobe InDesign
How to Present in Adobe InDesign,How to Present in Adobe InDesign,howto,1,low,False,How to Present in Adobe InDesign
How to Preview in Adobe InDesign,How to Preview in Adobe InDesign,howto,1,low,False,How to Preview in Adobe InDesign
How to Print Preview in Adobe InDesign,How to Print Preview in Adobe InDesign,howto,1,low,False,How to Print Preview in Adobe InDesign
How to Rasterize in Adobe InDesign,How to Rasterize in Adobe InDesign,howto,1,low,False,How to Rasterize in Adobe InDesign
How to Rasterize Text in Adobe InDesign,How to Rasterize Text in Adobe InDesign,howto,1,low,False,How to Rasterize Text in Adobe InDesign
How to Reduce Ink Coverage in Adobe InDesign,How to Reduce Ink Coverage in Adobe InDesign,howto,1,low,False,How to Reduce Ink Coverage in Adobe InDesign
How to Relink Files in Adobe InDesign,How to Relink Files in Adobe InDesign,howto,1,low,False,How to Relink Files in Adobe InDesign
How to Replace an Image in Adobe InDesign,How to Replace an Image in Adobe InDesign,howto,1,low,False,How to Replace an Image in Adobe InDesign
How to Save File to Creative Cloud in Adobe InDesign,How to Save File to Creative Cloud in Adobe InDesign,howto,1,low,False,How to Save File to Creative Cloud in Adobe InDesign
How to Save File with All Links in Adobe InDesign,How to Save File with All Links in Adobe InDesign,howto,1,low,False,How to Save File with All Links in Adobe InDesign
How to Select All Pages in Adobe InDesign,How to Select All Pages in Adobe InDesign,howto,1,low,False,How to Select All Pages in Adobe InDesign
How to Select all Text in Adobe InDesign,How to Select all Text in Adobe InDesign,howto,1,low,False,How to Select all Text in Adobe InDesign
How to Send a File in Adobe InDesign,How to Send a File in Adobe InDesign,howto,1,low,False,How to Send a File in Adobe InDesign
How to Share a File for Editing in Adobe InDesign,How to Share a File for Editing in Adobe InDesign,howto,1,low,False,How to Share a File for Editing in Adobe InDesign
How to Separate Pages in Adobe InDesign,How to Separate Pages in Adobe InDesign,howto,1,low,False,How to Separate Pages in Adobe InDesign
How to Set Baseline Grid in Adobe InDesign,How to Set Baseline Grid in Adobe InDesign,howto,1,low,False,How to Set Baseline Grid in Adobe InDesign
How to Set Bleed in Adobe InDesign,How to Set Bleed in Adobe InDesign,howto,1,low,False,How to Set Bleed in Adobe InDesign
How to Set Crop Marks in Adobe InDesign,How to Set Crop Marks in Adobe InDesign,howto,1,low,False,How to Set Crop Marks in Adobe InDesign
How to Set Margins in Adobe InDesign,How to Set Margins in Adobe InDesign,howto,1,low,False,How to Set Margins in Adobe InDesign
How to Set Tabs in Adobe InDesign,How to Set Tabs in Adobe InDesign,howto,1,low,False,How to Set Tabs in Adobe InDesign
How to Turn Off baseline grid in Adobe InDesign,How to Turn Off baseline grid in Adobe InDesign,howto,1,low,False,How to Turn Off baseline grid in Adobe InDesign
How to Start Page Numbers on Page 2 in Adobe InDesign,How to Start Page Numbers on Page 2 in Adobe InDesign,howto,1,low,False,How to Start Page Numbers on Page 2 in Adobe InDesign
How to Swap Pages in Adobe InDesign,How to Swap Pages in Adobe InDesign,howto,1,low,False,How to Swap Pages in Adobe InDesign
How to Text Wrap in Adobe InDesign,How to Text Wrap in Adobe InDesign,howto,1,low,False,How to Text Wrap in Adobe InDesign
How to Wrap Text Around an Image in Adobe InDesign,How to Wrap Text Around an Image in Adobe InDesign,howto,1,low,False,How to Wrap Text Around an Image in Adobe InDesign
How to Thread Text Boxes in Adobe InDesign,How to Thread Text Boxes in Adobe InDesign,howto,1,low,False,How to Thread Text Boxes in Adobe InDesign
How to Turn Off Text Wrap in Adobe InDesign,How to Turn Off Text Wrap in Adobe InDesign,howto,1,low,False,How to Turn Off Text Wrap in Adobe InDesign
How to Undo in Adobe InDesign,How to Undo in Adobe InDesign,howto,1,low,False,How to Undo in Adobe InDesign
How to Unhyphenate Text in Adobe InDesign,How to Unhyphenate Text in Adobe InDesign,howto,1,low,False,How to Unhyphenate Text in Adobe InDesign
How to Unlink Text Boxes in Adobe InDesign,How to Unlink Text Boxes in Adobe InDesign,howto,1,low,False,How to Unlink Text Boxes in Adobe InDesign
How to Use Eyedropper in Adobe InDesign,How to Use Eyedropper in Adobe InDesign,howto,1,low,False,How to Use Eyedropper in Adobe InDesign
How to Use Data Merge in Adobe InDesign,How to Use Data Merge in Adobe InDesign,howto,1,low,False,How to Use Data Merge in Adobe InDesign
How to Use Pantone Colors in Adobe InDesign,How to Use Pantone Colors in Adobe InDesign,howto,1,low,False,How to Use Pantone Colors in Adobe InDesign
How to Add Signature in Zoho Mail,How to Add Signature in Zoho Mail,howto,1,low,False,How to Add Signature in Zoho Mail
How To Add Zoho Mail To Iphone,How To Add Zoho Mail To Iphone,howto,1,low,False,How To Add Zoho Mail To Iphone
How To Add Zoho Mail To Apple Mail,How To Add Zoho Mail To Apple Mail,howto,1,low,False,How To Add Zoho Mail To Apple Mail
How To Add Zoho Mail To Gmail,How To Add Zoho Mail To Gmail,howto,1,low,False,How To Add Zoho Mail To Gmail
How To Set Up Zoho Mail,How To Set Up Zoho Mail,howto,1,low,False,How To Set Up Zoho Mail
How To Enable IMAP In Zoho Mail,How To Enable IMAP In Zoho Mail,howto,1,low,False,How To Enable IMAP In Zoho Mail
How To Forward Zoho Mail To Gmail,How To Forward Zoho Mail To Gmail,howto,1,low,False,How To Forward Zoho Mail To Gmail
How To Set Out Of Office In Zoho Mail,How To Set Out Of Office In Zoho Mail,howto,1,low,False,How To Set Out Of Office In Zoho Mail
How To Unsend An Email In Zoho,How To Unsend An Email In Zoho,howto,1,low,False,How To Unsend An Email In Zoho
How To Use Zoho Mail,How To Use Zoho Mail,howto,1,low,False,How To Use Zoho Mail
How To Use Zoho Mail In Gmail,How To Use Zoho Mail In Gmail,howto,1,low,False,How To Use Zoho Mail In Gmail
How To Create Zoho Account,How To Create Zoho Account,howto,1,low,False,How To Create Zoho Account
How To Delete Zoho Account,How To Delete Zoho Account,howto,1,low,False,How To Delete Zoho Account
