canonical_keyword,suggested_title,category,variant_count,signal_strength,source,frequency_count,all_variants
how to edit a pdf adobe acrobat,How to edit a pdf Adobe Acrobat,howto,19,high,volume_10+,,how to edit pdf in adobe acrobat | how to edit a pdf in adobe acrobat | adobe acrobat edit pdf tutorial | how to edit adobe acrobat pdf | how to use adobe acrobat to edit pdf | how to edit a pdf using adobe acrobat | how to edit a pdf without adobe acrobat | adobe acrobat how to edit pdf | how to edit a pdf on adobe acrobat | how to edit pdf adobe acrobat | how to edit a pdf adobe acrobat | how to turn adobe acrobat into pdf | adobe acrobat edit pdf how to | how to edit pdf using adobe acrobat | how to edit pdfs in adobe acrobat
how to copy a page in adobe acrobat,How to copy a page in Adobe Acrobat,howto,13,high,volume_10+,,how to duplicate a page in adobe acrobat | how to duplicate page in adobe acrobat | how to duplicate pages in adobe acrobat | how to copy a page in adobe acrobat | how to duplicate a page on adobe acrobat | adobe acrobat how to duplicate a page | how to copy pages in adobe acrobat | how to copy page in adobe acrobat | how to duplicate page on adobe acrobat | how to duplicate page adobe acrobat | how to duplicate pages on adobe acrobat | how to copy a page on adobe acrobat | how to duplicate a page adobe acrobat
how to add a font to adobe acrobat,How to add a font to Adobe Acrobat,howto,13,high,volume_10+,,how to add fonts to adobe acrobat | how to add a font to adobe acrobat | how to add font to adobe acrobat | how to embed fonts in adobe acrobat | how to add a font in adobe acrobat | how to add fonts in adobe acrobat | how to add font in adobe acrobat | how to add new fonts to adobe acrobat | how to add a new font to adobe acrobat | how to embed a font in adobe acrobat | how to add more fonts to adobe acrobat | how to embed font in adobe acrobat | how to add new font to adobe acrobat
how to sign adobe acrobat,How to sign Adobe Acrobat,howto,12,high,volume_10+,,how to sign in adobe acrobat | how to sign into adobe acrobat | how to sign on adobe acrobat | how to use adobe acrobat sign | adobe acrobat sign tutorial | how to sign in to adobe acrobat | how to sign out of adobe acrobat | how to sign with adobe acrobat | how to sign using adobe acrobat | how to sign adobe acrobat | adobe acrobat sign how to use | how to sign in on adobe acrobat
how to change a page size in adobe acrobat,How to change a page size in Adobe Acrobat,howto,12,high,volume_10+,,how to change page size in adobe acrobat | how to adjust page size in adobe acrobat | how to change the page size in adobe acrobat | how to change page size adobe acrobat | how to edit page size in adobe acrobat | how to change page size on adobe acrobat | how to change the size of a page in adobe acrobat | how to change a page size in adobe acrobat | adobe acrobat how to change page size | how to change size of page in adobe acrobat | how to change page size in adobe acrobat pro | how to change pdf page size in adobe acrobat
how to make a pdf fillable adobe acrobat,How to make a pdf fillable Adobe Acrobat,howto,12,high,volume_10+,,how to make a pdf fillable in adobe acrobat | how to create a fillable pdf in adobe acrobat | how to make a fillable pdf in adobe acrobat | how to make a pdf fillable adobe acrobat | adobe acrobat how to make a pdf fillable | how to make pdf fillable in adobe acrobat | how to make pdf fillable adobe acrobat | how to create fillable pdf in adobe acrobat | how to make a pdf fillable in adobe acrobat pro | how to create a fillable pdf in adobe acrobat pro | how to make a fillable pdf in adobe acrobat pro | how to make pdf fillable in adobe acrobat pro
how to delete a page in adobe acrobat,How to delete a page in Adobe Acrobat,howto,11,high,volume_10+,,how to delete pages in adobe acrobat | adobe acrobat how to delete a page | how to delete a page in adobe acrobat | how to delete pages on adobe acrobat | how to delete a page on adobe acrobat | how to delete page in adobe acrobat | how to remove pages in adobe acrobat | how to remove a page in adobe acrobat | how to delete pages adobe acrobat | how to delete page on adobe acrobat | how to delete multiple pages in adobe acrobat
how to add a signature in adobe acrobat,How to add a signature in Adobe Acrobat,howto,11,high,volume_10+,,how to add signature in adobe acrobat | how to add a signature in adobe acrobat | how to add signature to adobe acrobat | how to add a signature to adobe acrobat | how to add signature adobe acrobat | how to add signature on adobe acrobat | adobe acrobat how to add signature | how to add new signature in adobe acrobat | how to add a new signature in adobe acrobat | how to add a signature on adobe acrobat | how to add signatures to adobe acrobat
how to merge pdf files adobe acrobat,How to merge pdf files Adobe Acrobat,howto,11,high,volume_10+,,how to combine pdf files in adobe acrobat | how to combine pdf files adobe acrobat | how to merge pdf files in adobe acrobat | how to combine pdf files without adobe acrobat | how to combine pdf files using adobe acrobat | how to merge pdf files using adobe acrobat | how to combine two pdf files without adobe acrobat | how to combine two pdf files in adobe acrobat | how to merge pdf files adobe acrobat | how to combine pdf files on adobe acrobat | how to combine pdf files in adobe acrobat pro
how to save a pdf in adobe acrobat,How to save a pdf in Adobe Acrobat,howto,10,high,volume_10+,,how to download pdf from adobe acrobat | how to download a pdf from adobe acrobat | how to save a pdf in adobe acrobat | how to save a pdf on adobe acrobat | how to save pdf in adobe acrobat | how to save pdf from adobe acrobat | how to save pdf on adobe acrobat | how to download an adobe acrobat pdf | how to save a pdf from adobe acrobat | how to download pdf on adobe acrobat
how to compress a pdf adobe acrobat,How to compress a pdf Adobe Acrobat,howto,9,high,volume_10+,,how to compress a pdf in adobe acrobat | how to compress pdf in adobe acrobat | how to compress a pdf on adobe acrobat | how to compress pdf with adobe acrobat | how to compress a pdf with adobe acrobat | how to compress pdf adobe acrobat | how to compress a pdf adobe acrobat | how to compress a pdf using adobe acrobat | how to compress pdf using adobe acrobat
how to edit a pdf in adobe acrobat pro,How to edit a pdf in Adobe Acrobat pro,howto,9,high,volume_10+,,how to edit a pdf in adobe acrobat pro | how to edit pdf with adobe acrobat pro | how to edit pdf in adobe acrobat pro | how to edit a pdf with adobe acrobat pro | how to edit pdf using adobe acrobat pro | how to edit a signed pdf in adobe acrobat pro | how to edit a pdf file in adobe acrobat pro | how to edit a fillable pdf in adobe acrobat pro | how to edit a pdf form in adobe acrobat pro
how to make a form fillable in adobe acrobat,How to make a form fillable in Adobe Acrobat,howto,9,high,volume_10+,,how to make a form fillable in adobe acrobat | how to create a fillable form in adobe acrobat | adobe acrobat how to create a fillable form | adobe acrobat how to make fillable forms | how to make a fillable form in adobe acrobat | how to create fillable pdf form adobe acrobat | how to create a fillable pdf form adobe acrobat | create fillable pdf form adobe acrobat tutorial | adobe acrobat create fillable pdf form tutorial
how to add a page in adobe acrobat,How to add a page in Adobe Acrobat,howto,8,high,volume_10+,,how to add a page in adobe acrobat | how to add pages in adobe acrobat | how to add page in adobe acrobat | how to add a page on adobe acrobat | how to add a page to adobe acrobat | how to add pages on adobe acrobat | how to add a new page in adobe acrobat | how to add page on adobe acrobat
how to add a shape in adobe acrobat,How to add a shape in Adobe Acrobat,howto,8,high,volume_10+,,how to add shapes in adobe acrobat | how to add a shape in adobe acrobat | how to add shape in adobe acrobat | how to insert a shape in adobe acrobat | how to insert shape in adobe acrobat | how to add shapes on adobe acrobat | how to add shapes to adobe acrobat | how to insert shapes in adobe acrobat
how to change font size adobe acrobat,How to change font size Adobe Acrobat,howto,8,high,volume_10+,,how to change font size in adobe acrobat | how to change font size on adobe acrobat | how to change font size adobe acrobat | how to adjust font size in adobe acrobat | how to change the font size in adobe acrobat | how to edit font size in adobe acrobat | how to change font size in adobe acrobat pro 9 | how to change font size in adobe acrobat pro
how to change font adobe acrobat,How to change font Adobe Acrobat,howto,7,high,volume_10+,,how to change font in adobe acrobat | how to change font on adobe acrobat | how to change the font in adobe acrobat | how to change the font on adobe acrobat | how to change font adobe acrobat | how to edit font in adobe acrobat | how to change fonts in adobe acrobat
how to combine pdfs adobe acrobat,How to combine pdfs Adobe Acrobat,howto,7,high,volume_10+,,how to combine pdfs in adobe acrobat | adobe acrobat how to combine pdfs | how to merge pdfs in adobe acrobat | how to combine pdfs adobe acrobat | how to combine pdfs on adobe acrobat | how to combine pdf in adobe acrobat | how to combine multiple pdfs into one adobe acrobat
how to add page numbers adobe acrobat,How to add page numbers Adobe Acrobat,howto,7,high,volume_10+,,how to add page numbers in adobe acrobat | how to add page number in adobe acrobat | how to add page numbers adobe acrobat | how to add page numbers on adobe acrobat | how to insert page numbers in adobe acrobat | how to insert page number in pdf adobe acrobat | how to add page numbers in adobe acrobat pro
how to edit adobe acrobat,How to edit Adobe Acrobat,howto,6,high,volume_10+,,how to update adobe acrobat | how to edit in adobe acrobat | how to edit on adobe acrobat | how to edit adobe acrobat | how to switch to old adobe acrobat | how to update my adobe acrobat
how to delete adobe acrobat on mac,How to delete Adobe Acrobat on mac,howto,6,high,volume_10+,,how to delete adobe acrobat from mac | how to uninstall adobe acrobat on mac | how to remove adobe acrobat from mac | how to delete adobe acrobat on mac | how to get rid of adobe acrobat on mac | how to uninstall adobe acrobat mac
how to delete adobe acrobat,How to delete Adobe Acrobat,howto,6,high,volume_10+,,how to uninstall adobe acrobat | how to erase in adobe acrobat | how to get rid of adobe acrobat | how to erase on adobe acrobat | how to delete adobe acrobat | how to remove adobe acrobat
how to save as adobe acrobat,How to save as Adobe Acrobat,howto,6,high,volume_10+,,how to save as in adobe acrobat | how to save as on adobe acrobat | how to extract in adobe acrobat | adobe acrobat how to save as | how to save as in new adobe acrobat | how to save as adobe acrobat
how to add a watermark in adobe acrobat,How to add a watermark in Adobe Acrobat,howto,6,high,volume_10+,,how to add watermark in adobe acrobat | how to add a watermark in adobe acrobat | how to add watermark adobe acrobat | adobe acrobat how to add watermark | how to add watermark on adobe acrobat | how to add a watermark on adobe acrobat
how to upload a font to adobe acrobat,How to upload a font to Adobe Acrobat,howto,6,high,volume_10+,,how to upload a font to adobe acrobat | how to import fonts into adobe acrobat | how to upload font to adobe acrobat | how to upload fonts to adobe acrobat | how to import font into adobe acrobat | how to import a font into adobe acrobat
how to reduce file size adobe acrobat,How to reduce file size Adobe Acrobat,howto,6,high,volume_10+,,how to reduce file size in adobe acrobat | adobe acrobat how to reduce file size | how to reduce file size adobe acrobat | how to reduce file size on adobe acrobat | how to reduce pdf file size in adobe acrobat | how to reduce pdf file size adobe acrobat
how to cancel an adobe acrobat subscription,How to cancel an Adobe Acrobat subscription,howto,5,high,volume_10+,,how to cancel adobe acrobat subscription | how to cancel my adobe acrobat subscription | how to cancel your adobe acrobat subscription | cancel adobe acrobat subscription how to | how to cancel an adobe acrobat subscription
how to save in adobe acrobat,How to save in Adobe Acrobat,howto,5,high,volume_10+,,how to download adobe acrobat | how to download from adobe acrobat | how to save in adobe acrobat | how to save on adobe acrobat | how to download on adobe acrobat
how to redact adobe acrobat,How to redact Adobe Acrobat,howto,5,high,volume_10+,,how to redact in adobe acrobat | how to redact on adobe acrobat | adobe acrobat how to redact | how to redact using adobe acrobat | how to redact adobe acrobat
how to flatten a pdf adobe acrobat,How to flatten a pdf Adobe Acrobat,howto,5,high,volume_10+,,how to flatten a pdf in adobe acrobat | how to flatten pdf in adobe acrobat | adobe acrobat how to flatten pdf | how to flatten a pdf adobe acrobat | how to flatten pdf adobe acrobat
how to edit text adobe acrobat,How to edit text Adobe Acrobat,howto,5,high,volume_10+,,how to edit text in adobe acrobat | how to edit text on adobe acrobat | adobe acrobat how to edit text | how to change text in adobe acrobat | how to edit text adobe acrobat
how to log into adobe acrobat,How to log into Adobe Acrobat,howto,5,high,volume_10+,,how to measure in adobe acrobat | how to log out of adobe acrobat | how to log into adobe acrobat | how to log in to adobe acrobat | how to measure on adobe acrobat
how to add a link in adobe acrobat,How to add a link in Adobe Acrobat,howto,5,high,volume_10+,,how to add a hyperlink in adobe acrobat | how to add a link in adobe acrobat | how to add hyperlink in adobe acrobat | how to add links in adobe acrobat | how to add link in adobe acrobat
how to sign a pdf in adobe acrobat,How to sign a pdf in Adobe Acrobat,howto,5,high,volume_10+,,how to sign a pdf in adobe acrobat | how to sign adobe acrobat pdf | adobe acrobat how to sign a pdf | how to sign a pdf without adobe acrobat | how to sign pdf in adobe acrobat
how to download a font to adobe acrobat,How to download a font to Adobe Acrobat,howto,5,high,volume_10+,,how to download a font to adobe acrobat | how to download fonts to adobe acrobat | how to download font for adobe acrobat | how to download font to adobe acrobat | how to download fonts for adobe acrobat
how to add a bookmark in adobe acrobat,How to add a bookmark in Adobe Acrobat,howto,5,high,volume_10+,,how to add bookmarks in adobe acrobat | how to add bookmark adobe acrobat | how to add a bookmark in adobe acrobat | how to add bookmarks adobe acrobat | how to add bookmark in adobe acrobat
how to cancel adobe acrobat free trial,How to cancel Adobe Acrobat free trial,howto,5,high,volume_10+,,how to cancel adobe acrobat free trial | adobe acrobat how to cancel free trial | how to cancel free trial adobe acrobat | how to cancel free trial of adobe acrobat | how to cancel adobe acrobat pro free trial
how to remove adobe acrobat reader from mac,How to remove Adobe Acrobat reader from mac,howto,5,high,volume_10+,,how to uninstall adobe acrobat reader on mac | how to remove adobe acrobat reader from mac | how to get rid of adobe acrobat reader on mac | how to delete adobe acrobat reader from mac | how to uninstall adobe acrobat reader dc on mac
how to add a font to adobe acrobat pro,How to add a font to Adobe Acrobat pro,howto,5,high,volume_10+,,how to add fonts to adobe acrobat pro | how to add font to adobe acrobat pro | how to add a font to adobe acrobat pro | how to embed fonts in adobe acrobat pro dc | how to add fonts to adobe acrobat pro dc
how to sign a pdf adobe acrobat pro,How to sign a pdf Adobe Acrobat pro,howto,5,high,volume_10+,,how to sign a pdf in adobe acrobat pro | how to sign a pdf adobe acrobat pro | how to sign a pdf with adobe acrobat pro | how to digitally sign a pdf in adobe acrobat pro | how to sign a pdf in adobe acrobat pro dc
how to crop adobe acrobat,How to crop Adobe Acrobat,howto,4,medium,volume_10+,,how to crop in adobe acrobat | how to crop on adobe acrobat | how to crop adobe acrobat | adobe acrobat how to crop
how to crop a page in adobe acrobat,How to crop a page in Adobe Acrobat,howto,4,medium,volume_10+,,how to crop page in adobe acrobat | how to crop a page in adobe acrobat | how to crop pages in adobe acrobat | adobe acrobat how to crop a page
how to save a file in adobe acrobat,How to save a file in Adobe Acrobat,howto,4,medium,volume_10+,,how to download file from adobe acrobat | how to download a file from adobe acrobat | how to save a file in adobe acrobat | how to save a file on adobe acrobat
how to draw a line in adobe acrobat,How to draw a line in Adobe Acrobat,howto,4,medium,volume_10+,,how to draw a line in adobe acrobat | how to draw lines in adobe acrobat | how to draw line in adobe acrobat | how to draw a line on adobe acrobat
how to add a line in adobe acrobat,How to add a line in Adobe Acrobat,howto,4,medium,volume_10+,,how to add a line in adobe acrobat | how to add line in adobe acrobat | how to insert a line in adobe acrobat | how to add lines in adobe acrobat
how to resize a page in adobe acrobat,How to resize a page in Adobe Acrobat,howto,4,medium,volume_10+,,how to resize a page in adobe acrobat | how to resize pages in adobe acrobat | how to resize page in adobe acrobat | adobe acrobat how to resize page
how to crop a pdf in adobe acrobat,How to crop a pdf in Adobe Acrobat,howto,4,medium,volume_10+,,how to crop a pdf in adobe acrobat | how to crop pdf in adobe acrobat | how to crop a pdf on adobe acrobat | how to crop pdfs in adobe acrobat
how to add a table in adobe acrobat,How to add a table in Adobe Acrobat,howto,4,medium,volume_10+,,how to add a table in adobe acrobat | how to insert a table in adobe acrobat | how to add table in adobe acrobat | how to insert table in adobe acrobat
how to combine files adobe acrobat,How to combine files Adobe Acrobat,howto,4,medium,volume_10+,,how to combine files in adobe acrobat | how to combine files adobe acrobat | how to combine files on adobe acrobat | how to merge files in adobe acrobat
how to move a page in adobe acrobat,How to move a page in Adobe Acrobat,howto,4,medium,volume_10+,,how to reorder pages in adobe acrobat | how to move a page in adobe acrobat | how to move pages in adobe acrobat | how to rearrange pages in adobe acrobat
how to print double sided adobe acrobat,How to print double sided Adobe Acrobat,howto,4,medium,volume_10+,,how to print double sided in adobe acrobat | how to print double sided on adobe acrobat | how to print double sided adobe acrobat | adobe acrobat how to print double sided
how to extract pages adobe acrobat,How to extract pages Adobe Acrobat,howto,4,medium,volume_10+,,how to extract pages in adobe acrobat | adobe acrobat how to extract pages | how to extract pages adobe acrobat | how to extract pages from adobe acrobat
how to add images to a pdf using adobe acrobat,How to add images to a pdf using Adobe Acrobat,howto,4,medium,volume_10+,,how to add images to pdf using adobe acrobat | how to add image to pdf adobe acrobat | how to add images to a pdf using adobe acrobat | how to add image to pdf using adobe acrobat
how to extract a page from a pdf in adobe acrobat,How to extract a page from a pdf in Adobe Acrobat,howto,4,medium,volume_10+,,how to extract pages from pdf adobe acrobat | how to extract a page from a pdf in adobe acrobat | how to extract one page from pdf in adobe acrobat | how to extract pages from pdf in adobe acrobat
how to strikethrough adobe acrobat,How to strikethrough Adobe Acrobat,howto,4,medium,volume_10+,,how to strikethrough on adobe acrobat | how to strikethrough adobe acrobat | how to do strikethrough in adobe acrobat | how to strikethrough in adobe acrobat
how to reduce the size of a pdf in adobe acrobat,How to reduce the size of a pdf in Adobe Acrobat,howto,4,medium,volume_10+,,how to reduce size of pdf in adobe acrobat | how to reduce the size of a pdf in adobe acrobat | how to reduce pdf size in adobe acrobat | how to reduce pdf size adobe acrobat
how to add a signature in adobe acrobat pro,How to add a signature in Adobe Acrobat pro,howto,4,medium,volume_10+,,how to add a signature in adobe acrobat pro | how to add signature in adobe acrobat pro | how to add signature to adobe acrobat pro | how to insert a scanned signature in adobe acrobat pro
how to add a text box in adobe acrobat,How to add a text box in Adobe Acrobat,howto,4,medium,volume_10+,,how to add text box in adobe acrobat | how to add a text box in adobe acrobat | how to add text box adobe acrobat | how to add fillable text box in adobe acrobat
how to add a watermark in adobe acrobat pro,How to add a watermark in Adobe Acrobat pro,howto,4,medium,volume_10+,,how to add watermark in adobe acrobat pro | how to add a watermark in adobe acrobat pro | how to put a watermark in adobe acrobat pro | how to add watermark in pdf adobe acrobat pro
how to convert pdf to word adobe acrobat,How to convert pdf to word Adobe Acrobat,howto,4,medium,volume_10+,,how to convert pdf to word using adobe acrobat | how to convert pdf to word adobe acrobat | how to convert pdf to word in adobe acrobat | how to convert pdf to word in adobe acrobat pro
how to make adobe acrobat default,How to make Adobe Acrobat default,howto,3,medium,volume_10+,,how to make adobe acrobat default | how to make adobe acrobat not default | how to not make adobe acrobat default
how to undo adobe acrobat,How to undo Adobe Acrobat,howto,3,medium,volume_10+,,how to undo in adobe acrobat | how to undo on adobe acrobat | how to undo adobe acrobat
how to highlight adobe acrobat,How to highlight Adobe Acrobat,howto,3,medium,volume_10+,,how to highlight in adobe acrobat | how to highlight on adobe acrobat | how to highlight adobe acrobat
how to present in adobe acrobat,How to present in Adobe Acrobat,howto,3,medium,volume_10+,,how to present in adobe acrobat | how to present on adobe acrobat | how to present from adobe acrobat
how to make a signature in adobe acrobat,How to make a signature in Adobe Acrobat,howto,3,medium,volume_10+,,how to create a signature in adobe acrobat | how to create signature in adobe acrobat | how to make a signature in adobe acrobat
how to use adobe acrobat pro,How to use Adobe Acrobat pro,howto,3,medium,volume_10+,,adobe acrobat pro tutorial | how to use adobe acrobat pro | adobe acrobat pro how to use
how to print in adobe acrobat,How to print in Adobe Acrobat,howto,3,medium,volume_10+,,how to print from adobe acrobat | how to print in adobe acrobat | how to print on adobe acrobat
how to edit a pdf file adobe acrobat,How to edit a pdf file Adobe Acrobat,howto,3,medium,volume_10+,,how to edit pdf file in adobe acrobat | how to edit a pdf file in adobe acrobat | how to edit a pdf file adobe acrobat
how to erase text in adobe acrobat,How to erase text in Adobe Acrobat,howto,3,medium,volume_10+,,how to delete text in adobe acrobat | how to erase text in adobe acrobat | how to delete text on adobe acrobat
how to sign in adobe acrobat pro,How to sign in Adobe Acrobat pro,howto,3,medium,volume_10+,,how to sign in to adobe acrobat pro | how to sign in adobe acrobat pro | how to sign into adobe acrobat pro
how to add a date in adobe acrobat,How to add a date in Adobe Acrobat,howto,3,medium,volume_10+,,how to add date in adobe acrobat | how to add a date in adobe acrobat | how to insert date in adobe acrobat
how to use adobe acrobat ocr?,How to use Adobe Acrobat ocr?,howto,3,medium,volume_10+,,how to use adobe acrobat ocr? | adobe acrobat ocr tutorial | how to use ocr in adobe acrobat
how to unsubscribe adobe acrobat,How to unsubscribe Adobe Acrobat,howto,3,medium,volume_10+,,how to unsubscribe from adobe acrobat | how to unsubscribe to adobe acrobat | how to unsubscribe adobe acrobat
how to edit signature in adobe acrobat,How to edit signature in Adobe Acrobat,howto,3,medium,volume_10+,,how to change signature in adobe acrobat | how to edit signature in adobe acrobat | how to change your signature in adobe acrobat
how to open a pdf in adobe acrobat,How to open a pdf in Adobe Acrobat,howto,3,medium,volume_10+,,how to open a pdf in adobe acrobat | how to open pdf in adobe acrobat | how to open pdf without adobe acrobat
how to edit an adobe acrobat document,How to edit an Adobe Acrobat document,howto,3,medium,volume_10+,,how to edit documents in adobe acrobat | how to edit a document in adobe acrobat | how to edit an adobe acrobat document
how to edit pdf on mac adobe acrobat,How to edit pdf on mac Adobe Acrobat,howto,3,medium,volume_10+,,adobe acrobat edit pdf on mac how to | how to edit pdf on mac adobe acrobat | adobe acrobat edit pdf mac tutorial
how to make a table of contents in adobe acrobat,How to make a table of contents in Adobe Acrobat,howto,3,medium,volume_10+,,how to create table of contents in adobe acrobat | how to make table of contents in adobe acrobat | how to make a table of contents in adobe acrobat
how to split pages in adobe acrobat,How to split pages in Adobe Acrobat,howto,3,medium,volume_10+,,how to separate pages in adobe acrobat | how to split pages in adobe acrobat | how to split pages on adobe acrobat
how to translate a pdf in adobe acrobat,How to translate a pdf in Adobe Acrobat,howto,3,medium,volume_10+,,how to translate a pdf in adobe acrobat | adobe acrobat translate pdf how to | how to translate pdf in adobe acrobat
how to install a font in adobe acrobat,How to install a font in Adobe Acrobat,howto,3,medium,volume_10+,,how to install fonts in adobe acrobat | how to install a font in adobe acrobat | how to install font in adobe acrobat
how to split a pdf in adobe acrobat,How to split a pdf in Adobe Acrobat,howto,3,medium,volume_10+,,how to split pdf in adobe acrobat | how to split a pdf in adobe acrobat | adobe acrobat how to split pdf
