canonical_keyword,suggested_title,category,variant_count,signal_strength,source,frequency_count,all_variants
how to make a copy of a pdf on adobe acrobat,How to make a copy of a pdf on Adobe Acrobat,howto,3,medium,volume_10+,,how to make a copy of a pdf on adobe acrobat | how to create a copy of a pdf in adobe acrobat | how to make a copy of a pdf in adobe acrobat
how to select pages in adobe acrobat,How to select pages in Adobe Acrobat,howto,3,medium,volume_10+,,how to select pages in adobe acrobat | how to select all pages in adobe acrobat | how to select multiple pages in adobe acrobat
how to delete a line in adobe acrobat,How to delete a line in Adobe Acrobat,howto,3,medium,volume_10+,,how to delete lines in adobe acrobat | how to delete a line in adobe acrobat | how to remove lines in adobe acrobat
how to disable ai assistant in adobe acrobat,How to disable ai assistant in Adobe Acrobat,howto,3,medium,volume_10+,,adobe acrobat how to turn off ai assistant | how to turn off ai assistant in adobe acrobat | how to disable ai assistant in adobe acrobat
how to edit text on a pdf in adobe acrobat,How to edit text on a pdf in Adobe Acrobat,howto,3,medium,volume_10+,,how to edit text in pdf using adobe acrobat | how to edit text on a pdf in adobe acrobat | how to edit text in pdf adobe acrobat
how to add an arrow in adobe acrobat,How to add an arrow in Adobe Acrobat,howto,3,medium,volume_10+,,how to add arrow in adobe acrobat | how to add arrows in adobe acrobat | how to add an arrow in adobe acrobat
how to make a pdf editable adobe acrobat,How to make a pdf editable Adobe Acrobat,howto,3,medium,volume_10+,,how to make a pdf editable in adobe acrobat | how to make a pdf editable adobe acrobat | how to create an editable pdf in adobe acrobat
how to flatten a pdf in adobe acrobat pro,How to flatten a pdf in Adobe Acrobat pro,howto,3,medium,volume_10+,,how to flatten pdf in adobe acrobat pro dc | how to flatten a pdf in adobe acrobat pro dc | how to flatten a pdf in adobe acrobat pro
how to create a digital signature in adobe acrobat,How to create a digital signature in Adobe Acrobat,howto,3,medium,volume_10+,,how to create digital signature in adobe acrobat | how to create a digital signature in adobe acrobat | how to create a digital signature in adobe acrobat pro
how to delete a page in adobe acrobat reader,How to delete a page in Adobe Acrobat reader,howto,3,medium,volume_10+,,how to delete a page in adobe acrobat reader | how to delete pages in adobe acrobat reader | how to delete pages in adobe acrobat reader dc
how to change highlight color in adobe acrobat,How to change highlight color in Adobe Acrobat,howto,3,medium,volume_10+,,how to change highlight color in adobe acrobat | how to change highlight color in adobe acrobat pro | how to change adobe acrobat reader highlight color
how to get free adobe acrobat,How to get free Adobe Acrobat,howto,2,low,volume_10+,,how to get adobe acrobat for free | how to get free adobe acrobat
how to draw on adobe acrobat,How to draw on Adobe Acrobat,howto,2,low,volume_10+,,how to draw on adobe acrobat | how to draw in adobe acrobat
how to login adobe acrobat,How to login Adobe Acrobat,howto,2,low,volume_10+,,how to login to adobe acrobat | how to login adobe acrobat
how to use free adobe acrobat,How to use free Adobe Acrobat,howto,2,low,volume_10+,,how to use adobe acrobat for free | how to use free adobe acrobat
how to disable ai in adobe acrobat,How to disable ai in Adobe Acrobat,howto,2,low,volume_10+,,how to turn off ai in adobe acrobat | how to disable ai in adobe acrobat
how to fix adobe acrobat,How to fix Adobe Acrobat,howto,2,low,volume_10+,,how to repair adobe acrobat | how to fix adobe acrobat
how to make adobe acrobat default mac,How to make Adobe Acrobat default mac,howto,2,low,volume_10+,,how to make adobe acrobat default on mac | how to make adobe acrobat default mac
how to make a table in adobe acrobat,How to make a table in Adobe Acrobat,howto,2,low,volume_10+,,how to create a table in adobe acrobat | how to make a table in adobe acrobat
how to resize a pdf in adobe acrobat,How to resize a pdf in Adobe Acrobat,howto,2,low,volume_10+,,how to resize a pdf in adobe acrobat | how to resize pdf in adobe acrobat
how to clear adobe acrobat cache,How to clear Adobe Acrobat cache,howto,2,low,volume_10+,,how to clear adobe acrobat cache | how to clear cache in adobe acrobat
how to add pages to a pdf in adobe acrobat,How to add pages to a pdf in Adobe Acrobat,howto,2,low,volume_10+,,how to add a page to a pdf in adobe acrobat | how to add pages to a pdf in adobe acrobat
how to change text size in adobe acrobat,How to change text size in Adobe Acrobat,howto,2,low,volume_10+,,how to change text size in adobe acrobat | how to change text size on adobe acrobat
how to add text in adobe acrobat,How to add text in Adobe Acrobat,howto,2,low,volume_10+,,how to add text in adobe acrobat | how to add text to adobe acrobat
how to edit adobe acrobat pro,How to edit Adobe Acrobat pro,howto,2,low,volume_10+,,how to update adobe acrobat pro | how to edit adobe acrobat pro
how to add a check mark in adobe acrobat,How to add a check mark in Adobe Acrobat,howto,2,low,volume_10+,,how to add a check mark in adobe acrobat | how to add check mark in adobe acrobat
how to add bleed in adobe acrobat,How to add bleed in Adobe Acrobat,howto,2,low,volume_10+,,how to add bleed in adobe acrobat | how to add bleeds in adobe acrobat
how to change adobe acrobat default settings,How to change Adobe Acrobat default settings,howto,2,low,volume_10+,,how to change default settings in adobe acrobat | how to change adobe acrobat default settings
how to add fillable fields in adobe acrobat,How to add fillable fields in Adobe Acrobat,howto,2,low,volume_10+,,how to add fillable fields in adobe acrobat | adobe acrobat how to add fillable fields
how to edit a pdf document in adobe acrobat,How to edit a pdf document in Adobe Acrobat,howto,2,low,volume_10+,,how to edit a pdf document in adobe acrobat | how to edit pdf documents with adobe acrobat
how to enable javascript in adobe acrobat,How to enable javascript in Adobe Acrobat,howto,2,low,volume_10+,,how to enable javascript in adobe acrobat | how to enable javascript on adobe acrobat
how to white out in adobe acrobat,How to white out in Adobe Acrobat,howto,2,low,volume_10+,,how to white out in adobe acrobat | how to white out on adobe acrobat
how to align text in adobe acrobat,How to align text in Adobe Acrobat,howto,2,low,volume_10+,,how to center text in adobe acrobat | how to align text in adobe acrobat
how to resize an image in adobe acrobat,How to resize an image in Adobe Acrobat,howto,2,low,volume_10+,,how to resize an image in adobe acrobat | how to resize image in adobe acrobat
how to go back to old adobe acrobat,How to go back to old Adobe Acrobat,howto,2,low,volume_10+,,how to go back to old adobe acrobat | how to go back to new adobe acrobat
how to add a check box in adobe acrobat pro,How to add a check box in Adobe Acrobat pro,howto,2,low,volume_10+,,how to insert check box in adobe acrobat pro | how to add a check box in adobe acrobat pro
how to remove password from pdf adobe acrobat,How to remove password from pdf Adobe Acrobat,howto,2,low,volume_10+,,adobe acrobat remove password from pdf how to | how to remove password from pdf adobe acrobat
how to crop an image in adobe acrobat,How to crop an image in Adobe Acrobat,howto,2,low,volume_10+,,how to crop an image in adobe acrobat | how to crop image in adobe acrobat
how to translate in adobe acrobat,How to translate in Adobe Acrobat,howto,2,low,volume_10+,,how to translate in adobe acrobat | how to translate on adobe acrobat
how to hyperlink in adobe acrobat,How to hyperlink in Adobe Acrobat,howto,2,low,volume_10+,,how to hyperlink in adobe acrobat | adobe acrobat connect
how to add a checkbox in adobe acrobat,How to add a checkbox in Adobe Acrobat,howto,2,low,volume_10+,,how to add checkbox in adobe acrobat | how to add a checkbox in adobe acrobat
how to use adobe acrobat ai,How to use Adobe Acrobat ai,howto,2,low,volume_10+,,how to use ai in adobe acrobat | how to use adobe acrobat ai
how to export a pdf from adobe acrobat,How to export a pdf from Adobe Acrobat,howto,2,low,volume_10+,,how to export pdf from adobe acrobat | how to export a pdf from adobe acrobat
how to present a pdf in adobe acrobat,How to present a pdf in Adobe Acrobat,howto,2,low,volume_10+,,how to present pdfs in adobe acrobat | how to present a pdf in adobe acrobat
how to copy and paste a page in adobe acrobat,How to copy and paste a page in Adobe Acrobat,howto,2,low,volume_10+,,how to copy and paste pages in adobe acrobat | how to copy and paste a page in adobe acrobat
how to tag a link in adobe acrobat,How to tag a link in Adobe Acrobat,howto,2,low,volume_10+,,how to tag a link in adobe acrobat | how to tag links in adobe acrobat
how to print a booklet in adobe acrobat,How to print a booklet in Adobe Acrobat,howto,2,low,volume_10+,,how to print booklet in adobe acrobat | how to print a booklet in adobe acrobat
how to make adobe acrobat default pdf viewer,How to make Adobe Acrobat default pdf viewer,howto,2,low,volume_10+,,how to make adobe acrobat the default pdf viewer | how to make adobe acrobat default pdf viewer
how to add text to a pdf in adobe acrobat,How to add text to a pdf in Adobe Acrobat,howto,2,low,volume_10+,,how to add text to a pdf in adobe acrobat | how to add text to pdf adobe acrobat
how to add a checkmark in adobe acrobat,How to add a checkmark in Adobe Acrobat,howto,2,low,volume_10+,,how to add checkmark in adobe acrobat | how to add a checkmark in adobe acrobat
how to password protect a pdf in adobe acrobat,How to password protect a pdf in Adobe Acrobat,howto,2,low,volume_10+,,how to password protect a pdf in adobe acrobat | adobe acrobat password protect pdf how to
how to scan with adobe acrobat,How to scan with Adobe Acrobat,howto,2,low,volume_10+,,how to scan using adobe acrobat | how to scan with adobe acrobat
how to save a document in adobe acrobat,How to save a document in Adobe Acrobat,howto,2,low,volume_10+,,how to save a document in adobe acrobat | how to download a document from adobe acrobat
how to see layers in adobe acrobat,How to see layers in Adobe Acrobat,howto,2,low,volume_10+,,how to see layers in adobe acrobat | how to view layers in adobe acrobat
how to compress a file in adobe acrobat,How to compress a file in Adobe Acrobat,howto,2,low,volume_10+,,how to compress file in adobe acrobat | how to compress a file in adobe acrobat
how to merge documents in adobe acrobat,How to merge documents in Adobe Acrobat,howto,2,low,volume_10+,,how to merge documents in adobe acrobat | how to combine documents in adobe acrobat
how to make a box in adobe acrobat,How to make a box in Adobe Acrobat,howto,2,low,volume_10+,,how to make a box in adobe acrobat | how to create a box in adobe acrobat
how to add a link to a pdf in adobe acrobat,How to add a link to a pdf in Adobe Acrobat,howto,2,low,volume_10+,,how to add hyperlink to pdf adobe acrobat | how to add a link to a pdf in adobe acrobat
how to fill out a form in adobe acrobat,How to fill out a form in Adobe Acrobat,howto,2,low,volume_10+,,how to fill out a form in adobe acrobat | how to fill out a form on adobe acrobat
how to use javascript in adobe acrobat,How to use javascript in Adobe Acrobat,howto,2,low,volume_10+,,adobe acrobat javascript tutorial | how to use javascript in adobe acrobat
how to convert pdf to jpg adobe acrobat,How to convert pdf to jpg Adobe Acrobat,howto,2,low,volume_10+,,how to convert pdf to jpg using adobe acrobat | how to convert pdf to jpg adobe acrobat
how to duplicate in adobe acrobat,How to duplicate in Adobe Acrobat,howto,2,low,volume_10+,,how to duplicate in adobe acrobat | how to duplicate on adobe acrobat
how to rotate a page in adobe acrobat,How to rotate a page in Adobe Acrobat,howto,2,low,volume_10+,,how to rotate page in adobe acrobat | how to rotate a page in adobe acrobat
how to black out text in adobe acrobat,How to black out text in Adobe Acrobat,howto,2,low,volume_10+,,how to black out text in adobe acrobat | adobe acrobat how to black out text
how to rotate an image in adobe acrobat,How to rotate an image in Adobe Acrobat,howto,2,low,volume_10+,,how to rotate an image in adobe acrobat | how to rotate image in adobe acrobat
how to make a copy in adobe acrobat,How to make a copy in Adobe Acrobat,howto,2,low,volume_10+,,how to make a copy in adobe acrobat | how to make a copy on adobe acrobat
how to add a link to text in adobe acrobat,How to add a link to text in Adobe Acrobat,howto,2,low,volume_10+,,how to add link to text in adobe acrobat | how to add a link to text in adobe acrobat
how to duplicate a pdf in adobe acrobat,How to duplicate a pdf in Adobe Acrobat,howto,2,low,volume_10+,,how to duplicate a pdf in adobe acrobat | how to duplicate pdf in adobe acrobat
how to add a circle in adobe acrobat,How to add a circle in Adobe Acrobat,howto,2,low,volume_10+,,how to add circle in adobe acrobat | how to add a circle in adobe acrobat
how to print to pdf adobe acrobat,How to print to pdf Adobe Acrobat,howto,2,low,volume_10+,,how to print to pdf adobe acrobat | how to print to pdf in adobe acrobat
how to rotate a text box in adobe acrobat,How to rotate a text box in Adobe Acrobat,howto,2,low,volume_10+,,how to rotate a text box in adobe acrobat | how to rotate text box in adobe acrobat
how to add a box in adobe acrobat,How to add a box in Adobe Acrobat,howto,2,low,volume_10+,,how to add box in adobe acrobat | how to add a box in adobe acrobat
how to create a link in adobe acrobat,How to create a link in Adobe Acrobat,howto,2,low,volume_10+,,how to create a link in adobe acrobat | how to create a hyperlink in adobe acrobat
how to check for updates in adobe acrobat,How to check for updates in Adobe Acrobat,howto,2,low,volume_10+,,how to check for updates in adobe acrobat | how to check for updates on adobe acrobat
how to check adobe acrobat version,How to check Adobe Acrobat version,howto,2,low,volume_10+,,how to check adobe acrobat version | how to get old version of adobe acrobat
how to set adobe acrobat as default,How to set Adobe Acrobat as default,howto,2,low,volume_10+,,how to set adobe acrobat as default | how to set adobe acrobat as default on mac
how to get adobe acrobat pro for free,How to get Adobe Acrobat pro for free,howto,2,low,volume_10+,,how to get adobe acrobat pro for free | how to get adobe acrobat pro dc for free
how to create a signature in adobe acrobat pro,How to create a signature in Adobe Acrobat pro,howto,2,low,volume_10+,,how to create a signature in adobe acrobat pro dc | how to create a signature in adobe acrobat pro
how to add crop marks to a pdf in adobe acrobat,How to add crop marks to a pdf in Adobe Acrobat,howto,2,low,volume_10+,,how to add crop marks in adobe acrobat | how to add crop marks to a pdf in adobe acrobat
how to bring text to front in adobe acrobat,How to bring text to front in Adobe Acrobat,howto,2,low,volume_10+,,how to bring text to front in adobe acrobat | how to bring text to front in adobe acrobat pro
how to delete a page in adobe acrobat pro,How to delete a page in Adobe Acrobat pro,howto,2,low,volume_10+,,how to delete a page in adobe acrobat pro dc | how to delete a page in adobe acrobat pro
how to draw a line in adobe acrobat pro,How to draw a line in Adobe Acrobat pro,howto,2,low,volume_10+,,how to draw a line in adobe acrobat pro dc | how to draw a line in adobe acrobat pro
how to compare two pdf files in adobe acrobat,How to compare two pdf files in Adobe Acrobat,howto,2,low,volume_10+,,how to compare two pdf files in adobe acrobat pro | how to compare two pdf files in adobe acrobat
how to sign a document on adobe acrobat reader dc,How to sign a document on Adobe Acrobat reader dc,howto,2,low,volume_10+,,how to sign a document on adobe acrobat reader dc | how to sign adobe acrobat reader dc
how to add crops and bleeds in adobe acrobat,How to add crops and bleeds in Adobe Acrobat,howto,2,low,volume_10+,,how to add crops and bleeds in adobe acrobat | how to add crop marks and bleed in adobe acrobat
adobe acrobat chatgpt integration,adobe acrobat chatgpt integration,integration,2,low,volume_10+,,adobe acrobat chatgpt integration | adobe acrobat integration chatgpt
adobe acrobat chatgpt integration 2025,adobe acrobat chatgpt integration 2025,integration,2,low,volume_10+,,adobe acrobat chatgpt integration 2025 | adobe acrobat chatgpt integration plugin 2025
