canonical_keyword,suggested_title,category,variant_count,signal_strength,source,frequency_count,all_variants
how to integrate bigcommerce with drupal,How to integrate bigcommerce with drupal,integration,6,high,volume_10+,,drupal bigcommerce integration | bigcommerce and drupal integration | bigcommerce drupal integration guide | bigcommerce integration with drupal | how to integrate bigcommerce with drupal | drupal and bigcommerce integration
how to integrate drupal crm,How to integrate drupal crm,integration,5,high,volume_10+,,drupal crm integration | integrate crm with drupal | how to integrate drupal crm | integrate drupal with crm | crm drupal integration
drupal bigcommerce ecommerce integration,drupal bigcommerce ecommerce integration,integration,4,medium,volume_10+,,drupal bigcommerce integration for ecommerce | bigcommerce integration for drupal ecommerce | drupal bigcommerce ecommerce integration | drupal bigcommerce ecommerce platform integration
how to install drupal,How to install drupal,howto,3,medium,volume_10+,,how to install drupal | how to install drupal 8 | how to install drupal 6
drupal salesforce integration,drupal salesforce integration,integration,3,medium,volume_10+,,drupal salesforce integration | drupal and salesforce integration | salesforce drupal integration
drupal salesforce crm integration,drupal salesforce crm integration,integration,3,medium,volume_10+,,drupal salesforce crm integration | salesforce crm and drupal integration | drupal and salesforce crm integration
drupal beginners tutorial,drupal beginners tutorial,tutorial,3,medium,volume_10+,,drupal beginners tutorial | drupal tutorial for beginners step by step | drupal 7 tutorial for beginners
how to migrate from drupal 7 to drupal 9,How to migrate from drupal 7 to drupal 9,howto,2,low,volume_10+,,how to migrate from drupal 7 to drupal 9 | drupal migrate tutorial
how to upgrade drupal 7 to 9,How to upgrade drupal 7 to 9,howto,2,low,volume_10+,,how to upgrade drupal 7 to 9 | drupal upgrade tutorial
how to use drupal cms,How to use drupal cms,howto,2,low,volume_10+,,drupal cms tutorial | how to use drupal cms
how to create custom form in drupal 7,How to create custom form in drupal 7,howto,2,low,volume_10+,,how to create custom form in drupal 7 | how to create custom form in drupal 8
drupal integration consultant,drupal integration consultant,integration,2,low,volume_10+,,drupal integration consultant | drupal integration consultants
drupal integration agency,drupal integration agency,integration,2,low,volume_10+,,drupal integration agency | drupal integration agencies
drupal bigcommerce integration benefits,drupal bigcommerce integration benefits,integration,2,low,volume_10+,,bigcommerce and drupal integration benefits | drupal bigcommerce integration benefits
drupal magento integration,drupal magento integration,integration,2,low,volume_10+,,drupal magento integration | magento drupal integration
drupal integration company,drupal integration company,integration,2,low,volume_10+,,drupal integration company | drupal integration companies
drupal bigcommerce platform integration,drupal bigcommerce platform integration,integration,2,low,volume_10+,,drupal and bigcommerce platform integration | drupal bigcommerce platform integration
drupal integration service provider,drupal integration service provider,integration,2,low,volume_10+,,drupal integration services providers | drupal integration service provider
drupal bigcommerce integration services,drupal bigcommerce integration services,integration,2,low,volume_10+,,bigcommerce and drupal integration services | drupal bigcommerce integration services
bigcommerce and drupal website integration,bigcommerce and drupal website integration,integration,2,low,volume_10+,,bigcommerce and drupal website integration | bigcommerce integration for drupal websites
drupal integration firm,drupal integration firm,integration,2,low,volume_10+,,drupal integration firm | drupal integration firms
drupal openid connect,drupal openid connect,other,2,low,volume_10+,,drupal openid connect | openid connect drupal
drupal commerce tutorial,drupal commerce tutorial,tutorial,2,low,volume_10+,,drupal 8 commerce 2 tutorial | drupal commerce tutorial
