canonical_keyword,suggested_title,category,variant_count,signal_strength,source,frequency_count,all_variants
how to improve quality ranking facebook ads,How to improve quality ranking facebook ads,howto,2,low,volume_10+,,how to improve quality ranking facebook ads | how to improve quality ranking facebook ads
how to improve roas across meta and tiktok,How to improve roas across meta and tiktok,howto,2,low,volume_10+,,how to improve roas across meta and tiktok | how to improve roas across meta and tiktok
how to increase conversion rate facebook ads,How to increase conversion rate facebook ads,howto,2,low,volume_10+,,how to increase conversion rate facebook ads | how to increase conversion rate facebook ads
how to increase ctr facebook ads,How to increase ctr facebook ads,howto,2,low,volume_10+,,how to increase ctr facebook ads | how to increase ctr facebook ads
how to increase instagram followers through facebook ads,How to increase instagram followers through facebook ads,howto,2,low,volume_10+,,how to increase instagram followers through facebook ads | how to increase instagram followers through facebook ads
how to increase meta ads spending limit,How to increase meta ads spending limit,howto,2,low,volume_10+,,how to increase meta ads spending limit | how to increase meta ads spending limit
how to increase reach in facebook ads,How to increase reach in facebook ads,howto,2,low,volume_10+,,how to increase reach in facebook ads | how to increase reach on facebook ads
how to increase roas on meta ads,How to increase roas on meta ads,howto,2,low,volume_10+,,how to increase roas on meta ads | how to increase roas on meta ads
how to increase sales with facebook ads,How to increase sales with facebook ads,howto,2,low,volume_10+,,how to increase sales with facebook ads | how to increase sales with facebook ads
how to join meta,How to join meta,howto,2,low,volume_10+,,how to join meta | how to join meta
how to know a facebook ad is delivered,How to know a facebook ad is delivered,howto,2,low,volume_10+,,how to know a facebook ad is delivered | how to know a facebook ad is delivered
how to know if your facebook ads are running,How to know if your facebook ads are running,howto,2,low,volume_10+,,how to know if your facebook ads are running | how to know if your facebook ads are running
how to know the reach of a facebook ad,How to know the reach of a facebook ad,howto,2,low,volume_10+,,how to know the reach of a facebook ad | how to know the reach of a facebook ad
how to write a great meta description,How to write a great meta description,howto,2,low,volume_10+,,how to write great meta descriptions | how to write a great meta description
how to link facebook ad to landing page,How to link facebook ad to landing page,howto,2,low,volume_10+,,how to link facebook ad to landing page | how to link facebook ad to landing page
how to lower cpm meta ads,How to lower cpm meta ads,howto,2,low,volume_10+,,how to lower cpm meta ads | how to lower cpm meta ads
how to make $3000 threshold facebook ads account,How to make $3000 threshold facebook ads account,howto,2,low,volume_10+,,how to make $3000 threshold facebook ads account | how to make $3000 threshold facebook ads account
how to make someone an admin on meta business suite,How to make someone an admin on meta business suite,howto,2,low,volume_10+,,how to make someone an admin on meta business suite | how to make someone an admin on meta business suite
how to master facebook ads,How to master facebook ads,howto,2,low,volume_10+,,how to master facebook ads | how to master facebook ads
how to measure lifetime value using meta data,How to measure lifetime value using meta data,howto,2,low,volume_10+,,how to measure lifetime value using meta data | how to measure lifetime value using meta data
how to merge meta accounts,How to merge meta accounts,howto,2,low,volume_10+,,how to merge meta accounts | how to merge meta accounts
how to meta for developers create app,How to meta for developers create app,howto,2,low,volume_10+,,how to meta for developers create app | meta for developers create app steps
how to monitor competitors facebook ad spend,How to monitor competitors facebook ad spend,howto,2,low,volume_10+,,how to monitor competitors facebook ad spend | how to monitor competitors facebook ad spend
how to negotiate meta offer,How to negotiate meta offer,howto,2,low,volume_10+,,how to negotiate meta offer | how to negotiate meta offer
how to not let meta use your data for ai,How to not let meta use your data for ai,howto,2,low,volume_10+,,how to not let meta use your data for ai | how to not let meta use your data for ai
how to onboard account in facebook ads account,How to onboard account in facebook ads account,howto,2,low,volume_10+,,how to onboard account in facebook ads account | how to onboard account to facebook ads account
how to open a meta business account,How to open a meta business account,howto,2,low,volume_10+,,how to open a meta business account | how to open a meta business account
how to open a meta support ticket,How to open a meta support ticket,howto,2,low,volume_10+,,how to open a meta support ticket | how to open a meta support ticket
how to opt out of meta,How to opt out of meta,howto,2,low,volume_10+,,how to opt out of meta | how to opt out of meta
how to opt out of meta using my photos,How to opt out of meta using my photos,howto,2,low,volume_10+,,how to opt out of meta using my photos | how to opt out of meta using my photos
how to optimize meta ads,How to optimize meta ads,howto,2,low,volume_10+,,how to optimize meta ads | how to optimize meta ads
how to outsource facebook ads,How to outsource facebook ads,howto,2,low,volume_10+,,how to outsource facebook ads | how to outsource facebook ads
how to pair rayban meta,How to pair rayban meta,howto,2,low,volume_10+,,how to pair rayban meta | how to pair rayban meta
how to pay facebook ads with debit card,How to pay facebook ads with debit card,howto,2,low,volume_10+,,how to pay facebook ads with debit card | how to pay facebook ads with debit card
how to pay for a facebook ad,How to pay for a facebook ad,howto,2,low,volume_10+,,how to pay for a facebook ad | how to pay for a facebook ad
how to pay for meta ads,How to pay for meta ads,howto,2,low,volume_10+,,how to pay for meta ads | how to pay for meta ads
how to pay someone with meta pay,How to pay someone with meta pay,howto,2,low,volume_10+,,how to pay someone with meta pay | how to pay someone with meta pay
how to plan content for meta,How to plan content for meta,howto,2,low,volume_10+,,how to plan content for meta | how to plan content for meta
how to post a business ad on facebook marketplace,How to post a business ad on facebook marketplace,howto,2,low,volume_10+,,how to post a business ad on facebook marketplace | how to post a business ad on facebook marketplace
how to post a help wanted ad on facebook,How to post a help wanted ad on facebook,howto,2,low,volume_10+,,how to post a help wanted ad on facebook | how to post a help wanted ad on facebook
how to post a job on facebook meta business suite,How to post a job on facebook meta business suite,howto,2,low,volume_10+,,how to post a job on facebook meta business suite | how to post a job on facebook meta business suite
how to post a poll on meta business suite,How to post a poll on meta business suite,howto,2,low,volume_10+,,how to post a poll on meta business suite | how to post a poll on meta business suite
how to post a wanted ad on facebook marketplace,How to post a wanted ad on facebook marketplace,howto,2,low,volume_10+,,how to post a wanted ad on facebook marketplace | how to post a wanted ad on facebook marketplace
how to prevent facebook ad rejections,How to prevent facebook ad rejections,howto,2,low,volume_10+,,how to prevent facebook ad rejections | how to prevent facebook ad rejections
how to promote affiliate offers with facebook ads,How to promote affiliate offers with facebook ads,howto,2,low,volume_10+,,how to promote affiliate offers with facebook ads | how to promote affiliate offers with facebook ads
how to promote cpa offers with facebook ads,How to promote cpa offers with facebook ads,howto,2,low,volume_10+,,how to promote cpa offers with facebook ads | how to promote cpa offers with facebook ads
how to promote event in facebook ads manager,How to promote event in facebook ads manager,howto,2,low,volume_10+,,how to promote event in facebook ads manager | how to promote event on facebook ads manager
how to promote facebook group with ads,How to promote facebook group with ads,howto,2,low,volume_10+,,how to promote facebook group with ads | how to promote facebook group with ads
how to pull end date facebook ads reporting,How to pull end date facebook ads reporting,howto,2,low,volume_10+,,how to pull end date facebook ads reporting | facebook ads reporting how to pull end date
how to purchase facebook ads,How to purchase facebook ads,howto,2,low,volume_10+,,how to purchase facebook ads | how to purchase facebook ads
how to raise an issue in facebook ads,How to raise an issue in facebook ads,howto,2,low,volume_10+,,how to raise an issue in facebook ads | how to raise an issue on facebook ads
how to reactivate facebook ad account,How to reactivate facebook ad account,howto,2,low,volume_10+,,how to reactivate facebook ad account | how to reactivate facebook ad account
how to receive money from meta pay,How to receive money from meta pay,howto,2,low,volume_10+,,how to receive money from meta pay | how to receive money from meta pay
how to recognize success on facebook ad,How to recognize success on facebook ad,howto,2,low,volume_10+,,how to recognize success on facebook ad | how to recognize success on facebook ad
how to recover a deleted campaign in facebook ads manager,How to recover a deleted campaign in facebook ads manager,howto,2,low,volume_10+,,how to recover a deleted campaign in facebook ads manager | how to recover a deleted campaign on facebook ads manager
how to recover deleted ad campaign facebook,How to recover deleted ad campaign facebook,howto,2,low,volume_10+,,how to recover deleted ad campaign facebook | how to recover deleted ad campaign facebook
how to recover deleted ad set facebook,How to recover deleted ad set facebook,howto,2,low,volume_10+,,how to recover deleted ad set facebook | how to recover deleted ad set facebook
how to recover meta business account,How to recover meta business account,howto,2,low,volume_10+,,how to recover meta business account | how to recover meta business account
how to redeem meta lock codes,How to redeem meta lock codes,howto,2,low,volume_10+,,how to redeem meta lock codes | how to redeem meta lock codes
how to reduce cost per result in facebook ads,How to reduce cost per result in facebook ads,howto,2,low,volume_10+,,how to reduce cost per result in facebook ads | how to reduce cost per result in facebook ads
how to register as a meta developer,How to register as a meta developer,howto,2,low,volume_10+,,how to register as a meta developer | how to register as a meta developer
how to remove ad restrictions on facebook,How to remove ad restrictions on facebook,howto,2,low,volume_10+,,how to remove ad restrictions on facebook | how to remove ad restrictions on facebook
how to report to meta,How to report to meta,howto,2,low,volume_10+,,how to report to meta | how to report to meta
how to request access to meta business account,How to request access to meta business account,howto,2,low,volume_10+,,how to request access to meta business account | how to request access to meta business account
how to request partnership ads on facebook,How to request partnership ads on facebook,howto,2,low,volume_10+,,how to request partnership ads on facebook | how to request partnership ads on facebook
how to research competitors ads meta ad library,How to research competitors ads meta ad library,howto,2,low,volume_10+,,how to research competitors ads meta ad library | how to research competitors ads meta ad library
how to reset facebook ad algorithm,How to reset facebook ad algorithm,howto,2,low,volume_10+,,how to reset facebook ad algorithm | how to reset facebook ad algorithm
how to reset meta password,How to reset meta password,howto,2,low,volume_10+,,how to reset meta password | how to reset meta password
how to sue meta,How to sue meta,howto,2,low,volume_10+,,how to sue meta | how to sue meta
how to respond to comments in facebook ads,How to respond to comments in facebook ads,howto,2,low,volume_10+,,how to respond to comments in facebook ads | how to respond to comments on facebook ads
how to respond to facebook ad comments,How to respond to facebook ad comments,howto,2,low,volume_10+,,how to respond to facebook ad comments | how to respond to facebook ad comments
how to retarget meta ads,How to retarget meta ads,howto,2,low,volume_10+,,how to retarget meta ads | how to retarget meta ads
how to run a facebook birthday discount ad,How to run a facebook birthday discount ad,howto,2,low,volume_10+,,how to run a facebook birthday discount ad | how to run a facebook birthday discount ad
how to run black friday ads on facebook for sales,How to run black friday ads on facebook for sales,howto,2,low,volume_10+,,how to run black friday ads on facebook for sales | how to run black friday ads on facebook for sales
how to know if meta glasses are recording,How to know if meta glasses are recording,howto,2,low,volume_10+,,how to know if meta glasses are recording | how to know when meta glasses are recording
how to run facebook ads for a car dealership,How to run facebook ads for a car dealership,howto,2,low,volume_10+,,how to run facebook ads for a car dealership | how to run facebook ads for a car dealership
how to run facebook ads for a local buisness?,How to run facebook ads for a local buisness?,howto,2,low,volume_10+,,how to run facebook ads for a local buisness? | how to run facebook ads for a local buisness?
how to run facebook ads for daraz seller,How to run facebook ads for daraz seller,howto,2,low,volume_10+,,how to run facebook ads for daraz seller | how to run facebook ads for daraz seller
how to run facebook ads for local business,How to run facebook ads for local business,howto,2,low,volume_10+,,how to run facebook ads for local business | how to run facebook ads for local business
how to run facebook ads for shopify store,How to run facebook ads for shopify store,howto,2,low,volume_10+,,how to run facebook ads for shopify store | how to run facebook ads for shopify store
how to run facebook ads for small businesses,How to run facebook ads for small businesses,howto,2,low,volume_10+,,how to run facebook ads for small businesses | how to run facebook ads for small businesses
how to run facebook ads with $10 budget,How to run facebook ads with $10 budget,howto,2,low,volume_10+,,how to run facebook ads with $10 budget | how to run facebook ads with $10 budget
how to run lead generation ads on facebook,How to run lead generation ads on facebook,howto,2,low,volume_10+,,how to run lead generation ads on facebook | how to run lead generation ads on facebook
how to run meta ads for shopify store,How to run meta ads for shopify store,howto,2,low,volume_10+,,how to run meta ads for shopify store | how to run meta ads for shopify store
how to run pressure washing facebook ads,How to run pressure washing facebook ads,howto,2,low,volume_10+,,how to run pressure washing facebook ads | how to run pressure washing facebook ads
how to run social issues ads on facebook,How to run social issues ads on facebook,howto,2,low,volume_10+,,how to run social issues ads on facebook | how to run social issues ads on facebook
how to turn off ray ban meta,How to turn off ray ban meta,howto,2,low,volume_10+,,how to turn off ray ban meta | how to turn off meta ray bans
how to scale ai training like meta,How to scale ai training like meta,howto,2,low,volume_10+,,how to scale ai training like meta | how to scale ai training like meta
how to get meta ai on messenger,How to get meta ai on messenger,howto,2,low,volume_10+,,how to get meta ai on messenger | how to get meta ai in messenger
how to schedule stories on meta business suite,How to schedule stories on meta business suite,howto,2,low,volume_10+,,how to schedule stories on meta business suite | how to schedule stories on meta business suite
how to scrub meta data from a picture,How to scrub meta data from a picture,howto,2,low,volume_10+,,how to scrub meta data from a picture | how to scrub meta data from a picture
how to see ads run by a facebook page,How to see ads run by a facebook page,howto,2,low,volume_10+,,how to see ads run by a facebook page | how to see ads run by a facebook page
how to see how much you spent in facebook ads,How to see how much you spent in facebook ads,howto,2,low,volume_10+,,how to see how much you spent in facebook ads | how to see how much you spent on facebook ads
how to see who has access to meta business suite,How to see who has access to meta business suite,howto,2,low,volume_10+,,how to see who has access to meta business suite | how to see who has access to meta business suite
how to see your competitors facebook ad targeting,How to see your competitors facebook ad targeting,howto,2,low,volume_10+,,how to see your competitors facebook ad targeting | how to see your competitors facebook ad targeting
how to sell ethereum meta,How to sell ethereum meta,howto,2,low,volume_10+,,how to sell ethereum meta | how to sell ethereum meta
how to sell ethereum meta on coinbase wallet,How to sell ethereum meta on coinbase wallet,howto,2,low,volume_10+,,how to sell ethereum meta on coinbase wallet | how to sell ethereum meta on coinbase wallet
how to send data from facebook ads to bigquery,How to send data from facebook ads to bigquery,howto,2,low,volume_10+,,how to send data from facebook ads to bigquery | how to send data from facebook ads to bigquery
how to set bid cap facebook ads,How to set bid cap facebook ads,howto,2,low,volume_10+,,how to set bid cap facebook ads | how to set bid cap facebook ads
how to set daily budget facebook ads,How to set daily budget facebook ads,howto,2,low,volume_10+,,how to set daily budget facebook ads | how to set daily budget facebook ads
how to set lifetime budget on facebook ad,How to set lifetime budget on facebook ad,howto,2,low,volume_10+,,how to set lifetime budget on facebook ad | how to set lifetime budget on facebook ad
how to set meta ads account spending limit,How to set meta ads account spending limit,howto,2,low,volume_10+,,how to set meta ads account spending limit | meta ads account spending limit how to set
how to set meta ads frequency cap reach objective,How to set meta ads frequency cap reach objective,howto,2,low,volume_10+,,how to set meta ads frequency cap reach objective | meta ads frequency cap reach objective how to set
how to setup fbpixel 2025 guide,How to setup fbpixel 2025 guide,howto,2,low,volume_10+,,how to setup fbpixel 2025 guide | how to setup fbpixel 2025 step by step
how to share ad account access on facebook,How to share ad account access on facebook,howto,2,low,volume_10+,,how to share ad account access on facebook | how to share ad account access on facebook
how to share facebook ad preview link,How to share facebook ad preview link,howto,2,low,volume_10+,,how to share facebook ad preview link | how to share facebook ad preview link
how to share meta business suite access,How to share meta business suite access,howto,2,low,volume_10+,,how to share meta business suite access | how to share meta business suite access
how to spend in facebook ads,How to spend in facebook ads,howto,2,low,volume_10+,,how to spend in facebook ads | how to spend on facebook ads
how to start a facebook ad agency,How to start a facebook ad agency,howto,2,low,volume_10+,,how to start a facebook ad agency | how to start a facebook ad agency
how to start running facebook ads for clients,How to start running facebook ads for clients,howto,2,low,volume_10+,,how to start running facebook ads for clients | how to start running facebook ads for clients
how to stop a meta ad,How to stop a meta ad,howto,2,low,volume_10+,,how to stop a meta ad | how to stop a meta ad
how to stop meta from collecting data,How to stop meta from collecting data,howto,2,low,volume_10+,,how to stop meta from collecting data | how to stop meta from collecting data
how to stop meta from listening to me,How to stop meta from listening to me,howto,2,low,volume_10+,,how to stop meta from listening to me | how to stop meta from listening to me
how to stop meta from using my information,How to stop meta from using my information,howto,2,low,volume_10+,,how to stop meta from using my information | how to stop meta from using my information
how to submit a meta support ticket,How to submit a meta support ticket,howto,2,low,volume_10+,,how to submit a meta support ticket | how to submit a meta support ticket
how to sue meta in small claims court,How to sue meta in small claims court,howto,2,low,volume_10+,,how to sue meta in small claims court | how to sue meta in small claims court
how to sue meta instagram,How to sue meta instagram,howto,2,low,volume_10+,,how to sue meta instagram | how to sue meta instagram
how to talk to meta support,How to talk to meta support,howto,2,low,volume_10+,,how to talk to meta support | how to talk to meta support
how to target business owners in facebook ads,How to target business owners in facebook ads,howto,2,low,volume_10+,,how to target business owners in facebook ads | how to target business owners on facebook ads
how to target facebook ads based on google searches,How to target facebook ads based on google searches,howto,2,low,volume_10+,,how to target facebook ads based on google searches | how to target facebook ads based on google searches
how to target facebook ads for real estate,How to target facebook ads for real estate,howto,2,low,volume_10+,,how to target facebook ads for real estate | how to target facebook ads for real estate
how to target homeowners in facebook ads,How to target homeowners in facebook ads,howto,2,low,volume_10+,,how to target homeowners in facebook ads | how to target homeowners on facebook ads
how to target lgbtq in facebook ads,How to target lgbtq in facebook ads,howto,2,low,volume_10+,,how to target lgbtq in facebook ads | how to target lgbtq on facebook ads
how to target parents in facebook ads,How to target parents in facebook ads,howto,2,low,volume_10+,,how to target parents in facebook ads | how to target parents on facebook ads
how to target rich people in facebook ads,How to target rich people in facebook ads,howto,2,low,volume_10+,,how to target rich people in facebook ads | how to target rich people in facebook ads
how to target worldwide in facebook ads,How to target worldwide in facebook ads,howto,2,low,volume_10+,,how to target worldwide in facebook ads | how to target worldwide on facebook ads
how to buy meta bond,How to buy meta bond,howto,2,low,volume_10+,,how to buy meta bonds | how to buy meta bond
how to track app installs from facebook ads,How to track app installs from facebook ads,howto,2,low,volume_10+,,how to track app installs from facebook ads | how to track app installs from facebook ads
how to track conversions in facebook ads,How to track conversions in facebook ads,howto,2,low,volume_10+,,how to track conversions in facebook ads | how to track conversions in facebook ads
how to track purchases in facebook ads,How to track purchases in facebook ads,howto,2,low,volume_10+,,how to track purchases in facebook ads | how to track purchases on facebook ads
how to track sales from facebook ads,How to track sales from facebook ads,howto,2,low,volume_10+,,how to track sales from facebook ads | how to track sales from facebook ads
how to track your key facebook ads metrics?,How to track your key facebook ads metrics?,howto,2,low,volume_10+,,how to track your key facebook ads metrics? | how to track your key facebook ads metrics?
how to trade on meta trader 5,How to trade on meta trader 5,howto,2,low,volume_10+,,how to trade on meta trader 5 | how to trade on meta trader 5
how to transfer facebook ad account ownership,How to transfer facebook ad account ownership,howto,2,low,volume_10+,,how to transfer facebook ad account ownership | how to transfer facebook ad account ownership
how to transfer meta ad account ownership,How to transfer meta ad account ownership,howto,2,low,volume_10+,,how to transfer meta ad account ownership | how to transfer meta ad account ownership
how to transfer meta business account ownership,How to transfer meta business account ownership,howto,2,low,volume_10+,,how to transfer meta business account ownership | how to transfer meta business account ownership
how to turn off audience network facebook ads,How to turn off audience network facebook ads,howto,2,low,volume_10+,,how to turn off audience network facebook ads | how to turn off audience network facebook ads
how to turn off hey meta on glasses,How to turn off hey meta on glasses,howto,2,low,volume_10+,,how to turn off hey meta on glasses | how to turn off hey meta on glasses
how to find meta pixel code,How to find meta pixel code,howto,2,low,volume_10+,,how to find meta pixel code | how to find my meta pixel code
how to turn off messages on meta business suite,How to turn off messages on meta business suite,howto,2,low,volume_10+,,how to turn off messages on meta business suite | how to turn off messages on meta business suite
how to turn off meta search on instagram,How to turn off meta search on instagram,howto,2,low,volume_10+,,how to turn off meta search on instagram | how to turn off meta search on instagram
