canonical_keyword,suggested_title,category,variant_count,signal_strength,source,frequency_count,all_variants
how to transfer files to meta quest 3,How to transfer files to meta quest 3,howto,5,high,volume_10+,,how to transfer files from pc to meta quest 3 | how to transfer files from pc to meta quest 2 | how to transfer files from meta quest 3 to pc | how to transfer files to meta quest 3 | how to transfer files to meta quest 2
how to delete meta al,How to delete meta al,howto,5,high,volume_10+,,how to get rid of meta al on facebook | how to remove meta al from facebook | how to delete meta al on facebook | how to get rid of meta al | how to delete meta al
how to view competitor ads facebook ad library,How to view competitor ads facebook ad library,howto,5,high,volume_10+,,how to view competitor ads facebook ad library | facebook ad library how to view competitor ads | facebook ad library how to view competitor ads | how to check active ads on facebook ad library | how to check active ads on facebook ad library
how to work facebook ads,How to work facebook ads,howto,5,high,volume_10+,,how to work facebook ads | how to facebook ads work | how to work facebook ads | how to they work in facebook ads | facebook ads how to they work
how to start a chat with meta ai whatsapp,How to start a chat with meta ai whatsapp,howto,5,high,volume_10+,,how to start a chat with meta ai on whatsapp | how to start a chat with meta ai in whatsapp | how to start a chat with meta ai whatsapp | how to chat with meta ai on whatsapp | how to chat with meta ai in whatsapp
how to turn on tracking on meta quest 3,How to turn on tracking on meta quest 3,howto,5,high,volume_10+,,how to activate hand tracking on meta quest 3 | how to enable hand tracking meta quest 3 | how to enable hand tracking on meta quest 3 | how to turn on tracking on meta quest 3 | meta quest 3 how to use hand tracking
how to play minecraft vr meta quest 3,How to play minecraft vr meta quest 3,howto,5,high,volume_10+,,how to play minecraft vr meta quest 3 | how to play minecraft vr on meta quest 2 | how to play minecraft vr on meta quest 3 | how to play minecraft on meta quest 3 | how to play minecraft on meta quest 2
how to chat with meta ai in a group whatsapp,How to chat with meta ai in a group whatsapp,howto,5,high,volume_10+,,how to chat with meta ai in a group whatsapp | how to chat with meta ai in whatsapp group | how to use meta ai in whatsapp group chat | how to add meta ai to whatsapp group chat | how to use meta ai in whatsapp group
how to hang up a call on meta glasses,How to hang up a call on meta glasses,howto,5,high,volume_10+,,how to hang up on meta glasses | how to hang up with meta glasses | how to hang up meta glasses | how to hang up call on meta glasses | how to hang up a call on meta glasses
how to turn off meta glasses,How to turn off meta glasses,howto,5,high,volume_10+,,how to turn off light on meta glasses | how to turn off meta glasses light | how to turn off the light on meta glasses | how to turn off meta glasses | how to turn off recording light on meta glasses
how to use meta ai glasses,How to use meta ai glasses,howto,5,high,volume_10+,,how to use meta ai glasses | meta ai glasses tutorial | meta ai glasses how to use | how to return meta ai glasses | how to turn off meta ai glasses
how to delete a meta account,How to delete a meta account,howto,5,high,volume_10+,,how to remove instagram account from meta | how to remove meta account from instagram | how to remove a meta account from instagram | how to delete meta account | how to delete a meta account
how to see less ads on facebook,How to see less ads on facebook,howto,5,high,volume_10+,,how to see more friends and less ads on facebook | how to see less ads and more friends on facebook | how to see less ads on facebook and more friends | how to see less ads on facebook | how to get less ads on facebook
how to find ad id facebook,How to find ad id facebook,howto,5,high,volume_10+,,how to find ad account id facebook | how to find facebook ad account id | how to find my ad account id on facebook | how to find ad id facebook | how to find facebook ad id
how to chat with meta business support,How to chat with meta business support,howto,5,high,volume_10+,,how to access meta business support chat | meta business support chat how to access | how to chat with meta business support | how to chat with meta business support | meta business support live chat how to access
how to install a meta pixel,How to install a meta pixel,howto,5,high,volume_10+,,how to install meta pixel on website | how to install meta pixel on website guide | how to install meta pixel | how to install a meta pixel | how to install meta pixel on website 2025 guide
how to reset ray ban meta,How to reset ray ban meta,howto,5,high,volume_10+,,how to factory reset ray ban meta | how to factory reset meta ray bans | how to factory reset ray ban meta glasses | how to factory reset meta ray ban glasses | how to reset ray ban meta
how to pair ray-ban meta glasses,How to pair ray-ban meta glasses,howto,5,high,volume_10+,,how to pair ray-ban meta smart glasses | how to pair ray-ban meta smart glasses | ray-ban meta smart glasses how to use | how to use ray-ban meta smart glasses | how to pair ray-ban meta glasses
how to delete meta pay,How to delete meta pay,howto,5,high,volume_10+,,how to remove card from meta pay | how to remove card from meta pay | how to delete meta pay | how to remove meta pay | how to remove credit card from meta pay
how to play meta quest 2 on pc,How to play meta quest 2 on pc,howto,5,high,volume_10+,,how to play pc games on meta quest 3 | how to play pc games on meta quest 2 | how to play pc vr games on meta quest 3 | connect meta quest 2 to pc to run steamvr games | how to play meta quest 2 on pc
how to update meta quest 3s,How to update meta quest 3s,howto,5,high,volume_10+,,how to update meta quest 3s | how to update your meta quest 3s | how to adjust lenses on meta quest 3s | how to adjust focus on meta quest 3s | how to change language on meta quest 3s
how to cancel meta ads,How to cancel meta ads,howto,5,high,volume_10+,,how to cancel meta ads on facebook | how to cancel meta ads on facebook | how to cancel facebook ads | how to cancel ads on facebook | how to cancel meta ads
how to buy a facebook ad,How to buy a facebook ad,howto,5,high,volume_10+,,how to buy a facebook ad | how to buy an ad on facebook | how to buy ad space on facebook | how to buy facebook ad credit | how to buy a facebook ad coupon
meta ads google analytics integration,meta ads google analytics integration,integration,5,high,volume_10+,,google analytics 4 integration meta ads news | meta ads google analytics 4 integration news | meta ads google analytics integration news | google analytics integration meta ads news | meta ads google analytics integration
how to reconnect meta controller,How to reconnect meta controller,integration,5,high,volume_10+,,how to reconnect controllers to meta quest 3 | how to reconnect my meta quest 3 controllers | how to reconnect meta quest 3 controllers | how to reconnect meta quest 3s controllers | how to reconnect meta controller
what meta connect pt meta ai,what meta connect pt meta ai,integration,5,high,volume_10+,,what meta connect september pt ai | what connect september pt meta ai | meta connect september pt meta ai | what meta connect september meta ai | what meta connect pt meta ai
meta connect event 2025,meta connect event 2025,integration,5,high,volume_10+,,meta connect 2025 dates event | meta connect 2025 event date | meta connect 2025 dates event september 2025 | meta connect event 2025 | meta connect event date
meta connect 2025 ray-ban display,meta connect 2025 ray-ban display,integration,5,high,volume_10+,,meta connect 2025 announcements ray-ban display | meta connect 2025 ray-ban display announcement | meta connect 2025 announcements ray-ban | meta connect 2025 ray-ban display glasses | meta connect 2025 ray-ban display
how to connect facebook lead ads to mailchimp,How to connect facebook lead ads to mailchimp,integration,5,high,volume_10+,,connect facebook lead ads to mailchimp | how to connect facebook lead ads to mailchimp | connect facebook lead ads gmail mailchimp | connect facebook lead ads mailchimp webhook | connect email facebook lead ads mailchimp
how to meta tags,How to meta tags,howto,4,medium,volume_10+,,how to use meta tags | how to do meta tags | how to meta tags | meta tags how to
how to add someone to meta business suite,How to add someone to meta business suite,howto,4,medium,volume_10+,,how to add someone to meta business suite | how to add someone to your meta business suite | how to add someone on meta business suite | how to add someone to my meta business suite
how to setup meta click to whatsapp ads,How to setup meta click to whatsapp ads,howto,4,medium,volume_10+,,how to create meta click to whatsapp ads | how to setup meta click to whatsapp ads | meta click to whatsapp ads how to create | meta click to whatsapp ads how to set up
how to get meta ai on instagram,How to get meta ai on instagram,howto,4,medium,volume_10+,,how to get meta ai on instagram | how to get to meta ai on instagram | how to get the meta ai on instagram | how to get meta ai in instagram
how to track facebook ad performance,How to track facebook ad performance,howto,4,medium,volume_10+,,how to measure facebook ad performance | how to track facebook ad performance | how to track facebook ad performance | how to measure facebook ad performance
how to use rayban meta,How to use rayban meta,howto,4,medium,volume_10+,,how to use rayban meta | how to use meta raybans | rayban meta tutorial | rayban meta how to use
how to delete a meta pixel,How to delete a meta pixel,howto,4,medium,volume_10+,,how to delete a meta pixel | how to delete meta pixel | how to delete a pixel in meta | how to delete meta pixels
how to use help center meta ad library,How to use help center meta ad library,howto,4,medium,volume_10+,,how to use help center meta ad library | meta ad library how to use help center | meta ad library help center how to use | meta ad library help center how to use ad library
how to use meta,How to use meta,howto,4,medium,volume_10+,,how to use meta | how to use meta 3 | meta tutorial | meta steps
how to add a user to meta business suite,How to add a user to meta business suite,howto,4,medium,volume_10+,,how to add user to meta business suite | how to add users to meta business suite | how to add a user to meta business suite | how to add user in meta business suite
how to watch meta quest on tv,How to watch meta quest on tv,howto,4,medium,volume_10+,,how to watch meta quest 3 on tv | how to watch meta quest 2 on tv | how to watch tv on meta quest 3 | how to watch meta quest on tv
how to make meta ads,How to make meta ads,howto,4,medium,volume_10+,,how to set up meta ads | how to create meta ads | how to setup meta ads | how to make meta ads
how to earn money by facebook ads,How to earn money by facebook ads,howto,4,medium,volume_10+,,how to earn money by facebook ads | how to earn money using facebook ads | how to earn money on facebook ads | how to earn money from facebook ads
how to remove ads from facebook news feed,How to remove ads from facebook news feed,howto,4,medium,volume_10+,,how to get rid of ads on facebook news feed | how to get rid of ads in facebook news feed | how to remove ads from facebook news feed | how to get rid of facebook ads in news feed
how to avoid apple fee in facebook ads,How to avoid apple fee in facebook ads,howto,4,medium,volume_10+,,how to avoid apple fee in facebook ads | how to avoid apple fees on facebook ads | how to avoid apple fee on facebook ads | how to avoid apple service fee on facebook ads
how to check meta description of a website,How to check meta description of a website,howto,4,medium,volume_10+,,how to check meta description of a website | how to check website meta description | how to see the meta description of a website | how to check meta description
how to change meta data of a photo,How to change meta data of a photo,howto,4,medium,volume_10+,,how to edit meta data | how to edit meta data | how to change meta data | how to change meta data of a photo
how to pin a post in meta business suite,How to pin a post in meta business suite,howto,4,medium,volume_10+,,how to pin a post in meta business suite | how to pin a post in meta business suite | how to pin a post on meta business suite | how to pin a post on facebook meta business suite
how to work meta glasses,How to work meta glasses,howto,4,medium,volume_10+,,how to work meta glasses | how to meta glasses work | how to work the meta glasses | how to work rayban meta glasses
how to start meta glasses,How to start meta glasses,howto,4,medium,volume_10+,,how to start recording on meta glasses | how to start recording with meta glasses | how to start recording meta glasses | how to start meta glasses
how to mirror meta quest to tv,How to mirror meta quest to tv,howto,4,medium,volume_10+,,how to mirror meta quest 3 to tv | how to mirror meta quest 2 to tv | how to mirror meta quest to tv | how to screen mirror meta quest 3 to tv
how to download meta quest games,How to download meta quest games,howto,4,medium,volume_10+,,how to download games on meta quest 3 | how to download games on meta quest 2 | how to download meta quest games | how to download games on meta quest 3s
how to remove meta ai from messenger,How to remove meta ai from messenger,howto,4,medium,volume_10+,,how to remove meta ai from messenger | how to delete meta ai from messenger | how to get rid of meta ai on messenger | how to remove meta ai from messenger chat
how to make money on meta,How to make money on meta,howto,4,medium,volume_10+,,how to make money on meta | how to make money with meta | how to make money from meta | how to make money with meta ai
how to add meta ai to whatsapp,How to add meta ai to whatsapp,howto,4,medium,volume_10+,,how to add meta ai to whatsapp | how to add meta ai on whatsapp | how to add meta ai in whatsapp | how to add meta ai to whatsapp group
how to pair meta quest 3 to app,How to pair meta quest 3 to app,howto,4,medium,volume_10+,,how to pair meta quest 3 to app | how to pair meta quest 2 without app | how to pair meta quest 2 to app | how to pair meta quest 3s to app
how to update a game on meta quest 3,How to update a game on meta quest 3,howto,4,medium,volume_10+,,how to update games on meta quest 3 | how to update games on meta quest 2 | how to update a game on meta quest 3 | how to update games on meta quest 3s
how to use meta glasses gen 2,How to use meta glasses gen 2,howto,4,medium,volume_10+,,how to tell if meta glasses are gen 1 or 2 | how to tell what gen meta glasses i have | how to tell if my meta glasses are gen 1 or 2 | how to use meta glasses gen 2
how to change meta name,How to change meta name,howto,4,medium,volume_10+,,how to change meta name | how to change name on meta | how to change your name on meta | how to change name in facebook meta
how to reset a vr meta quest 2,How to reset a vr meta quest 2,howto,4,medium,volume_10+,,how to reset vr meta quest 3 | how to reset a vr meta quest 2 | how to reset vr meta quest 2 | how to reset vr headset meta quest 2
how to use steam vr on meta quest 3,How to use steam vr on meta quest 3,howto,4,medium,volume_10+,,how to use steam vr with meta quest 3 | how to use steam vr on meta quest 3 | how to use meta quest 3 with steam vr | how to play steam vr on meta quest 3
how to a b test facebook ads,How to a b test facebook ads,howto,4,medium,volume_10+,,how to ab test facebook ads | how to ab test facebook ads | how to a b test facebook ads | how to test facebook ads
how to accept a meta business suite invite,How to accept a meta business suite invite,howto,4,medium,volume_10+,,how to accept meta business invite | how to accept meta business invite | how to accept a meta business suite invite | how to accept meta business suite invite
how to find meta data of a photo,How to find meta data of a photo,howto,4,medium,volume_10+,,how to find meta data | how to find meta data | how to find meta data of a photo | how to find meta data of a photo
how to improve facebook ads,How to improve facebook ads,howto,4,medium,volume_10+,,how to improve cpm in facebook ads | how to improve cpm on facebook ads | how to improve facebook ads | how to improve facebook ads
how to keep meta from using my data,How to keep meta from using my data,howto,4,medium,volume_10+,,how to keep meta from using my data | how to keep meta from using my data | how to keep meta from using my data for ai | how to keep meta from using my data for ai
how to use a meta quest gift card,How to use a meta quest gift card,howto,4,medium,volume_10+,,how to redeem meta quest gift card | how to redeem a meta quest gift card | how to use a meta quest gift card | how to use meta quest gift card
how to add prescription to meta glasses,How to add prescription to meta glasses,howto,4,medium,volume_10+,,how to add prescription to meta glasses | how to put prescription in meta glasses | how to add prescription lenses to meta glasses | how to put prescription lenses in meta glasses
how to verify meta account,How to verify meta account,howto,4,medium,volume_10+,,how to meta verify facebook account | how to meta verify facebook account | how to verify meta account | how to verify meta account
how to meta whatsapp cloud api setup,How to meta whatsapp cloud api setup,howto,4,medium,volume_10+,,how to meta whatsapp cloud api setup | meta whatsapp cloud api setup steps | whatsapp cloud api setup steps meta developers | whatsapp cloud api setup steps meta documentation
how to track facebook ads,How to track facebook ads,howto,4,medium,volume_10+,,how to monitor comments in facebook ads | how to monitor comments on facebook ads | how to measure facebook ads | how to track facebook ads
how to post a job ad on facebook,How to post a job ad on facebook,howto,4,medium,volume_10+,,how to post a job ad on facebook marketplace | how to post a job ad on facebook marketplace | how to post a job ad on facebook | how to post job ad on facebook
how to prevent meta from using my data,How to prevent meta from using my data,howto,4,medium,volume_10+,,how to prevent meta from using my data | how to prevent meta from using my data | how to prevent meta from using my data for ai | how to prevent meta ai from using my data
how to add a meta pixel to website,How to add a meta pixel to website,howto,4,medium,volume_10+,,how to add meta pixel to website | how to add a meta pixel to website | how to add meta pixel | how to add meta pixel to wix website
how to setup meta pay,How to setup meta pay,howto,4,medium,volume_10+,,how to set up meta pay | how to setup meta pay | how to set up meta pay on messenger | how to set up meta pay on facebook
how to report an ad on facebook,How to report an ad on facebook,howto,4,medium,volume_10+,,how to report an ad on facebook | how to report an ad on facebook | how to report a scam ad on facebook | how to report scam ad on facebook
how to scale facebook ads,How to scale facebook ads,howto,4,medium,volume_10+,,how to resize video in facebook ads | how to resize video for facebook ads | how to scale facebook ads | how to do facebook video ads
how to run a meta ad,How to run a meta ad,howto,4,medium,volume_10+,,how to run a meta ad | how to run a meta ad | how to run a meta ad campaign | how to run a meta ad campaign
how to schedule a reel on meta business suite,How to schedule a reel on meta business suite,howto,4,medium,volume_10+,,how to schedule reels on instagram meta business suite | how to schedule reels on instagram meta business suite | how to schedule a reel on meta business suite | how to schedule reels on meta business suite
how to see ads you clicked on facebook,How to see ads you clicked on facebook,howto,4,medium,volume_10+,,how to see ads i've clicked on facebook | how to see ads i've clicked on facebook | how to see ads you clicked on facebook | how to see ads you clicked on facebook
how to see friends on facebook instead of ads,How to see friends on facebook instead of ads,howto,4,medium,volume_10+,,how to see friends on facebook instead of ads | how to see friends on facebook instead of ads | how to see friends posts on facebook instead of ads | how to see friends posts on facebook instead of ads
how to get meta business suite,How to get meta business suite,howto,4,medium,volume_10+,,how to see impressions on meta business suite | how to see impressions on meta business suite | how to get to meta business suite | how to get meta business suite
how to make an effective facebook ad,How to make an effective facebook ad,howto,4,medium,volume_10+,,how to setup effective facebook ad campaigns. | how to set up effective facebook ad campaigns. | how to create an effective facebook ad | how to make an effective facebook ad
how to create dynamic ads facebook,How to create dynamic ads facebook,howto,4,medium,volume_10+,,how to setup facebook dynamic product ads | how to set up facebook dynamic product ads | how to create dynamic ads on facebook | how to create dynamic ads facebook
how to spot fake facebook ads,How to spot fake facebook ads,howto,4,medium,volume_10+,,how to spot fake ads on facebook marketplace | how to spot fake ads on facebook marketplace | how to spot fake ads on facebook | how to spot fake facebook ads
how to block ad on facebook,How to block ad on facebook,howto,4,medium,volume_10+,,how to turn off ad blocker on facebook | how to turn off ad blocker on facebook | how to block ad on facebook | how to turn off ad on facebook
how to turn off oakley meta,How to turn off oakley meta,howto,4,medium,volume_10+,,how to turn off oakley meta | how to turn off oakley meta | how to turn off oakley meta vanguard | how to turn off oakley meta vanguard
how to turn off optimize text per person meta,How to turn off optimize text per person meta,howto,4,medium,volume_10+,,how to turn off optimize text per person meta | how to turn off optimize text per person meta | how to turn off optimize text per person meta ads | how to turn off optimize text per person meta ads
how to turn on oakley meta,How to turn on oakley meta,howto,4,medium,volume_10+,,how to turn on oakley meta | how to turn on oakley meta | how to turn on oakley meta vanguard | how to turn on oakley meta vanguard
how to use lookalike audience facebook ads,How to use lookalike audience facebook ads,howto,4,medium,volume_10+,,how to use lookalike audience facebook ads | how to use lookalike audience facebook ads | how to create lookalike audience facebook ads | how to create lookalike audience in facebook ads
how to verify phone number on facebook for ads,How to verify phone number on facebook for ads,howto,4,medium,volume_10+,,how to verify phone number on facebook for ads | how to verify phone number on facebook for ads | how to verify phone number to run ads on facebook | how to verify phone number to run ads on facebook
how to view ads meta ad library,How to view ads meta ad library,howto,4,medium,volume_10+,,how to view ads meta ad library | meta ad library how to view ads | how to view competitor ads meta ad library | meta ad library how to view competitor ads
how to write a meta title,How to write a meta title,howto,4,medium,volume_10+,,how to write meta title and description | how to write title and meta description | how to write meta title | how to write a meta title
how to write facebook ads,How to write facebook ads,howto,4,medium,volume_10+,,how to write facebook ads | how to write facebook ads | how to write facebook ads that convert | how to write facebook ads that convert
how to buy ray ban meta,How to buy ray ban meta,howto,4,medium,volume_10+,,how to buy meta ray ban display | how to buy ray ban meta display | how to buy ray ban meta | how to buy meta ray ban
how to go live on meta glasses,How to go live on meta glasses,howto,4,medium,volume_10+,,how to go live on instagram with meta glasses | how to go live with meta glasses on instagram | how to go live with meta glasses | how to go live on meta glasses
how to update meta quest link,How to update meta quest link,howto,4,medium,volume_10+,,how to update your meta quest link driver | how to update meta quest link drivers | how to update meta quest link | how to update meta quest drivers
how to change meta language,How to change meta language,howto,4,medium,volume_10+,,how to change language on meta quest 3 | how to change language on meta quest 2 | how to change language on meta | how to change meta language
how to set up meta ai,How to set up meta ai,howto,4,medium,volume_10+,,how to make meta ai nsfw | how to trick meta ai to generate nsfw | how to set up meta ai | how to get meta ai to generate nsfw
how to screen share meta quest 3,How to screen share meta quest 3,howto,4,medium,volume_10+,,how to screen share meta quest 3 | how to screen share on meta quest 3 | how to screen share meta quest 3 to tv | how to screen share meta quest 3 on discord
how to cancel meta pay,How to cancel meta pay,howto,4,medium,volume_10+,,how to cancel meta pay | how to cancel meta pay on facebook | how to cancel meta pay on iphone | how to cancel meta pay payment
how to add meta keywords,How to add meta keywords,howto,4,medium,volume_10+,,how to add meta keywords | how to add meta keywords in blogger | how to add meta keywords in website | how to add meta keywords in shopify
how to factory reset meta vr,How to factory reset meta vr,howto,4,medium,volume_10+,,how to factory reset meta vr headset | how to factory reset meta vr | how to reset meta vr headset | how to factory reset meta headset
