canonical_keyword,suggested_title,category,variant_count,signal_strength,source,frequency_count,all_variants
how to make a facebook ads,How to make a facebook ads,howto,104,high,volume_10+,,how to make ads on facebook | how to make facebook ads | how to make the best facebook ads | how to create facebook ads | how to make facebook ads | how to set up facebook ads | how to create facebook ads step by step | how to make ads on facebook | how to create ads on facebook | how to setup facebook ads | how to design facebook ads | how to create multiple ads on facebook | how to make a facebook ads | how to create a facebook ads | how to create ads in facebook
how to make a facebook ad,How to make a facebook ad,howto,99,high,volume_10+,,how to make a facebook ad? | how to create a facebook ad | how to make a facebook ad | how to create an ad on facebook | how to make an ad on facebook | how to create facebook ad | how to set up a facebook ad | how to design a facebook ad | how to make ad on facebook | how to make a ad on facebook | how to create ad on facebook | how to create an ad for facebook | how to make facebook ad | how to create a facebook ad step by step | how to setup a facebook ad
how to see a facebook page's ads,How to see a facebook page's ads,howto,99,high,volume_10+,,how to get the most out of facebook ads | how to get ads off facebook | how to see facebook ads | how to get ads on facebook | how to see ads on facebook | how to not see ads on facebook | how to view ads on facebook | how to view facebook ads | how to get all the ads off facebook | how to get ads off my facebook | how to get all ads off facebook | how to check ads on facebook | how to get the most out of facebook ads | how to get the ads off facebook | how to check facebook ads
how to delete a facebook ads account,How to delete a facebook ads account,howto,85,high,volume_10+,,how to get rid of ads on facebook | how to remove ads from facebook | how to get rid of facebook ads | how to get rid of all the ads on facebook | how to eliminate ads on facebook | how to remove ads on facebook | how to get rid of all ads on facebook | how to remove facebook ads | how to remove all ads from facebook | how to clear ads on facebook | how to delete ads on facebook | how to delete facebook ads | how to get rid of the ads on facebook | how to get rid of ads in facebook | how to remove ads in facebook
how to connect a meta quest 3 to pc,How to connect a meta quest 3 to pc,integration,83,high,volume_10+,,how to connect meta quest 3 to pc | connect meta quest 3 to pc | meta quest 3 connect to pc | how to connect meta quest 2 to pc | can meta quest 3 connect to pc | can the meta quest 3 connect to pc | can you connect meta quest 3 to pc | connect meta quest 2 to pc | how to link meta quest 3 to pc | can meta quest 2 connect to pc | can you connect meta quest 2 to pc | can you connect the meta quest 3 to pc | how to connect my meta quest 3 to my pc | how to link meta quest 2 to pc | connect pc to meta quest 3
how to run facebook ads,How to run facebook ads,howto,68,high,volume_10+,,how to run ads on facebook | how to run facebook ads step by step | how to run facebook ads | how to run ads on facebook | how to run facebook ads step by step | how to run facebook ads step by step guide | how to run facebook ads guide | how to run facebook ads effectively | how to run ads in facebook | how to run facebook ads tutorial | how to run ads on facebook and instagram | how to run facebook and instagram ads | how to run instagram ads without facebook | how to run ads on facebook and instagram | how to run ads on instagram without facebook
how to reset a meta quest,How to reset a meta quest,howto,63,high,volume_10+,,how to factory reset meta quest 2 | how to factory reset meta quest 3 | how to factory reset meta quest | how to factory reset a meta quest 3 | how to factory reset a meta quest 2 | how to factory reset a meta quest | how to factory reset meta quest 1 | how to factory reset your meta quest 2 | how to factory reset meta quest two | meta quest 3 how to factory reset | how to do factory reset on meta quest 2 | meta quest 3 factory reset steps | meta quest 3 factory reset how to | how to do a factory reset on meta quest 2 | how to factory reset my meta quest 2
how to stop facebook ads,How to stop facebook ads,howto,59,high,volume_10+,,how to stop ads on facebook | how to stop facebook ads | how to stop all the ads on facebook | how to stop all ads on facebook | how to stop ads in facebook | how to stop the ads on facebook | how to stop all facebook ads | how to pause facebook ads | how to stop all the facebook ads | how to stop ads from facebook | how to stop ads on facebook videos | how to stop facebook video ads | how to stop ads in facebook videos | how to stop video ads on facebook | how to stop facebook sponsored ads
how to use ray ban meta,How to use ray ban meta,howto,59,high,volume_10+,,how to use ray ban meta glasses | how to use meta ray ban glasses | ray ban meta glasses how to use | how to use the ray ban meta glasses | ray ban meta glasses tutorial | how to use my ray ban meta glasses | meta ray ban glasses how to use | how to use ray bans meta glasses | how to use the meta ray ban glasses | how to connect ray ban meta glasses | how to connect to ray ban meta glasses | how to connect meta ray ban glasses | how do you connect ray ban meta glasses | how to connect my ray ban meta glasses | ray ban meta glasses how to connect
how to block facebook ads,How to block facebook ads,howto,57,high,volume_10+,,how to block ads on facebook | how to turn off ads on facebook | how to block facebook ads | how to turn off facebook ads | how to block ads in facebook | how to block all ads on facebook | how to block ads from facebook | how to turn off ads in facebook | how to turn off all ads on facebook | how to disable ads on facebook | how to block all facebook ads | how to block ads facebook | how to disable ads in facebook | how to block all the ads on facebook | how to mute ads on facebook
how to connect a meta quest 2 to a tv,How to connect a meta quest 2 to a tv,integration,49,high,volume_10+,,how to connect meta quest 3 to tv | how to connect meta quest 2 to tv | how to connect meta quest to tv | connect meta quest 3 to tv | can you connect meta quest 3 to tv | how to connect a meta quest 2 to a tv | how to connect your meta quest 3 to your tv | meta quest 2 connect to tv | how to connect a meta quest 3 to a tv | connect meta quest 2 to tv | how to link meta quest 3 to tv | how to connect my meta quest 3 to my tv | can i connect my meta quest 3 to my tv | can i connect meta quest 3 to tv | how to connect the meta quest 3 to tv
how to connect a meta quest 3 controller,How to connect a meta quest 3 controller,integration,47,high,volume_10+,,how to connect meta quest 3 controller | how to connect meta quest 3 controllers | how to connect meta quest controller | how to connect controller to meta quest 3 | how to connect new meta quest 3 controller | how to connect controllers to meta quest 3 | how to connect a meta quest 3 controller | how to connect meta quest 2 controller | how to connect my controllers to my meta quest 3 | how to connect new controllers to meta quest 3 | how to connect meta quest controllers | connect controllers to meta quest 3 | can meta quest 3 controllers connect to quest 2 | how to connect your meta quest 3 controllers | how to connect controllers to meta quest
how to charge a meta quest 2,How to charge a meta quest 2,howto,46,high,volume_10+,,how to charge meta quest 3 controllers | how to charge meta quest 2 controllers | how to charge meta quest controllers | meta quest 3 how to charge controllers | meta quest 2 how to charge controllers | how to charge controllers for meta quest 2 | how to charge controllers for meta quest 3 | how to charge meta quest controller | how to charge a meta quest 2 controller | how to charge the meta quest 3 controllers | how to charge meta quest 3 controller | how to charge the meta quest 2 controllers | how to charge a meta quest 3 controller | meta quest how to charge controllers | how to charge your meta quest 3 controllers
how to mute meta ai,How to mute meta ai,howto,42,high,volume_10+,,how to turn off meta ai in whatsapp | how to disable meta ai on whatsapp | how to turn off meta ai on whatsapp | how to disable meta ai whatsapp | how to disable meta ai in whatsapp | how to turn off meta ai whatsapp | how to deactivate meta ai on whatsapp | how to block meta ai on whatsapp | disable meta ai whatsapp how to | meta ai whatsapp how to disable | how to disable meta ai from whatsapp | how to deactivate meta ai in whatsapp | whatsapp meta ai how to disable | how to use meta ai on whatsapp | how to use meta ai in whatsapp
how to connect meta to steam,How to connect meta to steam,integration,39,high,volume_10+,,how to connect meta quest 3 to steam | connect meta quest 3 to steam | how to link meta quest 3 to steam | connect steam to meta quest 3 | how to connect meta quest to steam | how to connect steam to meta quest 3 | how to connect meta quest 2 to steam | how to steam link to meta quest 3 | can the meta quest 3 connect to steam | meta quest 3 connect to steam | can you connect steam to meta quest 3 | how to link steam to meta quest 3 | connect meta quest 2 to steam | can you connect meta quest 3 to steam | can meta quest 3 connect to steam
how to cast a meta quest 3 to a tv,How to cast a meta quest 3 to a tv,howto,38,high,volume_10+,,how to cast meta quest 3 to tv | how to cast meta quest 2 to tv | how to cast meta quest to tv | how to cast a meta quest 3 to a tv | meta quest 3 how to cast to tv | how to cast my meta quest 3 to my tv | how to cast from meta quest 3 to tv | how to cast your meta quest 3 to your tv | how to cast my meta quest 2 to my tv | meta quest how to cast to tv | how to cast meta quest 3 on tv | meta quest 3 cast to tv how to | how to cast to tv from meta quest 3 | how to cast meta quest on tv | how to cast meta quest
how to pair a meta quest 3,How to pair a meta quest 3,howto,32,high,volume_10+,,how to pair meta quest 3 controller | how to pair meta quest 3 controllers | how to pair controllers to meta quest 3 | how to pair meta quest 2 controller | how to pair controllers meta quest 3 | how to pair new meta quest 3 controller | how to pair meta quest controllers | how to pair a meta quest 3 controller | meta quest 3 how to pair controllers | how to pair a new meta quest 3 controller | how to pair my meta quest 3 controllers | how to pair meta quest controller | how to pair controller to meta quest 3 | how to pair controllers to meta quest 2 | how to pair meta quest 2 controllers
how to meta ai on instagram,How to meta ai on instagram,howto,32,high,volume_10+,,how to turn off meta ai on instagram | how to disable meta ai on instagram | how to turn off meta ai instagram | how to block meta ai on instagram | how to disable meta ai in instagram | how to turn off meta ai in instagram | how to deactivate meta ai on instagram | how to disable meta ai instagram | instagram how to turn off meta ai | how to turn off instagram meta ai | how to turn off ai meta on instagram | how to use meta ai on instagram | how to use meta ai in instagram | how to use meta ai instagram | how to do meta ai on instagram
how to connect meta glasses,How to connect meta glasses,integration,31,high,volume_10+,,how to connect meta glasses | how to connect to meta glasses | connect meta glasses | how to connect my meta glasses | meta connect glasses | meta glasses connect | how to connect your meta glasses | how to connect the meta glasses | meta glasses how to connect | how do you connect meta glasses | how to connect meta glasses to phone | how do i connect my meta glasses to my phone | meta glasses connect to phone | how to connect my meta glasses to my phone | how to connect meta glasses to instagram
how to set up a meta quest 2,How to set up a meta quest 2,howto,29,high,volume_10+,,how to set up meta quest 2 | how to setup meta quest 2 | how to set up a meta quest 2 | how to set up meta quest 3 | how to set up meta quest | meta quest 2 how to set up | how to set up a meta quest 3 | how to set up the meta quest 3 | how to set up my meta quest 3 | meta quest how to set up | how to setup meta quest 3 | how to set up meta quest 2 on pc | how to set up meta quest 3 on pc | how to setup meta quest 3 on pc | how to make meta quest 3 more comfortable
how to update a meta quest 2,How to update a meta quest 2,howto,28,high,volume_10+,,how to change background on meta quest 3 | how to change meta quest background | how to change background on meta quest 2 | how to change background in meta quest 3 | how to change meta quest 3 background | how to change background meta quest 3 | how to change background in meta quest 2 | how to change your background on meta quest 3 | how to change meta quest 2 background | meta quest how to change background | how to change the background on meta quest 2 | how to change your background on meta quest 2 | meta quest 3 how to change background | how to change background meta quest 2 | meta quest 2 how to change background
how to use meta business suite,How to use meta business suite,howto,28,high,volume_10+,,how to use meta business suite | meta business suite tutorial | meta business suite how to use | how to use meta business suite | how to use meta business suite tutorial | how to use meta business suite tutorial | how to get out of meta business suite | how to get out of meta business suite | how to exit meta business suite | meta business suite tutorial guide 2025 | meta business suite guide tutorial 2025 | meta business suite tutorial 2025 | how to log into meta business suite | how to log out of meta business suite | how to log into meta business suite
how to connect facebook ads to google sheets,How to connect facebook ads to google sheets,integration,28,high,volume_10+,,connect facebook lead ads to google sheets | how to connect facebook lead ads to google sheets | connect facebook lead ads google sheets | connect facebook ads to google sheets | how to connect facebook ads to google sheets | connect facebook lead ads google sheets slack | connect facebook lead ads google sheets hubspot | connect facebook lead ads google sheets microsoft outlook | connect facebook lead ads google sheets mailchimp | connect facebook lead ads google sheets sendgrid | connect facebook lead ads google sheets sms | connect facebook lead ads google sheets leadconnector | connect facebook lead ads google sheets webhook | connect facebook lead ads google sheets pipedrive | connect facebook lead ads google sheets salesforce
how to delete meta ai,How to delete meta ai,howto,27,high,volume_10+,,how to remove meta ai from whatsapp | how to get rid of meta ai on whatsapp | how to delete meta ai on whatsapp | how to remove meta ai on whatsapp | how to remove meta ai whatsapp | how to delete meta ai in whatsapp | how to remove meta ai in whatsapp | how to delete meta ai from whatsapp | how to get rid of meta ai in whatsapp | how to uninstall meta ai from whatsapp | meta ai whatsapp how to remove | how to get rid of meta ai | how to delete meta ai | how to remove meta ai | how to uninstall meta ai
how to make a meta business account,How to make a meta business account,howto,25,high,volume_10+,,how to meta business manager create account | how to create meta business manager account | how to create a meta business manager account | create meta business manager account steps | create a meta business manager account steps | how to set up meta business manager account | how to set up a meta business manager account | meta business manager create account steps | create meta business manager account how to | create a meta business manager account how to | how to create a meta business account | how to create meta business account | how to set up a meta business account | how to make a meta business account | how to create a new meta business account
how to find facebook ads,How to find facebook ads,howto,24,high,volume_10+,,how to look up facebook ads | how to find facebook ads | how to find ads on facebook | how to search ads on facebook | how to search facebook ads | how to look up ads on facebook | how to look up facebook ads | how to search for ads on facebook | how to find old facebook ads | how to find competitors ads on facebook | how to find competitors facebook ads | how to find facebook ads of competitors | how to find competitor ads on facebook | how to find your competitors ads on facebook | how to find your competitors facebook ads
how to change meta controller battery,How to change meta controller battery,howto,23,high,volume_10+,,how to change meta quest 2 controller battery | how to change meta quest 3 controller battery | how to change battery in meta quest 3 controller | how to change battery on meta quest 3 controller | how to change battery in meta quest 2 controller | how to change meta quest controller batteries | how to change battery meta quest 3 controller | how to change batteries meta quest 3 controller | meta quest 2 how to change controller battery | how to change batteries in meta quest controller | how to change battery meta quest controller | how to change meta quest controller battery | how to change battery in meta quest controller | meta quest 3 how to change controller battery | how to change meta quest 2 controller batteries
how to watch porn on a meta quest,How to watch porn on a meta quest,howto,23,high,volume_10+,,how to watch porn on meta quest 3 | how to watch porn on meta quest | how to watch porn on meta quest 2 | how to watch porn with meta quest 3 | how to watch porn meta quest 2 | how to watch porn meta quest 3 | how to watch porn meta quest | meta quest 3 how to watch porn | how to watch porn on the meta quest 3 | how to watch porn in meta quest 3 | how to watch porn on a meta quest | how to watch porn in meta quest | how to watch vr porn on meta quest | how to watch vr porn on meta quest 3 | how to watch vr porn on meta quest 2
how to write a meta description,How to write a meta description,howto,23,high,volume_10+,,how to write meta descriptions for seo | how to write a meta description for seo | how to write meta description for seo | how to write seo meta description | how to write meta description seo best practices | how to write seo meta description best practices | how to write meta description seo | how to write a meta description | how to write meta descriptions | how to write meta description | meta description how to write | how to write the best meta description | how to write meta description best practices | how to write meta titles and descriptions for seo | how to write meta title and description for seo
how to make a meta account,How to make a meta account,howto,23,high,volume_10+,,how to create a meta account | how to make a meta account | how to create meta account | how to create a new meta account | how to set up a meta account | how to make a new meta account | how to make meta account | how to create a meta ad account | how to set up meta ad account | how to create meta ad account | how to set up a meta ad account | how to create a new ad account on meta | how to create an ad account on meta | how to create a new meta ad account | how to create a meta ads account
how to put facebook ads,How to put facebook ads,howto,22,high,volume_10+,,how to place facebook ads | how to put ads on facebook | how to place ads on facebook | how to add ads in facebook | how to add ads on facebook | how to put facebook ads | how to add funds in facebook ads | how to add funds to facebook ads | how to add funds on facebook ads | how to add funds in facebook ads | how to add funds for facebook ads | how to add emojis in facebook ads | how to put emojis in facebook ads | how to add emojis to facebook ads | how to add music in facebook ads
how to delete a facebook ad,How to delete a facebook ad,howto,21,high,volume_10+,,how to delete facebook ad account | how to delete ad account on facebook | how to delete an ad account on facebook | how to delete a facebook ad account | how to remove ad account from facebook | how to delete ad account facebook | how to delete ad accounts on facebook | how to delete a ad account on facebook | how to remove ad account on facebook | how to delete facebook ad | how to get rid of ad on facebook | how to delete an ad on facebook | how to delete a facebook ad | how to remove ad from facebook | how to delete ad on facebook
how to connect airpods to meta quest,How to connect airpods to meta quest,integration,21,high,volume_10+,,how to connect airpods to meta quest 3 | can you connect airpods to meta quest 3 | connect airpods to meta quest 3 | can you connect airpods to meta quest 2 | how to connect airpods to meta quest 2 | connect airpods to meta quest 2 | can airpods connect to meta quest 3 | can i connect airpods to meta quest 3 | how to connect airpods to meta quest | can you connect airpods to meta quest | how to connect airpods 4 to meta quest 3 | can i connect my airpods to my meta quest 3 | can you connect airpods to a meta quest 3 | connect airpods to meta quest | can i connect airpods to meta quest 2
how to wipe a meta quest 3,How to wipe a meta quest 3,howto,20,high,volume_10+,,how to delete apps on meta quest 3 | how to uninstall apps on meta quest 3 | how to delete apps on meta quest 2 | how to delete an app on meta quest 3 | how to delete apps from meta quest 3 | how to uninstall apps on meta quest 2 | how to uninstall meta quest app | how to clear meta quest 2 | how to wipe meta quest 3 | how to wipe meta quest 2 | how to wipe a meta quest 3 | how to erase meta quest 3 | how to wipe a meta quest 2 | how to uninstall apps on meta quest 3s | how to delete apps on meta quest 3s
meta ai integration,meta ai integration,integration,20,high,volume_10+,,meta ai whatsapp integration | whatsapp meta ai integration | meta ai integration whatsapp | meta ai integration with whatsapp | meta ai integration in whatsapp | meta ai whatsapp integration how to use | meta ai whatsapp integration meta ai on whatsapp | meta ai whatsapp integration guide | meta ai whatsapp meta ai integration whatsapp | meta ai whatsapp integration meta ai whatsapp | meta ai whatsapp integration 2025 | whatsapp meta ai integration 2025 | meta ai whatsapp business integration | whatsapp business meta ai integration | meta ai whatsapp integration features
how to enable developer mode meta quest,How to enable developer mode meta quest,howto,19,high,volume_10+,,how to enable developer mode on meta quest 2 | how to turn on developer mode on meta quest 2 | how to enable developer mode on meta quest 3 | how to enable developer mode meta quest 2 | how to enable developer mode on meta quest | how to enable developer mode meta quest 3 | how to turn on developer mode meta quest 2 | meta quest how to enable developer mode | enable developer mode meta quest 3 steps | enable developer mode meta quest how to | how to turn on developer mode on meta quest | how to turn on developer mode on meta quest 3 | how to enable developer mode meta quest | meta quest 3 developer mode enable steps | how to activate developer mode meta quest 3
how to connect meta quest 2 to ps5,How to connect meta quest 2 to ps5,integration,19,high,volume_10+,,can you connect meta quest 2 to ps5 | can i connect meta quest 3 to ps5 | can you connect a meta quest 2 to a ps5 | can the meta quest 2 connect to ps5 | can meta quest 2 connect to ps5 | can meta quest 3 connect to ps5 | can you connect meta quest 3 to ps5 | can you connect a meta quest 3 to ps5 | can i connect my meta quest 2 to my ps5 | can you connect the meta quest 3 to ps5 | can you connect meta quest to ps5 | can the meta quest 3 connect to ps5 | can a meta quest 2 connect to ps5 | can meta quest connect to ps5 | can a meta quest 3 connect to ps5
how to connect meta to phone,How to connect meta to phone,integration,18,high,volume_10+,,how to connect meta quest 2 to phone | how to connect meta quest 3 to phone | how to connect phone to meta quest 2 | how to connect phone to meta quest 3 | connect meta quest 2 to phone | meta quest 2 connect to phone | meta quest 3 connect to phone | connect phone to meta quest 3 | can i connect my phone to my meta quest 3 | connect phone to meta quest 2 | can i connect my phone to meta quest 3 | how to connect your meta quest 2 to your phone | connect meta quest 3 to phone | meta quest connect to phone | how to connect meta quest to phone
how to link instagram to meta business suite,How to link instagram to meta business suite,howto,17,high,volume_10+,,connect instagram to meta business suite | how to link instagram to meta business suite | how to connect instagram to meta business suite | meta business suite connect instagram | how to link instagram to meta business suite | how to connect meta business suite to instagram | connect meta business suite to instagram | connect instagram to meta business suite how to | how to connect instagram in meta business suite | how to connect instagram to facebook meta business suite | how to link instagram to facebook meta business suite | how to link instagram to facebook meta business suite | connect instagram to facebook meta business suite | meta business suite connect instagram account | connect instagram account to meta business suite
