canonical_keyword,suggested_title,category,variant_count,signal_strength,source,frequency_count,all_variants
how to add a meta description in wordpress,How to add a meta description in wordpress,howto,10,high,volume_10+,,how to add meta description in wordpress | how to add a meta description in wordpress | how to add meta description wordpress | wordpress how to add meta description | how to add meta descriptions in wordpress | how to add meta description tag in wordpress | how to add meta description | how to add meta description in wordpress without plugin | how to add keywords and meta descriptions in wordpress | how to add meta title and description in wordpress
how to create a pixel for facebook ads,How to create a pixel for facebook ads,howto,10,high,volume_10+,,how to create a pixel in facebook ads manager | how to create a facebook pixel in ads manager | how to create facebook pixel in ads manager | how to create a pixel on facebook ads manager | how to setup pixel in facebook ads | how to create a pixel for facebook ads | how to set up pixel on facebook ads | how to create pixel for facebook ads | how to setup facebook ads manager | how to set up facebook ads manager
how to meta events manager test events,How to meta events manager test events,howto,10,high,volume_10+,,meta events manager test events how to use | how to meta events manager test events | how to use meta events manager test events | meta events manager test events how to | meta events manager test events tool how to use | how to use meta events manager test events tool | test events tool meta events manager how to use | how to use meta events manager test events tab | meta events manager test events tab how to use | meta events manager test events how to test pixel
how to use meta ads manager,How to use meta ads manager,howto,10,high,volume_10+,,meta ads manager tutorial | how to use meta ads manager | how to use meta ads manager | meta ads manager how to use | how to login to meta ads manager | how to login to meta ads manager | meta ads manager tutorial for beginners | how to find meta ads manager | how to log out of meta ads manager | meta ads manager tutorial 2025
how to reduce facebook ads,How to reduce facebook ads,howto,10,high,volume_10+,,how to reduce ads on facebook | how to minimize ads on facebook | how to reduce facebook ads | how to reduce ads in facebook | how to reduce cpm facebook ads | how to reduce cpm on facebook ads | how to reduce cpm facebook ads | how to reduce facebook ads cost | how to reduce ads on facebook feed | how to reduce the number of ads on facebook
how to turn of meta ai,How to turn of meta ai,howto,10,high,volume_10+,,how to turn meta ai off | how to turn of meta ai | how to edit with meta ai | how to turn meta ai off on instagram | how to edit with meta ai instagram | how to turn of meta ai on instagram | how to turn meta ai off on facebook | how to turn of meta ai on facebook | how to edit photos with meta ai | how to use meta ai to edit photos
meta connect 2025 news,meta connect 2025 news,integration,10,high,volume_10+,,meta connect 2025 announcements news | meta connect 2025 news announcements | meta connect announcements 2025 news | meta connect 2025 news | meta connect news 2025 | meta connect 2025 announcements quest news | meta connect 2025 announcements quest 4 news | meta connect 2025 announcements news today | meta connect 2025 announcements ai glasses news | meta connect 2025 announcements ai news
how to integrate facebook lead ads with crm,How to integrate facebook lead ads with crm,integration,10,high,volume_10+,,facebook lead ads crm integration | how to integrate facebook lead ads with crm | crm integration with facebook lead ads | facebook lead ads zoho crm integration | zoho crm facebook lead ads integration | zoho crm integration with facebook lead ads | facebook lead ads agile crm integration | zoho crm facebook lead ads integration setup | zoho crm facebook lead ads integration native | zoho crm facebook lead ads integration 2025
how to add meta in wordpress,How to add meta in wordpress,howto,9,high,volume_10+,,how to add meta tags in wordpress | wordpress how to add meta tags | how to add meta tags to wordpress | how to add meta tags wordpress | how to insert meta tags in wordpress | how to add meta tags in wordpress without plugin | how to add meta tags in wordpress with plugin | how to add meta in wordpress | how to add meta tags in wordpress for beginners
how to find meta glasses,How to find meta glasses,howto,9,high,volume_10+,,how to find meta glasses | how to find my meta glasses | how to locate meta glasses | how to find your meta glasses | how to find lost meta glasses | how to find meta glasses if lost | lost meta glasses how to find | how to find rayban meta glasses | how to find meta glasses case
how to get prescription ray ban meta,How to get prescription ray ban meta,howto,9,high,volume_10+,,how to get prescription ray ban meta | how to get ray ban meta with prescription | how to get prescription meta ray bans | how to get ray ban meta prescription | how to get ray ban meta prescription glasses | how to get prescription ray ban meta glasses | how to get meta ray ban prescription glasses | how to get prescription lenses for ray ban meta | how to get prescription lenses for meta ray bans
how to run meta ads for a client,How to run meta ads for a client,howto,9,high,volume_10+,,how to run meta ads | how to run ads on meta | how to run meta ads step by step | how to run meta ads for a client | how to run meta ads for a client | how to run meta ads for beginners | how to run meta ads for beginners | how to run partnership ads in meta | how to run partnership ads in meta
how to use facebook lead ads,How to use facebook lead ads,howto,9,high,volume_10+,,how to use facebook lead ads | how to use facebook lead ads | facebook lead ads tutorial | facebook lead ads integration | integrate facebook lead ads | facebook leads ads integration | how to access leads from facebook ads | how to access leads from facebook ads | how to test facebook lead ads
how to play meta quest 2,How to play meta quest 2,howto,9,high,volume_10+,,how to play meta quest 2 | how to play meta quest 3 | how to play phasmophobia on meta quest 3 | how to play ps5 on meta quest 3 | how to play roblox on meta quest 2 | how to play fortnite on meta quest 3 | how to play xbox on meta quest 3 | how to play subnautica on meta quest 3 | how to play meta quest 3 on tv
how to buy meta quest games,How to buy meta quest games,howto,8,high,volume_10+,,how to buy meta quest games | how to buy meta quest 2 games | how to buy games for meta quest | how to buy games for meta quest 2 | how to buy games for meta quest 3 | how to buy meta quest 3 games | how to buy games on meta quest 3 | how to buy games on meta quest 2
how to hard reset a meta quest 2,How to hard reset a meta quest 2,howto,8,high,volume_10+,,how to hard reset meta quest 3 | how to hard reset meta quest 2 | how to hard reset a meta quest 2 | how to do a hard reset on meta quest 3 | how to hard reset a meta quest 3 | how to hard reset meta quest | how to do a hard reset on meta quest 2 | how to hard reset meta quest 3s
how to get meta glasses,How to get meta glasses,howto,8,high,volume_10+,,how to get prescription meta glasses | how to get meta glasses with prescription | how to get prescription in meta glasses | how to get meta glasses prescription | how to get prescription for meta glasses | how to get meta prescription glasses | how to get meta glasses | how to get prescription lenses for meta glasses
how to meta events manager create pixel,How to meta events manager create pixel,howto,8,high,volume_10+,,how to meta events manager create pixel | create a meta pixel events manager steps | meta events manager create pixel steps | create a meta pixel in events manager steps | create meta pixel in events manager steps | create meta pixel events manager steps | meta events manager create pixel steps 2025 | create meta pixel events manager steps 2025
how to schedule posts on meta business suite,How to schedule posts on meta business suite,howto,8,high,volume_10+,,how to use meta business suite to schedule posts | how to schedule posts on meta business suite | meta business suite schedule posts how to | how to schedule posts in meta business suite | how to use meta business suite to schedule posts | meta business suite schedule posts tutorial | how to schedule instagram posts in meta business suite | how to schedule instagram posts in meta business suite
how to stop meta ai,How to stop meta ai,howto,8,high,volume_10+,,how to stop meta from using my data for ai | how to stop meta using my data for ai | how to stop meta from using your data for ai | how to stop meta ai from using my data | how to stop meta using my data for ai | how to stop meta from using my data | how to stop meta from using my data | how to stop meta ai
how to open a meta quest 3 controller,How to open a meta quest 3 controller,howto,8,high,volume_10+,,how to open meta quest 3 controller | how to open meta quest 2 controller | how to open a meta quest 3 controller | how to open meta quest controller | how to open a meta quest 2 controller | how to open meta quest 2 controller battery | how to open meta quest 3 controller battery | how to open meta quest 3s controller
how to turn on meta quest,How to turn on meta quest,howto,8,high,volume_10+,,how to turn on meta quest 3 controller | how to turn on meta quest 2 controllers | how to turn on meta quest 3 controllers | how to turn on controllers meta quest 3 | how to turn on controllers for meta quest 3 | how to turn on meta quest 2 | how to turn on meta quest 3 | how to turn on meta quest
how to get a vpn on meta quest 3,How to get a vpn on meta quest 3,howto,8,high,volume_10+,,how to get vpn on meta quest 3 | how to get a vpn on meta quest 3 | how to get vpn on meta quest 2 | how to get vpn on meta quest | how to get a vpn on meta quest 2 | how to use vpn on meta quest 3 | how to use a vpn on meta quest 3 | how to use vpn on meta quest 2
how to change meta home,How to change meta home,howto,8,high,volume_10+,,how to change your home in meta quest 3 | how to change your meta quest home | how to change your home in meta quest 2 | how to change meta quest home | how to change home on meta quest 2 | how to change meta home | how to change your meta home | how to change home screen on meta quest 3
how to record meta glasses,How to record meta glasses,howto,8,high,volume_10+,,how to record on meta glasses | how to record with meta glasses | how to record meta glasses | meta glasses how to record | how to record video on meta glasses | how to record video with meta glasses | how to record longer on meta glasses | how to record on oakley meta glasses
how to give ad access on facebook,How to give ad access on facebook,howto,8,high,volume_10+,,how to give ad account access facebook | how to give access to ad account on facebook | how to give ad account access facebook | how to give access to facebook ad account | how to give ad access on facebook | how to give ad access on facebook | how to give agency access to facebook ad account | how to give agency access to facebook ad account
how to access meta ads manager,How to access meta ads manager,howto,8,high,volume_10+,,how to give meta ads manager access | how to give access to meta ads manager | how to give access to ads manager meta | how to give meta ads manager access | how to give someone access to meta ads manager | how to give someone access to meta ads manager | how to access meta ads manager | meta ads manager how to access
how to target facebook ads,How to target facebook ads,howto,8,high,volume_10+,,how to target facebook groups with ads | how to target groups in facebook ads | how to target facebook groups with ads | how to target groups on facebook ads | how to target facebook ads | facebook ads how to target | how to target with facebook ads | how to target ads on facebook
how to change meta email,How to change meta email,howto,8,high,volume_10+,,how to change meta email | how to change your meta email | how to change email on meta | how to change your email on meta | how to change email on meta account | how to change meta account email | how to change email for meta account | how to change email on meta quest
how to facebook ads manager,How to facebook ads manager,howto,8,high,volume_10+,,facebook ads manager tutorial | how to use facebook ads manager | how to facebook ads manager | facebook ads manager how to use | facebook ads manager tutorial 2025 | facebook ads manager tutorial for beginners | how to reset facebook ads manager | facebook ads manager tutorial screenshots
how to get a meta verified badge,How to get a meta verified badge,howto,8,high,volume_10+,,how to get meta verified | how to get verified on meta | meta verified how to get | how to get meta verified badge | how to get a meta verified badge | how to get meta verified on instagram | how to get meta verified for free | how to get meta verified without paying
how to find meta id,How to find meta id,howto,8,high,volume_10+,,how to find meta business id | how to find my meta business id | how to find your meta business id | how to find meta business manager id | how to find business manager id meta | how to find meta business portfolio id | how to find meta id | how to find business id in meta business suite
how to do facebook ads for beginners,How to do facebook ads for beginners,howto,8,high,volume_10+,,facebook ads tutorial for beginners | beginners tutorial for facebook ads | how to do facebook ads for beginners | facebook ads tutorial for beginners 2025 | facebook ads tutorial steps beginner 2025 | the best facebook ads tutorial for beginners 2025 | facebook ads tutorial for beginners youtube | facebook ads tutorial steps beginner 2026
how to use translation on meta glasses,How to use translation on meta glasses,howto,8,high,volume_10+,,how to do live translation on meta glasses | how to use live translation on meta glasses | how to use meta glasses for translation | how to use translation on meta glasses | how to start live translation on meta glasses | how to get live translation on meta glasses | how to turn on live translation on meta glasses | how to set up live translation on meta glasses
what meta connect pt hypernova meta,what meta connect pt hypernova meta,integration,8,high,volume_10+,,what meta connect september pt hypernova | meta connect september pt hypernova meta | what connect september pt hypernova meta | connect september pt hypernova meta ai | meta connect september pt hypernova ai | what meta connect september hypernova meta | what meta connect pt hypernova meta | what meta connect september pt meta
meta connect 2025 date september,meta connect 2025 date september,integration,8,high,volume_10+,,meta connect 2025 dates late september | meta connect 2025 dates late september 2025 | meta connect 2025 dates announced september 2025 | meta connect 2025 dates announced september | meta connect 2025 date september | meta connect 2025 date september 2025 | meta connect 2025 dates keynote september 2025 | meta connect 2025 dates september 17-18 2025
meta connect 2025 september 17 18,meta connect 2025 september 17 18,integration,8,high,volume_10+,,meta connect 2025 dates september 17 18 2025 | meta connect 2025 dates september 17 18 | meta connect 2025 dates september 17 2025 | meta connect 2025 date september 17 2025 | meta connect 2025 september 17 18 | meta connect 2025 september 17 18 2025 | meta connect 2025 september 17 2025 | meta connect 2025 dates september 17 18 official
connect facebook lead ads to gmail,connect facebook lead ads to gmail,integration,8,high,volume_10+,,connect facebook lead ads gmail pipedrive | connect facebook lead ads gmail salesforce | connect airtable facebook lead ads gmail | connect facebook lead ads gmail webhook | connect facebook lead ads gmail sms | connect facebook lead ads getresponse gmail | connect facebook lead ads gmail leadconnector | connect facebook lead ads to gmail
how to use meta glasses,How to use meta glasses,howto,7,high,volume_10+,,how to use meta glasses | meta glasses how to use | meta glasses tutorial | how to use the meta glasses | how to use my meta glasses | meta glasses how to | how to use your meta glasses
how to link an ad account to a facebook page,How to link an ad account to a facebook page,howto,7,high,volume_10+,,how to connect ad account to facebook page | how to link ad account to facebook page | how to connect ad account to facebook page | how to link an ad account to a facebook page | connect facebook page to ad account | how to connect facebook page to ad account | how to link ad account to facebook page
how to meta pay,How to meta pay,howto,7,high,volume_10+,,how to use meta pay | how to meta pay | how to pay with meta pay | how to pay with meta pay | how to do meta pay | how to meta pay | meta pay how to use
how to do a facebook ad,How to do a facebook ad,howto,7,high,volume_10+,,how to do a facebook ad | how to facebook ad | how to do an ad on facebook | how to ad on facebook | how to ad facebook | facebook ad tutorial | facebook ad how to
how to pair meta quest to phone,How to pair meta quest to phone,howto,7,high,volume_10+,,how to pair meta quest 2 to phone | how to pair meta quest 3 to phone | how to pair your meta quest 2 to your phone | how to pair your meta quest 3 to your phone | how to pair meta quest 2 with phone | how to pair meta quest to phone | how to pair meta quest 3s to phone
how to schedule a post on meta business suite,How to schedule a post on meta business suite,howto,7,high,volume_10+,,how to schedule a post on meta business suite | how to schedule a post in meta business suite | meta business suite schedule post how to | how to schedule post on meta business suite | how to schedule post in meta business suite | meta business suite schedule post tutorial | how to post on meta business suite
how to stop a facebook ad,How to stop a facebook ad,howto,7,high,volume_10+,,how to stop a facebook ad | how to pause a facebook ad | how to stop an ad on facebook | how to stop ad on facebook | how to stop facebook ad | how to pause facebook ad | how to stop ad payments on facebook
how to start a facebook ads agency,How to start a facebook ads agency,howto,7,high,volume_10+,,how to launch facebook ads | how to start facebook ads | how to start with facebook ads | how to launch facebook ads | facebook ads how to start | how to start a facebook ads agency | how to start a facebook ads agency
how to retarget facebook ads,How to retarget facebook ads,howto,7,high,volume_10+,,how to retarget ads on facebook | how to retarget facebook ads | how to retarget facebook ads | how to retarget on facebook ads | how to retarget ads on facebook | how to retarget audience in facebook ads | how to retarget audience on facebook ads
how to get meta ai,How to get meta ai,howto,7,high,volume_10+,,how to get meta ai on whatsapp | how to get meta ai in whatsapp | meta ai whatsapp how to get meta ai on whatsapp | meta ai on whatsapp how to get | meta ai whatsapp how to get | how to get meta ai | how to get meta ai on whatsapp iphone
how to refund a meta quest game,How to refund a meta quest game,howto,7,high,volume_10+,,how to refund games on meta quest 2 | how to refund meta quest games | how to refund a game on meta quest 2 | how to refund a game on meta quest 3 | how to refund a meta quest game | how to refund on meta quest | how to refund meta games
how to delete a game on meta quest 3,How to delete a game on meta quest 3,howto,7,high,volume_10+,,how to delete games on meta quest 3 | how to delete game on meta quest | how to delete games on meta quest 2 | how to uninstall games on meta quest 3 | how to delete a game on meta quest 3 | how to delete games on meta quest 3s | how to uninstall games on meta quest 3s
how to find meta serial number,How to find meta serial number,howto,7,high,volume_10+,,how to find meta quest 2 serial number | how to find meta quest 3 serial number | how to find serial number on meta quest 2 | how to find serial number on meta quest 3 | how to find meta quest serial number | how to find serial number on meta quest 3s | how to find meta serial number
how to check meta quest 3 storage,How to check meta quest 3 storage,howto,7,high,volume_10+,,how to check storage on meta quest 3 | how to check storage on meta quest 2 | how to get more storage on meta quest 2 | how to check meta quest 3 storage | how to get more storage on meta quest 3 | how to check storage on meta quest 3s | how to get more storage on meta quest 3s
how to download facebook ad video,How to download facebook ad video,howto,7,high,volume_10+,,how to download video from facebook ad library | how to download videos from facebook ad library | how to download facebook ad library videos | how to save video from facebook ad library | how to download facebook ad library video | how to download facebook ad videos | how to download facebook ad video
how to stream meta quest 3,How to stream meta quest 3,howto,7,high,volume_10+,,how to stream meta quest 3 to tv | how to stream meta quest 2 to tv | how to stream meta quest to tv | how to stream meta quest 3 on tv | how to stream meta quest 3s to tv | how to stream meta quest 3 to roku tv | how to stream meta quest 3
how to change meta description,How to change meta description,howto,7,high,volume_10+,,how to edit meta description in wordpress | how to change meta description in wordpress | how to update meta description in wordpress | how to change the meta description in wordpress | how to edit meta description in wordpress without plugin | how to change meta title and description in wordpress | how to change meta description
how to update meta app,How to update meta app,howto,7,high,volume_10+,,how to update apps on meta quest 3 | how to update meta quest app | how to update apps on meta quest 2 | how to update apps on meta quest | how to update meta quest link app | how to update meta app | how to change your pfp on meta quest app
how to use hands meta quest 3,How to use hands meta quest 3,howto,7,high,volume_10+,,how to use hands on meta quest 3 | how to use your hands on meta quest 3 | how to use hands in meta quest 3 | how to use hands meta quest 3 | how to switch to hands on meta quest 3 | how to use hands on meta quest 3s | how to use hand controls on meta quest 3
how to cancel a facebook ad,How to cancel a facebook ad,howto,7,high,volume_10+,,how to cancel facebook ad | how to cancel a facebook ad | how to cancel an ad on facebook | how to cancel ad on facebook | how to cancel a facebook ad boost | how to cancel facebook ad boost | how to cancel ad payment on facebook
how to add a page to meta business suite,How to add a page to meta business suite,howto,7,high,volume_10+,,how to add facebook page to meta business suite | how to add a facebook page to meta business suite | how to add facebook page to meta business suite | how to add page roles in meta business suite | how to add page roles in meta business suite | how to add a page to meta business suite | how to add page to meta business suite
how to turn on meta glasses,How to turn on meta glasses,howto,7,high,volume_10+,,how to turn on meta glasses | how to activate meta glasses | how to turn on my meta glasses | how to turn on oakley meta glasses | how to turn on meta ai glasses | how to turn on rayban meta glasses | how to turn on meta glasses gen 2
how to budget facebook ads,How to budget facebook ads,howto,7,high,volume_10+,,how to budget facebook ads | how to budget for facebook ads | how to budget facebook ads | how to increase budget in facebook ads | how to increase budget on facebook ads | how to determine budget for facebook ads | facebook ads how to decide on a budget
how to use meta ad library,How to use meta ad library,howto,7,high,volume_10+,,meta ad library how to use | how to use meta ad library | meta ad library tutorial | how to access meta ad library | meta ad library how to access | meta ad library how to use 2025 | meta ad library api how to use
how to give access to meta business suite,How to give access to meta business suite,howto,7,high,volume_10+,,how to give admin access on meta business suite | how to give admin access on meta business suite | how to give admin access to meta business suite | how to give access to meta business suite | how to give access to meta business suite | how to give someone access to meta business suite | how to give someone access to meta business suite
how to access facebook ads manager,How to access facebook ads manager,howto,7,high,volume_10+,,how to give facebook ads manager access | how to give access to facebook ads manager | how to give facebook ads manager access | how to give someone access in facebook ads manager | how to give someone access to facebook ads manager | how to access facebook ads manager | how to access ads manager on facebook
how to optimize facebook ads,How to optimize facebook ads,howto,7,high,volume_10+,,how to optimize facebook ads | how to optimize facebook ads | how to optimize ads on facebook | how to optimize facebook ads for conversions | how to optimize facebook ads for conversions | how to optimize your facebook ads for conversions | how to optimize facebook ads export
how to unpair a meta quest 2,How to unpair a meta quest 2,howto,7,high,volume_10+,,how to unpair meta quest 3 controllers | how to unpair meta quest 2 controller | how to unpair meta quest 3 controller | how to unpair meta quest 3 | how to unpair meta quest 2 | how to unpair a meta quest 2 | how to unpair and repair meta quest 3 controllers
