canonical_keyword,suggested_title,category,variant_count,signal_strength,source,frequency_count,all_variants
freshbooks quickbooks integration,freshbooks quickbooks integration,integration,6,high,volume_10+,,freshbooks quickbooks integration | freshbooks integrate with quickbooks | freshbooks integration with quickbooks | freshbooks and quickbooks integration | integrate freshbooks with quickbooks | quickbooks freshbooks integration
how to pay an invoice on freshbooks,How to pay an invoice on Freshbooks,howto,3,medium,volume_10+,,how to pay an invoice on freshbooks | how to pay invoice on freshbooks | how to pay freshbooks invoice
how to mark an invoice as paid in freshbooks,How to mark an invoice as paid in Freshbooks,howto,3,medium,volume_10+,,how to mark an invoice as paid in freshbooks | how to mark invoice as paid in freshbooks | freshbooks how to mark invoice as paid
freshbooks shopify integration,freshbooks shopify integration,integration,3,medium,volume_10+,,freshbooks shopify integration | shopify freshbooks integration | integrate freshbooks with shopify
freshbooks website integration,freshbooks website integration,integration,3,medium,volume_10+,,integrate freshbooks with website | integrate freshbooks into website | freshbooks website integration
how to switch from quickbooks to freshbooks,How to switch from quickbooks to Freshbooks,howto,2,low,volume_10+,,how to switch from quickbooks to freshbooks | how to switch from freshbooks to quickbooks
freshbooks hubspot integration,freshbooks hubspot integration,integration,2,low,volume_10+,,freshbooks hubspot integration | hubspot freshbooks integration
paychex freshbooks integration,paychex freshbooks integration,integration,2,low,volume_10+,,paychex freshbooks integration | freshbooks paychex integration
freshbooks xero integration,freshbooks xero integration,integration,2,low,volume_10+,,freshbooks xero integration | integrate freshbooks with xero
freshbooks integration apps,freshbooks integration apps,integration,2,low,volume_10+,,freshbooks integration with other apps | freshbooks integration apps
freshbooks time tracking integration,freshbooks time tracking integration,integration,2,low,volume_10+,,integrate time tracking with freshbooks | freshbooks time tracking integration
freshbooks google sheets integration,freshbooks google sheets integration,integration,2,low,volume_10+,,freshbooks classic google sheets integration | freshbooks google sheets integration
