canonical_keyword,suggested_title,category,variant_count,signal_strength,source,frequency_count,all_variants
how to create ai video with heygen,How to create ai video with heygen,howto,6,high,volume_10+,,heygen create ai avatar video tutorial | how to create ai avatar video with heygen | heygen create ai video tutorial | how to create ai video with heygen | heygen ai avatar video tutorial | heygen create avatar video tutorial
how to use heygen ai video generator,How to use heygen ai video generator,howto,4,medium,volume_10+,,heygen ai video generator how to use | heygen ai video generator tutorial | how to use heygen ai video generator tutorial | how to use heygen ai video generator
how to create avatar in heygen,How to create avatar in heygen,howto,4,medium,volume_10+,,heygen create avatar tutorial | heygen create avatar how to | heygen how to create avatar | how to create avatar in heygen
how to download a video from heygen,How to download a video from heygen,howto,4,medium,volume_10+,,how to download video from heygen | heygen download video tutorial | how to download a video from heygen | heygen how to download video
how to make videos in heygen,How to make videos in heygen,howto,4,medium,volume_10+,,heygen create video tutorial | heygen how to create video tutorial | how to make videos in heygen | heygen how to create video
how to use heygen ai,How to use heygen ai,howto,3,medium,volume_10+,,heygen ai tutorial | how to use heygen ai | heygen ai how to use
heygen canva integration,heygen canva integration,integration,3,medium,volume_10+,,heygen canva integration | canva heygen integration | heygen integration canva
heygen face swap how to,heygen face swap how to,other,3,medium,volume_10+,,heygen face swap tutorial | heygen face swap how to use | heygen face swap how to
heygen avatar creation steps,heygen avatar creation steps,other,3,medium,volume_10+,,heygen avatar creation tutorial | heygen avatar creation how to | heygen avatar creation steps
how to cancel heygen subscription,How to cancel heygen subscription,howto,2,low,volume_10+,,how to cancel heygen subscription | heygen cancel subscription how to
how to get heygen api key,How to get heygen api key,howto,2,low,volume_10+,,heygen api key how to get | how to get heygen api key
heygen zapier integration,heygen zapier integration,integration,2,low,volume_10+,,heygen zapier integration | zapier heygen integration
heygen hubspot integration,heygen hubspot integration,integration,2,low,volume_10+,,heygen hubspot integration | heygen integration hubspot
heygen shopify integration,heygen shopify integration,integration,2,low,volume_10+,,heygen shopify integration | heygen integration shopify
heygen elevenlabs integration,heygen elevenlabs integration,integration,2,low,volume_10+,,heygen elevenlabs integration | heygen integration with elevenlabs
make.com heygen integration,make.com heygen integration,integration,2,low,volume_10+,,make.com heygen integration | heygen make.com integration
n8n heygen integration,n8n heygen integration,integration,2,low,volume_10+,,n8n heygen integration | heygen n8n integration
heygen lti integration canvas,heygen lti integration canvas,integration,2,low,volume_10+,,heygen lti integration canvas | heygen lti canvas integration
heygen sora integration,heygen sora integration,integration,2,low,volume_10+,,heygen sora 2 integration | heygen sora integration
heygen elevenlabs voice integration,heygen elevenlabs voice integration,integration,2,low,volume_10+,,heygen elevenlabs voice integration | heygen integrate elevenlabs voice
heygen video creation steps,heygen video creation steps,other,2,low,volume_10+,,heygen video creation tutorial | heygen video creation steps
heygen create custom avatar how to,heygen create custom avatar how to,other,2,low,volume_10+,,heygen create custom avatar how to | heygen create custom avatar tutorial
heygen create avatar from photo how to,heygen create avatar from photo how to,other,2,low,volume_10+,,heygen create avatar from photo how to | heygen create avatar from photo tutorial
heygen talking photo tutorial,heygen talking photo tutorial,tutorial,2,low,volume_10+,,heygen talking photo tutorial | heygen talking photo how to use
heygen app tutorial,heygen app tutorial,tutorial,2,low,volume_10+,,heygen app how to use | heygen app tutorial
heygen video translate tutorial,heygen video translate tutorial,tutorial,2,low,volume_10+,,heygen video translate tutorial | heygen video translate how to use
heygen ai video creation tutorial,heygen ai video creation tutorial,tutorial,2,low,volume_10+,,heygen ai video creation tutorial | heygen ai avatar video creation tutorial
heygen create talking photo tutorial,heygen create talking photo tutorial,tutorial,2,low,volume_10+,,heygen create talking photo video tutorial | heygen create talking photo tutorial
