canonical_keyword,suggested_title,category,variant_count,signal_strength,source,frequency_count,all_variants
how to make page numbers indesign,How to make page numbers Indesign,howto,6,high,volume_10+,,how to make page numbers in indesign | how to set up page numbers in indesign | how to create page numbers in indesign | how to make page numbers indesign | how to make automatic page numbers in indesign | how to make page numbers start on page 2 indesign
how to number pages indesign,How to number pages Indesign,howto,5,high,volume_10+,,how to number pages in indesign | how to do page numbers in indesign | how to number pages indesign | how to number pages on indesign | how to do page numbers indesign
how to make a clipping mask in indesign,How to make a clipping mask in Indesign,howto,5,high,volume_10+,,how to make a clipping mask in indesign | how to make clipping mask in indesign | how to create a clipping mask in indesign | how to create clipping mask in indesign | how to make clipping mask indesign
how to make a drop cap in indesign,How to make a drop cap in Indesign,howto,5,high,volume_10+,,how to make a drop cap in indesign | how to create a drop cap in indesign | how to make drop cap in indesign | how to create drop cap in indesign | how to make drop caps in indesign
how to replace an image in indesign,How to replace an image in Indesign,howto,5,high,volume_10+,,how to replace an image in indesign | how to replace image in indesign | how to replace images in indesign | indesign how to replace image | how to replace image indesign
how to add an arrow in indesign,How to add an arrow in Indesign,howto,5,high,volume_10+,,how to add an arrow in indesign | how to add arrows in indesign | how to insert an arrow in indesign | how to add arrow in indesign | how to insert arrow in indesign
how to make a booklet in indesign,How to make a booklet in Indesign,howto,5,high,volume_10+,,how to make a booklet in indesign | how to set up a booklet in indesign | how to create a booklet in indesign | how to make booklet in indesign | how to make a booklet on indesign
how to move a page in indesign,How to move a page in Indesign,howto,5,high,volume_10+,,how to move pages in indesign | how to rearrange pages in indesign | how to reorder pages in indesign | how to move pages indesign | how to move a page in indesign
how to edit a parent page in indesign,How to edit a parent page in Indesign,howto,5,high,volume_10+,,how to edit parent page indesign | how to edit a parent page in indesign | how to rename parent pages in indesign | how to edit parent pages in indesign | how to rename a parent page in indesign
how to change background indesign,How to change background Indesign,howto,5,high,volume_10+,,how to change background in indesign | how to change the background in indesign | how to change background on indesign | how to change the background on indesign | how to change background indesign
how to resize an image in indesign without cropping,How to resize an image in Indesign without cropping,howto,5,high,volume_10+,,how to resize an image in indesign without cropping | how to resize image in indesign without cropping | indesign how to resize image without cropping | how to resize image indesign without cropping | how to resize images in indesign without cropping
how to make a magazine in indesign,How to make a magazine in Indesign,howto,5,high,volume_10+,,how to make a magazine in indesign | how to create a magazine in indesign | how to make a magazine on indesign | how to design a magazine in indesign | how to use indesign to make a magazine
how to make an indesign template,How to make an Indesign template,howto,5,high,volume_10+,,how to create a template in indesign | how to make a template in indesign | how to create an indesign template | how to create indesign templates | how to make an indesign template
how to make a spread in indesign,How to make a spread in Indesign,howto,5,high,volume_10+,,how to create a spread in indesign | how to make a spread in indesign | how to make a spread on indesign | how to create spreads in indesign | how to make spreads in indesign
how to place a pdf in indesign,How to place a pdf in Indesign,howto,5,high,volume_10+,,how to insert a pdf into indesign | how to insert pdf into indesign | how to place pdf in indesign | how to place a pdf in indesign | how to add pdf to indesign
how to add a text box in indesign,How to add a text box in Indesign,howto,5,high,volume_10+,,how to add a text box in indesign | how to add text box in indesign | how to insert a text box in indesign | how to insert text box in indesign | how to add padding to text box in indesign
how to print a booklet in indesign double sided,How to print a booklet in Indesign double sided,howto,5,high,volume_10+,,how to print double sided in indesign | how to print double sided on indesign | how to print double sided indesign | how to print indesign booklet double sided | how to print a booklet in indesign double sided
how to turn off hyphenation indesign,How to turn off hyphenation Indesign,howto,4,medium,volume_10+,,how to turn off hyphenation in indesign | indesign how to turn off hyphenation | how to turn off hyphenation indesign | how to disable hyphenation in indesign
how to curve text indesign,How to curve text Indesign,howto,4,medium,volume_10+,,how to curve text in indesign | how to curve text indesign | how to curve text on indesign | indesign how to curve text
how to underline text indesign,How to underline text Indesign,howto,4,medium,volume_10+,,how to underline text in indesign | how to underline text indesign | indesign how to underline text | how to underline text on indesign
how to highlight text indesign,How to highlight text Indesign,howto,4,medium,volume_10+,,how to highlight text in indesign | how to highlight text indesign | indesign how to highlight text | how to highlight text on indesign
how to add a bullet point in indesign,How to add a bullet point in Indesign,howto,4,medium,volume_10+,,how to add bullet points in indesign | how to add bullet points indesign | how to add bullet point in indesign | how to add a bullet point in indesign
how to change font color indesign,How to change font color Indesign,howto,4,medium,volume_10+,,how to change font color in indesign | how to change font color indesign | how to change font color on indesign | indesign how to change font color
how to remove hyphen in indesign,How to remove hyphen in Indesign,howto,4,medium,volume_10+,,how to get rid of hyphens in indesign | how to remove hyphens in indesign | how to remove hyphen in indesign | how to get rid of hyphen in indesign
how to open a pdf in indesign,How to open a pdf in Indesign,howto,4,medium,volume_10+,,how to open pdf in indesign | how to open a pdf in indesign | how to open pdf with indesign | how to open a pdf with indesign
how to warp text indesign,How to warp text Indesign,howto,4,medium,volume_10+,,how to warp text in indesign | how to warp text indesign | how to text warp in indesign | how to warp text on indesign
how to make columns in indesign,How to make columns in Indesign,howto,4,medium,volume_10+,,how to make columns in indesign | how to create columns in indesign | how to make two columns in indesign | how to create two columns in indesign
how to import a pdf to indesign,How to import a pdf to Indesign,howto,4,medium,volume_10+,,how to import pdf into indesign | how to import a pdf into indesign | how to import pdf to indesign | how to import a pdf to indesign
how to edit text indesign,How to edit text Indesign,howto,4,medium,volume_10+,,how to edit text in indesign | how to change text in indesign | how to edit text on indesign | how to edit text indesign
how to edit a table in indesign,How to edit a table in Indesign,howto,4,medium,volume_10+,,how to edit a table in indesign | how to edit table in indesign | how to edit tables in indesign | how to edit table indesign
how to add a bleed in indesign,How to add a bleed in Indesign,howto,4,medium,volume_10+,,how to add bleed in indesign | how to add bleeds in indesign | how to add a bleed in indesign | how to add bleed indesign
how to make a 2 page spread in indesign,How to make a 2 page spread in Indesign,howto,4,medium,volume_10+,,how to make a 2 page spread in indesign | how to make indesign pages not spreads | how to make a two page spread in indesign | how to make two page spread in indesign
how to link in indesign,How to link in Indesign,howto,4,medium,volume_10+,,how to hyperlink in indesign | how to link in indesign | how to hyperlink indesign | how to hyperlink on indesign
how to type on a path indesign,How to type on a path Indesign,howto,4,medium,volume_10+,,how to type on a path in indesign | how to type on path indesign | how to type on path in indesign | how to type on a path indesign
how to edit bullets in indesign,How to edit bullets in Indesign,howto,4,medium,volume_10+,,how to edit bullets in indesign | how to change bullets in indesign | how to adjust bullets in indesign | how to change bullet in indesign
how to resize indesign,How to resize Indesign,howto,4,medium,volume_10+,,how to resize in indesign | how to scale in indesign | how to resize on indesign | how to resize indesign
how to do a spell check in indesign,How to do a spell check in Indesign,howto,4,medium,volume_10+,,how to do spell check in indesign | how to use spell check in indesign | how to do a spell check in indesign | how to do spell check on indesign
how to make a chart in indesign,How to make a chart in Indesign,howto,4,medium,volume_10+,,how to make a chart in indesign | how to create a chart in indesign | how to make chart in indesign | how to make charts in indesign
how to duplicate an indesign file,How to duplicate an Indesign file,howto,4,medium,volume_10+,,how to duplicate an indesign file | how to duplicate indesign file | how to duplicate a file in indesign | how to duplicate file in indesign
how to make a transparent gradient in indesign,How to make a transparent gradient in Indesign,howto,4,medium,volume_10+,,how to make a transparent gradient in indesign | how to make transparent gradient in indesign | how to make gradient transparent in indesign | how to create a transparent gradient in indesign
how to make a shape in indesign,How to make a shape in Indesign,howto,4,medium,volume_10+,,how to make shapes in indesign | how to create shapes in indesign | how to make a shape in indesign | how to create a shape in indesign
how to edit baseline grid indesign,How to edit baseline grid Indesign,howto,4,medium,volume_10+,,how to edit baseline grid indesign | how to change baseline grid in indesign | how to adjust baseline grid in indesign | how to change the baseline grid in indesign
how to make a pie chart in indesign,How to make a pie chart in Indesign,howto,4,medium,volume_10+,,how to make a pie chart in indesign | how to create a pie chart in indesign | how to make pie chart in indesign | how to create pie chart in indesign
how to do a mail merge in indesign,How to do a mail merge in Indesign,howto,4,medium,volume_10+,,how to mail merge in indesign | how to do a mail merge in indesign | how to do mail merge in indesign | how to mail merge indesign
how to export one page in indesign,How to export one page in Indesign,howto,4,medium,volume_10+,,how to export one page in indesign | how to export only one page in indesign | how to export just one page in indesign | how to export one page from indesign
how to change the size of an indesign document,How to change the size of an Indesign document,howto,4,medium,volume_10+,,how to change document size in indesign | how to change the size of an indesign document | how to change document size indesign | how to change size of indesign document
how to cut an image in indesign,How to cut an image in Indesign,howto,4,medium,volume_10+,,how to cut out an image in indesign | how to cut an image in indesign | how to cut images in indesign | how to cut image in indesign
how to put an illustrator file into indesign,How to put an illustrator file into Indesign,howto,4,medium,volume_10+,,how to place illustrator file in indesign | how to put illustrator file into indesign | how to put an illustrator file into indesign | how to insert illustrator file into indesign
how to add a shape in indesign,How to add a shape in Indesign,howto,4,medium,volume_10+,,how to add shapes in indesign | how to add a shape in indesign | how to insert a shape in indesign | how to insert shapes in indesign
how to edit bleed in indesign,How to edit bleed in Indesign,howto,4,medium,volume_10+,,how to change bleed in indesign | how to change the bleed in indesign | how to adjust bleed in indesign | how to edit bleed in indesign
how to change the size of an image in indesign,How to change the size of an image in Indesign,howto,4,medium,volume_10+,,how to change the size of an image in indesign | how to change size of image in indesign | how to adjust image size in indesign | how to change image size in indesign
how to add text to indesign,How to add text to Indesign,howto,4,medium,volume_10+,,how to add text to indesign | how to embed text in indesign | how to add text in indesign | how to insert text in indesign
how to use scissor tool in indesign,How to use scissor tool in Indesign,howto,4,medium,volume_10+,,how to use the scissors tool in indesign | how to use the scissor tool in indesign | how to use scissors tool in indesign | how to use scissor tool in indesign
how to do a word count in indesign,How to do a word count in Indesign,howto,4,medium,volume_10+,,how to do a word count in indesign | how to count words in indesign | how to word count in indesign | how to do word count in indesign
how to add crop marks indesign,How to add crop marks Indesign,howto,4,medium,volume_10+,,how to add crop marks in indesign | how to add trim marks in indesign | how to add crop marks indesign | how to add bleed and crop marks in indesign
how to make an image smaller in indesign,How to make an image smaller in Indesign,howto,4,medium,volume_10+,,how to make an image smaller in indesign | how to make image smaller in indesign | how to make an image smaller on indesign | how to make an image smaller in indesign without cropping
how to make a big first letter in indesign,How to make a big first letter in Indesign,howto,4,medium,volume_10+,,how to make the first letter big in indesign | how to make first letter big in indesign | how to make a big first letter in indesign | how to make first letter of paragraph big indesign
how to make a book cover in indesign,How to make a book cover in Indesign,howto,4,medium,volume_10+,,how to make a book cover in indesign | how to create a book cover in indesign | how to design a book cover in indesign | how to create a book cover with spine in indesign
how to make an editable pdf in indesign,How to make an editable pdf in Indesign,howto,4,medium,volume_10+,,how to create editable pdf in indesign | how to make an editable pdf in indesign | how to create an editable pdf from indesign | how to create a pdf with editable fields indesign
how to add a drop shadow in indesign,How to add a drop shadow in Indesign,howto,4,medium,volume_10+,,how to add drop shadow in indesign | how to add a drop shadow in indesign | how to add a drop shadow to text in indesign | how to add drop shadow to text in indesign
how to package an indesign file with all links,How to package an Indesign file with all links,howto,4,medium,volume_10+,,how to package indesign file with links | how to package an indesign file with all links | how to package an indesign file with fonts and links | how to package indesign file with links and fonts
how to crop indesign,How to crop Indesign,howto,3,medium,volume_10+,,how to crop in indesign | how to crop on indesign | how to crop indesign
how to underline indesign,How to underline Indesign,howto,3,medium,volume_10+,,how to underline in indesign | how to underline indesign | how to underline on indesign
how to bold text indesign,How to bold text Indesign,howto,3,medium,volume_10+,,how to bold text in indesign | how to bold text indesign | how to bold text on indesign
how to highlight indesign,How to highlight Indesign,howto,3,medium,volume_10+,,how to highlight in indesign | how to highlight on indesign | how to highlight indesign
how to undo indesign,How to undo Indesign,howto,3,medium,volume_10+,,how to undo in indesign | how to undo on indesign | how to undo indesign
how to ungroup indesign,How to ungroup Indesign,howto,3,medium,volume_10+,,how to ungroup in indesign | how to ungroup indesign | how to ungroup on indesign
how to convert a pdf to indesign,How to convert a pdf to Indesign,howto,3,medium,volume_10+,,how to convert pdf to indesign | how to convert indesign to pdf | how to convert a pdf to indesign
how to find overset text indesign,How to find overset text Indesign,howto,3,medium,volume_10+,,how to find overset text indesign | indesign how to find overset text | how to find overset text in indesign
how to crop a photo in indesign,How to crop a photo in Indesign,howto,3,medium,volume_10+,,how to crop a photo in indesign | how to crop photo in indesign | how to crop photos in indesign
how to link an image in indesign,How to link an image in Indesign,howto,3,medium,volume_10+,,how to link images in indesign | how to link an image in indesign | how to link image in indesign
how to add a drop cap in indesign,How to add a drop cap in Indesign,howto,3,medium,volume_10+,,how to add a drop cap in indesign | how to add drop cap in indesign | how to add drop caps in indesign
how to make text go around an image in indesign,How to make text go around an image in Indesign,howto,3,medium,volume_10+,,how to make text go around an image in indesign | indesign how to make text go around an image | how to make text go around image in indesign
how to draw an arrow in indesign,How to draw an arrow in Indesign,howto,3,medium,volume_10+,,how to draw an arrow in indesign | how to draw arrow in indesign | how to draw arrows in indesign
how to change indesign to cmyk,How to change Indesign to cmyk,howto,3,medium,volume_10+,,how to change indesign to cmyk | how to change to cmyk in indesign | how to switch to cmyk in indesign
how to change color in indesign,How to change color in Indesign,howto,3,medium,volume_10+,,how to change color in indesign | how to change colors in indesign | how to change color on indesign
how to indent indesign,How to indent Indesign,howto,3,medium,volume_10+,,how to indent in indesign | how to indent indesign | how to indent on indesign
how to make a photo black and white in indesign,How to make a photo black and white in Indesign,howto,3,medium,volume_10+,,how to make a photo black and white in indesign | how to make photo black and white in indesign | how to make photos black and white in indesign
how to use tabs indesign,How to use tabs Indesign,howto,3,medium,volume_10+,,how to use tabs in indesign | how to do tabs in indesign | how to use tabs indesign
how to make text vertical indesign,How to make text vertical Indesign,howto,3,medium,volume_10+,,how to make text vertical in indesign | how to make vertical text in indesign | how to make text vertical indesign
how to import an image into indesign,How to import an image into Indesign,howto,3,medium,volume_10+,,how to import images into indesign | how to import an image into indesign | how to import image into indesign
how to add a font to adobe indesign,How to add a font to adobe Indesign,howto,3,medium,volume_10+,,how to add fonts to adobe indesign | how to add font to adobe indesign | how to add a font to adobe indesign
how to open an illustrator file in indesign,How to open an illustrator file in Indesign,howto,3,medium,volume_10+,,how to open illustrator file in indesign | how to open an illustrator file in indesign | how to open indesign file in illustrator
how to package indesign,How to package Indesign,howto,3,medium,volume_10+,,how to package in indesign | how to package indesign | how to package on indesign
how to use indesign templates,How to use Indesign templates,howto,3,medium,volume_10+,,how to use indesign templates | indesign template tutorial | how to use templates in indesign
how to install a font in indesign,How to install a font in Indesign,howto,3,medium,volume_10+,,how to install fonts in indesign | how to install fonts indesign | how to install a font in indesign
how to resize a page in indesign,How to resize a page in Indesign,howto,3,medium,volume_10+,,how to resize a page in indesign | how to resize page in indesign | how to resize pages in indesign
how to change indesign language,How to change Indesign language,howto,3,medium,volume_10+,,how to change language in indesign | how to change indesign language | how to change the language in indesign
how to edit pages in indesign,How to edit pages in Indesign,howto,3,medium,volume_10+,,how to edit pages in indesign | how to rename pages in indesign | how to switch pages in indesign
how to add a table of contents in indesign,How to add a table of contents in Indesign,howto,3,medium,volume_10+,,how to add table of contents in indesign | how to add a table of contents in indesign | how to insert table of contents in indesign
how to do a clipping mask in indesign,How to do a clipping mask in Indesign,howto,3,medium,volume_10+,,how to clipping mask in indesign | how to do clipping mask in indesign | how to do a clipping mask in indesign
how to make a newsletter in indesign,How to make a newsletter in Indesign,howto,3,medium,volume_10+,,how to create a newsletter in indesign | how to design a newsletter in indesign | how to make a newsletter in indesign
how to change text opacity in indesign,How to change text opacity in Indesign,howto,3,medium,volume_10+,,how to change opacity of text in indesign | how to change text opacity in indesign | how to change the opacity of text in indesign
how to remove a parent page in indesign,How to remove a parent page in Indesign,howto,3,medium,volume_10+,,how to remove parent page in indesign | how to remove a parent page in indesign | how to remove parent page from one page in indesign
how to vertically center text in indesign,How to vertically center text in Indesign,howto,3,medium,volume_10+,,indesign how to center text vertically | how to vertically center text in indesign | how to center text vertically in indesign
how to use pen tool indesign,How to use pen tool Indesign,howto,3,medium,volume_10+,,how to use the pen tool in indesign | how to use pen tool in indesign | how to use pen tool indesign
how to turn an image black and white in indesign,How to turn an image black and white in Indesign,howto,3,medium,volume_10+,,how to turn an image black and white in indesign | how to turn image black and white in indesign | how to change image to black and white in indesign
how to delete overset text in indesign,How to delete overset text in Indesign,howto,3,medium,volume_10+,,how to get rid of overset text in indesign | how to delete overset text in indesign | how to remove overset text in indesign
how to see errors in indesign,How to see errors in Indesign,howto,3,medium,volume_10+,,how to see errors in indesign | how to view errors in indesign | how to check errors in indesign
how to crop a picture in indesign,How to crop a picture in Indesign,howto,3,medium,volume_10+,,how to crop a picture in indesign | how to crop picture in indesign | how to crop pictures in indesign
how to resize an indesign document,How to resize an Indesign document,howto,3,medium,volume_10+,,how to resize a document in indesign | how to resize an indesign document | how to resize document in indesign
how to change the color of an image in indesign,How to change the color of an image in Indesign,howto,3,medium,volume_10+,,how to change the color of an image in indesign | how to change color of image in indesign | how to change image color in indesign
how to make a border in indesign,How to make a border in Indesign,howto,3,medium,volume_10+,,how to make a border in indesign | how to create a border in indesign | how to make a border on indesign
how to make grids in indesign,How to make grids in Indesign,howto,3,medium,volume_10+,,how to make grids in indesign | how to set up grids in indesign | how to create grids in indesign
how to make a parent page in indesign,How to make a parent page in Indesign,howto,3,medium,volume_10+,,how to make a parent page in indesign | how to create a parent page in indesign | how to make a page a parent page in indesign
how to open an indd file without indesign,How to open an indd file without Indesign,howto,3,medium,volume_10+,,how to open indd file without indesign | how to open an indd file without indesign | how to open indd files without indesign
how to use tables in indesign,How to use tables in Indesign,howto,3,medium,volume_10+,,how to use tables in indesign | indesign tables tutorial | indesign table tutorial
how to export an image from indesign,How to export an image from Indesign,howto,3,medium,volume_10+,,how to export an image from indesign | how to export image from indesign | how to export images from indesign
how to flatten an image in indesign,How to flatten an image in Indesign,howto,3,medium,volume_10+,,how to flatten images in indesign | how to flatten an image in indesign | how to flatten image in indesign
how to change font in indesign,How to change font in Indesign,howto,3,medium,volume_10+,,how to change all font in indesign | how to change font in indesign | how to change all fonts in indesign
how to export indesign,How to export Indesign,howto,3,medium,volume_10+,,how to export from indesign | how to export indesign | how to export in indesign
