canonical_keyword,suggested_title,category,variant_count,signal_strength,source,frequency_count,all_variants
how to merge shapes in indesign,How to merge shapes in Indesign,howto,2,low,volume_10+,,how to combine shapes in indesign | how to merge shapes in indesign
how to make a frame in indesign,How to make a frame in Indesign,howto,2,low,volume_10+,,how to create a frame in indesign | how to make a frame in indesign
how to make a gradient swatch in indesign,How to make a gradient swatch in Indesign,howto,2,low,volume_10+,,how to create a gradient swatch in indesign | how to make a gradient swatch in indesign
how to make a button in indesign,How to make a button in Indesign,howto,2,low,volume_10+,,how to create a button in indesign | how to make a button in indesign
how to flatten a pdf in indesign,How to flatten a pdf in Indesign,howto,2,low,volume_10+,,how to flatten pdf in indesign | how to flatten a pdf in indesign
how to color background in indesign,How to color background in Indesign,howto,2,low,volume_10+,,how to color the background in indesign | how to color background in indesign
how to make crop marks in indesign,How to make crop marks in Indesign,howto,2,low,volume_10+,,how to make crop marks in indesign | how to create crop marks in indesign
how to get adobe indesign for free,How to get adobe Indesign for free,howto,2,low,volume_10+,,how to get adobe indesign for free | how to get adobe indesign for free & cheap
how to align to baseline grid indesign,How to align to baseline grid Indesign,howto,2,low,volume_10+,,how to align text to baseline grid in indesign | how to align to baseline grid indesign
how to change indesign page size with content,How to change Indesign page size with content,howto,2,low,volume_10+,,how to change page size in indesign without affecting content | how to change indesign page size with content
how to save an indesign file as a jpeg,How to save an Indesign file as a jpeg,howto,2,low,volume_10+,,how to save indesign as jpeg | how to save an indesign file as a jpeg
how to get pantone colors in indesign,How to get pantone colors in Indesign,howto,2,low,volume_10+,,how to get pantone colors in indesign | how to get pantone colors in indesign 2024
how to snap to baseline grid in indesign,How to snap to baseline grid in Indesign,howto,2,low,volume_10+,,how to snap to baseline grid in indesign | how to snap text to baseline grid indesign
how to add a master page in indesign,How to add a master page in Indesign,howto,2,low,volume_10+,,how to add a master page in indesign | how to add text to master page indesign
how to use pantone connect in indesign,How to use pantone connect in Indesign,integration,2,low,volume_10+,,pantone connect indesign | how to use pantone connect in indesign
adobe indesign beginner tutorial,adobe indesign beginner tutorial,tutorial,2,low,volume_10+,,adobe indesign beginner tutorial | adobe indesign tutorial for beginners
interactive indesign tutorial,interactive indesign tutorial,tutorial,2,low,volume_10+,,interactive indesign tutorial | indesign interactive tutorial
