canonical_keyword,suggested_title,category,variant_count,signal_strength,source,frequency_count,all_variants
how to do a hanging indent in indesign,How to do a hanging indent in Indesign,howto,3,medium,volume_10+,,how to do hanging indent in indesign | how to do hanging indent on indesign | how to do a hanging indent in indesign
how to export a single page in indesign,How to export a single page in Indesign,howto,3,medium,volume_10+,,how to export single page in indesign | how to export a single page from indesign | how to export a single page in indesign
how to view pages in indesign,How to view pages in Indesign,howto,3,medium,volume_10+,,how to preview pages in indesign | how to preview page in indesign | how to view pages in indesign
how to do a table of contents in indesign,How to do a table of contents in Indesign,howto,3,medium,volume_10+,,indesign table of contents tutorial | how to do table of contents in indesign | how to do a table of contents in indesign
how to make a trifold brochure in indesign,How to make a trifold brochure in Indesign,howto,3,medium,volume_10+,,how to make a trifold brochure in indesign | how to create a trifold brochure in indesign | how to set up a trifold brochure in indesign
how to use indesign for beginners,How to use Indesign for beginners,howto,3,medium,volume_10+,,indesign tutorial beginner | indesign beginner tutorial | how to use indesign for beginners
how to add a border in indesign,How to add a border in Indesign,howto,3,medium,volume_10+,,how to add border in indesign | how to add a border in indesign | how to add borders in indesign
how to convert an indesign file to pdf,How to convert an Indesign file to pdf,howto,3,medium,volume_10+,,how to convert an indesign file to pdf | how to convert indesign file to pdf | how to convert pdf to indesign file
how to edit bullet points in indesign,How to edit bullet points in Indesign,howto,3,medium,volume_10+,,how to edit bullet points in indesign | how to change bullet points in indesign | how to change bullet point color in indesign
how to make a text wrap in indesign,How to make a text wrap in Indesign,howto,3,medium,volume_10+,,how to make text wrap in indesign | how to make a text wrap in indesign | how to make text ignore text wrap in indesign
how to remove page numbers in indesign,How to remove page numbers in Indesign,howto,3,medium,volume_10+,,how to remove page numbers in indesign | how to delete page numbers in indesign | how to remove page number from first page indesign
how to place a multi page pdf in indesign,How to place a multi page pdf in Indesign,howto,3,medium,volume_10+,,how to place a multi page pdf in indesign | how to place multi page pdf in indesign | how to place multiple page pdf in indesign
how to export pdf in cmyk indesign,How to export pdf in cmyk Indesign,howto,3,medium,volume_10+,,how to export indesign to cmyk pdf print | how to export indesign to pdf for print | how to export pdf in cmyk indesign
how to make indesign file cmyk,How to make Indesign file cmyk,howto,3,medium,volume_10+,,how to make sure indesign file is cmyk | how to make sure indesign is in cmyk | how to make indesign file cmyk
indesign step and repeat,indesign step and repeat,other,3,medium,volume_10+,,indesign step and repeat | step and repeat indesign | step and repeat in indesign
how to turn off facing pages indesign,How to turn off facing pages Indesign,howto,2,low,volume_10+,,how to turn off facing pages in indesign | how to turn off facing pages indesign
how to italicize in indesign,How to italicize in Indesign,howto,2,low,volume_10+,,how to italicize in indesign | how to italicize on indesign
how to turn on spell check indesign,How to turn on spell check Indesign,howto,2,low,volume_10+,,how to turn on spell check in indesign | how to turn on spell check indesign
how to bold in indesign,How to bold in Indesign,howto,2,low,volume_10+,,how to bold in indesign | how to bold on indesign
how to turn off hyphen in indesign,How to turn off hyphen in Indesign,howto,2,low,volume_10+,,how to turn off hyphens in indesign | how to turn off hyphen in indesign
how to align text in indesign,How to align text in Indesign,howto,2,low,volume_10+,,how to center text in indesign | how to align text in indesign
how to make rounded corners in indesign,How to make rounded corners in Indesign,howto,2,low,volume_10+,,how to make rounded corners in indesign | how to create rounded corners in indesign
how to layout a book in indesign,How to layout a book in Indesign,howto,2,low,volume_10+,,how to layout a book in indesign | indesign book layout tutorial
how to group in indesign,How to group in Indesign,howto,2,low,volume_10+,,how to group in indesign | how to group on indesign
how to remove hyphenation in indesign,How to remove hyphenation in Indesign,howto,2,low,volume_10+,,how to remove hyphenation in indesign | how to get rid of hyphenation in indesign
how to check spelling indesign,How to check spelling Indesign,howto,2,low,volume_10+,,how to check spelling in indesign | how to check spelling indesign
how to rotate text indesign,How to rotate text Indesign,howto,2,low,volume_10+,,how to rotate text in indesign | how to rotate text indesign
how to edit a pdf in indesign,How to edit a pdf in Indesign,howto,2,low,volume_10+,,how to edit a pdf in indesign | how to edit pdf in indesign
how to run a spell check in indesign,How to run a spell check in Indesign,howto,2,low,volume_10+,,how to run spell check in indesign | how to run a spell check in indesign
how to make text curve indesign,How to make text curve Indesign,howto,2,low,volume_10+,,how to make text curve in indesign | how to make text curve indesign
how to outline a stroke in indesign,How to outline a stroke in Indesign,howto,2,low,volume_10+,,how to outline stroke in indesign | how to outline a stroke in indesign
how to type vertically in indesign,How to type vertically in Indesign,howto,2,low,volume_10+,,how to type vertically in indesign | how to write vertically in indesign
how to use gradient tool in indesign,How to use gradient tool in Indesign,howto,2,low,volume_10+,,how to use gradient tool in indesign | how to use the gradient tool in indesign
how to stop hyphenation in indesign,How to stop hyphenation in Indesign,howto,2,low,volume_10+,,how to stop hyphenation in indesign | indesign how to stop hyphenation
how to update indesign,How to update Indesign,howto,2,low,volume_10+,,how to update indesign | how to edit in indesign
how to convert illustrator to indesign,How to convert illustrator to Indesign,howto,2,low,volume_10+,,how to convert illustrator to indesign | how to convert indesign to illustrator
how to view indesign without lines,How to view Indesign without lines,howto,2,low,volume_10+,,how to view indesign without lines | how to preview indesign without lines
how to make a rounded rectangle in indesign,How to make a rounded rectangle in Indesign,howto,2,low,volume_10+,,how to make a rounded rectangle in indesign | how to make rounded rectangle in indesign
how to round rectangle corners in indesign,How to round rectangle corners in Indesign,howto,2,low,volume_10+,,how to round rectangle corners in indesign | how to round corners of rectangle in indesign
how to export an interactive pdf from indesign,How to export an interactive pdf from Indesign,howto,2,low,volume_10+,,how to export interactive pdf indesign | how to export an interactive pdf from indesign
how to make a portfolio in indesign,How to make a portfolio in Indesign,howto,2,low,volume_10+,,how to make a portfolio in indesign | how to create a portfolio in indesign
how to make a zine in indesign,How to make a zine in Indesign,howto,2,low,volume_10+,,how to make a zine in indesign | how to make a zine on indesign
how to duplicate in indesign,How to duplicate in Indesign,howto,2,low,volume_10+,,how to duplicate in indesign | how to duplicate on indesign
how to create outline in indesign,How to create outline in Indesign,howto,2,low,volume_10+,,how to create outlines in indesign | how to create outline in indesign
how to embed fonts in pdf indesign,How to embed fonts in pdf Indesign,howto,2,low,volume_10+,,how to embed fonts in pdf indesign | how to embed fonts in indesign pdf
how to send a packaged indesign file,How to send a packaged Indesign file,howto,2,low,volume_10+,,how to send a packaged indesign file | how to send packaged indesign file
how to add a background color in indesign,How to add a background color in Indesign,howto,2,low,volume_10+,,how to add background color in indesign | how to add a background color in indesign
how to change indesign to rgb,How to change Indesign to rgb,howto,2,low,volume_10+,,how to change indesign to rgb | how to change to rgb in indesign
how to make a curved line in indesign,How to make a curved line in Indesign,howto,2,low,volume_10+,,how to make a curved line in indesign | how to make curved lines in indesign
how to flip an image in indesign,How to flip an image in Indesign,howto,2,low,volume_10+,,how to flip an image in indesign | how to flip image in indesign
how to change bullet style in indesign,How to change bullet style in Indesign,howto,2,low,volume_10+,,how to change bullet style in indesign | indesign how to change bullet style
how to adjust kerning in indesign,How to adjust kerning in Indesign,howto,2,low,volume_10+,,how to adjust kerning in indesign | how to change kerning in indesign
how to fix missing font in indesign,How to fix missing font in Indesign,howto,2,low,volume_10+,,how to fix missing fonts in indesign | how to fix missing font in indesign
how to make a calendar in indesign,How to make a calendar in Indesign,howto,2,low,volume_10+,,how to make a calendar in indesign | how to create a calendar in indesign
how to find word count in indesign,How to find word count in Indesign,howto,2,low,volume_10+,,how to find word count in indesign | how to find word count on indesign
how to add a gradient in indesign,How to add a gradient in Indesign,howto,2,low,volume_10+,,how to add a gradient in indesign | how to add gradient in indesign
how to make a dotted line in indesign,How to make a dotted line in Indesign,howto,2,low,volume_10+,,how to make a dotted line in indesign | how to make dotted line in indesign
how to draw a curved line in indesign,How to draw a curved line in Indesign,howto,2,low,volume_10+,,how to draw a curved line in indesign | how to draw curved lines in indesign
how to replace missing font in indesign,How to replace missing font in Indesign,howto,2,low,volume_10+,,how to replace missing fonts in indesign | how to replace missing font in indesign
how to remove the background of a picture in indesign,How to remove the background of a picture in Indesign,howto,2,low,volume_10+,,how to remove the background of a picture in indesign | how to remove background from picture in indesign
how to add another page in indesign,How to add another page in Indesign,howto,2,low,volume_10+,,how to add another page in indesign | how to add another page on indesign
how to export indesign to powerpoint,How to export Indesign to powerpoint,howto,2,low,volume_10+,,how to export indesign to powerpoint | how to export from indesign to powerpoint
how to export illustrator to indesign,How to export illustrator to Indesign,howto,2,low,volume_10+,,how to export from illustrator to indesign | how to export illustrator to indesign
how to rotate in indesign,How to rotate in Indesign,howto,2,low,volume_10+,,how to rotate in indesign | how to rotate on indesign
how to make a copy of indesign file,How to make a copy of Indesign file,howto,2,low,volume_10+,,how to make a copy of an indesign file | how to make a copy of indesign file
how to find error in indesign,How to find error in Indesign,howto,2,low,volume_10+,,how to find errors in indesign | how to find error in indesign
how to center text in a text box in indesign,How to center text in a text box in Indesign,howto,2,low,volume_10+,,how to center text in text box indesign | how to center text in a text box in indesign
how to make an image transparent in indesign,How to make an image transparent in Indesign,howto,2,low,volume_10+,,how to make an image transparent in indesign | how to make image transparent in indesign
how to make a picture black and white in indesign,How to make a picture black and white in Indesign,howto,2,low,volume_10+,,how to make a picture black and white in indesign | how to make picture black and white in indesign
how to make an index in indesign,How to make an index in Indesign,howto,2,low,volume_10+,,how to create an index in indesign | how to make an index in indesign
how to draw in indesign,How to draw in Indesign,howto,2,low,volume_10+,,how to draw in indesign | how to draw on indesign
how to make a text box in indesign,How to make a text box in Indesign,howto,2,low,volume_10+,,how to create a text box in indesign | how to make a text box in indesign
how to make a catalog in indesign,How to make a catalog in Indesign,howto,2,low,volume_10+,,how to make a catalog in indesign | how to create a catalog in indesign
how to remove facing pages in indesign,How to remove facing pages in Indesign,howto,2,low,volume_10+,,how to remove facing pages in indesign | how to get rid of facing pages indesign
how to shrink an image in indesign,How to shrink an image in Indesign,howto,2,low,volume_10+,,how to shrink an image in indesign | how to shrink image in indesign
how to change bullet color in indesign,How to change bullet color in Indesign,howto,2,low,volume_10+,,how to change bullet color in indesign | how to change color of bullets in indesign
how to edit a template in indesign,How to edit a template in Indesign,howto,2,low,volume_10+,,how to edit indesign template | how to edit a template in indesign
how to do a pull quote in indesign,How to do a pull quote in Indesign,howto,2,low,volume_10+,,how to do a pull quote in indesign | how to do pull quotes in indesign
how to add a background in indesign,How to add a background in Indesign,howto,2,low,volume_10+,,how to add a background in indesign | how to add background in indesign
how to redo in indesign,How to redo in Indesign,howto,2,low,volume_10+,,how to redo in indesign | how to redo on indesign
how to edit artboard size in indesign,How to edit artboard size in Indesign,howto,2,low,volume_10+,,how to change artboard size in indesign | how to edit artboard size in indesign
how to link text in indesign,How to link text in Indesign,howto,2,low,volume_10+,,how to hyperlink text in indesign | how to link text in indesign
how to export a spread in indesign,How to export a spread in Indesign,howto,2,low,volume_10+,,how to export spreads in indesign | how to export a spread in indesign
how to make a graph in indesign,How to make a graph in Indesign,howto,2,low,volume_10+,,how to make a graph in indesign | how to create a graph in indesign
how to export indesign as spreads,How to export Indesign as spreads,howto,2,low,volume_10+,,how to export indesign as spreads | how to export as spreads in indesign
how to change leading in indesign,How to change leading in Indesign,howto,2,low,volume_10+,,how to change leading in indesign | how to adjust leading in indesign
how to make a mask in indesign,How to make a mask in Indesign,howto,2,low,volume_10+,,how to create a mask in indesign | how to make a mask in indesign
how to relink an image in indesign,How to relink an image in Indesign,howto,2,low,volume_10+,,how to relink images in indesign | how to relink an image in indesign
how to make a fillable pdf in indesign,How to make a fillable pdf in Indesign,howto,2,low,volume_10+,,how to make a fillable pdf in indesign | how to create a fillable pdf in indesign
how to see dpi in indesign,How to see dpi in Indesign,howto,2,low,volume_10+,,how to check dpi in indesign | how to see dpi in indesign
how to draw a shape in indesign,How to draw a shape in Indesign,howto,2,low,volume_10+,,how to draw a shape in indesign | how to draw shapes in indesign
how to wrap text around an object in indesign,How to wrap text around an object in Indesign,howto,2,low,volume_10+,,how to wrap text around an object in indesign | how to wrap text around object in indesign
how to draw a triangle in indesign,How to draw a triangle in Indesign,howto,2,low,volume_10+,,how to draw a triangle in indesign | how to draw triangle in indesign
how to open a pdf in indesign to edit,How to open a pdf in Indesign to edit,howto,2,low,volume_10+,,how to open a pdf in indesign to edit | how to open pdf in indesign to edit
how to apply a master page in indesign,How to apply a master page in Indesign,howto,2,low,volume_10+,,how to apply master page in indesign | how to apply a master page in indesign
how to flatten an indesign file,How to flatten an Indesign file,howto,2,low,volume_10+,,how to flatten indesign file | how to flatten an indesign file
how to crop a shape in indesign,How to crop a shape in Indesign,howto,2,low,volume_10+,,how to crop a shape in indesign | how to crop shape in indesign
how to replace a photo in indesign,How to replace a photo in Indesign,howto,2,low,volume_10+,,how to replace a photo in indesign | how to replace photo in indesign
how to share an indesign file,How to share an Indesign file,howto,2,low,volume_10+,,how to share indesign files | how to share an indesign file
how to share an indesign file for editing,How to share an Indesign file for editing,howto,2,low,volume_10+,,how to share an indesign file for editing | how to share indesign files for editing
how to use master pages in indesign,How to use master pages in Indesign,howto,2,low,volume_10+,,how to use master pages in indesign | indesign master pages tutorial
how to use type on a path tool in indesign,How to use type on a path tool in Indesign,howto,2,low,volume_10+,,how to use type on a path tool in indesign | how to use type on path tool indesign
how to add a baseline grid in indesign,How to add a baseline grid in Indesign,howto,2,low,volume_10+,,how to add baseline grid indesign | how to add a baseline grid in indesign
how to export indesign to pdf high quality,How to export Indesign to pdf high quality,howto,2,low,volume_10+,,how to export indesign to pdf high quality | how to export high quality pdf from indesign
how to superscript in indesign,How to superscript in Indesign,howto,2,low,volume_10+,,how to superscript in indesign | how to do superscript in indesign
how to send an indesign file with links,How to send an Indesign file with links,howto,2,low,volume_10+,,how to send an indesign file with links | how to send indesign file with links
how to make a modular grid in indesign,How to make a modular grid in Indesign,howto,2,low,volume_10+,,how to create a modular grid in indesign | how to make a modular grid in indesign
how to put an image in a shape in indesign,How to put an image in a shape in Indesign,howto,2,low,volume_10+,,how to place an image in a shape in indesign | how to put an image in a shape in indesign
how to use eyedropper tool in indesign,How to use eyedropper tool in Indesign,howto,2,low,volume_10+,,how to use eyedropper tool in indesign | how to use the eyedropper tool in indesign
how to make a magazine spread in indesign,How to make a magazine spread in Indesign,howto,2,low,volume_10+,,how to set up a magazine spread in indesign | how to make a magazine spread in indesign
how to undo on adobe indesign,How to undo on adobe Indesign,howto,2,low,volume_10+,,how to undo on adobe indesign | how to undo in adobe indesign
how to layout a magazine in indesign,How to layout a magazine in Indesign,howto,2,low,volume_10+,,how to layout a magazine in indesign | indesign magazine layout tutorial
how to make an ebook in indesign,How to make an ebook in Indesign,howto,2,low,volume_10+,,how to create an ebook in indesign | how to make an ebook in indesign
how to recover an indesign file,How to recover an Indesign file,howto,2,low,volume_10+,,how to recover indesign file | how to recover an indesign file
how to add lorem ipsum in indesign,How to add lorem ipsum in Indesign,howto,2,low,volume_10+,,how to insert lorem ipsum in indesign | how to add lorem ipsum in indesign
how to print a book in indesign,How to print a book in Indesign,howto,2,low,volume_10+,,how to print a book in indesign | how to print a book from indesign
how to change line spacing in indesign,How to change line spacing in Indesign,howto,2,low,volume_10+,,how to change line spacing in indesign | how to adjust line spacing in indesign
how to wrap text around a shape in indesign,How to wrap text around a shape in Indesign,howto,2,low,volume_10+,,how to wrap text around a shape in indesign | how to wrap text around shape in indesign
how to turn of hyphenation in indesign,How to turn of hyphenation in Indesign,howto,2,low,volume_10+,,how to turn hyphenation off in indesign | how to turn of hyphenation in indesign
how to export an indesign file to pdf,How to export an Indesign file to pdf,howto,2,low,volume_10+,,how to export indesign file to pdf | how to export an indesign file to pdf
how to convert indesign to cmyk,How to convert Indesign to cmyk,howto,2,low,volume_10+,,how to convert indesign to cmyk | how to convert to cmyk in indesign
how to put a photoshop file into indesign,How to put a photoshop file into Indesign,howto,2,low,volume_10+,,how to put a photoshop file into indesign | how to put photoshop file into indesign
how to make a fillable form in indesign,How to make a fillable form in Indesign,howto,2,low,volume_10+,,how to make a fillable form in indesign | how to create a fillable form in indesign
how to open a photoshop file in indesign,How to open a photoshop file in Indesign,howto,2,low,volume_10+,,how to open photoshop file in indesign | how to open a photoshop file in indesign
how to go back in indesign,How to go back in Indesign,howto,2,low,volume_10+,,how to go back in indesign | how to go back on indesign
how to delete a link in indesign,How to delete a link in Indesign,howto,2,low,volume_10+,,how to remove hyperlink in indesign | how to delete a link in indesign
how to reset indesign preferences,How to reset Indesign preferences,howto,2,low,volume_10+,,how to reset indesign preferences | how to reset preferences in indesign
how to open indesign files,How to open Indesign files,howto,2,low,volume_10+,,how to open indesign files | how to open indesign file without indesign
how to get rid of orphans and widows in indesign,How to get rid of orphans and widows in Indesign,howto,2,low,volume_10+,,how to get rid of orphans and widows in indesign | how to get rid of widows and orphans in indesign
how to print preview in indesign,How to print preview in Indesign,howto,2,low,volume_10+,,how to print preview in indesign | how to see print preview in indesign
how to blur an image in indesign,How to blur an image in Indesign,howto,2,low,volume_10+,,how to blur image in indesign | how to blur an image in indesign
how to make an image bigger in indesign,How to make an image bigger in Indesign,howto,2,low,volume_10+,,how to make image bigger in indesign | how to make an image bigger in indesign
how to turn an indesign file into a pdf,How to turn an Indesign file into a pdf,howto,2,low,volume_10+,,how to turn indesign file into pdf | how to turn an indesign file into a pdf
how to make rows in indesign,How to make rows in Indesign,howto,2,low,volume_10+,,how to create rows in indesign | how to make rows in indesign
how to change an image in indesign,How to change an image in Indesign,howto,2,low,volume_10+,,how to change image in indesign | how to change an image in indesign
how to see page size in indesign,How to see page size in Indesign,howto,2,low,volume_10+,,how to check page size in indesign | how to see page size in indesign
how to create paragraph styles in indesign,How to create paragraph styles in Indesign,howto,2,low,volume_10+,,how to create paragraph styles in indesign | how to set up paragraph styles in indesign
how to insert a page break in indesign,How to insert a page break in Indesign,howto,2,low,volume_10+,,how to insert a page break in indesign | how to insert page break in indesign
how to move an anchor point in indesign,How to move an anchor point in Indesign,howto,2,low,volume_10+,,how to move an anchor point in indesign | how to move anchor points in indesign
how to open idml file in indesign,How to open idml file in Indesign,howto,2,low,volume_10+,,how to open idml file without indesign | how to open idml file in indesign
how to add shadow to text indesign,How to add shadow to text Indesign,howto,2,low,volume_10+,,how to add shadow to text indesign | how to add shadow to text in indesign
how to move illustrator file to indesign,How to move illustrator file to Indesign,howto,2,low,volume_10+,,how to move illustrator file to indesign | how to transfer illustrator file to indesign
how to make a book in adobe indesign,How to make a book in adobe Indesign,howto,2,low,volume_10+,,how to create a book in adobe indesign | how to make a book in adobe indesign
how to resize a photo in indesign,How to resize a photo in Indesign,howto,2,low,volume_10+,,how to resize photo in indesign | how to resize a photo in indesign
how to use liquid layout indesign,How to use liquid layout Indesign,howto,2,low,volume_10+,,indesign liquid layout tutorial | how to use liquid layout indesign
how to convert an illustrator file to indesign,How to convert an illustrator file to Indesign,howto,2,low,volume_10+,,how to convert an illustrator file to indesign | how to convert illustrator file to indesign
how to create bleed in indesign,How to create bleed in Indesign,howto,2,low,volume_10+,,how to create bleed in indesign | how to set up bleed in indesign
