canonical_keyword,suggested_title,category,variant_count,signal_strength,source,frequency_count,all_variants
how to add a page number in indesign,How to add a page number in Indesign,howto,36,high,volume_10+,,how to add page numbers in indesign | how to insert page numbers in indesign | how to add page numbers indesign | how to add page number in indesign | how to put page numbers in indesign | how to add page numbers to indesign | indesign how to add page numbers | how to add page numbers on indesign | how to add page number indesign | how to insert page number in indesign | how to insert page numbers indesign | how to add a page number in indesign | how to put page numbers on indesign | how to add page number on indesign | how to add numbers to pages in indesign
how to add an image in indesign,How to add an image in Indesign,howto,26,high,volume_10+,,how to insert an image in indesign | how to insert image in indesign | how to embed images in indesign | how to insert images in indesign | how to add an image in indesign | how to place an image in indesign | how to add images in indesign | how to add image in indesign | how to embed an image in indesign | how to add an image to indesign | how to insert image into indesign | how to add images to indesign | how to insert an image into indesign | how to embed image in indesign | how to add image to indesign
how to make a table indesign,How to make a table Indesign,howto,18,high,volume_10+,,how to make a table in indesign | how to create a table in indesign | how to make a grid in indesign | how to create a grid in indesign | how to make tables in indesign | how to make table in indesign | how to create table in indesign | how to create tables in indesign | how to make a table indesign | how to create a table indesign | how to set up a grid in indesign | how to make a grid on indesign | how to make a table on indesign | how to create a table on indesign | how to make grid in indesign
how to change a page size in indesign,How to change a page size in Indesign,howto,18,high,volume_10+,,how to change page size in indesign | how to edit page size in indesign | how to change page size indesign | how to change indesign page size | how to change the size of a page in indesign | indesign how to change page size | how to change the page size in indesign | how to change the size of one page in indesign | how to change a page size in indesign | how to change page sizes in indesign | how to change page size on indesign | how to change one page size in indesign | how to edit page size indesign | how to adjust page size in indesign | how to change size of one page in indesign
how to add a link in indesign,How to add a link in Indesign,howto,17,high,volume_10+,,how to add a hyperlink in indesign | how to embed links in indesign | how to add hyperlink in indesign | how to add a link in indesign | how to add link in indesign | how to insert hyperlink in indesign | how to embed a link in indesign | how to insert link in indesign | how to add links in indesign | how to insert a hyperlink in indesign | how to insert a link in indesign | how to add links to indesign | how to embed link in indesign | how to add link to indesign | how to add a link to indesign
how to add a font to indesign,How to add a font to Indesign,howto,15,high,volume_10+,,how to add fonts to indesign | how to embed fonts in indesign | how to add font to indesign | how to add a font to indesign | how to add fonts in indesign | how to embed font in indesign | how to embed fonts indesign | how to embed a font in indesign | how to add a font in indesign | how to embed font indesign | how to add fonts on indesign | how to add fonts indesign | how to add font in indesign | how to add fonts into indesign | indesign how to embed fonts
how to add a page in indesign,How to add a page in Indesign,howto,15,high,volume_10+,,how to add pages in indesign | how to add a page in indesign | how to add page in indesign | how to add a page on indesign | how to add a new page in indesign | how to add more pages in indesign | how to add page on indesign | how to add pages to indesign | how to insert a page in indesign | how to add a page to indesign | how to insert pages in indesign | how to add pages indesign | how to add page indesign | how to add new page in indesign | how to add pages on indesign
how to add a photo in indesign,How to add a photo in Indesign,howto,15,high,volume_10+,,how to insert a photo in indesign | how to insert photo in indesign | how to add a photo in indesign | how to insert a photo into indesign | how to add photo to indesign | how to insert photo indesign | how to insert photos in indesign | how to add photos in indesign | how to add photos to indesign | how to add photo in indesign | how to place a photo in indesign | how to insert a photo on indesign | how to insert photo into indesign | how to embed photos in indesign | how to add a photo to indesign
how to add a video to indesign,How to add a video to Indesign,howto,13,high,volume_10+,,how to embed a video in indesign | how to embed video in indesign | how to add video to indesign | how to insert video into indesign | how to add a video to indesign | how to insert a video in indesign | how to put video in indesign | how to put a video in indesign | how to place a video in indesign | how to add a video in indesign | how to insert a video into indesign | how to insert video in indesign | how to add video in indesign
how to text wrap an image in indesign,How to text wrap an image in Indesign,howto,13,high,volume_10+,,how to wrap text around an image in indesign | how to wrap text around image in indesign | how to wrap text around image indesign | indesign how to wrap text around image | how to text wrap around an image in indesign | how to wrap text around an image indesign | how to make text wrap around an image in indesign | how to make text wrap around image in indesign | indesign how to make text wrap around image | how to make text wrap around an image indesign | how to make text wrap around image indesign | how to text wrap image in indesign | how to text wrap an image in indesign
how to resize an image indesign,How to resize an image Indesign,howto,12,high,volume_10+,,how to resize an image in indesign | how to resize image in indesign | how to resize images in indesign | how to scale an image in indesign | indesign how to resize image | how to scale images in indesign | how to scale image in indesign | how to resize image indesign | how to resize image on indesign | how to resize an image on indesign | how to resize an image indesign | how to resize images indesign
how to add a picture in indesign,How to add a picture in Indesign,howto,12,high,volume_10+,,how to insert a picture in indesign | how to add a picture in indesign | how to insert picture in indesign | how to insert a picture into indesign | how to insert pictures into indesign | how to insert a picture on indesign | how to add pictures in indesign | how to place a picture in indesign | indesign how to insert picture | how to add a picture to indesign | how to insert pictures in indesign | how to add pictures to indesign
how to change the color of a gradient in indesign,How to change the color of a gradient in Indesign,howto,12,high,volume_10+,,how to change gradient color in indesign | how to change color of gradient in indesign | how to change the color of a gradient in indesign | how to change gradient colors in indesign | how to change the gradient color in indesign | how to change gradient color indesign | how to change colors in gradient indesign | how to change color gradient in indesign | how to edit gradient colors in indesign | indesign how to change gradient color | how to change color of gradient feather indesign | how to change gradient feather color in indesign
how to change background color indesign,How to change background color Indesign,howto,12,high,volume_10+,,how to change background color in indesign | how to change background color on indesign | how to change background color indesign | how to change the background color in indesign | how to change the background color on indesign | how to change indesign background color | indesign how to change background color | how to change color of background in indesign | how to change background color on adobe indesign | how to change background color in adobe indesign | adobe indesign how to change background color | how to change background color in indesign on mac
how to do a text wrap in indesign,How to do a text wrap in Indesign,howto,11,high,volume_10+,,how to text wrap in indesign | how to wrap text in indesign | how to do text wrap in indesign | how to wrap text indesign | how to text wrap indesign | how to do a text wrap in indesign | how to use text wrap in indesign | how to text wrap on indesign | how to do text wrap on indesign | how to do text wrap indesign | how to wrap text on indesign
how to upload a font to indesign,How to upload a font to Indesign,howto,11,high,volume_10+,,how to import fonts into indesign | how to import font into indesign | how to upload fonts to indesign | how to import a font into indesign | how to upload font to indesign | how to load fonts into indesign | how to upload fonts into indesign | how to upload a font to indesign | how to import font to indesign | how to import fonts in indesign | how to import fonts to indesign
how to change the color of a page in indesign,How to change the color of a page in Indesign,howto,11,high,volume_10+,,how to change page color in indesign | how to change page color indesign | how to change the color of a page in indesign | how to change the page color in indesign | how to change color of page in indesign | how to change page color on indesign | how to change indesign page color | indesign how to change page color | how to change the color of the page in indesign | how to change page background color in indesign | how to change page color in adobe indesign
how to change an indesign file from rgb to cmyk,How to change an Indesign file from rgb to cmyk,howto,11,high,volume_10+,,how to change rgb to cmyk in indesign | how to change from rgb to cmyk in indesign | how to change indesign from cmyk to rgb | how to change cmyk to rgb in indesign | how to change indesign from rgb to cmyk | how to change cmyk to rgb indesign | how to change rgb to cmyk indesign | how to change from cmyk to rgb in indesign | how to change indesign file from rgb to cmyk | how to change an indesign file from rgb to cmyk | how to change indesign file from cmyk to rgb
how to save indesign as a pdf,How to save Indesign as a pdf,howto,11,high,volume_10+,,how to save indesign as pdf | how to save indesign as a pdf | how to download indesign as pdf | how to save an indesign as a pdf | how to save an indesign file as a pdf | how to save indesign file as pdf | how to save a indesign file as a pdf | how to download an indesign file as a pdf | how to save an indesign document as a pdf | how to save indesign document as pdf | how to save adobe indesign as pdf
how to crop an image indesign,How to crop an image Indesign,howto,10,high,volume_10+,,how to crop an image in indesign | how to crop image in indesign | how to crop images in indesign | how to crop an image on indesign | how to crop image indesign | indesign how to crop image | how to crop an image indesign | how to crop image on indesign | how to crop images on indesign | how to crop images indesign
how to copy a page in indesign,How to copy a page in Indesign,howto,10,high,volume_10+,,how to duplicate a page in indesign | how to duplicate page in indesign | how to duplicate pages in indesign | how to copy a page in indesign | how to copy pages in indesign | how to copy page in indesign | indesign how to duplicate a page | how to duplicate page indesign | how to duplicate a page indesign | how to duplicate a page on indesign
how to make a book indesign,How to make a book Indesign,howto,10,high,volume_10+,,how to make a book in indesign | how to create a book in indesign | how to set up a book in indesign | how to design a book in indesign | how to use indesign to make a book | how to set up indesign for a book | how to make book in indesign | how to create book in indesign | how to make a book indesign | how to make a book on indesign
how to print a booklet indesign,How to print a booklet Indesign,howto,10,high,volume_10+,,how to print a booklet in indesign | how to print booklet in indesign | how to print a booklet from indesign | how to print booklet indesign | how to print booklet from indesign | how to print indesign booklet | indesign how to print booklet | how to print a booklet on indesign | how to print booklet on indesign | how to print a booklet indesign
how to package a indesign file,How to package a Indesign file,howto,9,high,volume_10+,,how to package an indesign file | how to package indesign file | how to package a file in indesign | how to package files in indesign | how to package indesign files | how to package file in indesign | indesign how to package a file | how to package a indesign file | how to package multiple indesign files
how to link text boxes indesign,How to link text boxes Indesign,howto,9,high,volume_10+,,how to link text boxes in indesign | how to connect text boxes in indesign | how to connect two text boxes in indesign | how to link two text boxes in indesign | indesign connect text boxes | how to link text boxes indesign | indesign how to connect text boxes | connect text boxes indesign | indesign how to link text boxes
how to make an arrow indesign,How to make an arrow Indesign,howto,9,high,volume_10+,,how to make an arrow in indesign | how to create an arrow in indesign | how to make arrow in indesign | how to make arrows in indesign | how to make an arrow indesign | how to make an arrow on indesign | how to create arrow in indesign | how to make arrow indesign | how to create arrows in indesign
how to make a table of contents indesign,How to make a table of contents Indesign,howto,9,high,volume_10+,,how to make a table of contents in indesign | how to create a table of contents in indesign | how to make table of contents in indesign | how to create table of contents in indesign | how to set up a table of contents in indesign | how to make table of contents indesign | how to create table of contents indesign | how to set up table of contents in indesign | how to make a table of contents indesign
how to make a qr code indesign,How to make a qr code Indesign,howto,9,high,volume_10+,,how to make a qr code in indesign | how to create a qr code in indesign | how to make qr code in indesign | how to create qr code in indesign | how to generate a qr code in indesign | how to generate qr code in indesign | how to make a qr code indesign | how to make a qr code on indesign | how to create a qr code in adobe indesign
how to make an image black and white indesign,How to make an image black and white Indesign,howto,8,high,volume_10+,,how to make an image black and white in indesign | how to make image black and white in indesign | how to make images black and white in indesign | how to make image black and white indesign | indesign how to make image black and white | how to make an image black and white indesign | how to make an image in indesign black and white | how to make an image black and white on indesign
how to make a gradient indesign,How to make a gradient Indesign,howto,8,high,volume_10+,,how to make a gradient in indesign | how to create a gradient in indesign | how to make gradient in indesign | how to create gradient in indesign | how to make gradients in indesign | how to make a gradient indesign | how to make a gradient on indesign | how to make gradient indesign
how to add a grid in indesign,How to add a grid in Indesign,howto,8,high,volume_10+,,how to insert a table in indesign | how to insert table in indesign | how to add a table in indesign | how to insert table indesign | how to add grid in indesign | how to add a grid in indesign | how to add table in indesign | how to insert a table into indesign
how to change text color indesign,How to change text color Indesign,howto,8,high,volume_10+,,how to change text color in indesign | how to change color of text in indesign | how to change text color indesign | how to change the color of text in indesign | how to change text color on indesign | how to change the text color in indesign | indesign how to change text color | how to change text color in adobe indesign
how to edit a master page in indesign,How to edit a master page in Indesign,howto,8,high,volume_10+,,how to edit master page in indesign | how to edit a master page in indesign | how to edit master pages in indesign | how to edit the master page in indesign | how to change master page in indesign | indesign how to edit master page | how to edit master page indesign | how to edit text in indesign master page
how to remove background of an image in indesign,How to remove background of an image in Indesign,howto,8,high,volume_10+,,how to remove background from image in indesign | how to remove background of image in indesign | how to remove image background in indesign | how to remove the background of an image in indesign | how to remove background from image indesign | how to remove background of an image in indesign | indesign how to remove background from image | how to remove white background from image in indesign
how to use adobe indesign,How to use adobe Indesign,howto,7,high,volume_10+,,adobe indesign tutorial | how to use adobe indesign | adobe tutorial indesign | indesign adobe tutorial | indesign tutorial adobe | tutorial adobe indesign | adobe indesign how to
how to preview indesign,How to preview Indesign,howto,7,high,volume_10+,,how to preview in indesign | how to preview on indesign | how to preview indesign | how to view indesign preview | how to see preview in indesign | indesign how to preview | how to view in indesign
how to make a triangle indesign,How to make a triangle Indesign,howto,7,high,volume_10+,,how to make a triangle in indesign | how to make triangle in indesign | how to create a triangle in indesign | how to make a triangle on indesign | how to create triangle in indesign | how to make a triangle indesign | how to make triangles in indesign
how to round corners indesign,How to round corners Indesign,howto,7,high,volume_10+,,how to round corners in indesign | how to round corners indesign | how to round one corner in indesign | indesign how to round corners | how to round corners on indesign | how to round corner in indesign | how to round only one corner in indesign
how to delete a page in indesign,How to delete a page in Indesign,howto,7,high,volume_10+,,how to delete a page in indesign | how to delete pages in indesign | how to delete page in indesign | how to remove pages in indesign | how to delete a page on indesign | how to remove a page in indesign | how to delete pages on indesign
how to remove a background in indesign,How to remove a background in Indesign,howto,7,high,volume_10+,,how to remove background in indesign | how to remove background on indesign | how to remove a background in indesign | how to remove background indesign | how to delete background in indesign | how to get rid of background in indesign | how to remove a background on indesign
how to save as a pdf in indesign,How to save as a pdf in Indesign,howto,7,high,volume_10+,,how to export indesign to pdf | how to save as pdf on indesign | how to save as pdf indesign | how to save as pdf in indesign | how to save as a pdf in indesign | how to export pdf in indesign | how to export pdf from indesign
how to make a brochure indesign,How to make a brochure Indesign,howto,7,high,volume_10+,,how to make a brochure in indesign | how to design a brochure in indesign | how to create a brochure in indesign | how to set up a brochure in indesign | how to make a brochure indesign | how to make brochure in indesign | how to make a brochure on indesign
how to make a master page in indesign,How to make a master page in Indesign,howto,7,high,volume_10+,,how to make a master page in indesign | how to create a master page in indesign | how to create master pages in indesign | how to make master page in indesign | how to create master page in indesign | how to make master pages in indesign | how to set up master pages in indesign
how to download a font to indesign,How to download a font to Indesign,howto,7,high,volume_10+,,how to download fonts to indesign | how to download fonts for indesign | how to download fonts into indesign | how to download a font to indesign | how to download fonts in indesign | how to download font to indesign | how to download fonts on indesign
how to change page number indesign,How to change page number Indesign,howto,7,high,volume_10+,,how to change page numbers in indesign | how to edit page numbers in indesign | how to change page number in indesign | how to adjust page numbers in indesign | how to edit page number in indesign | how to change page number indesign | indesign how to change page number start
how to make a star indesign,How to make a star Indesign,howto,6,high,volume_10+,,how to make a star in indesign | how to create a star in indesign | how to make a star indesign | how to make star in indesign | how to make a star on indesign | how to make stars in indesign
how to edit a gradient in indesign,How to edit a gradient in Indesign,howto,6,high,volume_10+,,how to edit gradient in indesign | how to edit a gradient in indesign | how to edit gradients in indesign | how to adjust gradient in indesign | how to edit gradient indesign | how to change gradient in indesign
how to do a drop cap in indesign,How to do a drop cap in Indesign,howto,6,high,volume_10+,,how to do a drop cap in indesign | how to do drop cap in indesign | how to drop cap in indesign | how to do drop caps in indesign | how to remove drop cap in indesign | how to drop cap indesign
how to do a data merge in indesign,How to do a data merge in Indesign,howto,6,high,volume_10+,,how to data merge in indesign | how to do a data merge in indesign | how to use data merge in indesign | indesign data merge tutorial | how to do data merge in indesign | how to data merge indesign
how to rotate an image in indesign,How to rotate an image in Indesign,howto,6,high,volume_10+,,how to rotate an image in indesign | how to rotate image in indesign | how to rotate images in indesign | how to rotate image indesign | how to rotate an image on indesign | how to rotate image on indesign
how to make an interactive pdf indesign,How to make an interactive pdf Indesign,howto,6,high,volume_10+,,how to make an interactive pdf in indesign | how to create an interactive pdf in indesign | how to create interactive pdf in indesign | how to make interactive pdf indesign | how to make an interactive pdf indesign | how to make interactive pdf in indesign
how to make a link in indesign,How to make a link in Indesign,howto,6,high,volume_10+,,how to create a hyperlink in indesign | how to create hyperlink in indesign | how to make a hyperlink in indesign | how to make hyperlink in indesign | how to create a link in indesign | how to make a link in indesign
how to do a gradient in indesign,How to do a gradient in Indesign,howto,6,high,volume_10+,,how to do a gradient in indesign | how to do gradient in indesign | how to gradient in indesign | how to use gradient in indesign | how to use gradients in indesign | how to do gradients in indesign
how to check word count indesign,How to check word count Indesign,howto,6,high,volume_10+,,how to see word count in indesign | how to check word count in indesign | how to check word count on indesign | how to see word count on indesign | how to get word count in indesign | how to check word count indesign
how to make indesign pages side by side,How to make Indesign pages side by side,howto,6,high,volume_10+,,how to make pages side by side in indesign | how to make indesign pages side by side | how to make indesign pages not side by side | indesign how to make pages side by side | how to make pages in indesign not side by side | how to make pages in indesign side by side
how to make a baseline grid in indesign,How to make a baseline grid in Indesign,howto,6,high,volume_10+,,how to set up baseline grid indesign | how to create a baseline grid in indesign | how to create baseline grid in indesign | how to set up a baseline grid in indesign | how to make a baseline grid in indesign | how to make baseline grid indesign
how to save a pdf in indesign,How to save a pdf in Indesign,howto,6,high,volume_10+,,how to save pdf in indesign | how to save a pdf in indesign | how to save indesign to pdf | how to save pdf from indesign | how to save a pdf from indesign | how to save pdf indesign
how to change color mode indesign,How to change color mode Indesign,howto,6,high,volume_10+,,how to change color mode in indesign | how to change color mode indesign | indesign how to change color mode | how to change the color mode in indesign | how to change indesign color mode | how to change document color mode in indesign
how to make a transparent background in indesign,How to make a transparent background in Indesign,howto,6,high,volume_10+,,how to make background transparent in indesign | how to make indesign background transparent | how to make transparent background in indesign | how to make a transparent background in indesign | how to make background transparent indesign | how to make an image background transparent in indesign
