canonical_keyword,suggested_title,category,variant_count,signal_strength,source,frequency_count,all_variants
how to save a lucidchart,How to save a Lucidchart,howto,6,high,volume_10+,,how to save in lucidchart | how to download lucidchart | how to save lucidchart | how to download a lucidchart | how to download from lucidchart | how to save a lucidchart
how to make a flowchart in lucidchart,How to make a flowchart in Lucidchart,howto,4,medium,volume_10+,,how to create a flowchart in lucidchart | how to make a flowchart in lucidchart | lucidchart how to create flowchart | how to create flowchart in lucidchart
how to save a lucidchart as a pdf,How to save a Lucidchart as a pdf,howto,3,medium,volume_10+,,how to save lucidchart as pdf | how to save a lucidchart as a pdf | how to download lucidchart as pdf
how to undo in lucidchart,How to undo in Lucidchart,howto,2,low,volume_10+,,how to undo in lucidchart | how to undo on lucidchart
how to use lucidchart ai,How to use Lucidchart ai,howto,2,low,volume_10+,,how to use ai in lucidchart | how to use lucidchart ai
how to create an org chart in lucidchart,How to create an org chart in Lucidchart,howto,2,low,volume_10+,,how to create an org chart in lucidchart | how to create org chart in lucidchart
how to add lucidchart to google docs,How to add Lucidchart to google docs,howto,2,low,volume_10+,,how to insert lucidchart into google docs | how to add lucidchart to google docs
how to export lucidchart,How to export Lucidchart,howto,2,low,volume_10+,,how to export lucidchart | how to export from lucidchart
how to change a shape in lucidchart,How to change a shape in Lucidchart,howto,2,low,volume_10+,,how to change shape in lucidchart | how to change a shape in lucidchart
how to draw on lucidchart,How to draw on Lucidchart,howto,2,low,volume_10+,,how to draw on lucidchart | how to draw in lucidchart
how to insert a table in lucidchart,How to insert a table in Lucidchart,howto,2,low,volume_10+,,how to insert a table in lucidchart | how to insert table in lucidchart
how to change shape color in lucidchart,How to change shape color in Lucidchart,howto,2,low,volume_10+,,how to change shape color in lucidchart | how to change color of shape in lucidchart
how to add a text box in lucidchart,How to add a text box in Lucidchart,howto,2,low,volume_10+,,how to add text box in lucidchart | how to add a text box in lucidchart
lucidchart jira integration,lucidchart jira integration,integration,2,low,volume_10+,,lucidchart jira integration | jira lucidchart integration
github lucidchart integration,github lucidchart integration,integration,2,low,volume_10+,,github lucidchart integration | lucidchart github integration
