canonical_keyword,suggested_title,category,variant_count,signal_strength,source,frequency_count,all_variants
how to use microsoft 365 copilot,How to use microsoft 365 copilot,howto,37,high,volume_10+,,how to use microsoft 365 copilot | microsoft 365 copilot how to use | how to use copilot in microsoft 365 | how to use copilot microsoft 365 | microsoft 365 copilot tutorial | how to use copilot for microsoft 365 | how to use copilot with microsoft 365 | how to use microsoft copilot 365 | microsoft 365 copilot integration | microsoft copilot integration with microsoft 365 | copilot integration with microsoft 365 | microsoft copilot integration microsoft 365 | microsoft copilot microsoft 365 integration | how to disable copilot in microsoft 365 | how to turn off copilot in microsoft 365
how to use microsoft copilot,How to use microsoft copilot,howto,12,high,volume_10+,,how to use microsoft copilot | microsoft copilot how to use | microsoft copilot tutorial | how to use copilot microsoft | how to use copilot in microsoft | how to best use microsoft copilot | how to use microsoft copilot effectively | how to use microsoft copilot tutorial | copilot how to use microsoft | copilot microsoft how to use | how to try microsoft copilot | how to effectively use microsoft copilot
how to use microsoft copilot in outlook,How to use microsoft copilot in outlook,howto,10,high,volume_10+,,how to use microsoft copilot in outlook | microsoft copilot outlook how to use | how to use copilot in microsoft outlook | microsoft copilot outlook tutorial | microsoft copilot in outlook how to use | how to use microsoft copilot with outlook | microsoft copilot outlook integration | microsoft copilot integration with outlook | how to add microsoft copilot to outlook | how to enable microsoft copilot in outlook
how to enable microsoft copilot,How to enable microsoft copilot,howto,10,high,volume_10+,,how to enable microsoft copilot | how to activate microsoft copilot | how to turn on copilot microsoft | how to turn on microsoft copilot | how to enable copilot in microsoft teams | how to enable microsoft copilot in teams | how to activate copilot in microsoft teams | how to enable copilot in microsoft word | how to enable microsoft copilot in word | how to activate copilot in microsoft word
how to use microsoft copilot on whatsapp,How to use microsoft copilot on whatsapp,howto,8,high,volume_10+,,microsoft copilot whatsapp integration | microsoft copilot whatsapp integration how to use | microsoft copilot integration with whatsapp | how to use microsoft copilot on whatsapp | microsoft copilot whatsapp how to use | microsoft copilot whatsapp integration 2025 | microsoft copilot whatsapp integration official | microsoft copilot studio whatsapp integration
how to use copilot in microsoft teams,How to use copilot in microsoft teams,howto,7,high,volume_10+,,how to use copilot in microsoft teams meetings | how to use microsoft copilot in teams meeting | how to use copilot in microsoft teams meeting | how to use copilot in microsoft teams | how to use microsoft copilot in teams | how to enable copilot in microsoft teams meetings | how to add copilot to microsoft teams meeting
microsoft 365 copilot anthropic integration,microsoft 365 copilot anthropic integration,integration,7,high,volume_10+,,microsoft 365 copilot anthropic integration news | anthropic microsoft 365 copilot integration news | microsoft 365 copilot claude integration news | microsoft copilot anthropic integration news | microsoft 365 copilot anthropic integration 2025 | microsoft 365 copilot sora 2 integration news | microsoft 365 copilot anthropic integration
how to get microsoft copilot,How to get microsoft copilot,howto,6,high,volume_10+,,how to get microsoft copilot | how to get copilot microsoft | microsoft copilot how to get | how to get the most out of microsoft copilot | how to get access to microsoft copilot | how to get microsoft copilot for free
microsoft copilot gpt-5 integration,microsoft copilot gpt-5 integration,integration,5,high,volume_10+,,microsoft copilot gpt-5 integration | gpt-5 microsoft copilot integration | microsoft 365 copilot gpt-5 integration | microsoft copilot gpt-5 integration announcement | microsoft copilot gpt-5 integration news
how to use microsoft ai copilot,How to use microsoft ai copilot,howto,4,medium,volume_10+,,how to use microsoft ai copilot | microsoft ai copilot how to use | how to use microsoft copilot ai | microsoft copilot ai integration
how to use microsoft copilot in excel,How to use microsoft copilot in excel,howto,4,medium,volume_10+,,how to use microsoft copilot in excel | microsoft copilot excel tutorial | microsoft copilot excel integration | microsoft excel copilot integration
servicenow microsoft copilot integration,servicenow microsoft copilot integration,integration,4,medium,volume_10+,,servicenow microsoft copilot integration | microsoft copilot servicenow integration | microsoft copilot integration with servicenow | servicenow integration with microsoft copilot
microsoft copilot canva integration mcp,microsoft copilot canva integration mcp,integration,4,medium,volume_10+,,microsoft copilot canva integration mcp server | microsoft copilot canva mcp server integration | canva mcp server microsoft copilot integration | microsoft copilot canva integration mcp
microsoft copilot sap integration,microsoft copilot sap integration,integration,4,medium,volume_10+,,microsoft copilot sap integration | microsoft copilot integration with sap | sap joule integration with microsoft copilot | sap joule microsoft copilot integration
microsoft edge copilot integration 2025,microsoft edge copilot integration 2025,integration,4,medium,volume_10+,,microsoft to do copilot integration 2025 | microsoft copilot gpt-4o integration 2025 | microsoft onenote copilot integration 2025 | microsoft edge copilot integration 2025
how to start microsoft copilot,How to start microsoft copilot,howto,3,medium,volume_10+,,how to start using microsoft copilot | how to start microsoft copilot | how to start using copilot microsoft
how to cite microsoft copilot,How to cite microsoft copilot,howto,3,medium,volume_10+,,how to cite microsoft copilot in apa | how to cite microsoft copilot in apa 7 | how to cite microsoft copilot
how to use microsoft copilot on telegram,How to use microsoft copilot on telegram,howto,3,medium,volume_10+,,telegram microsoft copilot integration | microsoft copilot telegram integration | how to use microsoft copilot on telegram
how to use copilot in ms word,How to use copilot in ms word,howto,3,medium,volume_10+,,how to turn off copilot in ms word | how to disable copilot in ms word | how to use copilot in ms word
microsoft copilot word integration,microsoft copilot word integration,integration,3,medium,volume_10+,,microsoft copilot word integration | microsoft word copilot integration | microsoft 365 copilot word integration
microsoft copilot office integration,microsoft copilot office integration,integration,3,medium,volume_10+,,microsoft copilot office 365 integration | microsoft copilot integration with office 365 | microsoft copilot office integration
microsoft copilot gpt-5 integration 2025,microsoft copilot gpt-5 integration 2025,integration,3,medium,volume_10+,,microsoft copilot gpt-5 integration august 2025 | microsoft copilot gpt-5 integration 2025 | microsoft 365 copilot gpt-5 integration 2025
microsoft copilot mcp integration,microsoft copilot mcp integration,integration,3,medium,volume_10+,,microsoft copilot studio mcp integration | microsoft copilot mcp integration | microsoft copilot studio mcp server integration
microsoft copilot claude integration,microsoft copilot claude integration,integration,3,medium,volume_10+,,microsoft 365 copilot claude integration | claude 4.5 microsoft 365 copilot integration | microsoft copilot claude integration
how to disable microsoft copilot windows 10,How to disable microsoft copilot windows 10,howto,2,low,volume_10+,,how to disable microsoft copilot windows 10 | how to turn off microsoft copilot windows 10
how to disable microsoft copilot windows 11,How to disable microsoft copilot windows 11,howto,2,low,volume_10+,,how to disable microsoft copilot windows 11 | how to turn off microsoft copilot windows 11
how to sign in to microsoft copilot,How to sign in to microsoft copilot,howto,2,low,volume_10+,,how to sign up for microsoft copilot | how to sign in to microsoft copilot
how to use microsoft office copilot,How to use microsoft office copilot,howto,2,low,volume_10+,,microsoft office copilot how to use | how to use microsoft office copilot
how to get microsoft copilot api key,How to get microsoft copilot api key,howto,2,low,volume_10+,,how to get microsoft copilot api key | microsoft copilot api key how to get
how to uninstall microsoft copilot windows 11,How to uninstall microsoft copilot windows 11,howto,2,low,volume_10+,,how to remove microsoft copilot from windows 11 | how to uninstall microsoft copilot windows 11
how to use microsoft copilot at work,How to use microsoft copilot at work,howto,2,low,volume_10+,,how to use microsoft copilot at work | how to use microsoft copilot for work
how to use microsoft 365 copilot in excel,How to use microsoft 365 copilot in excel,howto,2,low,volume_10+,,microsoft 365 copilot excel integration | how to use microsoft 365 copilot in excel
how to enable microsoft copilot in powerpoint,How to enable microsoft copilot in powerpoint,howto,2,low,volume_10+,,how to enable copilot in powerpoint microsoft 365 | how to enable microsoft copilot in powerpoint
how to use copilot in microsoft edge,How to use copilot in microsoft edge,howto,2,low,volume_10+,,how to disable copilot in microsoft edge | how to use copilot in microsoft edge
how to use copilot in ms teams,How to use copilot in ms teams,howto,2,low,volume_10+,,how to use copilot in ms teams meeting | how to use copilot in ms teams
microsoft copilot salesforce integration,microsoft copilot salesforce integration,integration,2,low,volume_10+,,microsoft copilot salesforce integration | microsoft copilot integration with salesforce
how to connect hana to microsoft copilot studio?,How to connect hana to microsoft copilot studio?,integration,2,low,volume_10+,,how to connect hana to microsoft copilot studio? | connect hana to microsoft copilot studio
how to connect odoo to microsoft copilot studio?,How to connect odoo to microsoft copilot studio?,integration,2,low,volume_10+,,how to connect odoo to microsoft copilot studio? | connect odoo to microsoft copilot studio
microsoft copilot api integration,microsoft copilot api integration,integration,2,low,volume_10+,,microsoft copilot api integration | microsoft 365 copilot api integration
microsoft anthropic copilot integration,microsoft anthropic copilot integration,integration,2,low,volume_10+,,microsoft anthropic copilot integration | microsoft copilot anthropic claude integration
microsoft copilot canva integration,microsoft copilot canva integration,integration,2,low,volume_10+,,microsoft copilot canva integration news | microsoft copilot canva integration
microsoft copilot gpt-4 integration,microsoft copilot gpt-4 integration,integration,2,low,volume_10+,,microsoft copilot gpt-4 integration | microsoft 365 copilot gpt-4 integration
microsoft copilot power bi integration,microsoft copilot power bi integration,integration,2,low,volume_10+,,microsoft copilot power bi integration | microsoft 365 copilot power bi integration
microsoft copilot llm team integration benefits,microsoft copilot llm team integration benefits,integration,2,low,volume_10+,,microsoft copilot llm team integration evaluation | microsoft copilot llm team integration benefits
microsoft copilot visual studio integration,microsoft copilot visual studio integration,integration,2,low,volume_10+,,microsoft copilot visual studio code integration | microsoft copilot visual studio integration
connect oracle to microsoft copilot studio,connect oracle to microsoft copilot studio,integration,2,low,volume_10+,,connect oracle hcm to microsoft copilot studio | connect oracle to microsoft copilot studio
