canonical_keyword,suggested_title,category,variant_count,signal_strength,source,frequency_count,all_variants
how to save a reddit video,How to save a Reddit video,howto,29,high,volume_10+,,how to download reddit video | how to download reddit videos | how to download videos from reddit | how to save reddit videos | how to download a reddit video | how to save videos from reddit | how to download video from reddit | how to download a video from reddit | how to save a video from reddit | how to save videos on reddit | how to save a reddit video | how to save reddit video | how to download videos on reddit | how to save video from reddit | how to download videos off reddit
how to see a reddit users deleted posts,How to see a Reddit users deleted posts,howto,29,high,volume_10+,,how to see deleted reddit posts | how to view deleted reddit posts | how to read deleted reddit posts | how to see deleted posts on reddit | how to look at deleted reddit posts | reddit how to see deleted posts | how to see old deleted reddit posts | how to see my deleted reddit posts | how to check deleted reddit posts | how to see reddit deleted posts | how to see reddit posts that were deleted | how to view deleted posts on reddit | how to see deleted posts reddit | how to see your deleted reddit posts | how to see my deleted posts on reddit
how to find a reddit user,How to find a Reddit user,howto,26,high,volume_10+,,how to find a reddit user | how to find reddit users | how to find a user on reddit | how to search for users on reddit | how to look up reddit users | how to find reddit user | how to search reddit users | how to find out who a reddit user is | how to search users on reddit | how to search for a user on reddit | how to find users on reddit | how to look up a reddit user | how to search for a reddit user | how to search for reddit user | how to search a reddit user
how to see reddit upvotes,How to see Reddit upvotes,howto,25,high,volume_10+,,how to see upvotes on reddit | how to see your upvotes on reddit | how to see reddit upvotes | how to check your upvotes on reddit | how to check upvotes on reddit | how to get upvotes on reddit | how to see my upvotes on reddit | how to get more upvotes on reddit | how to see who upvotes on reddit | how to check reddit upvotes | how to look at upvotes on reddit | how to see your reddit upvotes | how to view reddit upvotes | how to view my upvotes on reddit | how to look at reddit upvotes
how to wipe reddit history,How to wipe Reddit history,howto,22,high,volume_10+,,how to delete reddit history | how to clear reddit history | how to clear history on reddit | how to delete history on reddit | how to erase reddit history | how to remove reddit history | how to delete all reddit history | how to delete your reddit history | how to wipe reddit history | how to get rid of reddit history | how to clear your reddit history | how to clear my reddit history | how to clear all reddit history | how to clear history reddit | how to delete my reddit history
how to delete a reddit comment,How to delete a Reddit comment,howto,22,high,volume_10+,,how to delete reddit comments | how to delete all reddit comments | how to delete comments on reddit | how to delete all comments on reddit | how to delete all my reddit comments | how to delete a reddit comment | how to delete reddit comment | reddit how to delete all comments | how to delete all your reddit comments | how to delete a comment on reddit | how to delete all comments in reddit | how to delete all comments reddit | how to delete my reddit comments | how to delete old reddit comments | how to delete all of your reddit comments
how to change a reddit username,How to change a Reddit username,howto,21,high,volume_10+,,how to change reddit username | how to change username on reddit | how to change your reddit username | how to change your username on reddit | how to change my reddit username | reddit how to change username | how to change username reddit | how to edit reddit username | how to change username in reddit | how to change a reddit username | how to change my username on reddit | change reddit username how to | how to update reddit username | reddit change username how to | how to change reddit username?
how to see date of a reddit post,How to see date of a Reddit post,howto,20,high,volume_10+,,how to see exact date of reddit post | how to see the exact date of a reddit post | how to check exact date of reddit post | how to see exact date reddit post | how to get exact date of reddit post | how to view exact date of reddit post | reddit how to see exact date of post | how to see exact date of a reddit post | how to check the exact date of a reddit post | how to see exact reddit post date | how to see date of reddit post | how to see the date of a reddit post | how to see reddit post date | how to see date on reddit post | how to see date of a reddit post
how to delete a reddit account,How to delete a Reddit account,howto,18,high,volume_10+,,how to delete reddit account | how to delete a reddit account | how to delete your reddit account | how to delete my reddit account | reddit how to delete account | how to remove reddit account | how to delete reddit accounts | delete reddit account how to | how to remove a reddit account | how to delete all reddit accounts | how to delete account reddit | how to delete account on reddit | how to wipe reddit account | how to delete old reddit account | how to delete an account on reddit
how to save a reddit gif,How to save a Reddit gif,howto,18,high,volume_10+,,how to download gifs from reddit | how to download reddit gifs | how to save reddit gifs | how to save a gif from reddit | how to download gif from reddit | how to save gifs from reddit | how to download a gif from reddit | how to download reddit gif | how to save reddit gif | how to save a reddit gif | how to download a reddit gif | how to save gif from reddit | how to save gifs on reddit | how to download gifs on reddit | download reddit gif tutorial
how to see a deleted reddit comment,How to see a deleted Reddit comment,howto,17,high,volume_10+,,how to see deleted reddit comments | how to see deleted comments on reddit | how to view deleted reddit comments | how to view deleted comments on reddit | how to read deleted reddit comments | how to see a deleted reddit comment | how to see deleted reddit comment | reddit how to see deleted comments | how to read deleted comments on reddit | how to see reddit deleted comments | reddit how to view deleted comments | how to see a deleted comment on reddit | how to see deleted comments reddit | how to view a deleted reddit comment | how to view deleted reddit comment
how to post a video on reddit,How to post a video on Reddit,howto,16,high,volume_10+,,how to post videos on reddit | how to post a video on reddit | how to post video on reddit | how to send videos on reddit | how to post video to reddit | how to send a video on reddit | how to send video on reddit | how to post a video to reddit | how to post videos to reddit | how to share videos on reddit | reddit video post how to | how to share video on reddit | how to share a video on reddit | reddit how to post video | how to post video reddit
how to get reddit karma,How to get Reddit karma,howto,15,high,volume_10+,,how to get karma on reddit | how to get reddit karma | how to get more karma on reddit | how to get karma reddit | reddit how to get karma | how to get more reddit karma | how to check reddit karma | how to get reddit karma tips | how to get karma on reddit tips | how to get reddit karma quickly | how to get karma in reddit | how to get more karma on reddit tips | how to see your reddit karma | how to see reddit karma | how to get karma on reddit quickly
how to make a reddit account,How to make a Reddit account,howto,15,high,volume_10+,,how to establish reddit account | how to create a reddit account | how to make multiple reddit accounts | how to create a new reddit account | how to make a new reddit account | how to create reddit account | how to create new reddit account | how to establish my reddit account | how to establish your reddit account | how to establish a reddit account | how to create multiple reddit accounts | how to make a reddit account | how to quickly establish reddit account | how to make reddit account | how to make new reddit account
how to delete a reddit post,How to delete a Reddit post,howto,14,high,volume_10+,,how to delete reddit post | how to delete a reddit post | how to delete a post on reddit | reddit how to delete post | how to delete post on reddit | how to delete your reddit post | how to delete your own reddit post | how to remove a reddit post | how to delete my reddit post | how to take down a reddit post | how to delete post reddit | how to remove a post on reddit | how to remove a post from reddit | how to remove reddit post
how to get free onlyfans reddit,How to get free onlyfans Reddit,howto,14,high,volume_10+,,how to see onlyfans for free reddit | how to get free onlyfans reddit | how to get onlyfans for free reddit | how to view onlyfans for free reddit | how to see any onlyfans for free reddit | reddit how to get free onlyfans | how to see onlyfans free reddit | how to get any onlyfans for free reddit | how to get onlyfans free reddit | how to get free onlyfans content reddit | how to view onlyfans content for free reddit | how to get onlyfans content for free reddit | how to see someone's onlyfans for free reddit | how to get someone's onlyfans for free reddit
how to delete a reddit chat,How to delete a Reddit chat,howto,13,high,volume_10+,,how to delete reddit messages | how to delete messages on reddit | how to delete reddit chat | how to delete a reddit chat | how to delete messages reddit | how to delete all reddit messages | how to delete reddit chat messages | how to delete reddit message | how to delete a reddit message | reddit how to delete messages | how to delete all messages on reddit | how to clear reddit messages | how to delete reddit dm
how to see reddit followers,How to see Reddit followers,howto,13,high,volume_10+,,how to see followers on reddit | how to see reddit followers | reddit how to see followers | how to see your followers on reddit | how to view followers on reddit | how to see your reddit followers | how to check reddit followers | how to get more followers on reddit | how to view reddit followers | how to get followers on reddit | how to view reddit followers list | how to get more reddit followers | how to see my reddit followers
how to add a gif to reddit comment,How to add a gif to Reddit comment,howto,13,high,volume_10+,,how to add gif to reddit comment | how to add a gif to reddit comment | how to add gifs to reddit comments | how to put gif in reddit comment | how to embed gif in reddit comment | how to insert gif in reddit comment | how to put a gif in reddit comments | how to put a gif in a reddit comment | how to add gif reddit comment | how to add a gif to a reddit comment | how to put gifs in reddit comments | how to add gif in reddit comment | how to add gifs in reddit comments
how to clear history reddit app,How to clear history Reddit app,howto,13,high,volume_10+,,how to clear history on reddit app | how to delete history on reddit app | how to clear reddit history on app | how to delete reddit history on app | how to clear history in reddit app | how to delete history in reddit app | how to clear history reddit app | how to delete reddit app history | how to clear reddit app history | how to delete history reddit app | how to delete reddit history app | how to clear history on reddit app iphone | how to delete cash app history reddit
how to make a throwaway reddit account,How to make a throwaway Reddit account,howto,12,high,volume_10+,,how to make a throwaway reddit account | how to create a throwaway reddit account | how to make throwaway reddit account | how to make a reddit throwaway account | how to create throwaway reddit account | how to create a throwaway account on reddit | how to create reddit throwaway account | how to create a reddit throwaway account | how to make reddit throwaway account | how to make throwaway account reddit | how to create throwaway account reddit | how to make a throwaway reddit account without email
how to find posts from a deleted reddit account,How to find posts from a deleted Reddit account,howto,12,high,volume_10+,,how to find deleted reddit posts | how to look up deleted reddit posts | how to find deleted posts on reddit | how to search deleted reddit posts | how to find reddit deleted posts | how to find old deleted reddit posts | how to find my deleted reddit posts | how to search for deleted reddit posts | how to find reddit posts that have been deleted | reddit how to find deleted posts | how to find posts from a deleted reddit account | how to find posts from deleted reddit account
how to edit a reddit post,How to edit a Reddit post,howto,11,high,volume_10+,,how to edit reddit post | how to edit a reddit post | how to edit a post on reddit | how to edit post on reddit | how to edit my reddit post | how to update a reddit post | how to edit your reddit post | how to update post on reddit | reddit how to edit post | how to update reddit post | how to update a post on reddit
how to see a deleted reddit post,How to see a deleted Reddit post,howto,11,high,volume_10+,,how to see deleted reddit post | how to see a deleted reddit post | how to view deleted reddit post | how to view a deleted reddit post | how to see a reddit post that was deleted | how to read a deleted reddit post | how to read deleted reddit post | how to see deleted post on reddit | how to check if reddit post was deleted | how to see deleted post reddit | how to see reddit post that was deleted
how to find someone reddit,How to find someone Reddit,howto,10,high,volume_10+,,how to find someone on reddit | how to find someones reddit | how to look up someone on reddit | how to find someone in reddit | how to search for someone on reddit | reddit how to find someone | how to find out who someone is on reddit | how to search someone on reddit | how to find someone reddit | how to look up someones reddit
how to see reddit history,How to see Reddit history,howto,10,high,volume_10+,,how to see reddit history | how to check reddit history | how to view reddit history | how to look at reddit history | how to see history on reddit | how to view history on reddit | how to see your reddit history | how to see reddit view history | how to check history on reddit | how to see my reddit history
how to post a nsfw video on reddit,How to post a nsfw video on Reddit,howto,10,high,volume_10+,,how to post nsfw videos on reddit | how to post videos on reddit nsfw | how to post videos on nsfw reddit | how to post nsfw video on reddit | how to post video on reddit nsfw | how to post video on nsfw reddit | how to post videos in nsfw reddit | how to post nsfw videos to reddit | how to post a nsfw video on reddit | how to post a video on reddit nsfw
how to send a video on reddit chat,How to send a video on Reddit chat,howto,10,high,volume_10+,,how to send video in reddit chat | how to send videos on reddit messages | how to send videos in reddit chat | how to send videos on reddit chat | how to send video on reddit chat | how to send video in reddit dm | how to send a video on reddit chat | how to send videos on reddit dm | how to send a video in reddit chat | how to share videos on reddit chat
how to view upvotes reddit app,How to view upvotes Reddit app,howto,10,high,volume_10+,,how to check your upvotes on reddit app | how to look at upvotes on reddit app | how to check upvotes on reddit app | how to see upvotes on reddit app | how to view your upvotes reddit app | how to check your upvotes reddit app | how to see your upvotes on reddit app | how to check my upvotes on reddit app | how to view upvotes reddit app | how to view your upvotes on reddit app
how to see upvoted posts reddit app,How to see upvoted posts Reddit app,howto,10,high,volume_10+,,how to see upvoted posts on reddit app | how to see my upvoted posts on reddit app | how to see upvoted posts reddit app | how to see your upvoted posts on reddit app | how to see posts you upvoted on reddit app | how to check upvoted posts on reddit app | reddit how to see upvoted posts | how to see reddit posts you upvoted | how to view upvoted posts on reddit | how to see what you upvoted on reddit app
how to see saved reddit posts,How to see saved Reddit posts,howto,10,high,volume_10+,,how to see saved posts on reddit | how to view saved posts on reddit | how to see saved reddit posts | how to see reddit saved posts | how to get to saved reddit posts | how to view saved posts on reddit desktop | how to see saved posts on reddit desktop | how to view saved posts reddit desktop | how to see saved reddit posts on pc | how to view saved posts on reddit mobile
how to block nsfw on reddit app,How to block nsfw on Reddit app,howto,10,high,volume_10+,,how to block nsfw content on reddit app | how to block nsfw content reddit app | block nsfw content reddit app how to | how to block nsfw content on reddit | how to disable nsfw content on reddit | how to turn off nsfw content on reddit | how to turn off nsfw on reddit app | how to block nsfw on reddit app | how to block nsfw content reddit app settings | how to block nsfw content on reddit app and site
how to block nsfw reddit,How to block nsfw Reddit,howto,9,high,volume_10+,,how to turn off nsfw on reddit | how to block nsfw on reddit | how to turn off nsfw reddit | how to block nsfw reddit | how to disable nsfw on reddit | how to block all nsfw on reddit | reddit how to block nsfw | how to block reddit nsfw | how to turn off reddit nsfw
how to clear reddit recent,How to clear Reddit recent,howto,9,high,volume_10+,,how to clear reddit recent | how to delete reddit recent | how to clear reddit recents | how to remove reddit recent | how to get rid of reddit recent | reddit how to clear recent | how to delete recent on reddit | how to delete reddit recents | how to clear recent on reddit
how to make a reddit community,How to make a Reddit community,howto,9,high,volume_10+,,how to create a reddit community | how to create a community on reddit | how to make a reddit community | how to create reddit community | how to build community reddit | how to make reddit community | how to build a reddit community | how to make a community on reddit | how to create your own reddit community
how to find people reddit,How to find people Reddit,howto,9,high,volume_10+,,how to find people on reddit | how to search for people on reddit | how to search people on reddit | how to find peoples reddit | reddit how to find people | how to find people in reddit | how to search people in reddit | how to find people reddit | how to look up people on reddit
how to search a reddit,How to search a Reddit,howto,9,high,volume_10+,,how to search reddit effectively | how to search reddit | how to search on reddit | how to search reddit effectively tips | how to search in reddit | how to search a reddit | how to use reddit search | reddit search how to use | how to find reddit
how to post a gif on reddit comment,How to post a gif on Reddit comment,howto,9,high,volume_10+,,how to post gif in reddit comment | how to post gif on reddit comment | how to post a gif in reddit comments | how to post gifs in reddit comments | how to post a gif on reddit comment | how to post gifs on reddit comments | how to post a gif in a reddit comment | how to post gifs on reddit comments mobile | how to post gifs on tiktok comments reddit
how to get around a reddit ban,How to get around a Reddit ban,howto,9,high,volume_10+,,how to get around reddit permanent ban | how to get around a permanent reddit ban | how to get around a reddit permanent ban | how to get around permanent reddit ban | how to get around a reddit ban | how to get around reddit ban | how to get around reddit bans | how to get around reddit permanent ban on iphone | how to get around reddit permanent ban on android
how to see when a reddit post was made,How to see when a Reddit post was made,howto,9,high,volume_10+,,how to see when a reddit post was made | how to see when reddit post was made | how to check when a reddit post was made | how to see the date a reddit post was made | how to see what date a reddit post was made | how to see date reddit post was made | how to see what day a reddit post was made | how to see what time a reddit post was made | how to see exactly when a reddit post was made
how to post a reddit post,How to post a Reddit post,howto,8,high,volume_10+,,how to post on reddit | how to post to reddit | how to post in reddit | how to share a reddit post | how to post a reddit post | reddit how to post | how to post reddit | how to post on reddit step by step
how to post reddit anonymously,How to post Reddit anonymously,howto,8,high,volume_10+,,how to post anonymously on reddit | how to post on reddit anonymously | how to post to reddit anonymously | reddit how to post anonymously | how to anonymously post on reddit | how to post reddit anonymously | how to post anonymously in reddit | how to post anonymously reddit
how to make a reddit post,How to make a Reddit post,howto,8,high,volume_10+,,how to make a post on reddit | how to make a reddit post | how to create a reddit post | how to create a post on reddit | how to make reddit post | how to make post on reddit | how to create reddit post | how to make a post in reddit
how to promote onlyfans reddit,How to promote onlyfans Reddit,howto,8,high,volume_10+,,how to promote onlyfans on reddit | how to use reddit to promote onlyfans | how to promote onlyfans reddit | how to promote your onlyfans on reddit | how to promote my onlyfans on reddit | how to promote on reddit onlyfans | how to use reddit to promote your onlyfans | how to promote your onlyfans reddit
how to upload a video to reddit,How to upload a video to Reddit,howto,8,high,volume_10+,,how to upload video to reddit | how to upload videos to reddit | how to upload a video to reddit | how to upload video on reddit | how to upload a video on reddit | how to upload videos on reddit | reddit how to upload video | how to upload video reddit
how to see reddit history pc,How to see Reddit history pc,howto,8,high,volume_10+,,how to see reddit history on pc | how to check reddit history on pc | how to view reddit history on pc | how to see history on reddit pc | how to look at reddit history on pc | how to view history on reddit pc | how to see reddit history pc | how to check history on reddit pc
how to delete reddit posts,How to delete Reddit posts,howto,8,high,volume_10+,,how to delete all reddit posts | how to delete reddit posts | how to delete all my reddit posts | how to delete posts on reddit | how to delete old reddit posts | how to delete all posts on reddit | reddit how to delete all posts | how to delete all your reddit posts
how to evade a reddit ban,How to evade a Reddit ban,howto,8,high,volume_10+,,how to evade reddit ban | how to ban evade on reddit | how to evade a reddit ban | how to ban evade reddit | how to evade ban on reddit | how to evade ban reddit | reddit how to ban evade | how to evade reddit bans
how to tag a reddit user,How to tag a Reddit user,howto,8,high,volume_10+,,how to tag a user on reddit | how to tag a reddit user | how to tag reddit user | reddit how to tag a user | how to tag users on reddit | how to tag user on reddit | how to tag user in reddit | how to tag a user in reddit
how to leave a reddit community,How to leave a Reddit community,howto,8,high,volume_10+,,how to leave a reddit community | how to leave reddit community | how to leave reddit communities | how to leave multiple reddit communities | how to leave all reddit communities | how to quickly leave reddit communities | how to leave all communities on reddit | how to leave multiple communities on reddit
how to make a reddit gif,How to make a Reddit gif,howto,8,high,volume_10+,,how to make a reddit gif | how to make reddit gifs | how to make a gif on reddit | how to make reddit gif | how to make gif for reddit | how to make a gif for reddit | how to make gifs for reddit | how to make gifs on reddit
how to see a deleted reddit account,How to see a deleted Reddit account,howto,8,high,volume_10+,,how to see deleted reddit accounts | how to view deleted reddit accounts | how to see deleted reddit account | how to look at deleted reddit accounts | how to view a deleted reddit account | how to view deleted reddit account | how to see a deleted reddit account | how to get deleted reddit account back
how to get a reddit post removed,How to get a Reddit post removed,howto,8,high,volume_10+,,how to get a reddit post removed | how to see removed reddit post | how to see a removed reddit post | how to get reddit post removed | how to see why reddit post was removed | how to get a post removed from reddit | how to see why my reddit post was removed | how to see reddit post removed by moderators
how to turn off reddit safe search,How to turn off Reddit safe search,howto,8,high,volume_10+,,how to turn off safe search on reddit | how to turn off reddit safe search | how to turn off safe search reddit | how to disable safe search on reddit | how to turn off safe search in reddit | reddit how to turn off safe search | how to turn off safe search on reddit mobile | how to turn off safe search on reddit on iphone
how to turn reddit dark mode,How to turn Reddit dark mode,howto,8,high,volume_10+,,how to change reddit to dark mode | how to turn reddit to dark mode | how to turn reddit dark mode | how to turn reddit into dark mode | how to turn reddit on dark mode | how to switch reddit to dark mode | how to turn dark mode on reddit app | how to change reddit to dark mode on pc
