canonical_keyword,suggested_title,category,variant_count,signal_strength,source,frequency_count,all_variants
how to do seo reddit,How to do seo Reddit,howto,2,low,volume_10+,,how to use reddit for seo | how to do seo reddit
how to quit vaping cold turkey reddit,How to quit vaping cold turkey Reddit,howto,2,low,volume_10+,,how to quit vaping cold turkey reddit | how to quit vaping reddit cold turkey
how to get unbanned on reddit,How to get unbanned on Reddit,howto,2,low,volume_10+,,how to get unbanned from reddit | how to get unbanned on reddit
how to cheat codesignal reddit,How to cheat codesignal Reddit,howto,2,low,volume_10+,,how to cheat on codesignal reddit | how to cheat codesignal reddit
how to download pinterest videos reddit,How to download pinterest videos Reddit,howto,2,low,volume_10+,,how to download pinterest videos reddit | how to download videos from pinterest reddit
how to make reddit comments private,How to make Reddit comments private,howto,2,low,volume_10+,,how to make reddit comments private | how to make your reddit comments private
how to post a photo on reddit,How to post a photo on Reddit,howto,2,low,volume_10+,,how to post a photo on reddit | how to post photos on reddit
how to buy reddit upvotes,How to buy Reddit upvotes,howto,2,low,volume_10+,,how to buy reddit upvotes | how to buy upvotes on reddit
how to choose a reddit username,How to choose a Reddit username,howto,2,low,volume_10+,,how to choose a reddit username | how to choose reddit username
how to add spoiler in reddit,How to add spoiler in Reddit,howto,2,low,volume_10+,,how to add spoiler in reddit | how to put spoilers on reddit
how to see reddit streak,How to see Reddit streak,howto,2,low,volume_10+,,how to check reddit streak | how to see reddit streak
how to see nsfw on reddit,How to see nsfw on Reddit,howto,2,low,volume_10+,,how to see nsfw on reddit | how to view nsfw on reddit
how to bypass reddit permanent ban,How to bypass Reddit permanent ban,howto,2,low,volume_10+,,how to bypass reddit permanent ban | how to bypass permanent reddit ban
how to use promo money prizepicks reddit,How to use promo money prizepicks Reddit,howto,2,low,volume_10+,,how to use promo money prizepicks reddit | how to use promo money on prizepicks reddit
how to go incognito reddit pc,How to go incognito Reddit pc,howto,2,low,volume_10+,,how to go incognito on reddit pc | how to go incognito reddit pc
how to find someones onlyfans reddit,How to find someones onlyfans Reddit,howto,2,low,volume_10+,,how to find someone on onlyfans reddit | how to find someones onlyfans reddit
how to stop reddit,How to stop Reddit,howto,2,low,volume_10+,,how to stop using reddit | how to stop reddit
how to make money at home reddit,How to make money at home Reddit,howto,2,low,volume_10+,,how to make money from home reddit | how to make money at home reddit
how to get rid of a hickey fast reddit,How to get rid of a hickey fast Reddit,howto,2,low,volume_10+,,how to get rid of a hickey fast reddit | how to get rid of hickeys fast reddit
how to send pics on reddit,How to send pics on Reddit,howto,2,low,volume_10+,,how to send pics on reddit | how to post pics on reddit
how to use reddit api,How to use Reddit api,howto,2,low,volume_10+,,how to use reddit api | reddit api tutorial
how to pin reddit posts,How to pin Reddit posts,howto,2,low,volume_10+,,how to pin reddit posts | how to pin posts on reddit
how to edit reddit posts,How to edit Reddit posts,howto,2,low,volume_10+,,how to edit reddit posts | how to edit posts on reddit
how to change reddit username 2025,How to change Reddit username 2025,howto,2,low,volume_10+,,how to change reddit username 2025 | how to change username on reddit 2025
how to change reddit username google account,How to change Reddit username google account,howto,2,low,volume_10+,,how to change reddit username google account | how to change username on reddit google account
how to find reddit history,How to find Reddit history,howto,2,low,volume_10+,,how to find reddit history | how to find reddit search history
how to get sound on reddit videos,How to get sound on Reddit videos,howto,2,low,volume_10+,,how to get sound on reddit videos | how to get reddit videos with sound
how to circumvent a reddit ban,How to circumvent a Reddit ban,howto,2,low,volume_10+,,how to circumvent reddit ban | how to circumvent a reddit ban
how to post a video on reddit mobile,How to post a video on Reddit mobile,howto,2,low,volume_10+,,how to post videos on reddit mobile | how to post a video on reddit mobile
how to check account creation date reddit,How to check account creation date Reddit,howto,2,low,volume_10+,,how to check account creation date reddit | how to check reddit account creation date
how to private browse reddit,How to private browse Reddit,howto,2,low,volume_10+,,how to private browse on reddit | how to private browse reddit
how to get backlinks reddit,How to get backlinks Reddit,howto,2,low,volume_10+,,how to get backlinks reddit | how to get backlinks from reddit
how to suck dick reddit,How to suck dick Reddit,howto,2,low,volume_10+,,reddit how to suck dick | how to suck dick reddit
how to study for mcat reddit,How to study for mcat Reddit,howto,2,low,volume_10+,,how to study for mcat reddit | how to study for the mcat reddit
how to download off soundcloud reddit,How to download off soundcloud Reddit,howto,2,low,volume_10+,,how to download from soundcloud reddit | how to download off soundcloud reddit
how to see reddit history on browser,How to see Reddit history on browser,howto,2,low,volume_10+,,how to see reddit history on browser | how to view reddit history on browser
how to make another reddit account,How to make another Reddit account,howto,2,low,volume_10+,,how to make another reddit account | how to create another reddit account
how to see private instagram reddit,How to see private instagram Reddit,howto,2,low,volume_10+,,how to view private instagram reddit | how to see private instagram reddit
how to see deleted reddit images,How to see deleted Reddit images,howto,2,low,volume_10+,,how to see deleted reddit images | how to view deleted reddit images
how to stop receiving reddit emails,How to stop receiving Reddit emails,howto,2,low,volume_10+,,how to stop receiving emails from reddit | how to stop receiving reddit emails
how to delete reddit account on app,How to delete Reddit account on app,howto,2,low,volume_10+,,how to delete reddit account on app | how to remove reddit account from app
how to see archived reddit posts,How to see archived Reddit posts,howto,2,low,volume_10+,,how to see archived reddit posts | how to view archived reddit posts
how to download reddit,How to download Reddit,howto,2,low,volume_10+,,how to download from reddit | how to download reddit
how to clear reddit hostory,How to clear Reddit hostory,howto,2,low,volume_10+,,how to delete reddit hostory | how to clear reddit hostory
how to clear reddit history on pc,How to clear Reddit history on pc,howto,2,low,volume_10+,,how to clear reddit history on pc | how to delete reddit history on pc
how to pin a post on reddit mobile,How to pin a post on Reddit mobile,howto,2,low,volume_10+,,how to pin post on reddit mobile | how to pin a post on reddit mobile
how to spoiler on reddit mobile,How to spoiler on Reddit mobile,howto,2,low,volume_10+,,how to spoiler on reddit mobile | how to do spoilers on reddit mobile
how to avoid reddit ban evasion,How to avoid Reddit ban evasion,howto,2,low,volume_10+,,how to avoid reddit ban evasion | how to avoid ban evasion reddit
how to stop overthinking reddit tips,How to stop overthinking Reddit tips,howto,2,low,volume_10+,,reddit how to stop overthinking quickly | how to stop overthinking reddit tips
how to avoid a reddit ban,How to avoid a Reddit ban,howto,2,low,volume_10+,,how to avoid reddit ban | how to avoid a reddit ban
how to clear recent on reddit pc,How to clear recent on Reddit pc,howto,2,low,volume_10+,,how to clear recent on reddit pc | how to clear reddit recent on pc
how to make new reddit account after ban,How to make new Reddit account after ban,howto,2,low,volume_10+,,how to make new reddit account after ban | how to create new reddit account after ban
how to see reddit username,How to see Reddit username,howto,2,low,volume_10+,,how to check reddit username | how to see reddit username
how to study for gre reddit,How to study for gre Reddit,howto,2,low,volume_10+,,how to study for gre reddit | how to study for the gre reddit
how to cook crack reddit,How to cook crack Reddit,howto,2,low,volume_10+,,how to cook crack reddit | reddit how to cook crack
how to invest in reddit stocks,How to invest in Reddit stocks,howto,2,low,volume_10+,,how to invest in reddit stocks | how to invest in stocks reddit
how to unjoin a reddit community,How to unjoin a Reddit community,howto,2,low,volume_10+,,how to unjoin a reddit community | how to unjoin reddit community
how to allow videos on reddit community,How to allow videos on Reddit community,howto,2,low,volume_10+,,how to allow videos on reddit community | how to allow videos in reddit community
how to write a reddit post,How to write a Reddit post,howto,2,low,volume_10+,,how to write a reddit post | how to write a post on reddit
how to invest reddit,How to invest Reddit,howto,2,low,volume_10+,,how to invest reddit | reddit how to invest
how to sober up reddit,How to sober up Reddit,howto,2,low,volume_10+,,how to sober up quickly reddit | how to sober up reddit
how to translate reddit page,How to translate Reddit page,howto,2,low,volume_10+,,how to translate reddit pages | how to translate reddit page
how to blur nsfw reddit ios,How to blur nsfw Reddit ios,howto,2,low,volume_10+,,how to blur nsfw on reddit ios | how to blur nsfw reddit ios
how to gain reddit karma fast,How to gain Reddit karma fast,howto,2,low,volume_10+,,how to gain karma on reddit fast | how to gain reddit karma fast
how to make a reddit story,How to make a Reddit story,howto,2,low,volume_10+,,how to make reddit stories | how to make a reddit story
how to block reddit on phone,How to block Reddit on phone,howto,2,low,volume_10+,,how to block reddit on phone | how to block reddit on my phone
how to go incognito reddit app,How to go incognito Reddit app,howto,2,low,volume_10+,,how to go incognito on reddit app | how to go incognito reddit app
how to mass leave reddit communities,How to mass leave Reddit communities,howto,2,low,volume_10+,,how to mass leave reddit communities | how to mass leave communities reddit
how to smoke without smell reddit,How to smoke without smell Reddit,howto,2,low,volume_10+,,how to smoke without smell reddit | how to smoke without the smell reddit
how to unban reddit account,How to unban Reddit account,howto,2,low,volume_10+,,how to unban reddit account | how to unban my reddit account
how to post video on reddit with link,How to post video on Reddit with link,howto,2,low,volume_10+,,how to post video on reddit without link | how to post video on reddit with link
how to start a podcast reddit,How to start a podcast Reddit,howto,2,low,volume_10+,,reddit how to start a podcast | how to start a podcast reddit
how to remove reddit ads,How to remove Reddit ads,howto,2,low,volume_10+,,how to get rid of reddit ads | how to remove reddit ads
how to delete reddit comment history,How to delete Reddit comment history,howto,2,low,volume_10+,,how to delete reddit comment history | how to delete comment history on reddit
how to block nsfw content reddit site,How to block nsfw content Reddit site,howto,2,low,volume_10+,,how to block nsfw content on reddit site | how to block nsfw content reddit site
how to delete a reddit acount,How to delete a Reddit acount,howto,2,low,volume_10+,,how to delete reddit acount | how to delete a reddit acount
how to skip relias training videos reddit,How to skip relias training videos Reddit,howto,2,low,volume_10+,,how to skip through relias training videos reddit | how to skip relias training videos reddit
how to report a reddit account,How to report a Reddit account,howto,2,low,volume_10+,,how to report a reddit account | how to report reddit account
how to change reddit u/ name,How to change Reddit u/ name,howto,2,low,volume_10+,,how to change reddit u/ name | how to change reddit name u/
how to pick a reddit username,How to pick a Reddit username,howto,2,low,volume_10+,,how to pick a reddit username | how to pick reddit username
how to find who lives at an address reddit,How to find who lives at an address Reddit,howto,2,low,volume_10+,,how to find out who lives at an address reddit | how to find who lives at an address reddit
how to promote podcast on reddit strategies,How to promote podcast on Reddit strategies,howto,2,low,volume_10+,,how to promote podcast on reddit strategies | how to promote podcasts on reddit strategies
how to tell if reddit account is a bot,How to tell if Reddit account is a bot,howto,2,low,volume_10+,,how to tell if a reddit account is a bot | how to tell if reddit account is a bot
how to browse reddit anonymously on pc,How to browse Reddit anonymously on pc,howto,2,low,volume_10+,,how to browse reddit anonymously on pc | how to browse anonymously on reddit pc
how to schedule reddit posts,How to schedule Reddit posts,howto,2,low,volume_10+,,how to schedule reddit posts | how to schedule posts on reddit
how to prep for anal reddit,How to prep for anal Reddit,howto,2,low,volume_10+,,how to prep for anal reddit | reddit how to prep for anal
how to pin a reddit comment,How to pin a Reddit comment,howto,2,low,volume_10+,,how to pin a reddit comment | how to pin reddit comment
how to find somebodys reddit,How to find somebodys Reddit,howto,2,low,volume_10+,,how to find somebody on reddit | how to find somebodys reddit
how to get rid of red eyes from smoking reddit,How to get rid of red eyes from smoking Reddit,howto,2,low,volume_10+,,how to get rid of red eyes from smoking reddit | how to get rid of red eyes after smoking reddit
how to clear reddit view history,How to clear Reddit view history,howto,2,low,volume_10+,,how to delete reddit view history | how to clear reddit view history
how to quit vaping reddit,How to quit vaping Reddit,howto,2,low,volume_10+,,how to quit vaping reddit | reddit how to quit vaping
how to make crack reddit,How to make crack Reddit,howto,2,low,volume_10+,,how to make crack reddit | reddit how to make crack
how to unclog a cart reddit,How to unclog a cart Reddit,howto,2,low,volume_10+,,how to unclog a cart reddit | how to unclog cart reddit
how to get free textbooks reddit,How to get free textbooks Reddit,howto,2,low,volume_10+,,how to get free textbooks reddit | how to get textbooks for free reddit
how to cite a reddit comment,How to cite a Reddit comment,howto,2,low,volume_10+,,how to cite a reddit comment | how to cite reddit comment
how to see onlyfans without paying reddit,How to see onlyfans without paying Reddit,howto,2,low,volume_10+,,how to see onlyfans without paying reddit | reddit how to see onlyfans without paying
how to check someones reddit,How to check someones Reddit,howto,2,low,volume_10+,,how to look someone up on reddit | how to check someones reddit
how to delete reddit messages inbox,How to delete Reddit messages inbox,howto,2,low,volume_10+,,how to delete reddit messages inbox | how to delete reddit inbox messages
how to clear reddit inbox,How to clear Reddit inbox,howto,2,low,volume_10+,,how to clear reddit inbox | how to delete reddit inbox
how to make ai reddit stories,How to make ai Reddit stories,howto,2,low,volume_10+,,how to make ai reddit stories | how to make reddit stories with ai
how to study for step 3 reddit,How to study for step 3 Reddit,howto,2,low,volume_10+,,how to study for step 3 reddit | reddit how to study for step 2
how to open redgifs on reddit mobile,How to open redgifs on Reddit mobile,howto,2,low,volume_10+,,how to open redgifs on reddit mobile | how to open redgifs in reddit mobile
how to find someone i know on reddit,How to find someone i know on Reddit,howto,2,low,volume_10+,,how to find someone you know on reddit | how to find someone i know on reddit
how to post on a reddit page,How to post on a Reddit page,howto,2,low,volume_10+,,how to post on a reddit page | how to post on your own reddit page
how to find porn on tiktok reddit,How to find porn on tiktok Reddit,howto,2,low,volume_10+,,how to find porn on tiktok reddit | reddit how to find porn on tiktok
how to make reddit nsfw,How to make Reddit nsfw,howto,2,low,volume_10+,,how to make reddit nsfw | how to make my reddit nsfw
how to turn off safe mode reddit,How to turn off safe mode Reddit,howto,2,low,volume_10+,,how to turn off safe mode on reddit | how to turn off safe mode reddit
how to change reddit feed,How to change Reddit feed,howto,2,low,volume_10+,,how to change reddit feed | how to customize reddit feed
how to give a good bj reddit,How to give a good bj Reddit,howto,2,low,volume_10+,,how to give a good bj reddit | how to give good bj reddit
how to leave reddit community fast,How to leave Reddit community fast,howto,2,low,volume_10+,,how to leave reddit community fast | how to leave reddit communities fast
how to delete all reddit posts at once,How to delete all Reddit posts at once,howto,2,low,volume_10+,,how to delete all reddit posts at once | how to delete multiple reddit posts at once
how to quit porn reddit,How to quit porn Reddit,howto,2,low,volume_10+,,how to quit porn reddit | reddit how to quit porn
how to make a reddit,How to make a Reddit,howto,2,low,volume_10+,,how to create a reddit | how to make a reddit
how to get around reddit age verification,How to get around Reddit age verification,howto,2,low,volume_10+,,how to get around reddit age verification | how to get around age verification reddit
how to report a reddit page,How to report a Reddit page,howto,2,low,volume_10+,,how to report a reddit page | how to report reddit page
how to get a fake id reddit,How to get a fake id Reddit,howto,2,low,volume_10+,,how to get a fake id reddit | reddit how to get a fake id
how to get on raya reddit,How to get on raya Reddit,howto,2,low,volume_10+,,how to get on raya reddit | reddit how to get on raya
how to delete reddit data,How to delete Reddit data,howto,2,low,volume_10+,,how to delete reddit data | how to delete all reddit data
how to follow a reddit user,How to follow a Reddit user,howto,2,low,volume_10+,,how to follow a reddit user | how to follow reddit user
how to search a reddit community,How to search a Reddit community,howto,2,low,volume_10+,,how to find reddit communities | how to search a reddit community
how to tell if reddit account is suspended,How to tell if Reddit account is suspended,howto,2,low,volume_10+,,how to tell if reddit account is suspended | how to tell if your reddit account is suspended
how to boost reddit post,How to boost Reddit post,howto,2,low,volume_10+,,how to boost reddit post | how to boost your reddit post
how to stop a sugar addiction reddit,How to stop a sugar addiction Reddit,howto,2,low,volume_10+,,how to stop sugar addiction reddit | how to stop a sugar addiction reddit
how to use reddit for beginners,How to use Reddit for beginners,howto,2,low,volume_10+,,how to use reddit for beginners | how to use reddit beginner guide
how to grow a reddit community,How to grow a Reddit community,howto,2,low,volume_10+,,how to grow a reddit community | how to grow reddit community
how to clean a weed grinder reddit,How to clean a weed grinder Reddit,howto,2,low,volume_10+,,how to clean weed grinder reddit | how to clean a weed grinder reddit
how to find dupe furniture reddit,How to find dupe furniture Reddit,howto,2,low,volume_10+,,how to find dupe furniture reddit | how to find furniture dupes reddit
how to stream netflix on discord reddit,How to stream netflix on discord Reddit,howto,2,low,volume_10+,,how to stream netflix on discord reddit | reddit how to stream netflix on discord
how to set reddit flair,How to set Reddit flair,howto,2,low,volume_10+,,how to set flair on reddit | how to set reddit flair
how to get more reddit comment replies,How to get more Reddit comment replies,howto,2,low,volume_10+,,how to get more replies on reddit comment | how to get more reddit comment replies
how to make reddit ads,How to make Reddit ads,howto,2,low,volume_10+,,how to set up reddit ads | how to make reddit ads
how to find my boyfriends reddit,How to find my boyfriends Reddit,howto,2,low,volume_10+,,how to find my boyfriend on reddit | how to find my boyfriends reddit
how to make a reddit page,How to make a Reddit page,howto,2,low,volume_10+,,how to make a reddit page | how to create a reddit page
how to clear reddit historu,How to clear Reddit historu,howto,2,low,volume_10+,,how to clear reddit historu | how to delete reddit historu
how to tag an account on reddit push,How to tag an account on Reddit push,howto,2,low,volume_10+,,how to tag an account on a reddit push | how to tag an account on reddit push
how to edit reddit profile,How to edit Reddit profile,howto,2,low,volume_10+,,how to switch profiles on reddit | how to edit reddit profile
how to stop kratom reddit,How to stop kratom Reddit,howto,2,low,volume_10+,,how to stop using kratom reddit | how to stop kratom reddit
how to get retatrutide reddit,How to get retatrutide Reddit,howto,2,low,volume_10+,,retatrutide how to get reddit | how to get retatrutide reddit
how to watch onlyfans free reddit,How to watch onlyfans free Reddit,howto,2,low,volume_10+,,how to watch onlyfans for free reddit | how to watch onlyfans free reddit
how to reddit anonymous,How to Reddit anonymous,howto,2,low,volume_10+,,how to reddit anonymous | how to be anonymous on reddit
how to mention a user on reddit,How to mention a user on Reddit,howto,2,low,volume_10+,,reddit how to mention a user | how to mention a user on reddit
how to browse reddit privately,How to browse Reddit privately,howto,2,low,volume_10+,,how to browse privately on reddit | how to browse reddit privately
how to stop reddit addiction,How to stop Reddit addiction,howto,2,low,volume_10+,,how to stop reddit addiction | how to stop addiction reddit
how to view redgifs on reddit app,How to view redgifs on Reddit app,howto,2,low,volume_10+,,how to view redgifs on reddit app | how to get to redgifs from reddit app
how to sober up from a high fast reddit,How to sober up from a high fast Reddit,howto,2,low,volume_10+,,how to sober up from a high fast reddit | how to sober up fast reddit high
how to report a reddit post,How to report a Reddit post,howto,2,low,volume_10+,,how to report a reddit post | how to report reddit post
how to search within a subreddit reddit,How to search within a subReddit Reddit,howto,2,low,volume_10+,,reddit search within subreddit how to | how to search within a subreddit reddit
how to make cart last longer reddit,How to make cart last longer Reddit,howto,2,low,volume_10+,,how to make cart last longer reddit | how to make your cart last longer reddit
how to get cocaine out of system reddit,How to get cocaine out of system Reddit,howto,2,low,volume_10+,,how to get cocaine out of system reddit | how to get cocaine out of your system reddit
how to detox weed reddit,How to detox weed Reddit,howto,2,low,volume_10+,,how to detox weed reddit | how to detox from weed reddit
how to cure sleep apnea naturally reddit,How to cure sleep apnea naturally Reddit,howto,2,low,volume_10+,,how to cure sleep apnea naturally reddit | how to naturally cure sleep apnea reddit
how to make a reddit community private,How to make a Reddit community private,howto,2,low,volume_10+,,how to make reddit community private | how to make a reddit community private
how to leave all reddit communities at once,How to leave all Reddit communities at once,howto,2,low,volume_10+,,how to leave all reddit communities at once | how to leave multiple reddit communities at once
how to buy a car reddit,How to buy a car Reddit,howto,2,low,volume_10+,,how to buy a car reddit | how to buy a used car reddit
how to make a post on reddit community,How to make a post on Reddit community,howto,2,low,volume_10+,,how to make a post on reddit community | how to make a post on a reddit community
how to recover a deleted reddit post,How to recover a deleted Reddit post,howto,2,low,volume_10+,,how to recover a deleted reddit post | how to recover deleted reddit post
how to get around a reddit perma ban,How to get around a Reddit perma ban,howto,2,low,volume_10+,,how to get around reddit perma ban | how to get around a reddit perma ban
how to unfollow a reddit post,How to unfollow a Reddit post,howto,2,low,volume_10+,,how to unfollow reddit post | how to unfollow a reddit post
how to start a blog reddit,How to start a blog Reddit,howto,2,low,volume_10+,,how to start a blog reddit | reddit how to start a blog
how to delete a reddit post you made,How to delete a Reddit post you made,howto,2,low,volume_10+,,how to delete a reddit post you made | how to delete reddit post you made
how to access reddit,How to access Reddit,howto,2,low,volume_10+,,how to access reddit | how to access old reddit
how to vape in a hotel room reddit,How to vape in a hotel room Reddit,howto,2,low,volume_10+,,how to vape in a hotel room reddit | how to vape in hotel room reddit
how to edit a pdf for free reddit,How to edit a pdf for free Reddit,howto,2,low,volume_10+,,how to edit a pdf for free reddit | how to edit pdf for free reddit
how to add link in reddit post,How to add link in Reddit post,howto,2,low,volume_10+,,how to add link in reddit post | how to add link to reddit post
how to see deleted reddit profiles,How to see deleted Reddit profiles,howto,2,low,volume_10+,,how to view deleted reddit profiles | how to see deleted reddit profiles
