canonical_keyword,suggested_title,category,variant_count,signal_strength,source,frequency_count,all_variants
how to watch nfl free reddit,How to watch nfl free Reddit,howto,8,high,volume_10+,,how to watch nfl games for free reddit | how to watch nfl games free reddit | reddit how to watch nfl games for free | reddit how to watch nfl games free | how to watch nfl games reddit free | how to watch nfl for free reddit | how to watch nfl free reddit | reddit how to watch nfl games
how to add a video to reddit post,How to add a video to Reddit post,howto,8,high,volume_10+,,how to add video to reddit post | how to add a video to a reddit post | how to embed video in reddit post | how to add a video to reddit post | how to add videos to reddit post | how to embed youtube video in reddit post | how to add youtube video to reddit post | how to embed a youtube video in a reddit post
how to get sound on reddit gif,How to get sound on Reddit gif,howto,8,high,volume_10+,,how to get sound on reddit gifs | how to get reddit gifs with sound | how to get sound in reddit gifs | how to get sound on reddit gif | how to get sound on gifs reddit app | how to get gif sound on reddit app | how to get sound on reddit gifs mobile | how to get sound on reddit gifs iphone
how to sell feet pics reddit,How to sell feet pics Reddit,howto,8,high,volume_10+,,how to sell feet pics reddit | reddit how to sell feet pics | how to sell feet pics on reddit | how to sell feet pics for money reddit | how to sell feet pics on feet finder reddit | how to sell feet pics reddit 2025 | how to sell feet pics reddit 2024 | how to sell feet pics online reddit
how to edit reddit name,How to edit Reddit name,howto,7,high,volume_10+,,how to change reddit name | how to change name on reddit | how to change your name on reddit | how to change your reddit name | how to change my reddit name | how to change my name on reddit | how to edit reddit name
how to find a reddit username,How to find a Reddit username,howto,7,high,volume_10+,,how to find reddit username | how to find my reddit username | how to find your reddit username | how to find out reddit username | how to find username on reddit | how to find a reddit username | how to find a username on reddit
how to get old reddit,How to get old Reddit,howto,7,high,volume_10+,,how to get old reddit | how to get more views on reddit | how to view old reddit | how to get to old reddit | how to get off reddit | how to get views on reddit | how to navigate reddit
how to report a reddit sub,How to report a Reddit sub,howto,7,high,volume_10+,,reddit how to report a subreddit | how to report a reddit sub | how to report a subreddit on reddit | how to report a sub on reddit | how to report reddit sub | how to report a sub reddit | how to report a subreddit to reddit
how to edit a reddit post title,How to edit a Reddit post title,howto,7,high,volume_10+,,how to edit reddit post title | how to edit title of reddit post | how to edit title in reddit post | how to change reddit post title | how to edit the title of a reddit post | how to edit title on reddit post | how to edit a reddit post title
how to delete a reddit thread,How to delete a Reddit thread,howto,7,high,volume_10+,,how to delete threads on reddit | how to delete reddit threads | reddit how to delete threads | how to delete a thread on reddit | how to delete threads reddit | how to delete reddit thread | how to delete a reddit thread
how to add a photo to reddit post,How to add a photo to Reddit post,howto,7,high,volume_10+,,how to add photo to reddit post | how to add photos to reddit post | how to add photos to a reddit post | how to add a photo to reddit post | how to add multiple photos to reddit post | how to add a photo to a reddit post | how to add more photos to reddit post
how to post in a reddit community,How to post in a Reddit community,howto,7,high,volume_10+,,how to post in a reddit community | how to post on reddit community | how to post in a community on reddit | how to post to a reddit community | how to post in reddit community | how to post on a reddit community | how to post on reddit without community
how to make reddit account nsfw,How to make Reddit account nsfw,howto,7,high,volume_10+,,how to make reddit account nsfw | how to make your reddit account nsfw | how to make my reddit account nsfw | how to make my reddit account not nsfw | how to make your reddit account not nsfw | how to make reddit account not nsfw | how to make reddit account nsfw on app
how to get reddit karma fast,How to get Reddit karma fast,howto,7,high,volume_10+,,how to get karma on reddit fast | how to get reddit karma fast | how to get karma fast on reddit | how to get more karma on reddit fast | how to get comment karma on reddit fast | how to get reddit comment karma fast | how to get 100 karma on reddit fast
how to find someone's reddit account,How to find someone's Reddit account,howto,7,high,volume_10+,,how to find someone's reddit account | how to find someone's new reddit account | how to find someone's reddit account methods | how to find someone's account on reddit | how to find someone's reddit account by email | how to find someone's alt reddit account | how to find someone's reddit account without username
how to allow nsfw reddit app,How to allow nsfw Reddit app,howto,7,high,volume_10+,,how to allow nsfw on reddit app | how to turn on nsfw reddit app | how to allow nsfw reddit app | how to enable nsfw on reddit app | how to enable nsfw content on reddit app | how to allow nsfw content on reddit app | how to enable nsfw on reddit app ios
how to stream nfl free reddit,How to stream nfl free Reddit,howto,7,high,volume_10+,,how to stream nfl games for free reddit | reddit how to stream nfl games free | how to stream nfl games free reddit | reddit how to stream nfl games | how to stream nfl games reddit | how to stream nfl for free reddit | how to stream nfl free reddit
how to find someone's number reddit,How to find someone's number Reddit,howto,7,high,volume_10+,,how to find someone's reddit with phone number | reddit how to find someone's phone number | how to find someone's phone number reddit | reddit how to look up phone number | reddit how to lookup a phone number | how to find someone's name by phone number reddit | how to find someone's number reddit
how to log out reddit app,How to log out Reddit app,howto,6,high,volume_10+,,how to log out of reddit app | how to log out reddit app | how to log out on reddit app | how to log out of the reddit app | how to log off reddit app | how to log out of reddit on app
how to add a reddit flair,How to add a Reddit flair,howto,6,high,volume_10+,,how to add flair on reddit | how to add a flair on reddit | reddit how to add flair | how to add flair reddit | how to add reddit flair | how to add a reddit flair
how to mute notifications reddit,How to mute notifications Reddit,howto,6,high,volume_10+,,how to turn off reddit notifications | how to mute notifications on reddit | how to mute notifications reddit | how to mute reddit notifications | how to turn off notifications on reddit | how to disable reddit notifications
how to go incognito reddit,How to go incognito Reddit,howto,6,high,volume_10+,,how to go incognito on reddit | how to go incognito reddit | how to go incognito in reddit | how to go on reddit incognito | how to go reddit incognito | reddit how to go incognito
how to link reddit,How to link Reddit,howto,6,high,volume_10+,,how to hyperlink on reddit | how to link on reddit | how to hyperlink reddit | how to link in reddit | how to hyperlink in reddit | how to link reddit
how to block reddit emails,How to block Reddit emails,howto,6,high,volume_10+,,how to turn off reddit emails | how to turn off emails from reddit | how to disable reddit emails | how to block reddit emails | how to block emails from reddit | how to disable emails from reddit
how to increase reddit karma,How to increase Reddit karma,howto,6,high,volume_10+,,how to increase reddit karma | how to increase karma on reddit | how to increase karma reddit | how to increase karma on reddit tips | how to increase reddit karma tips | how to increase reddit karma quickly
how to give a blowjob reddit,How to give a blowjob Reddit,howto,6,high,volume_10+,,how to give a blowjob reddit | how to give blowjob reddit | reddit how to give a blowjob | how to give the best blowjob reddit | reddit how to give blowjob | how to give best blowjob reddit
how to delete a reddit community,How to delete a Reddit community,howto,6,high,volume_10+,,how to delete a reddit community | how to delete reddit community | how to delete community on reddit | how to delete a community on reddit | how to delete my reddit community | how to delete your reddit community
how to see my reddit posts,How to see my Reddit posts,howto,6,high,volume_10+,,how to see old reddit posts | how to view old reddit posts | how to look at old reddit posts | how to see my reddit posts | how to get more posts on reddit | how to see your reddit posts
how to make a reddit bot,How to make a Reddit bot,howto,6,high,volume_10+,,how to make a reddit bot | how to create a reddit bot | how to make a bot on reddit | how to build a reddit bot | how to make reddit bots | how to make reddit bot
how to find a deleted reddit post,How to find a deleted Reddit post,howto,6,high,volume_10+,,how to find a deleted reddit post | how to find deleted reddit post | how to find out if my reddit post was deleted | how to find a reddit post that was deleted | how to find out if reddit post was deleted | how to find deleted post on reddit
how to find a reddit account,How to find a Reddit account,howto,6,high,volume_10+,,how to find a reddit account | how to find reddit accounts | how to find reddit account | how to find an account on reddit | how to find old reddit account | how to find accounts on reddit
how to block a sub reddit,How to block a sub Reddit,howto,6,high,volume_10+,,reddit how to block a subreddit | reddit how to block subreddits | how to block a sub reddit | how to block a reddit sub | how to block subreddits on reddit | how to block a subreddit on reddit
how to quote a reddit comment,How to quote a Reddit comment,howto,6,high,volume_10+,,how to quote a reddit comment | how to quote reddit comment | how to quote in reddit comment | reddit how to quote comment | how to quote in a reddit comment | how to quote a comment on reddit
how to promote a podcast on reddit best practices,How to promote a podcast on Reddit best practices,howto,6,high,volume_10+,,how to promote podcasts on reddit best practices | how to promote podcast on reddit best practices | how to promote podcasts on reddit effectively | how to promote podcast on reddit | how to promote a podcast on reddit best practices | how to promote podcasts on reddit
how to make a reddit post anonymous,How to make a Reddit post anonymous,howto,6,high,volume_10+,,how to make an anonymous post on reddit | how to make anonymous reddit post | how to make an anonymous reddit post | how to make anonymous post on reddit | how to make a reddit post anonymous | how to make reddit post anonymous
how to reddit incognito,How to Reddit incognito,howto,6,high,volume_10+,,how to reddit incognito | how to use reddit incognito | how to incognito reddit | how to incognito on reddit | how to do incognito on reddit | how to use incognito on reddit
how to pin a post on reddit profile,How to pin a post on Reddit profile,howto,6,high,volume_10+,,how to pin a post to your reddit profile | how to pin a post on reddit profile | how to pin a post on your reddit profile | how to pin post to reddit profile | how to pin reddit post to profile | how to pin post on reddit profile
how to add a video on reddit,How to add a video on Reddit,howto,6,high,volume_10+,,how to put videos on reddit | how to add video on reddit | how to add videos on reddit | how to add a video on reddit | how to add video to reddit | how to add videos to reddit
how to see reddit search history,How to see Reddit search history,howto,6,high,volume_10+,,how to see reddit search history | how to view reddit search history | how to see search history on reddit | how to look at reddit search history | how to check reddit search history | how to see deleted reddit search history
how to find reddit pr client,How to find Reddit pr client,howto,6,high,volume_10+,,how to find reddit pr clients | how to find pr clients using reddit | how to find pr clients on reddit | how to find clients on reddit pr | how to find reddit pr client | how to find clients on reddit for pr services
how to find saved reddit posts,How to find saved Reddit posts,howto,6,high,volume_10+,,how to find saved posts on reddit | how to find saved reddit posts | how to find reddit saved posts | how to find my saved reddit posts | how to find saved posts on reddit desktop | how to find saved posts reddit desktop
how to find someones reddit username,How to find someones Reddit username,howto,6,high,volume_10+,,how to find someone on reddit without username | how to find someones reddit username | how to find someone on reddit with username | how to find someone on reddit by username | how to find someone on reddit without their username | how to find someone on reddit with their username
how to enable reddit dark mode,How to enable Reddit dark mode,howto,6,high,volume_10+,,how to turn on reddit dark mode | how to turn on dark mode on reddit | how to enable reddit dark mode | how to turn on dark mode reddit | how to turn on dark mode reddit desktop | how to turn on dark mode on reddit pc
how to make a reddit story video,How to make a Reddit story video,howto,6,high,volume_10+,,how to make reddit story videos | how to make a reddit story video | how to make those reddit story videos | how to create reddit story videos | how to make ai reddit story videos | how to make reddit story videos for free
how to find a reddit user without username,How to find a Reddit user without username,howto,6,high,volume_10+,,how to find reddit user by username on app | how to find reddit user by username on reddit app | how to find reddit user by username in reddit app | how to find reddit user by username in app | how to find a reddit user without username | how to search for users on reddit app
how to see chegg answers reddit,How to see chegg answers Reddit,howto,6,high,volume_10+,,how to see chegg answers free reddit | how to get chegg answers for free reddit | how to view chegg answers for free reddit | how to see chegg answers reddit | how to view chegg answers reddit | how to get chegg for free reddit
how to see a private instagram account reddit,How to see a private instagram account Reddit,howto,6,high,volume_10+,,how to view instagram without an account reddit | how to view instagram without account reddit | reddit how to view instagram without account | how to see a private instagram account reddit | how to view a private instagram account reddit | how to see if someone has multiple instagram accounts reddit
how to find the date of a reddit post,How to find the date of a Reddit post,howto,6,high,volume_10+,,how to find date of reddit post | how to find the date of a reddit post | how to find reddit post date | how to find exact date of reddit post | how to find the exact date of a reddit post | how to find the date a reddit post was made
how to stop smoking weed reddit,How to stop smoking weed Reddit,howto,6,high,volume_10+,,how to stop smoking weed reddit | how to stop smoking weed everyday reddit | how to stop smoking weed reddit anxiety | how to stop smoking weed reddit adhd | how to stop smoking weed while pregnant reddit | how to slowly stop smoking weed reddit
how to quote reddit,How to quote Reddit,howto,5,high,volume_10+,,how to quote on reddit | reddit how to quote | how to quote in reddit | how to quote reddit | how to do quotes on reddit
how to delete a reddit,How to delete a Reddit,howto,5,high,volume_10+,,how to delete reddit | how to get rid of reddit | how to delete a reddit | how to remove reddit | how to delete your reddit
how to turn on reddit nsfw,How to turn on Reddit nsfw,howto,5,high,volume_10+,,how to enable nsfw on reddit | how to turn on nsfw on reddit | how to allow nsfw on reddit | how to turn on reddit nsfw | how to turn on nsfw reddit
how to earn reddit karma,How to earn Reddit karma,howto,5,high,volume_10+,,how to earn karma on reddit | how to earn reddit karma | how to earn karma on reddit tips | reddit karma how to earn | reddit how to earn karma
how to see removed reddit posts,How to see removed Reddit posts,howto,5,high,volume_10+,,how to see removed reddit posts | how to view removed reddit posts | how to read removed reddit posts | how to see removed posts on reddit | reddit how to see removed posts
how to delete reddit chats,How to delete Reddit chats,howto,5,high,volume_10+,,how to delete reddit chats | how to delete chats in reddit | how to delete all reddit chats | how to delete chats on reddit | how to delete all chats on reddit
how to get a reddit flair,How to get a Reddit flair,howto,5,high,volume_10+,,how to get flair on reddit | how to get a flair on reddit | how to get reddit flair | how to get a reddit flair | how to see reddit flairs
how to appeal a reddit ban,How to appeal a Reddit ban,howto,5,high,volume_10+,,how to appeal reddit ban | how to appeal a reddit ban | how to appeal ban on reddit | reddit how to appeal a ban | how to appeal a ban on reddit
how to hide reddit posts,How to hide Reddit posts,howto,5,high,volume_10+,,how to hide reddit posts | how to hide your reddit posts | how to hide posts on reddit | how to hide my reddit posts | how to hide your posts on reddit
how to know if a reddit account is banned,How to know if a Reddit account is banned,howto,5,high,volume_10+,,how to know if reddit account is banned | how to know if my reddit account is banned | how to know if your reddit account is banned | how to know if reddit account banned | how to know if a reddit account is banned
how to browse reddit anonymously,How to browse Reddit anonymously,howto,5,high,volume_10+,,how to browse reddit anonymously | how to browse anonymously on reddit | how to anonymously browse reddit | how to browse anonymously reddit | reddit how to browse anonymously
how to add flair to a reddit post,How to add flair to a Reddit post,howto,5,high,volume_10+,,how to add flair to reddit post | how to add a flair to a reddit post | reddit how to add flair to post | how to add flair on reddit post | how to add flair to a reddit post
how to post an image on reddit,How to post an image on Reddit,howto,5,high,volume_10+,,how to post images on reddit | how to post an image on reddit | how to post multiple images on reddit | how to post image on reddit | how to post image to reddit post
how to search reddit posts,How to search Reddit posts,howto,5,high,volume_10+,,how to find old reddit posts | how to find your reddit posts | how to search old reddit posts | how to search reddit posts | how to find my reddit posts
how to save a reddit post,How to save a Reddit post,howto,5,high,volume_10+,,how to save a reddit post | how to save a post on reddit | how to save reddit post | how to download reddit post | how to download a reddit post
how to pin a reddit post,How to pin a Reddit post,howto,5,high,volume_10+,,how to pin a reddit post | how to pin reddit post | how to pin a post on reddit | how to pin post on reddit | reddit how to pin a post
how to block a reddit community,How to block a Reddit community,howto,5,high,volume_10+,,how to block a reddit community | how to block a community on reddit | how to block reddit community | how to block communities on reddit | how to block community on reddit
how to hide reddit comments,How to hide Reddit comments,howto,5,high,volume_10+,,how to hide comments on reddit | how to hide reddit comments | how to hide my reddit comments | how to hide your comments on reddit | how to hide my comments on reddit
how to make a reddit throwaway,How to make a Reddit throwaway,howto,5,high,volume_10+,,how to make reddit throwaway | how to make throwaway reddit | how to create reddit throwaway | how to make a reddit throwaway | how to make a throwaway reddit
how to edit a reddit post on mobile,How to edit a Reddit post on mobile,howto,5,high,volume_10+,,how to edit a reddit post on mobile | how to edit reddit post on mobile | how to edit a post on reddit mobile | how to edit post on reddit mobile | how to edit reddit post mobile
how to hide reddit post history,How to hide Reddit post history,howto,5,high,volume_10+,,how to hide post history on reddit | how to hide reddit post history | reddit how to hide post history | how to hide your reddit post history | how to hide post history reddit
how to save reddit videos on pc,How to save Reddit videos on pc,howto,5,high,volume_10+,,how to download reddit videos on pc | how to download videos from reddit on pc | how to download reddit videos pc | how to download reddit video on pc | how to save reddit videos on pc
how to add an image to a reddit post,How to add an image to a Reddit post,howto,5,high,volume_10+,,how to add image to reddit post | how to add images to reddit post | how to add multiple images to reddit post | how to add an image to a reddit post | how to embed image in reddit post
how to find a reddit users email,How to find a Reddit users email,howto,5,high,volume_10+,,how to find a reddit user by email | how to find reddit user by email | how to find a reddit users email | how to find out a reddit users email | how to find email of reddit user
how to save reddit images,How to save Reddit images,howto,5,high,volume_10+,,how to save reddit images | how to download reddit images | how to save images from reddit | how to download reddit image | how to download images from reddit
how to tell if a reddit account is banned,How to tell if a Reddit account is banned,howto,5,high,volume_10+,,how to tell if reddit account is banned | how to tell if my reddit account is banned | how to tell if reddit account banned | how to tell if your reddit account is banned | how to tell if a reddit account is banned
how to add a picture to reddit post,How to add a picture to Reddit post,howto,5,high,volume_10+,,how to add pictures to reddit post | how to add picture to reddit post | how to add a picture to a reddit post | how to add a picture to reddit post | how to add pictures to a reddit post
how to get a reddit account banned,How to get a Reddit account banned,howto,5,high,volume_10+,,how to view banned reddit accounts | how to check if reddit account is banned | how to check if my reddit account is banned | how to get a reddit account banned | how to see banned reddit accounts
how to save videos from reddit app,How to save videos from Reddit app,howto,5,high,volume_10+,,how to save videos from reddit app | how to download video from reddit app | how to download videos from reddit app | save videos from reddit app how to | how to download video in reddit app
how to see reddit shares,How to see Reddit shares,howto,5,high,volume_10+,,how to see reddit shares | how to get more reddit post views | how to preview reddit post | how to get more reddit post shares | how to get more shares on reddit
how to make a reddit account private,How to make a Reddit account private,howto,5,high,volume_10+,,how to make reddit account private | how to make your reddit account private | how to make my reddit account private | how to make a reddit account private | how to make reddit account private mobile
how to make a reddit account after being banned,How to make a Reddit account after being banned,howto,5,high,volume_10+,,how to make a new reddit account after being banned | how to make a reddit account after being banned | how to create a reddit account after being banned | banned from reddit how to make new account | how to create reddit account if shadow banned
how to change reddit display name,How to change Reddit display name,howto,5,high,volume_10+,,how to change reddit display name | how to change display name on reddit | how to change display name reddit | how to change my reddit display name | how to change reddit username display name
how to make a second reddit account,How to make a second Reddit account,howto,5,high,volume_10+,,how to make a second reddit account | how to create a second reddit account | how to create second reddit account | how to make second reddit account | how to make a second reddit account on mobile
how to kill a tooth nerve reddit,How to kill a tooth nerve Reddit,howto,5,high,volume_10+,,how to kill a nerve in a tooth reddit | how to kill a tooth nerve reddit | how to kill nerve in tooth reddit | how to kill tooth nerve reddit | how to kill an exposed tooth nerve reddit
how to make reddit story tiktoks,How to make Reddit story tiktoks,howto,5,high,volume_10+,,how to make reddit story tiktoks | how to make reddit stories on tiktok | how to make tiktok reddit stories | how to make the reddit story tiktoks | how to make reddit story tiktoks for free
how to give a blow job reddit,How to give a blow job Reddit,howto,5,high,volume_10+,,how to give a blow job reddit | how to give blow job reddit | reddit how to give a blow job | how to give the best blow job reddit | how to give a good blow job reddit
how to get prescribed adderall reddit,How to get prescribed adderall Reddit,howto,5,high,volume_10+,,how to get prescribed adderall reddit | how to get adderall prescribed reddit | reddit how to get prescribed adderall | how to get adderall prescribed texas reddit | how to get prescribed adderall reddit 2022
how to make money online reddit,How to make money online Reddit,howto,5,high,volume_10+,,how to make money online reddit | reddit how to make money online | how to make money online reddit 2025 | how to make money online reddit 2021 | how to make money online reddit 2022
