canonical_keyword,suggested_title,category,variant_count,signal_strength,source,frequency_count,all_variants
how to make reddit dark mode,How to make Reddit dark mode,howto,5,high,volume_10+,,how to make reddit dark mode | how to make old reddit dark mode | how to make reddit dark mode desktop | how to make reddit dark mode without signing in | how to make reddit app dark mode
how to block reddit app on iphone,How to block Reddit app on iphone,howto,5,high,volume_10+,,how to disable nsfw on reddit app iphone | how to turn off nsfw on reddit app iphone | how to turn off nsfw on reddit iphone | how to turn off nsfw on reddit on iphone | how to block reddit app on iphone
how to stop reddit sending emails,How to stop Reddit sending emails,howto,5,high,volume_10+,,how to stop reddit from sending emails | how to stop reddit sending emails | how to get reddit to stop sending emails | how to make reddit stop sending emails | how to stop reddit from sending me emails
how to pass a drug test reddit,How to pass a drug test Reddit,howto,5,high,volume_10+,,how to pass a drug test reddit | how to pass drug test reddit | how to pass a drug test tomorrow reddit | how to pass drug test for probation reddit | how to pass random drug test reddit
how to view comments reddit mobile,How to view comments Reddit mobile,howto,5,high,volume_10+,,how to view comments on reddit mobile app | how to view comments reddit mobile app | how to view comments on reddit mobile | how to view comments reddit mobile | how to read comments on reddit app
how to detox weed for a drug test reddit,How to detox weed for a drug test Reddit,howto,4,medium,volume_10+,,how to detox weed for drug test reddit | how to detox from weed for drug test reddit | how to detox from weed for a drug test reddit | how to detox weed for a drug test reddit
how to dm reddit,How to dm Reddit,howto,4,medium,volume_10+,,how to dm on reddit | how to message on reddit | how to dm reddit | how to dm in reddit
how to mla cite a reddit post,How to mla cite a Reddit post,howto,4,medium,volume_10+,,how to cite a reddit post in mla | how to mla cite a reddit post | how to cite a reddit post mla | how to cite reddit post mla
how to edit reddit flair,How to edit Reddit flair,howto,4,medium,volume_10+,,how to change flair on reddit | how to change reddit flair | how to change your flair on reddit | how to edit reddit flair
how to clear reddit cache,How to clear Reddit cache,howto,4,medium,volume_10+,,how to clear reddit cache | how to clear cache on reddit | how to delete reddit cache | how to clear cache reddit
how to spoiler tag reddit,How to spoiler tag Reddit,howto,4,medium,volume_10+,,how to spoiler tag on reddit | how to spoiler tag reddit | reddit how to spoiler tag | how to tag spoilers on reddit
how to deactivate a reddit account,How to deactivate a Reddit account,howto,4,medium,volume_10+,,how to deactivate reddit account | how to deactivate a reddit account | how to deactivate my reddit account | how to disable reddit account
how to make money reddit,How to make money Reddit,howto,4,medium,volume_10+,,how to make money on reddit | how to make money reddit | reddit how to make money | how to make money from reddit
how to find out if someone has a reddit account,How to find out if someone has a Reddit account,howto,4,medium,volume_10+,,how to find someones reddit account | how to find someone reddit account | how to find out if someone has a reddit account | how to find someones account on reddit
how to post a picture on reddit,How to post a picture on Reddit,howto,4,medium,volume_10+,,how to post pictures on reddit | how to post a picture on reddit | how to send pictures on reddit | how to post multiple pictures on reddit
how to see history on reddit desktop,How to see history on Reddit desktop,howto,4,medium,volume_10+,,how to see history on reddit desktop | how to view reddit history on desktop | how to see reddit history on desktop | how to view history on reddit desktop
how to change reddit user,How to change Reddit user,howto,4,medium,volume_10+,,how to change reddit user | how to change your reddit user | how to change my reddit user | how to change user on reddit
how to private a reddit account,How to private a Reddit account,howto,4,medium,volume_10+,,how to private reddit account | how to private my reddit account | how to private your reddit account | how to private a reddit account
how to cite a reddit post apa,How to cite a Reddit post apa,howto,4,medium,volume_10+,,how to cite a reddit post in apa | how to cite reddit post apa | how to cite a reddit post apa | how to apa cite a reddit post
how to hide posts on reddit profile,How to hide posts on Reddit profile,howto,4,medium,volume_10+,,how to hide reddit posts from profile | how to hide posts on reddit profile | how to hide reddit posts on profile | how to hide posts from reddit profile
how to give a good blowjob reddit,How to give a good blowjob Reddit,howto,4,medium,volume_10+,,how to give a good blowjob reddit | how to give good blowjobs reddit | reddit how to give a good blowjob | how to give good blowjob reddit
how to change reddit user name,How to change Reddit user name,howto,4,medium,volume_10+,,how to change reddit user name | how to change your reddit user name | how to change my reddit user name | how to change user name on reddit
how to embed a reddit video in discord,How to embed a Reddit video in discord,howto,4,medium,volume_10+,,how to embed reddit video in discord | how to embed reddit videos on discord | how to embed reddit videos in discord | how to embed a reddit video in discord
how to find someone's reddit username,How to find someone's Reddit username,howto,4,medium,volume_10+,,how to find someone's reddit username | how to find out someone's reddit username | how to find someone's reddit without username | how to find someone's username on reddit
how to anonymous browse reddit,How to anonymous browse Reddit,howto,4,medium,volume_10+,,how to anonymous browse reddit | how to anonymous browse on reddit | how to browse anonymous on reddit | reddit how to anonymous browse
how to unhide a reddit post,How to unhide a Reddit post,howto,4,medium,volume_10+,,how to unhide reddit post | how to unhide a post on reddit | how to unhide post on reddit | how to unhide a reddit post
how to switch accounts reddit desktop,How to switch accounts Reddit desktop,howto,4,medium,volume_10+,,how to switch reddit accounts on desktop | how to switch accounts on reddit desktop | how to switch between reddit accounts on desktop | how to switch accounts reddit desktop
how to clear reddit notifications,How to clear Reddit notifications,howto,4,medium,volume_10+,,how to delete reddit notifications | how to get rid of reddit notifications | how to clear reddit notifications | how to delete notifications on reddit
how to change reddit account,How to change Reddit account,howto,4,medium,volume_10+,,how to switch reddit accounts | how to switch between reddit accounts | how to switch accounts on reddit | how to change reddit account
how to turn off reddit email notifications,How to turn off Reddit email notifications,howto,4,medium,volume_10+,,how to turn off reddit email notifications | how to turn off email notifications from reddit | how to turn off email notifications reddit | how to turn off email notifications on reddit
how to unsubscribe reddit,How to unsubscribe Reddit,howto,4,medium,volume_10+,,how to unsubscribe from reddit | how to unsubscribe reddit | how to unsubscribe to reddit | how to unsubscribe on reddit
how to see reddit wrapped,How to see Reddit wrapped,howto,4,medium,volume_10+,,how to see reddit wrapped | how to get reddit wrapped | how to view reddit wrapped | how to check reddit wrapped
how to save onlyfans videos reddit,How to save onlyfans videos Reddit,howto,4,medium,volume_10+,,how to download onlyfans videos reddit | how to download videos from onlyfans reddit | reddit how to download onlyfans videos | how to save onlyfans videos reddit
how to make a sub reddit,How to make a sub Reddit,howto,4,medium,volume_10+,,how to make a sub reddit | reddit how to create a subreddit | how to create a subreddit on reddit | how to make a subreddit on reddit
how to use reddit without an account,How to use Reddit without an account,howto,4,medium,volume_10+,,how to use reddit without account | how to use your reddit accounts effectively | how to have multiple reddit accounts | how to use reddit without an account
how to view a suspended reddit account,How to view a suspended Reddit account,howto,4,medium,volume_10+,,how to view suspended reddit accounts | how to see suspended reddit accounts | how to view suspended reddit account | how to view a suspended reddit account
how to block a reddit user,How to block a Reddit user,howto,4,medium,volume_10+,,how to block reddit user | how to block a reddit user | how to block a user on reddit | reddit how to block user
how to change reddit u/,How to change Reddit u/,howto,4,medium,volume_10+,,how to change reddit u/ | how to change my reddit u/ | how to change u/ on reddit | how to change your reddit u/
how to post on a reddit group,How to post on a Reddit group,howto,4,medium,volume_10+,,how to post in reddit group | how to post on reddit group | how to post on a reddit group | how to post in a reddit group
how to see who upvoted on reddit,How to see who upvoted on Reddit,howto,4,medium,volume_10+,,how to see who upvoted you on reddit | how to see what you upvoted on reddit | reddit how to see who upvoted | how to see who upvoted on reddit
how to delete reddit history iphone,How to delete Reddit history iphone,howto,4,medium,volume_10+,,how to clear reddit history on iphone | how to delete reddit history iphone | how to erase history in reddit on iphone | how to delete reddit history on iphone
how to do anonymous browsing reddit,How to do anonymous browsing Reddit,howto,4,medium,volume_10+,,how to use anonymous browsing on reddit | how to use reddit anonymous browsing | how to do anonymous browsing reddit | how to do anonymous browsing on reddit
how to get a reddit account unbanned,How to get a Reddit account unbanned,howto,4,medium,volume_10+,,how to get reddit account unbanned | how to get my reddit account unbanned | how to get your reddit account unbanned | how to get a reddit account unbanned
how to avoid reddit account suspension,How to avoid Reddit account suspension,howto,4,medium,volume_10+,,how to avoid reddit suspension new account tips | how to avoid reddit account suspension tips | how to avoid reddit suspension new account | how to avoid reddit account suspension
how to make an anonymous reddit account,How to make an anonymous Reddit account,howto,4,medium,volume_10+,,how to create an anonymous reddit account | how to make an anonymous reddit account | how to create anonymous reddit account | how to make anonymous reddit account
how to remind me on reddit,How to remind me on Reddit,howto,4,medium,volume_10+,,how to do remind me on reddit | how to remind me on reddit | how to use reddit remind me | how to use remind me reddit
how to blowjob reddit,How to blowjob Reddit,howto,4,medium,volume_10+,,blowjob tutorial reddit | reddit blowjob tutorial | reddit how to blowjob | how to blowjob reddit
how to farm karma reddit,How to farm karma Reddit,howto,4,medium,volume_10+,,how to farm karma on reddit | how to farm karma reddit | how to karma farm reddit | how to farm reddit karma
how to find a person reddit,How to find a person Reddit,howto,4,medium,volume_10+,,how to find a person on reddit | how to find person on reddit | how to find a person reddit | how to search for a person on reddit
how to clear reddit hidden history,How to clear Reddit hidden history,howto,4,medium,volume_10+,,how to delete hidden reddit history | how to clear reddit hidden history | how to delete hidden history on reddit | how to delete reddit hidden history
how to appeal a permanent reddit ban,How to appeal a permanent Reddit ban,howto,4,medium,volume_10+,,how to appeal reddit permanent ban | how to appeal permanent ban on reddit | how to appeal permanent reddit ban | how to appeal a permanent reddit ban
how to increase reddit comment karma,How to increase Reddit comment karma,howto,4,medium,volume_10+,,how to increase reddit comment karma | how to increase comment karma reddit tips | how to increase comment karma on reddit | how to increase reddit comment karma tips
how to save reddit images without watermark,How to save Reddit images without watermark,howto,4,medium,volume_10+,,how to download reddit images without watermark | how to save images from reddit without watermark | how to download reddit image without watermark | how to save reddit images without watermark
how to delete reddit posts and comments,How to delete Reddit posts and comments,howto,4,medium,volume_10+,,how to delete all reddit comments and posts | how to delete all reddit posts and comments | how to delete reddit posts and comments | how to delete all posts and comments on reddit
how to delete a sub reddit,How to delete a sub Reddit,howto,4,medium,volume_10+,,how to delete a sub reddit | reddit how to delete subreddit | how to delete a reddit sub | how to delete reddit subreddit
how to clear recent reddit history,How to clear recent Reddit history,howto,4,medium,volume_10+,,how to delete reddit recent history | how to clear recent reddit history | how to clear reddit recent history | how to delete recent reddit history
how to turn on sound reddit gif,How to turn on sound Reddit gif,howto,4,medium,volume_10+,,how to turn on sound on reddit gifs | how to enable sound on reddit gifs | how to turn on sound for reddit gifs | how to turn on sound reddit gif
how to see reddit following,How to see Reddit following,howto,4,medium,volume_10+,,how to see reddit following list | how to check reddit following | how to see reddit following | how to see following on reddit
how to find reddit upvotes,How to find Reddit upvotes,howto,4,medium,volume_10+,,how to find reddit upvotes | how to find upvotes on reddit | how to find my upvotes on reddit | how to find your upvotes on reddit
how to send pictures on reddit dm,How to send pictures on Reddit dm,howto,4,medium,volume_10+,,how to send pictures in reddit chat | how to send pictures on reddit dm | how to send picture on reddit chat | how to send pictures on reddit chat
how to make reddit profile private,How to make Reddit profile private,howto,4,medium,volume_10+,,how to make reddit profile private | how to make my reddit profile private | how to make your reddit profile private | how to make reddit profile private 2025
how to delete a reddit account on mobile,How to delete a Reddit account on mobile,howto,4,medium,volume_10+,,how to delete reddit account on mobile | how to delete reddit account mobile | how to delete a reddit account on mobile | how to delete reddit account on mobile app
how to clear reddit search history,How to clear Reddit search history,howto,4,medium,volume_10+,,how to delete reddit search history | how to clear reddit search history | how to clear search history on reddit | how to clear reddit search history activity
how to see removed reddit comments,How to see removed Reddit comments,howto,4,medium,volume_10+,,how to see removed reddit comments | how to see removed comments on reddit | how to view removed reddit comments | how to see comments removed by moderator reddit
how to find a sugar daddy reddit,How to find a sugar daddy Reddit,howto,4,medium,volume_10+,,how to find a sugar daddy reddit | reddit how to find sugar daddy | reddit how to find a sugar daddy | reddit how to find sugar daddy stories
how to clear reddit app cache,How to clear Reddit app cache,howto,4,medium,volume_10+,,how to clear reddit app cache | how to clear cache reddit app | how to clear cache on reddit app | how to clear reddit app cache on iphone
how to find a reddit account by email,How to find a Reddit account by email,howto,4,medium,volume_10+,,how to find reddit account with email | how to find a reddit account by email | how to find the email of a reddit account | how to find email associated with reddit account
how to get 100 va disability reddit,How to get 100 va disability Reddit,howto,4,medium,volume_10+,,reddit how to get 100 va disability | how to get 100 va disability reddit | how to get 100 disability from the va reddit | how to get 100 percent va disability reddit
how to add a flair on reddit mobile,How to add a flair on Reddit mobile,howto,4,medium,volume_10+,,how to add a flair on reddit mobile | how to add flair on reddit mobile | how to add flair reddit mobile | how to add custom flair on reddit mobile
how to clear inbox reddit app,How to clear inbox Reddit app,howto,4,medium,volume_10+,,how to clear inbox on reddit app | how to clear inbox reddit app | how to delete inbox messages on reddit app | how to clear inbox on reddit app clear messages
how to find someone on reddit by email,How to find someone on Reddit by email,howto,4,medium,volume_10+,,how to find someone on reddit by email | how to find someone on reddit with email | how to find someone on reddit by email for free | how to find someone on reddit with their email
how to start period early reddit,How to start period early Reddit,howto,4,medium,volume_10+,,how to start period early reddit | how to start your period early reddit | how to get period to start early reddit | how to get my period to start early reddit
how to get past a reddit ban,How to get past a Reddit ban,howto,4,medium,volume_10+,,how to get past reddit ban | how to get past a reddit ban | how to get past reddit permanent ban | how to get past reddit ip ban
how to edit flair on reddit mobile,How to edit flair on Reddit mobile,howto,4,medium,volume_10+,,how to change user flair reddit mobile | how to edit user flair on reddit mobile | how to edit flair on reddit mobile | how to change reddit flair on mobile
how to get out of jury duty reddit,How to get out of jury duty Reddit,howto,4,medium,volume_10+,,how to get out of jury duty reddit | how to get out of jury duty reddit california | how to get out of federal jury duty reddit | how to get out of jury duty in texas reddit
reddit how to recover from cold,reddit how to recover from cold,other,4,medium,volume_10+,,reddit how to recover from a cold | reddit how to recover from a cold tips | reddit how to recover from cold | reddit how to recover from cold tips
how to crosspost reddit,How to crosspost Reddit,howto,3,medium,volume_10+,,how to crosspost on reddit | reddit how to crosspost | how to crosspost reddit
how to sign out reddit app,How to sign out Reddit app,howto,3,medium,volume_10+,,how to sign out of reddit app | how to sign out reddit app | how to sign out on reddit app
how to cross post reddit,How to cross post Reddit,howto,3,medium,volume_10+,,how to cross post on reddit | how to cross post reddit | reddit how to cross post
how to block reddit,How to block Reddit,howto,3,medium,volume_10+,,how to block reddit | how to block on reddit | how to deactivate reddit
how to tag someone reddit,How to tag someone Reddit,howto,3,medium,volume_10+,,how to tag someone on reddit | how to tag someone in reddit | how to tag someone reddit
how to gain karma reddit,How to gain karma Reddit,howto,3,medium,volume_10+,,how to gain karma on reddit | how to gain karma reddit | how to gain reddit karma
how to spoiler reddit,How to spoiler Reddit,howto,3,medium,volume_10+,,how to spoiler on reddit | how to do spoilers on reddit | how to spoiler reddit
how to change reddit password,How to change Reddit password,howto,3,medium,volume_10+,,how to change reddit password | how to change password on reddit | reddit how to change password
how to report a reddit community,How to report a Reddit community,howto,3,medium,volume_10+,,how to report a reddit community | how to report reddit community | how to report a community on reddit
how to give head reddit,How to give head Reddit,howto,3,medium,volume_10+,,how to give head reddit | how to give the best head reddit | reddit how to give head
how to unsubscribe reddit email,How to unsubscribe Reddit email,howto,3,medium,volume_10+,,how to unsubscribe from reddit emails | how to unsubscribe to reddit emails | how to unsubscribe reddit email
how to go anonymous reddit,How to go anonymous Reddit,howto,3,medium,volume_10+,,how to go anonymous on reddit | how to go anonymous reddit | reddit how to go anonymous
how to make a burner reddit account,How to make a burner Reddit account,howto,3,medium,volume_10+,,how to make a burner reddit account | how to create a burner reddit account | how to make a reddit burner account
how to permanently delete a reddit account,How to permanently delete a Reddit account,howto,3,medium,volume_10+,,how to permanently delete reddit account | how to delete reddit account permanently | how to permanently delete a reddit account
how to get a reddit api key,How to get a Reddit api key,howto,3,medium,volume_10+,,how to get reddit api key | how to get a reddit api key | reddit api key how to get
how to post a redgif to reddit,How to post a redgif to Reddit,howto,3,medium,volume_10+,,how to post redgifs on reddit | how to post a redgif to reddit | how to post redgifs to reddit
how to view nsfw reddit without account,How to view nsfw Reddit without account,howto,3,medium,volume_10+,,how to view nsfw reddit without account | how to view nsfw on reddit without account | how to view reddit nsfw without account
how to block reddit porn,How to block Reddit porn,howto,3,medium,volume_10+,,how to block porn on reddit | how to block reddit porn | how to block porn reddit
how to get reddit comment karma,How to get Reddit comment karma,howto,3,medium,volume_10+,,how to get comment karma on reddit | how to get more comment karma on reddit | how to get reddit comment karma
how to cite reddit apa,How to cite Reddit apa,howto,3,medium,volume_10+,,how to cite reddit apa | how to cite reddit in apa | how to apa cite reddit
how to quote reddit mobile,How to quote Reddit mobile,howto,3,medium,volume_10+,,how to quote on reddit mobile | how to quote reddit mobile | how to quote in reddit mobile
how to cite reddit mla,How to cite Reddit mla,howto,3,medium,volume_10+,,how to cite reddit mla | how to cite reddit in mla | how to mla cite reddit
how to search a reddit users comments,How to search a Reddit users comments,howto,3,medium,volume_10+,,how to look up a reddit users comments | how to search reddit user comments | how to search a reddit users comments
how to change reddit username mobile,How to change Reddit username mobile,howto,3,medium,volume_10+,,how to change username on reddit mobile | how to change reddit username on mobile | how to change reddit username mobile
how to post a gif on reddit,How to post a gif on Reddit,howto,3,medium,volume_10+,,how to post gif on reddit | how to post gifs on reddit | how to post a gif on reddit
how to make reddit private,How to make Reddit private,howto,3,medium,volume_10+,,how to make reddit private | how to make my reddit private | how to make your reddit private
how to get adderall reddit,How to get adderall Reddit,howto,3,medium,volume_10+,,how to get adderall reddit | how to get off adderall reddit | reddit how to get adderall
how to turn on reddit incognito mode,How to turn on Reddit incognito mode,howto,3,medium,volume_10+,,how to turn on reddit incognito mode | how to turn on incognito mode on reddit | how to turn on incognito mode reddit
how to change reddit handle,How to change Reddit handle,howto,3,medium,volume_10+,,how to change reddit handle | how to change your reddit handle | how to change my reddit handle
how to turn on anonymous browsing reddit,How to turn on anonymous browsing Reddit,howto,3,medium,volume_10+,,how to turn on anonymous browsing reddit | how to turn on reddit anonymous browsing | how to turn on anonymous browsing on reddit
how to unhide reddit posts,How to unhide Reddit posts,howto,3,medium,volume_10+,,how to unhide posts on reddit | reddit how to unhide posts | how to unhide reddit posts
how to search reddit comments,How to search Reddit comments,howto,3,medium,volume_10+,,how to search reddit comments | how to search your reddit comments | how to search my reddit comments
how to log out of a reddit account,How to log out of a Reddit account,howto,3,medium,volume_10+,,how to log out of reddit account | how to log out of a reddit account | how to log out reddit account
how to download soundcloud songs reddit,How to download soundcloud songs Reddit,howto,3,medium,volume_10+,,how to download soundcloud songs reddit | how to download songs from soundcloud reddit | how to download songs off soundcloud reddit
how to find a deleted reddit account,How to find a deleted Reddit account,howto,3,medium,volume_10+,,how to find deleted reddit accounts | how to find a deleted reddit account | how to find deleted reddit account
how to post a link on reddit,How to post a link on Reddit,howto,3,medium,volume_10+,,how to post a link on reddit | how to post links on reddit | how to post a link in reddit
how to make reddit posts private,How to make Reddit posts private,howto,3,medium,volume_10+,,how to make reddit posts private | how to make your reddit posts private | how to make my reddit posts private
how to access dark web reddit,How to access dark web Reddit,howto,3,medium,volume_10+,,how to access the dark web reddit | how to access dark web reddit | reddit how to access dark web
how to browse reddit incognito,How to browse Reddit incognito,howto,3,medium,volume_10+,,how to browse reddit incognito | how to browse incognito on reddit | how to browse incognito reddit
