canonical_keyword,suggested_title,category,variant_count,signal_strength,source,frequency_count,all_variants
salesgenie email provider integration,salesgenie email provider integration,integration,2,low,volume_10+,,can salesgenie integrate with my email provider? | salesgenie email provider integration
salesgenie salesforce integration,salesgenie salesforce integration,integration,2,low,volume_10+,,can i integrate salesgenie with salesforce? | salesgenie salesforce integration
connect salesgenie to existing crm,connect salesgenie to existing crm,integration,2,low,volume_10+,,connect salesgenie to existing crm | how do i connect salesgenie to my existing crm?
salesgenie crm lead integration,salesgenie crm lead integration,integration,2,low,volume_10+,,salesgenie leads integration with crm software | salesgenie crm lead integration
salesgenie external data integration,salesgenie external data integration,integration,2,low,volume_10+,,salesgenie external data sources integration | salesgenie external data integration
salesgenie crm integration real-time data,salesgenie crm integration real-time data,integration,2,low,volume_10+,,salesgenie crm integration real-time data | salesgenie crm integration real-time data sync
salesgenie crm integration customization,salesgenie crm integration customization,integration,2,low,volume_10+,,salesgenie crm integration settings customization | salesgenie crm integration customization
