canonical_keyword,suggested_title,category,variant_count,signal_strength,source,frequency_count,all_variants
softr airtable integration,softr airtable integration,integration,4,medium,volume_10+,,softr airtable integration | softr airtable integration tutorial | airtable softr integration tutorial | softr airtable integration guide
how to set up job postings on a softr site?,How to set up job postings on a Softr site?,howto,2,low,volume_10+,,how to set up job postings on softr site | how to set up job postings on a softr site?
how to build a blog or news site with softr,How to build a blog or news site with Softr,howto,2,low,volume_10+,,how to build a blog or news site with softr? | how to build a blog or news site with softr
how to create a client portal with softr?,How to create a client portal with Softr?,howto,2,low,volume_10+,,how to set up an agency client portal on softr? | how to create a client portal with softr?
how to use softr to build a vendor login portal?,How to use Softr to build a vendor login portal?,howto,2,low,volume_10+,,how to use softr to build a vendor login portal? | softr vendor login portal tutorial
softr memberstack integration,softr memberstack integration,integration,2,low,volume_10+,,softr memberstack integration | memberstack softr integration
softr outseta integration,softr outseta integration,integration,2,low,volume_10+,,softr outseta integration | outseta softr integration
slack softr integration,slack softr integration,integration,2,low,volume_10+,,slack softr integration | softr slack integration
softr google sheets integration,softr google sheets integration,integration,2,low,volume_10+,,softr google sheets integration | softr google sheets integration 2025
softr steps reviews complaints,softr steps reviews complaints,other,2,low,volume_10+,,softr steps reviews and complaints | softr steps reviews complaints
