canonical_keyword,suggested_title,category,variant_count,signal_strength,source,frequency_count,all_variants
how to add a privacy policy on wix,How to add a privacy policy on wix,howto,3,medium,volume_10+,,how to add a privacy policy on wix | how to add privacy policy to wix | how to add privacy policy to wix website
how to transfer wix premium to another site,How to transfer wix premium to another site,howto,3,medium,volume_10+,,how to transfer wix premium to another site | wix how to transfer premium to another site | how to transfer premium plan in wix to another site
how to add a hamburger menu in wix,How to add a hamburger menu in wix,howto,3,medium,volume_10+,,how to add hamburger menu in wix | how to add a hamburger menu in wix | how to add hamburger menu in wix mobile
how to send a preview link on wix,How to send a preview link on wix,howto,3,medium,volume_10+,,how to send a preview link on wix | how to share wix preview link | how to share wix site preview link
how to make wix website faster,How to make wix website faster,howto,3,medium,volume_10+,,how to make my wix website load faster | how to make wix website load faster | how to make wix website faster
how to give access to wix website,How to give access to wix website,howto,3,medium,volume_10+,,how to give someone access to your wix website | how to give someone access to wix website | how to give access to wix website
how to add google analytics to wix,How to add google analytics to wix,howto,3,medium,volume_10+,,how to add google analytics to wix | how to add google analytics to wix site | how to add google analytics to wix website
how to add facebook pixel to wix,How to add facebook pixel to wix,howto,3,medium,volume_10+,,how to add facebook pixel to wix | how to add facebook pixel to wix website | how to add facebook pixel to wix site
how to share a wix website with someone,How to share a wix website with someone,howto,3,medium,volume_10+,,how to share a wix website with someone to edit | how to share a wix website with someone | how to share wix website to edit
how to add html code to wix,How to add html code to wix,howto,3,medium,volume_10+,,how to add html code to wix website | how to add html code to wix | how to add code to wix website
how to connect wix to instagram,How to connect wix to instagram,integration,3,medium,volume_10+,,connect instagram to wix | how to connect wix to instagram | how to connect instagram to wix
wix hubspot integration,wix hubspot integration,integration,3,medium,volume_10+,,wix hubspot integration | hubspot wix integration | wix and hubspot integration
how to connect google domain to wix,How to connect google domain to wix,integration,3,medium,volume_10+,,connect google domain to wix | how to connect google domain to wix | connect google domains to wix
wix salesforce integration,wix salesforce integration,integration,3,medium,volume_10+,,wix salesforce integration | wix to salesforce integration | wix integration with salesforce
how to connect printful to wix,How to connect printful to wix,integration,3,medium,volume_10+,,connect printful to wix | connect wix to printful | how to connect printful to wix
wix etsy integration,wix etsy integration,integration,3,medium,volume_10+,,wix etsy integration | integrate etsy with wix | etsy wix integration
how to connect squarespace domain to wix,How to connect squarespace domain to wix,integration,3,medium,volume_10+,,connect squarespace domain to wix | how to connect squarespace domain to wix | connect wix domain to squarespace
how to connect square to wix,How to connect square to wix,integration,3,medium,volume_10+,,how to connect square to wix | can you connect square to wix | connect square to wix
how to connect custom domain to wix,How to connect custom domain to wix,integration,3,medium,volume_10+,,wix connect custom domain | how to connect custom domain to wix | connect custom domain to wix
how to connect stripe to wix,How to connect stripe to wix,integration,3,medium,volume_10+,,connect stripe to wix | wix stripe connect | how to connect stripe to wix
wix connect external domain,wix connect external domain,integration,3,medium,volume_10+,,wix connect external domain | connect external domain to wix | connect wix domain to external site
wix constant contact integration,wix constant contact integration,integration,3,medium,volume_10+,,wix constant contact integration | constant contact wix integration | wix automations constant contact integration
how to connect wix site to google search console,How to connect wix site to google search console,integration,3,medium,volume_10+,,wix connect to google search console | how to connect wix website to google search console | how to connect wix site to google search console
how to improve wix seo,How to improve wix seo,howto,2,low,volume_10+,,how to improve wix seo | how to improve seo on wix
how to use wix studio,How to use wix studio,howto,2,low,volume_10+,,wix studio tutorial | how to use wix studio
how to add a pop up on wix,How to add a pop up on wix,howto,2,low,volume_10+,,how to add a pop up on wix | how to add pop up on wix
how to use wix website builder,How to use wix website builder,howto,2,low,volume_10+,,wix website builder tutorial | how to use wix website builder
how to change wix website url,How to change wix website url,howto,2,low,volume_10+,,how to change your website url on wix | how to change wix website url
how to switch from wordpress to wix,How to switch from wordpress to wix,howto,2,low,volume_10+,,how to switch from wordpress to wix | how to switch from wix to wordpress
how to use wix website,How to use wix website,howto,2,low,volume_10+,,wix website tutorial | how to use wix website
how to add testimonials to wix,How to add testimonials to wix,howto,2,low,volume_10+,,how to embed testimonials on wix | how to add testimonials to wix
how to link google reviews to wix website,How to link google reviews to wix website,howto,2,low,volume_10+,,how to link google reviews to wix website | how to connect google reviews to wix website
how to create a form in wix,How to create a form in wix,howto,2,low,volume_10+,,how to create a form in wix | how to create a form on wix
how to get a qr code for wix website,How to get a qr code for wix website,howto,2,low,volume_10+,,how to get a qr code for wix website | how to get qr code for wix website
how to make a wix site private,How to make a wix site private,howto,2,low,volume_10+,,how to make a wix site private | how to make wix site private
how to publish a wix website for free,How to publish a wix website for free,howto,2,low,volume_10+,,how to publish wix website for free | how to publish a wix website for free
how to get wix website on google,How to get wix website on google,howto,2,low,volume_10+,,how to get your wix website on google | how to get wix website on google
how to add a search bar in wix,How to add a search bar in wix,howto,2,low,volume_10+,,how to add a search bar in wix | how to add search bar in wix
how to add sales tax on wix,How to add sales tax on wix,howto,2,low,volume_10+,,how to add sales tax on wix | how to add sales tax to wix
how to unpublish wix,How to unpublish wix,howto,2,low,volume_10+,,how to unpublish wix | how to unpublish on wix
how to switch from wix editor to wix studio,How to switch from wix editor to wix studio,howto,2,low,volume_10+,,how to switch from wix editor to wix studio | how to switch from wix studio to wix editor
how to embed on wix,How to embed on wix,howto,2,low,volume_10+,,how to embed on wix | how to embed in wix
how to upload a pdf to wix,How to upload a pdf to wix,howto,2,low,volume_10+,,how to upload pdf to wix | how to upload a pdf to wix
how to transfer a domain away from wix,How to transfer a domain away from wix,howto,2,low,volume_10+,,how to transfer domain away from wix | how to transfer a domain away from wix
how to backup wix site,How to backup wix site,howto,2,low,volume_10+,,how to backup wix site | how to export wix site
how to switch to wix studio,How to switch to wix studio,howto,2,low,volume_10+,,how to switch to wix studio | how to switch from wix to wix studio
how to add a user to wix,How to add a user to wix,howto,2,low,volume_10+,,how to add a user to wix | how to add user to wix
how to make wix website responsive,How to make wix website responsive,howto,2,low,volume_10+,,how to make wix website responsive | how to make website responsive wix
how to make a wix website private,How to make a wix website private,howto,2,low,volume_10+,,how to make wix website private | how to make a wix website private
how to download a wix website,How to download a wix website,howto,2,low,volume_10+,,how to download wix website | how to download a wix website
how to save wix website as pdf,How to save wix website as pdf,howto,2,low,volume_10+,,how to download wix website as pdf | how to save wix website as pdf
how to password protect a wix site,How to password protect a wix site,howto,2,low,volume_10+,,how to password protect a wix site | how to password protect wix site
how to make a blog on wix,How to make a blog on wix,howto,2,low,volume_10+,,how to create a blog on wix | how to make a blog on wix
how to transfer wix domain to another site,How to transfer wix domain to another site,howto,2,low,volume_10+,,how to transfer wix domain to another site | how to transfer domain from one wix site to another
how to add keywords to wix website,How to add keywords to wix website,howto,2,low,volume_10+,,how to add keywords to wix website | how to add keywords to website wix
how to share wix website link,How to share wix website link,howto,2,low,volume_10+,,how to share wix website link | how to share my wix website link
how to add a button on wix,How to add a button on wix,howto,2,low,volume_10+,,how to add button in wix | how to add a button on wix
how to duplicate a page in wix,How to duplicate a page in wix,howto,2,low,volume_10+,,how to duplicate a page in wix | how to duplicate a page on wix
how to build a wix website from scratch,How to build a wix website from scratch,howto,2,low,volume_10+,,how to create a wix website from scratch | how to build a wix website from scratch
how to transfer ownership of a wix website,How to transfer ownership of a wix website,howto,2,low,volume_10+,,how to transfer ownership of wix website | how to transfer ownership of a wix website
how to create a wix site,How to create a wix site,howto,2,low,volume_10+,,how to create a site on wix | how to create a wix site
how to add adobe font to wix,How to add adobe font to wix,howto,2,low,volume_10+,,how to add adobe fonts to wix | how to add adobe font to wix
how to delete a strip on wix,How to delete a strip on wix,howto,2,low,volume_10+,,how to delete a strip on wix | how to delete a strip in wix
how to add a subdomain in wix,How to add a subdomain in wix,howto,2,low,volume_10+,,how to add a subdomain in wix | how to add subdomain in wix
how to add a downloadable pdf to wix,How to add a downloadable pdf to wix,howto,2,low,volume_10+,,how to add downloadable pdf to wix | how to add a downloadable pdf to wix
how to optimize wix website,How to optimize wix website,howto,2,low,volume_10+,,how to optimize wix website | how to optimize my wix website
how to create a subdomain in wix,How to create a subdomain in wix,howto,2,low,volume_10+,,how to create a subdomain in wix | how to create a subdomain on wix
how to find a wix website,How to find a wix website,howto,2,low,volume_10+,,how to find a wix website | how to find my wix website
how to add a dropdown menu in wix,How to add a dropdown menu in wix,howto,2,low,volume_10+,,how to add a dropdown menu in wix | how to add dropdown menu in wix
how to add site members on wix,How to add site members on wix,howto,2,low,volume_10+,,how to add site members on wix | how to add members to wix site
how to shut down a wix website,How to shut down a wix website,howto,2,low,volume_10+,,how to shut down wix website | how to shut down a wix website
how to delete a domain on wix,How to delete a domain on wix,howto,2,low,volume_10+,,how to delete a domain on wix | how to remove domain from wix
how to add an admin to wix website,How to add an admin to wix website,howto,2,low,volume_10+,,how to add admin to wix website | how to add an admin to wix website
how to redirect a domain to another domain wix,How to redirect a domain to another domain wix,howto,2,low,volume_10+,,how to redirect a domain to another domain wix | how to redirect wix domain to another domain
how to share an unpublished wix site,How to share an unpublished wix site,howto,2,low,volume_10+,,how to share an unpublished wix site | how to share unpublished wix site
how to cancel wix auto renewal,How to cancel wix auto renewal,howto,2,low,volume_10+,,wix how to cancel auto renewal | how to cancel wix auto renewal
how to earn money from wix,How to earn money from wix,howto,2,low,volume_10+,,how to earn money from wix | how to earn money through wix
how to remove wix banner,How to remove wix banner,howto,2,low,volume_10+,,how to get rid of wix banner | how to remove wix banner
how to transfer a wix website,How to transfer a wix website,howto,2,low,volume_10+,,how to transfer wix website | how to transfer a wix website
how to share wix,How to share wix,howto,2,low,volume_10+,,how to share on wix | how to share wix
how to use wix blog,How to use wix blog,howto,2,low,volume_10+,,wix blog tutorial | how to use wix blog
how to hide a page on wix studio,How to hide a page on wix studio,howto,2,low,volume_10+,,how to hide a page on wix studio | how to hide a page in wix studio
how to login to wix website,How to login to wix website,howto,2,low,volume_10+,,how to login to my wix website | how to login to wix website
how to create an ecommerce website on wix,How to create an ecommerce website on wix,howto,2,low,volume_10+,,how to create an ecommerce website on wix | how to make ecommerce website in wix
how to add a drop down menu in wix,How to add a drop down menu in wix,howto,2,low,volume_10+,,how to add drop down menu in wix | how to add a drop down menu in wix
how to buy a domain on wix,How to buy a domain on wix,howto,2,low,volume_10+,,how to buy a domain from wix | how to buy a domain on wix
how to choose a template with wix,How to choose a template with wix,howto,2,low,volume_10+,,how to choose a new template on wix | how to choose a template with wix
how to use wix for beginners,How to use wix for beginners,howto,2,low,volume_10+,,wix beginner tutorial | how to use wix for beginners
how to edit text on wix,How to edit text on wix,howto,2,low,volume_10+,,how to edit text on wix | how to edit text in wix
how to turn off auto renewal on wix,How to turn off auto renewal on wix,howto,2,low,volume_10+,,wix how to turn off auto renewal | how to turn off auto renewal on wix
how to monetize a blog on wix,How to monetize a blog on wix,howto,2,low,volume_10+,,how to monetize wix blog | how to monetize a blog on wix
how to add a carousel in wix,How to add a carousel in wix,howto,2,low,volume_10+,,how to add carousel in wix | how to add a carousel in wix
how to add a strip in wix,How to add a strip in wix,howto,2,low,volume_10+,,how to add strip in wix | how to add a strip in wix
how to disable wix chat,How to disable wix chat,howto,2,low,volume_10+,,how to turn off wix chat | how to disable wix chat
how to edit footer in wix,How to edit footer in wix,howto,2,low,volume_10+,,how to edit footer in wix | how to change footer in wix
how to add a banner to wix website,How to add a banner to wix website,howto,2,low,volume_10+,,how to add banner on wix website | how to add a banner to wix website
how to edit wix,How to edit wix,howto,2,low,volume_10+,,how to edit on wix | how to edit wix
how to unpublish a page on wix,How to unpublish a page on wix,howto,2,low,volume_10+,,how to unpublish a page on wix | how to unpublish a page in wix
how to duplicate a wix website,How to duplicate a wix website,howto,2,low,volume_10+,,how to duplicate a wix website | how to duplicate a website on wix
how to stop wix subscription,How to stop wix subscription,howto,2,low,volume_10+,,how to pause wix subscription | how to stop wix subscription
how to close a wix website,How to close a wix website,howto,2,low,volume_10+,,how to close a wix website | how to close wix website
how to add a calendar to wix website,How to add a calendar to wix website,howto,2,low,volume_10+,,how to add google calendar to wix website | how to add a calendar to wix website
how to link social media to wix website,How to link social media to wix website,howto,2,low,volume_10+,,how to link social media to wix website | how to add social media links to wix website
how to add live chat to wix,How to add live chat to wix,howto,2,low,volume_10+,,how to add live chat to wix website | how to add live chat to wix
how to add instagram to wix website,How to add instagram to wix website,howto,2,low,volume_10+,,how to add instagram to wix website | how to add instagram link to wix website
how to add logo to wix website,How to add logo to wix website,howto,2,low,volume_10+,,how to add logo to wix website | how to add logo to website tab wix
how to add whatsapp in wix website,How to add whatsapp in wix website,howto,2,low,volume_10+,,how to add whatsapp button to wix website | how to add whatsapp in wix website
how to add hover effect in wix,How to add hover effect in wix,howto,2,low,volume_10+,,how to add hover effect on image in wix | how to add hover effect in wix
how to add chatbot to wix website,How to add chatbot to wix website,howto,2,low,volume_10+,,how to add chatbot to wix website | how to add ai chatbot to wix website
how to add music to wix website,How to add music to wix website,howto,2,low,volume_10+,,how to add background music to wix website | how to add music to wix website
how to add pixel to wix website,How to add pixel to wix website,howto,2,low,volume_10+,,how to add pixel to wix website | how to add meta pixel to wix website
how to edit wix mobile site,How to edit wix mobile site,howto,2,low,volume_10+,,how to edit wix mobile site | how to edit text on wix mobile site
how to add a link to wix website,How to add a link to wix website,howto,2,low,volume_10+,,how to add a link to wix website | how to add facebook link to wix website
how to add logo to wix header,How to add logo to wix header,howto,2,low,volume_10+,,how to add logo to wix header | how to add logo to wix website header
openai wix integration,openai wix integration,integration,2,low,volume_10+,,openai wix integration | wix openai integration
klaviyo wix integration,klaviyo wix integration,integration,2,low,volume_10+,,klaviyo wix integration | wix klaviyo integration
wix shipping integration,wix shipping integration,integration,2,low,volume_10+,,wix shipping integration | shipping integration wix
wix stripe integration,wix stripe integration,integration,2,low,volume_10+,,wix stripe integration | stripe wix integration
printful wix integration,printful wix integration,integration,2,low,volume_10+,,printful wix integration | wix printful integration
wix lightspeed integration,wix lightspeed integration,integration,2,low,volume_10+,,wix lightspeed integration | lightspeed wix integration
printify wix integration,printify wix integration,integration,2,low,volume_10+,,printify wix integration | wix printify integration
how to connect printify to wix,How to connect printify to wix,integration,2,low,volume_10+,,how to connect printify to wix | connect printify to wix
wix xero integration,wix xero integration,integration,2,low,volume_10+,,wix xero integration | wix and xero integration
mailerlite wix integration,mailerlite wix integration,integration,2,low,volume_10+,,mailerlite wix integration | wix mailerlite integration
wix amazon integration,wix amazon integration,integration,2,low,volume_10+,,wix amazon integration | integrate amazon with wix
connect wix to quickbooks,connect wix to quickbooks,integration,2,low,volume_10+,,connect wix to quickbooks | connect quickbooks to wix
wix ebay integration,wix ebay integration,integration,2,low,volume_10+,,wix ebay integration | integrate ebay with wix
wix chatgpt integration,wix chatgpt integration,integration,2,low,volume_10+,,wix chatgpt integration | wix chatgpt integration tutorial
airtable wix integration,airtable wix integration,integration,2,low,volume_10+,,airtable wix integration | wix airtable integration
zapier wix integration,zapier wix integration,integration,2,low,volume_10+,,zapier wix integration | wix zapier integration
how to connect namecheap domain to wix,How to connect namecheap domain to wix,integration,2,low,volume_10+,,connect namecheap domain to wix | how to connect namecheap domain to wix
wix canva integration,wix canva integration,integration,2,low,volume_10+,,wix canva integration | canva wix integration
how to connect mailchimp to wix,How to connect mailchimp to wix,integration,2,low,volume_10+,,connect mailchimp to wix | how to connect mailchimp to wix
wix idx integration,wix idx integration,integration,2,low,volume_10+,,wix idx integration | idx integration wix
calendly wix integration,calendly wix integration,integration,2,low,volume_10+,,calendly wix integration | wix calendly integration
wix notion integration,wix notion integration,integration,2,low,volume_10+,,notion wix integration guide | wix notion integration
activecampaign wix integration,activecampaign wix integration,integration,2,low,volume_10+,,activecampaign wix integration | wix activecampaign integration
wix eventbrite integration,wix eventbrite integration,integration,2,low,volume_10+,,wix eventbrite integration | eventbrite wix integration
brevo wix integration,brevo wix integration,integration,2,low,volume_10+,,brevo wix integration | wix brevo integration
jobber wix integration,jobber wix integration,integration,2,low,volume_10+,,jobber wix integration | wix jobber integration
typeform wix integration,typeform wix integration,integration,2,low,volume_10+,,typeform wix integration | wix typeform integration
wix honeybook integration,wix honeybook integration,integration,2,low,volume_10+,,wix honeybook integration | honeybook wix integration
wix flodesk integration,wix flodesk integration,integration,2,low,volume_10+,,wix flodesk integration | flodesk wix integration
wix docusign integration,wix docusign integration,integration,2,low,volume_10+,,wix docusign integration | docusign integration on wix
wix connect existing domain,wix connect existing domain,integration,2,low,volume_10+,,wix connect existing domain | connect existing domain to wix
jotform wix integration,jotform wix integration,integration,2,low,volume_10+,,jotform wix integration | wix jotform integration
zoho wix integration,zoho wix integration,integration,2,low,volume_10+,,zoho wix integration | wix zoho integration
wix google sheets integration,wix google sheets integration,integration,2,low,volume_10+,,wix automations google sheets integration | wix google sheets integration
wix tiktok shop integration,wix tiktok shop integration,integration,2,low,volume_10+,,wix tiktok shop integration | wix tiktok shop integration 2025
wix google calendar integration,wix google calendar integration,integration,2,low,volume_10+,,wix google calendar integration | wix bookings google calendar integration
wix google tag manager integration,wix google tag manager integration,integration,2,low,volume_10+,,wix google tag manager integration | wix google tag manager integration instructions
wix instagram feed integration,wix instagram feed integration,integration,2,low,volume_10+,,wix instagram feed integration | wix blog instagram feed integration
wix how to change page url,wix how to change page url,other,2,low,volume_10+,,wix how to change url of page | wix how to change page url
wix password protected page how to,wix password protected page how to,other,2,low,volume_10+,,wix password protected page how to | wix studio password protected pages tutorial
wix website builder tutorial beginners,wix website builder tutorial beginners,tutorial,2,low,volume_10+,,wix website builder tutorial for beginners | wix website builder tutorial beginners
wix adi tutorial,wix adi tutorial,tutorial,2,low,volume_10+,,wix adi tutorial | wix adi how to use
