canonical_keyword,suggested_title,category,variant_count,signal_strength,source,frequency_count,all_variants
how to make a wix website,How to make a wix website,howto,45,high,volume_10+,,how to create a wix website | how to make a website with wix | how to make a wix website | how to build a wix website | how to create a website on wix | how to make a website on wix | how to create a website with wix | how to build a website on wix | how to use wix to build a website | how to build a website with wix | how to make a website in wix | how to create a website on wix step by step | how to make wix website | how to create wix website | how to build wix website
how to change a wix template,How to change a wix template,howto,15,high,volume_10+,,how to change wix template | how to change template on wix | wix how to change template | how to change template wix | how to change template in wix | how to change my wix template | how to change a template on wix | how to change a wix template | how to change your wix template | how to change the template on wix | how to change the template in wix | how to change your template on wix | how to change templates in wix | how to change templates on wix | how to change a template in wix
how to connect a domain to wix,How to connect a domain to wix,integration,14,high,volume_10+,,wix connect domain | connect domain to wix | how to connect domain to wix | connect a domain to wix | how to connect a domain to wix | connect domain wix | connect my domain to wix | how to connect your domain to wix | wix how to connect domain | how to connect my domain to wix | wix domain connect | connect a domain wix | wix connect domain guide | wix connect a domain you already own
how to connect a godaddy domain to wix,How to connect a godaddy domain to wix,integration,14,high,volume_10+,,connect godaddy domain to wix | how to connect godaddy domain to wix | connect my godaddy domain to wix | how to connect a godaddy domain to wix | can you connect a godaddy domain to wix | how to connect my godaddy domain to wix | how to connect wix to godaddy domain | how to link godaddy domain to wix | connect godaddy domain to wix website | how to connect wix website to godaddy domain | connect wix website to godaddy domain | connect godaddy domain to wix free | how to connect godaddy domain to wix for free | connect wix site to godaddy domain
how to delete a wix website,How to delete a wix website,howto,13,high,volume_10+,,how to delete wix website | how to delete a wix website | how to delete a website on wix | how to delete website on wix | how to delete my wix website | how to delete your wix website | how to take down a wix website | how to delete a website from wix | how to delete a website in wix | wix how to delete website | how to delete website wix | how to delete your website on wix | how to delete website from wix
how to delete a page wix,How to delete a page wix,howto,12,high,volume_10+,,how to delete a page in wix | how to delete a page on wix | how to delete pages on wix | how to delete pages in wix | wix how to delete a page | how to delete page on wix | how to delete wix page | how to delete a page from wix | how to delete a page wix | how to delete a wix page | how to delete page wix | how to delete page in wix
how to change a domain name on wix,How to change a domain name on wix,howto,12,high,volume_10+,,how to change domain name on wix | how to change wix domain name | how to change domain name in wix | wix how to change domain name | how to change my domain name on wix | how to change domain names on wix | how to change your domain name on wix | how to change domain name wix | how to change a domain name on wix | how to change domain name on wix for free | how to change wix free domain name | how to change wix domain name free
how to delete a wix site,How to delete a wix site,howto,11,high,volume_10+,,how to delete a wix site | how to delete wix site | how to delete site on wix | how to take down wix site | how to delete a site on wix | how to delete site wix | how to delete sites on wix | how to delete a site in wix | wix how to delete a site | how to delete site in wix | how to delete a site from wix
how to delete a section in wix,How to delete a section in wix,howto,10,high,volume_10+,,how to delete a section in wix | how to delete a section on wix | how to delete section in wix | wix how to delete a section | how to remove a section in wix | how to delete sections in wix | how to delete sections on wix | how to delete section wix | how to delete section on wix | how to remove a section on wix
how to make a free wix website,How to make a free wix website,howto,10,high,volume_10+,,how to create a free website on wix | how to create a website on wix for free | how to create a free website with wix | how to create a free wix website | how to make a free website on wix | how to create a wix website for free | how to make a free wix website | how to make a wix website for free | how to make a website on wix for free | how to create a free website using wix
how to add google reviews to a wix website,How to add google reviews to a wix website,howto,10,high,volume_10+,,how to add google reviews to wix website | how to put google reviews on wix website | how to embed google reviews on wix website | how to add google reviews to a wix website | how to add google reviews on wix website | how to add google reviews to your wix website | how to embed google reviews on wix | how to add google reviews to wix | how to add reviews to wix website | how to add reviews on wix website
how to integrate shopify with wix,How to integrate shopify with wix,integration,10,high,volume_10+,,wix shopify integration | shopify wix integration | can you integrate shopify with wix | integrate shopify with wix | wix and shopify integration | can wix integrate with shopify | wix integration with shopify | shopify integration with wix | how to integrate shopify with wix | shopify and wix integration
how to unpublish a wix site,How to unpublish a wix site,howto,8,high,volume_10+,,how to unpublish wix site | how to unpublish site on wix | how to unpublish a wix site | how to unpublish a site on wix | wix how to unpublish site | how to unpublish my wix site | how to unpublish site wix | wix unpublish site tutorial
how to edit a wix website,How to edit a wix website,howto,8,high,volume_10+,,how to edit wix website | how to edit a wix website | how to edit my wix website | wix how to edit website | how to edit website on wix | how to edit your wix website | how to edit my website on wix | how to update wix website
how to change wix website name,How to change wix website name,howto,8,high,volume_10+,,how to change website name on wix | how to change wix website name | how to change website name in wix | how to change name of website on wix | how to change the website name on wix | wix how to change website name | how to change your website name on wix | how to change website name wix
how to share a wix website,How to share a wix website,howto,8,high,volume_10+,,how to publish wix website | how to share wix website | how to share a wix website | how to share a website on wix | how to publish a wix website | how to publish a website on wix | how to publish website on wix | how to share website on wix
how to transfer a domain to wix,How to transfer a domain to wix,howto,7,high,volume_10+,,how to transfer domain from wix | how to transfer domain to wix | how to transfer a domain to wix | how to transfer a domain from wix | wix how to transfer domain | how to transfer wix domain | how to transfer my domain to wix
how to transfer a wix website to wordpress,How to transfer a wix website to wordpress,howto,7,high,volume_10+,,how to transfer website from wix to wordpress | how to transfer my wix website to wordpress | how to migrate wix website to wordpress | how to migrate website from wix to wordpress | how to transfer a wix website to wordpress | how to transfer wix website to wordpress | how to transfer website from wordpress to wix
how to add a youtube video on wix,How to add a youtube video on wix,howto,7,high,volume_10+,,how to embed youtube video in wix | how to add a youtube video on wix | how to embed a youtube video in wix | how to add youtube video to wix | how to add a youtube video to wix | how to add youtube video to wix website | how to add a youtube video to wix website
how to transfer a domain from squarespace to wix,How to transfer a domain from squarespace to wix,howto,6,high,volume_10+,,how to transfer domain from squarespace to wix | how to transfer domain from wix to squarespace | how to transfer wix domain to squarespace | how to transfer a domain from squarespace to wix | how to transfer a domain from wix to squarespace | how to transfer squarespace domain to wix
how to add a pdf to wix,How to add a pdf to wix,howto,6,high,volume_10+,,how to add pdf to wix | how to add a pdf to wix | how to embed a pdf in wix | how to embed pdf in wix | how to add a pdf on wix | how to add pdf in wix
how to transfer a domain from godaddy to wix,How to transfer a domain from godaddy to wix,howto,6,high,volume_10+,,how to transfer domain from wix to godaddy | how to transfer domain from godaddy to wix | how to transfer godaddy domain to wix | how to transfer a domain from godaddy to wix | how to transfer a domain from wix to godaddy | how to transfer wix domain to godaddy
how to add a header in wix,How to add a header in wix,howto,6,high,volume_10+,,how to add a header in wix | how to add header in wix | how to add a header on wix | how to add header wix | how to add header on wix | wix how to add header
how to make a drop down menu in wix,How to make a drop down menu in wix,howto,6,high,volume_10+,,how to make a drop down menu in wix | how to create a drop down menu in wix | wix how to make a drop down menu | how to make drop down menu in wix | how to make a drop down menu on wix | how to create drop down menu in wix
how to edit a wix site,How to edit a wix site,howto,6,high,volume_10+,,how to edit wix site | how to rename wix site | how to rename site on wix | how to edit site on wix | how to edit a wix site | how to edit my wix site
how to add a favicon on wix,How to add a favicon on wix,howto,6,high,volume_10+,,how to add favicon in wix | how to add favicon on wix | how to add a favicon on wix | how to add favicon wix | how to add a favicon in wix | wix how to add favicon
wix mailchimp integration,wix mailchimp integration,integration,6,high,volume_10+,,wix mailchimp integration | mailchimp wix integration | wix and mailchimp integration | integrate mailchimp with wix | mailchimp and wix integration | mailchimp integration with wix
wix square integration,wix square integration,integration,6,high,volume_10+,,wix square integration | square wix integration | wix and square integration | square and wix integration | square integration with wix | wix integration with square
how to connect shopify to wix,How to connect shopify to wix,integration,6,high,volume_10+,,connect shopify to wix | can you connect wix to shopify | connect wix to shopify | can you connect shopify to wix | how to connect shopify to wix | how to connect wix to shopify
how to connect google analytics to wix,How to connect google analytics to wix,integration,6,high,volume_10+,,connect wix to google analytics | how to connect google analytics to wix | connect google analytics to wix | how to connect google analytics to wix website | wix connect google analytics 4 ga4 | connect google analytics 4 to wix site
wix accept payments paypal connect,wix accept payments paypal connect,other,6,high,volume_10+,,wix accept payments paypal connect steps | wix accept payments paypal connect | wix accept payments paypal how to connect | wix connect paypal accept payments settings | wix accept payments settings paypal connect | wix accept payments paypal connect instructions
how to cancel a wix subscription,How to cancel a wix subscription,howto,5,high,volume_10+,,how to cancel wix subscription | how to cancel a wix subscription | how to cancel my wix subscription | how to cancel your wix subscription | cancel wix subscription how to
how to change wix website template,How to change wix website template,howto,5,high,volume_10+,,how to change website template on wix | how to change wix website template | how to change my wix website template | how to change your wix website template | wix how to change website template
how to change wix site name,How to change wix site name,howto,5,high,volume_10+,,how to change site name on wix | how to change wix site name | how to change site name in wix | how to change site name wix | wix how to change site name
how to add a column in wix,How to add a column in wix,howto,5,high,volume_10+,,how to add columns in wix | how to add a column in wix | how to add column in wix | how to add columns wix | wix how to add columns
how to hide a section in wix,How to hide a section in wix,howto,5,high,volume_10+,,how to hide a section in wix | how to hide sections in wix | how to hide section in wix | how to hide a section on wix | how to hide section on wix
how to hide a page on wix,How to hide a page on wix,howto,5,high,volume_10+,,how to hide a page on wix | how to hide a page in wix | wix how to hide a page | how to hide page on wix | how to hide pages on wix
how to share a wix site,How to share a wix site,howto,5,high,volume_10+,,how to publish wix site | wix how to publish site | how to share a wix site | how to publish site on wix | how to share wix site
how to delete a wix account,How to delete a wix account,howto,4,medium,volume_10+,,how to delete wix account | how to delete a wix account | how to delete my wix account | how to delete your wix account
how to transfer a domain from wordpress to wix,How to transfer a domain from wordpress to wix,howto,4,medium,volume_10+,,how to transfer domain from wix to wordpress | how to transfer wix domain to wordpress | how to transfer domain from wordpress to wix | how to transfer a domain from wordpress to wix
how to migrate wix to shopify,How to migrate wix to shopify,howto,4,medium,volume_10+,,how to migrate from shopify to wix | how to migrate wix to shopify | how to migrate from wix to shopify | how to transfer wix to shopify
how to migrate wix to wordpress,How to migrate wix to wordpress,howto,4,medium,volume_10+,,how to migrate from wix to wordpress | how to migrate wix to wordpress | how to transfer wix to wordpress | how to transfer wordpress to wix
how to get a free wix domain,How to get a free wix domain,howto,4,medium,volume_10+,,how to get a free domain on wix | how to get free wix domain | how to get a free wix domain | how to get free domain on wix
how to add a collaborator on wix,How to add a collaborator on wix,howto,4,medium,volume_10+,,how to add a collaborator on wix | how to add collaborators on wix | how to add collaborator on wix | wix how to add collaborator
how to transfer ownership of a wix site,How to transfer ownership of a wix site,howto,4,medium,volume_10+,,how to transfer wix site ownership | how to transfer ownership of a wix site | how to transfer site ownership on wix | wix transfer site ownership how to
how to unpublish a wix website,How to unpublish a wix website,howto,4,medium,volume_10+,,how to unpublish wix website | how to unpublish a wix website | how to unpublish a website on wix | how to unpublish website on wix
how to cancel a wix domain,How to cancel a wix domain,howto,4,medium,volume_10+,,how to cancel wix domain | how to cancel domain on wix | how to cancel a domain on wix | how to cancel a wix domain
how to add a form to wix,How to add a form to wix,howto,4,medium,volume_10+,,how to add a form to wix | how to add a form on wix | how to embed a form on wix | how to add a form in wix
how to add code to wix,How to add code to wix,howto,4,medium,volume_10+,,how to add code to wix | how to embed code on wix | how to add embed code to wix | how to embed code in wix
how to export a wix website,How to export a wix website,howto,4,medium,volume_10+,,how to backup wix website | how to export a wix website | how to back up wix website | how to export wix website
how to add a text box in wix,How to add a text box in wix,howto,4,medium,volume_10+,,how to add a text box in wix | how to add a text box on wix | how to add text box on wix | how to add text box in wix
how to deactivate a wix website,How to deactivate a wix website,howto,4,medium,volume_10+,,how to deactivate wix website | how to deactivate a wix website | how to turn off wix website | how to disable wix website
how to add a video to wix,How to add a video to wix,howto,4,medium,volume_10+,,how to embed a video in wix | how to embed a video on wix | how to embed video in wix | how to add a video to wix
how to make a wix portfolio,How to make a wix portfolio,howto,4,medium,volume_10+,,how to create a portfolio on wix | how to make a portfolio on wix | how to make a wix portfolio | how to use wix to create a portfolio
how to add an anchor on wix,How to add an anchor on wix,howto,4,medium,volume_10+,,how to add an anchor on wix | how to add an anchor in wix | how to add anchor wix | how to add anchor in wix
how to make money with a wix website,How to make money with a wix website,howto,4,medium,volume_10+,,how to make money from wix website | how to make money with wix website | how to make money from my wix website | how to make money with a wix website
how to add a subpage in wix,How to add a subpage in wix,howto,4,medium,volume_10+,,how to add subpages in wix | how to add a subpage in wix | how to add subpage in wix | how to add a subpage on wix
how to monetize a wix website,How to monetize a wix website,howto,4,medium,volume_10+,,how to monetize your wix website | how to monetize wix website | how to monetize a wix website | how to monetize my wix website
how to add instagram feed to wix,How to add instagram feed to wix,howto,4,medium,volume_10+,,how to embed instagram feed on wix | how to add instagram feed to wix | how to add instagram feed on wix | how to add instagram feed to wix website
how to add a blog to wix website,How to add a blog to wix website,howto,4,medium,volume_10+,,how to add a blog to my wix website | how to add blog to wix website | how to add a blog to wix website | how to add a blog page to my wix website
how to add a google form to wix website,How to add a google form to wix website,howto,4,medium,volume_10+,,how to add google form to wix website | how to add a google form to wix website | how to add forms to wix website | how to embed google form in wix
wix quickbooks integration,wix quickbooks integration,integration,4,medium,volume_10+,,wix quickbooks integration | wix and quickbooks integration | wix integration with quickbooks | quickbooks wix integration
how to connect domain to wix for free,How to connect domain to wix for free,integration,4,medium,volume_10+,,how to connect domain to wix for free | can you connect a domain to wix for free | how to connect my domain to wix for free | can i connect my domain to wix for free
wix connect domain free plan,wix connect domain free plan,integration,4,medium,volume_10+,,wix free plan custom domain connect | wix free plan connect custom domain | wix connect custom domain free plan | wix connect domain free plan
wix connect domain plan,wix connect domain plan,integration,4,medium,volume_10+,,wix connect domain plan | wix connect domain plan cost | wix connect domain without premium plan | wix connect domain plan price
how to change wix url,How to change wix url,howto,3,medium,volume_10+,,how to change url on wix | how to change url in wix | how to change wix url
how to do seo on wix,How to do seo on wix,howto,3,medium,volume_10+,,how to do seo on wix | wix seo tutorial | seo wix tutorial
how to cancel a wix account,How to cancel a wix account,howto,3,medium,volume_10+,,how to cancel wix account | how to cancel my wix account | how to cancel a wix account
how to make a website builder like wix,How to make a website builder like wix,howto,3,medium,volume_10+,,how to create a website builder like wix | how to make a website builder like wix | how to create website builder like wix
how to make a landing page on wix,How to make a landing page on wix,howto,3,medium,volume_10+,,how to create a landing page on wix | how to create a landing page in wix | how to make a landing page on wix
how to change wix theme,How to change wix theme,howto,3,medium,volume_10+,,how to change theme on wix | how to change wix theme | how to change theme in wix
how to transfer a wix site to another account,How to transfer a wix site to another account,howto,3,medium,volume_10+,,how to transfer a wix site to another account | how to transfer wix site to another account | wix transfer site to another account how to
how to use wix editor,How to use wix editor,howto,3,medium,volume_10+,,wix editor tutorial | how to use wix editor | wix editor how to use
how to use wix ai website builder,How to use wix ai website builder,howto,3,medium,volume_10+,,how to use wix ai website builder | wix ai website builder tutorial | wix ai website builder how to use
how to use dynamic pages in wix,How to use dynamic pages in wix,howto,3,medium,volume_10+,,wix dynamic pages tutorial | how to use dynamic pages in wix | wix dynamic page tutorial
how to make a pop up on wix,How to make a pop up on wix,howto,3,medium,volume_10+,,how to create a pop up on wix | how to make a pop up on wix | how to make a pop up in wix
how to cancel a wix website,How to cancel a wix website,howto,3,medium,volume_10+,,how to cancel wix website | how to cancel a wix website | how to cancel my wix website
how to upload a font to wix,How to upload a font to wix,howto,3,medium,volume_10+,,how to upload fonts to wix | how to upload a font to wix | how to upload font to wix
how to get a refund on wix,How to get a refund on wix,howto,3,medium,volume_10+,,how to get a refund from wix | how to get a refund on wix | how to get refund from wix
how to transfer wix domain to shopify,How to transfer wix domain to shopify,howto,3,medium,volume_10+,,how to transfer domain from shopify to wix | how to transfer domain from wix to shopify | how to transfer wix domain to shopify
how to add a font to wix,How to add a font to wix,howto,3,medium,volume_10+,,how to add fonts to wix | how to add a font to wix | how to add font to wix
how to close a wix account,How to close a wix account,howto,3,medium,volume_10+,,how to close wix account | how to close my wix account | how to close a wix account
how to change wix domain,How to change wix domain,howto,3,medium,volume_10+,,how to change domain on wix | how to change domain in wix | how to change wix domain
how to change wix site template,How to change wix site template,howto,3,medium,volume_10+,,how to change wix site template | how to change site template on wix | how to change template on wix site
how to get found on google wix,How to get found on google wix,howto,3,medium,volume_10+,,how to get found on google wix | wix how to get found on google | how to get found on google with wix
how to delete a wix blog,How to delete a wix blog,howto,3,medium,volume_10+,,how to remove blog from wix | how to delete a wix blog | how to delete wix blog
how to unlock wix domain,How to unlock wix domain,howto,3,medium,volume_10+,,how to unlock domain on wix | how to unlock wix domain | how to unlock domain in wix
how to transfer a wix website to another account,How to transfer a wix website to another account,howto,3,medium,volume_10+,,how to transfer wix website to another account | how to transfer a wix website to another wix account | how to transfer a wix website to another account
how to change favicon wix,How to change favicon wix,howto,3,medium,volume_10+,,how to change favicon on wix | how to change favicon wix | how to change favicon in wix
how to group elements in wix,How to group elements in wix,howto,3,medium,volume_10+,,how to group elements in wix | wix how to group elements | how to group elements on wix
how to add a lightbox on wix,How to add a lightbox on wix,howto,3,medium,volume_10+,,how to add a lightbox on wix | how to add lightbox in wix | how to add a lightbox in wix
how to add a pdf to wix website,How to add a pdf to wix website,howto,3,medium,volume_10+,,how to add a pdf to wix website | how to add pdf to wix website | how to add a pdf to my wix website
how to add a footer on wix,How to add a footer on wix,howto,3,medium,volume_10+,,how to add footer in wix | how to add a footer on wix | how to add a footer in wix
how to add video to wix website,How to add video to wix website,howto,3,medium,volume_10+,,how to embed video in wix website | how to add videos to wix website | how to add video to wix website
how to duplicate a wix site,How to duplicate a wix site,howto,3,medium,volume_10+,,how to duplicate wix site | how to duplicate a wix site | wix duplicate site how to
how to add a page in wix,How to add a page in wix,howto,3,medium,volume_10+,,how to add a page in wix | how to add a new page in wix | how to add a page on wix
how to add a document to wix,How to add a document to wix,howto,3,medium,volume_10+,,how to embed a document in wix | how to add documents to wix | how to add a document to wix
how to add a link on wix,How to add a link on wix,howto,3,medium,volume_10+,,how to add a hyperlink in wix | how to add a link on wix | how to add a link in wix
how to share a wix website without publishing,How to share a wix website without publishing,howto,3,medium,volume_10+,,how to share a wix website without publishing | how to share wix website without publishing | how to share wix website link without publishing
